tweets,price change,Tweet Sent.
el autos mi hoy the founder of the engineering company bought has left after a clash with automation reportedly ousted after just six months the verge here is a rap for your marketing department twitter account comparing merlin engines to unfortunately its not the merlin engines still cool though are investors savvy or stupid has officially started releasing its revolutionary autopilot update a w musks giant tunnel boring machine arrived at first pictures top manufacturing executive departs at the worst possible time has a new model and market love the idea and fun marketing day of qualification matches complete ranked in the division long and meaty talk w founders martin says article video u el es la el m ms en la la en opening night with and with and,neg,neg
musk confirms semi truck reveal in pickup truck in to months level will change everything wait a way out in yes watch here to reach level fully autonomous driving in years et la route aux solar con w para el model the model dashboard sure looks nice store at the mall the village as the fear factor in future staff training workshop is trying to scare staff a new kind of speed the concept a new kind of speed the concept a new kind of speed the concept x superchargers update week in review news us giant to on market on the map is wrong about the bubble heres why excited to have exhibiting at reactivated its automatic braking system after losing top consumer reports model y el interior,neg,neg
render model y chief of supplier ousted after clash with mayo a en a new kind of speed the concept a new kind of speed the concept a new kind of speed the concept solar tile teases future plans at talk new age lit great musk business quotes read ca to autonomous drive in the works and a semi long haul drivers you need a new job model s signature performance p i am the original owner of this is what happens when cant stand now the most valuable car company in the us why booking my flights to thanks start up en thats great news the latest venture tweets via excited to have exhibiting at,neg,neg
cook announces apples new billion advanced manufacturing fund to promote us job creation i bet its on track to release model in c on track to release model in so misses on profits and beats on sales is this the new trend i say yes well this is going to be awesome much like s a model can be reused many times with minimal refurbishment between trips roadster for sale last bid k auction ends soon car location reporting bigger loss emphasizes gains in production and sales new roadster for sale from member last bid k auction ends car location model y coming late or on new platform en the model y looks gr not the model platform only has m of wire mm why give standard answer not interested in or any i love what i do desperate for exit just teased some tantalizing details about via scratch that with a snow brush use one of these musk just teased some tantalizing details about model y the verge unveils new and exclusive sleek more callers took minutes today,neg,neg
buying long dated puts carries much better odds than buying lottery over a mos period successfully brokered the sale for the property of a square foot auto dealership tenanted by confirms that model progress is right was hat tun along the lines of hexes on pro athletes is there an curse on tech visionaries on inc being worth more than apple inc i may be delusional c test drove some s today my friend is buying one obsessed arriving in late or on non is one thats simply too risky for most individual investors a wall street just like death and taxes losses will continue earnings call transcript in talks to resolve issues with legacy clients a wall street bank eviscerates en in talks to resolve issues with legacy clients is deliberately telling people the is worse than the model broker tour vineyard reports record revenues of billion in q but burns through million definitely in my budget my style too so pretty financial in talks to resolve issues with legacy clients,neg,neg
traditional car dealers battle over franchise laws in on pd on pd getting a feel for the s d heres why is not the next this probably revolutionizes the industry if can pull it off autopilot mode saves car from collision electric vehicle benefits you probably know should call it to mark the discovery of the new solar system a nu way for future transport y solar city a la en la how about subterranean efficient can still get that sex without a model e realize technology cant solve everything traditional car dealers battle over franchise laws in las para el ya rival para rocking on with concert series wont dramatically change interior lists as potential takeover targets for a via,pos,neg
ran into a group of test drivers from nice sight and mutual respect but i trade my begins taking orders for its roof tile systems ht cc nothing wrong with admiring a beautiful object but give me a any day limitations by great musk business quotes read pone a la investing in new solar initiative i reckon and should learn from this guys in would love if my mobile charged in less than apple likely to acquire likely to acquire but we can dream via solar roof tiles superhero l i v e n o w check it out link in the look you get when you know it just feels right el model s pd con dos a en just revealed how much its solar roof will cost click here to see the is optimized for carrying library books so they slosh around starts taking orders for its solar shingle in love the inventor hes like aha,neg,neg
supercharger en spotted at dealer guess he had to get that door fix somehow game we counted vs between and update article brr enjoying the heated seats during halftime el ha jet this weeks news in seconds full video at take that shows stunning progress with his tunnel boring project check it out do you remember that scene i dream about having my own someday and meet you s new include cores unique approach to cars is about more than just electric el solar es starts selling solar roof says savings to cover costs would be great to see as support vehicles for the or and maybe even a how musk and shook up the auto industry model s pd with manufacturer plates spotted on i south in hills mi s roofs are cheaper than normal roofs and offers lifetime says its solar roof will last until your kids have kids or suck it fossil fuel apologists could s free energy concept be powering solar con w para el model,neg,neg
fords first electric could have an edge on s model y our websites run at ludicrous speed faster than c check out the model s nude body fords first electric could have an edge on model y f markets had the opportunity to look at a today blew me away with the tech inside congrats to my doctor with the indirect effect are cool option i want and it is pushing to innovate or stay behind little ride in after a business visit at thanks city of its sow insightful is now selling its roof tiles at about per square foot via my personal doctor is my new driver find out how you could have a for en el y el collects videos from cars to improve its tech calls forced silence claim preposterous welcomes us to state line musk says its pencils down for model cu a of musks long list of failures,neg,neg
surprise this supercharger miles south of and its also a showroom and salt spotlight if not short what would you be short new model spy shot shows off an elegant wood trim on the interior will s tiles finally give solar shingles their day in the sun solar tiles what you need to know amazing tech for energy efficient construction a poster child of this market a poster child of this market el model s pd con dos a en and the sign says long hair freaky people not apply so i put my hair under my hat and i went in to ask him why he said you look like a fine outstanding young man i think do so i took off my hat i said imagine that huh me are you going s groundbreaking solar roof is coming signs signs everywhere theres signs fucking up the scenery breaking my mind do this do that cant you read the sign top companies where the world wants to work now and the sign says anybody caught trespassing will be shot on sight so i jumped the fence and i yelled at the house hey what gives you the right to put up a fence and keep me out or to keep mother nature in if god were here tell it to your face man some kind of sinner signs signs everywhere theres signs el fucking up the scenery breaking my mind do this do that cant you read the sign oh say now mister cant you read driving a gasoline car will feel like driving a car of yesterday you got to have a shirt and tie to get a seat you cant watch no you cant eat you supposed to be here,pos,neg
en from sales person unlimited supercharger is back for model s and model x the best companies to work at according to when was alive he the smartest man alive if not heard of i suggest you read up him musk musk autopilot level autonomy full hardware musk gamer just remember instructs in different ways to lie to us is no different why do we protect them anyway a la the best ever spent latest is on robot cars did you know that one has roughly the same amount of as million lines of mode news tips date night begins and my husband floored it why musk not trump is the most important person on via el model s pd con dos a en everything you need to know about s new roof show me the data the truth about,neg,neg
en cars daily journal is out rt next venture vs turns down conditions for workers la en la when hes really his ears go sideways will face massive margin pressure from leaf replacement motors inc model week here comes leaf bolt future is completely inhuman and we be surprised business free supercharging for recent buyers fortune i wrote that research group thinks model must be at least to survive labor conditions labor rights long weekend adventure checking out a new charger autopilot mode saves car from collision if you buy a model s or x through the link below you get free supercharging and why musk not trump is the most important person on twitter model weekend news and more at,neg,neg
a recap of the model information we received earlier today we should be supporting innovation in ct not discouraging it vote for musk ford is vying for magic by doubling down on its dreams cars are either the next or a s mac says makes autopilot smooth as silk for current models launches first aggregated virtual plant in us musk drag races model s musk musk la a en para auto putting a furniture executive in charge doing to do it they should move their headquarters to poach s people fancy is turning your car into a high speed rail pod will it also charge your car sleeper seats for long travel will crush overvalued and who builds a car with one radar no wonder it crashed into a truck new owners can now get free charging with a referral code exciting radar detectors for v escort i quad hp investors skeptical ford change will revive stock price by via ford is vying for magic by doubling down on its dreams,neg,neg
quietly has made number in this industry with a company from with clean energy ambitions wants to take on sweet ride in park model in deep metallic blue out and about la final model en hoping to win the this guy thinks every big hill is a damned pyramid at the drawing recommendations announced by council model s performance p with k call or ala the words side factory of the future inside center in c the rest of the world is going but is making powered cars autopilot predicts crashes freakishly early third edition the rest of the world is going but is making powered cars a closer look at margins and profitability seeking alpha look forward to coming out on looks fun now you can chat with your if you really want to en,neg,neg
at the movie with my daddy gull wing in wow can we get those in model just got referrals for the year under the referral program has anyone else hit yet ready to invest xiv is definitely worth checking out today song electric vehicles are now the cleanest cars in want to win a here is your chance ready for at in too solar roof calculator electric vehicles are now the cleanest cars in musk enslaving niggers candidate to white house trump is history new report slams working conditions at plant referral program crackdown musk to shut down referral code abuse i hope unionization efforts at succeed this appalling could be enabled pretty easily says musk model s x will have and lower steering wheel via software update finally made it to the factory la a y a las was brilliant is important like,pos,neg
musk says these books helped make him billions sorry fan boys mama love the model x bring on your insane yet predictable rage el model solar some autoworkers say conditions are dangerous a look inside the factory what the reveal auto workers worry increased production sacrifices safety s model budget can do to in seconds last night was awesome poison owners now giving out test drives a primer en la en the icon gets exclusive model test drive mile from in alto looks sharp u model can go mph in seconds chart reveals let the games begin v en white prior design twins why agreed with the pope on climate change and not with wow for thinking about getting one but i love my i will not impressive for a in plus,pos,neg
blue up c every time i pull up next to a i roll down my window to hear the sweet sound of silence s model x missing out on hunger for crossovers like this knew earth is a globe solar roof tiles are already sold out well into why does everyone with the exception of want to make an ugly red carpet opening day at in these cars are truly amazing more cars here than in any maybe we brought the at chevron lets see what is all about golf body model s forward labs roof promises higher production lower cost than s tropical smoothie feedback is crucial o i dunno styles a desirable product even else is doing variations of leaf volt why indeed video in article op n tank op auto ambulance en pretty soon electric cars will cost less than gasoline,pos,neg
la a cc what is the yearly cost of a my first year owning a cost via we are thinking white how i gave up my musk plaza yes para musk can a startup compete with new roof look out forward labs new solar roof is cheaper than and it can be installed in half the time do what works flip whats buzzing model x port good seats for center con video el fin la wants you to know its model as good as the model s fortune with the application of technology can be generated artificially however the artificial is quite low in quality level compared with involving mantra etc electric g i really hate that i only see old rich dudes driving a because they are the ones that screwed up the earth in the first place,neg,neg
new temporary superchargers in ca not apple will have the next tech moonshot funded keep it growing hours to go in a funded keep it growing hours to go check out this awesome startup could take a good lesson from them stop more chaos in traffic more hacks more wars due to lithium concept who wins first moving or here an example of aiming at insurance tower via confirms wheel options optional glass roof and coil suspension via watch autopilot system help avoid a crash with superhuman sight the connected car is here today t the connected car is here today with the application of technology can be generated artificially however the artificial is quite low in quality level compared with involving mantra etc continues to push forward just gonna go ahead and apologize now for my snap story tomorrow apple thinks is more innovative conned by,neg,neg
for musk impresario the latest act falls what is up to a presentation by y en la motors breaking news musk calls himself an idiot all murdered out one of the reasons why this is my next car all we need now is an area to clean the windshield just like at the gas station then the super chargers will be perfect my best weeks so far this year last week was a nice vacation trailer this week is tour of factory new west total new total pone en y model s o model x no drivers wait till they put one in this is the best photo of the model interior seen yet keeps it going with the application of technology can be generated artificially renewable energy is what the future all about i have some reports for you to read if nothing else will be informative however the artificial is quite low in quality level compared with involving mantra etc pickup trucks r coming to a neighborhood near you apple founder says not apple will create the next breakthrough technology emails we will be deactivating any referral codes that violate,pos,neg
they do buy them great idea i wish more airports had rentals regulator crash hinder research gm appears to be doing very little in we just drove the model x its very impressive pros and cons the bolt vs model s if you stopped the subsides would sink faster than a lead balloon the of asking to stay in musk to trump ditch deal and ill quit as your adviser s el cartel festival mother of all en roofs come cheaper than regular roofs with infinity musk model en s innovative autopilot system was a game changer but now has found a way to play along my celebrity wish list item is to sing this with you the is to solar panels as the is to a i get panels cause ugly too musk says hell quit white house role if trump dumps accord musk draws the line musk questions market cap again via,pos,neg
patron et co trump head of and both quit s business advisory council today smart both completely stupid for to work with trump in the first place respect for them is diminished plantation fl supercharger station gas miles without gas love it with the application of technology can be generated artificially fuck todays latest image sale however the artificial is quite low in quality level compared with involving mantra etc hey how come postal trucks electric already your company grew because of billion gov seen both on flatbed trucks morning musk quits white house advisory councils in wake of trumps decision to pull out of via el ms streamlines ordering with new ahead of model launch i be this excited for an electrical plug how about stop suppressing technologies that would grant free energy to everyone summit with a view feat factory,neg,neg
the of and musk and both resign musk model en check out this this vehicle is located at mileage is stock d now can we cut off all that money to and let them succeed or fail on their own off to got my tickets model s in fatal crash was going mph in white lightning this brand new was in for a and fires female engineer who alleged model s ya las y y en my amazing day at imagine that business insider thinks the only reason musk was advising trump was profit with the application of technology can be generated artificially factory workers reveal pain injury and stress via on it is a science and probably will never be profitable via however the artificial is quite low in quality level compared with involving mantra etc says a semi and pickup are actually happening u fires female engineer who sued over sexual harassment the mercury news trump general electric and what a crazy week the big deal la d para el model s y x,pos,neg
models at in so rude lady took a spot care people in line so rude lady took a spot care people in line says bill could make it unable to sell in herald took spot care people in line upon return yelled everyone drinking according to a story from a creator via a healer an unspecified number of people use scalar weapons do international i think so it will lead to losses because people are often stupid but there wont be big losses es lawmaker at center of debate over s future in la model owners club spotted a silver model on the test track what do and have in common and just what is going on in heres my idea says bill could make it unable to sell in herald so if you r going to spend k on a model x you give the wheels some a no a apple a volt y proud to be a owner thank you for your commitment to,neg,neg
musk el roadster con hard rock juntas looking for your local owners club let us know well get you connected solar con w para el model a la actions dun milliard this sky blue roadster is by far the rarest car seen today this is so that its not even that u has sold final stake bringing collaboration to a close fortune not locally installing and power walls or similar instead enthusiasts urge veto of legislation that company says will threaten its sales in model apple the next big breakthrough will come from via the ton battery problem musks truck may not work at all model s autopilot hardware version merging onto highway with the application of technology can be generated artificially however the artificial is quite low in quality level compared with involving mantra etc temporal en,neg,neg
when review they send their best by of the coolest customized seen keep an open heart and find love again i know stock hits high going into shareholders meeting elegant solar roof does not only save energy but also money at the charging station he likes the when i was in college my buy raffle tickets by to support you just might win a time is running out get your raffle tickets by to support you just might win a i made a new bed dad all by myself to resume rooftop solar sales price on carbon and buy raffle ticket to support you just might win international reduce el a doing amazing today again join here national insurer to raise rates on vehicles while cries foul motors seek traction upstate times union to resume rooftop solar sales new times to resume rooftop solar sales one traders plan to triple his money by betting on,pos,neg
check out bare size running cross training walking shoes via musk cites model x design thinking mistake informing model y plan no me this patent could solve one of the issues with owning a has definitely cars is now at the center of innovation it has and not to mention new instantly deals a fatal blow to fossil fuels challenges faces as shareholders meet with the application of technology can be generated artificially musk cites model x design thinking mistake informing model y plan musk teases semi truck event surprises music tech is currently working on new factories will build a new one for model y total however the artificial is quite low in quality level compared with involving mantra etc has definitely cars has definitely cars musk cites model x design thinking mistake informing model y plan the is already a compact how much smaller can the y get marina musk is a jackass like west he impress me get,pos,neg
great musk business quotes read c things we learned from s shareholder meeting via gives a shadowy tease of the model y crossover gives a shadowy tease of the model y crossover the is theirs the for which i really worked is mine el para la en teases new model y car as cheaper model nears production s is missing the craze would you buy a starting at how great is the solar roof yes please with the application of technology can be generated artificially this spent more than on home battery calculated hell have a electricity bill el yo especial para however the artificial is quite low in quality level compared with involving mantra etc musk the boring company is in and has already approved the permit big five chart service for now posted china growth coming on strong as fortune magazine in issue,pos,neg
to install charge points at shopping across via i am celebrating getting a new rt heres why and tech are destined to beat big oil read here got my new plates and how fitting they are s goals for will require billions more in capital investors cheer via took the model x out for a spin today this vehicle is awesome and on our showroom actually it is rocket science us installs will fall this yr solar to rise but well below last yrs growth so stoked bought a a truck reportedly intentionally ran over people at a event in interested in solutions ease solutions is your good thing he invent any knew with the application of technology can be generated artificially news beyond lithium stocks to buy now however the artificial is quite low in quality level compared with involving mantra etc lo ms la rt of what it means for s future el automobile a en el,pos,neg
when others saw failure he saw promise the story is one we should all remember cool thought for a feature a setting that auto rolls the windows up when placing or accepting a phone call en is hurtling toward a share business insider comings and goings computer vision director of used cars and a if the big draw has a lead but capital trapped in if in decline stranded capital a gathering calls for light bulb beverages there is only light slowdowns in the area this evening welcome to the future model x is here a rally in shares spurred by chief executive officer s confidence in selling electric vehicles with the application of technology can be generated artificially mother of all a rock however the artificial is quite low in quality level compared with involving mantra etc universal knowledge exists universal truth exists deny either all you want or like both exists regardless mother of all a rock u line of charging at d the man the myth the legend what a great trip to been waiting for my refund since despite numerous calls to whats going on superchargers,neg,neg
