tweets,price change,Tweet Sent.
on twitter model could be successor to model s heres a see more great tits a kitten needed some to get out of a tight spot in a model rear bumper via thanks so much to crystal of airlines she helped me unlocked my car by allowing me to install on her phone how musk schedules his time between and boring u he goes is that i said no its just all the i walk outside nope its thunder could u me the coil a kitten needed some to get out of a tight spot in a model rear bumper via the best service of any manufacturer hands down the two best things in the world and kittens just i know whats better or the cant stop watch no matter your political affiliation got to have mad respect for and his amazing ambition to revolutionize with the application of technology can be generated artificially saved a week kitten on the job via total eclipse oil giant sees its future in electricity read more here however the artificial is quite low in quality level compared with involving mantra etc version did you decide whether to bring the to or not mechanics rescue kitten stuck inside model x find out about then come back is some talking about show them the urn where his ashes are,neg,neg
driver in fatal autopilot crash ignored safety warnings smart move by would benefit from growing overall needs for priority access at times proclaims this the week electric went mainstream new model s record over miles on a single charge el model s pd con dos a en etc are the most companies offers another hint model way with the application of technology can be generated artificially detailed of capabilities new to j adapter allows other electric cars to charge at is actively talking about opening up its supercharger network to other brilliant inventions that never got built history driver in fatal autopilot crash got numerous warnings us government via however the artificial is quite low in quality level compared with involving mantra etc new to j adapter allows other electric cars to charge at destination chargers new to j adapter allows other electric cars to charge at destination chargers model production details from insider thousands to be delivered end of dodge hopes to avoid markup issues with demon video roadshow d,neg,neg
is reportedly trying to build its own music streaming service c me to what do you from a too bad its not a is reportedly trying to build its own music streaming service could be your next streaming music provider nice profit on today is talking to the music labels about creating its own streaming service considering launching its own streaming music platform model s pd pkg auto pilot premium pkg you know the solution is solar panels and a research it s looks set to launch its own service eventually this car combo look what came on radio just now casino autopilot requires the driver to pay more attention not less writes new guru could help its cars teach themselves technology review i bought my st today may buy the blue one after my next bonus overlook the hipster haircut it was half off ya hay en a,pos,neg
the present is theirs the for which i really worked is mine c a startup backed by s has big plans for its battery tech via the proposed music service might not be what everyone thinks somehow being a k car makes you feel better model model still weekly via stock charts analysis d seeks electric car gallery in new upscale shopping center service whats thinking en la en leaked photos of the model ignite an power struggle the proposed music service might not be what everyone thinks others seek ways to keep drivers hands on wheel automotive news checks off on bucket list and bonus of looking good too with the application of technology can be generated artificially however the artificial is quite low in quality level compared with involving mantra etc central it is a complex process a m me ms pronto pas no y e it is a complex process,neg,neg
has stiffed new state on the factory and and his handed them million todays now available just absolutely brilliant film oh and plays just quality x could start its own music streaming service my new could start its own music streaming service could start its own music streaming service could start its own music streaming service could start its own music streaming service could start its own music streaming service model s model x drawing for a subscriber in hong leaders read readers lead rt rt hired a top to lead a critical aspect of autopilot heres a el ms en ken blocks gymkhana nine is a sell i have the for speed new model or used model s video inc starts selling solar panels in its stores motley fool the present is theirs the for which i really worked is mine,neg,neg
fresh in in this seems like an easy decision el model s pd con dos a en great musk business quotes c tn electronic library offers job resources radio model delivery announcement maybe it will only cost cars to buy one rite aid store reportedly mulling launch of own streaming music service gm shares s story hello why is dealer in using bike lane every day as its private parking lot with the application of technology can be generated artificially chinas building enough capacity to blow musk out of the water via however the artificial is quite low in quality level compared with involving mantra etc wow big news for on plus,neg,neg
was struggling in until it had an to sell was test driving a model s d today model lo us solar demand could drop percent if trade case succeeds report el model s pd con dos a en west crying out for leadership to harness solar power for cars solar body panels its easy west crying out for leadership to harness solar power for cars solar body panels its easy with the application of technology can be generated artificially great musk business quotes however the artificial is quite low in quality level compared with involving mantra etc is making a comeback thanks hey everyone time to buy s new electric car for only grand it can go miles your taxes have already paid for it so why not what do you think of the new are you saving up your pennies the car is to start around and with a federal electric car tax credit could cost cc early movers in market cat gs does drive his in ludicrous mode all the time gonna buy a hummer and run over every ugly electric car i see on the road thank you too sir that i own a i even own a gauss delivery schedule is a for now,neg,neg
model production to start this week deliveries begin this month ahead of schedule musk of all new cars registered in in was all electric second most sold car in i regret the time when was a unit used to measure magnetic fields or a funny inventor with a geeky old fashioned th new fashioned transportation in the spirit of an inspirational video on perseverance ingenuity thank you go electric the latest el con dos la quarterly sales fall as battery supply crimps output wring miles from a model s d i would fire the crew who was in charge of designing your model s looks like an fiat to me charging for an means full battery in min how long restroom visit is the best ma fit for f gm dice vale ms general motors en dos doing content right tech leaders call out sexual harassment in the startup community test drive one word for this car unreal s st electric car for the masses is coming soon,neg,neg
new telegram group for friends available ask your questions or collaborate to improve plans to fight in the market drops after says the is worth musk is a shady guy tech kids squeal on the left the likes fireworks on the much better c is latest company to face scrutiny for hostile workplace for all those haters out there of falcon launch is now live model s model s tech pass sunroof k drops after gs to liftoff musk el roadster con if you lose money with no competition how are you going to make money with competition light some have arrived these six companies may well change the world these six companies may well change the world car of future shall be full more car makers are going full electric is the pioneer tough to beat these six companies may well,neg,neg
month in loaded with options safer than a or gets dinged by insurance industry crash report via musk world population accelerating toward collapse does not drink does owns what electric cars in will start delivering the in heres everything you need to know about the s designs the first y fans en super charger update still only stalls in loses no spot in market value among us automakers compares model to apple could change the world real life see more at real life see more at the model is starting production heres how its different from the bolt group s model s is safe but not super safe loses no spot in market value among us automakers new times the is starting heres how its different from the via s is coming and it will be the largest ever via m la fin la diesel et essence tout en just saw a on side of ran out of juice you should or die hat die note autos,neg,neg
installer la plus en via with serious implications for congratulations false alarm closing all its stores false alarm closing all its stores however the artificial is quite low in quality level compared with involving mantra etc cobalt investment case made by supply and demand rt rt to build worlds biggest project in its fr via to enable large scale to paradigm shifts take leadership i my early movers lulu p more early movers lulu p more win contract for massive system in idea is to stabilize the grid and bring down prices seriously sir may i have a i would so appreciate it a good driver could do something as well on proving grounds it is not the worlds largest battery it is a collection of small batteries connected together en la a ms a a la ms en para,neg,neg
real life see more at real life see more at inspirational to say the least found our next car center con en every boy can dream with the application of technology can be generated artificially what will we commit to universal exists universal truth exists deny either all you want or like both exists regardless mt universal exists universal truth exists however the artificial is quite low in quality level compared with involving mantra etc beautiful day at mt rainier yesterday early movers lulu p more early movers lulu p more will be happy to topple from us car company you should have included the in sparks no list is complete without it its been painful waiting for my so i wrote this song about my murdered out model s dude or when i watched episode of it made me want my more so i naturally i wrote,neg,neg
musk tweets new photos of latest car the model parking at airport all d and except for my wimpy plug in personnel great to see this new affordable electric car on the market first using to generate win hong tax change reduces sales from to zero in one month via creates energy future for and this time are not sold separately gotta love for long trips what investors missed in the market last week great musk business quotes taking me for a ride through the metro parks some perspective on s sales numbers s model has been released model we wont get mass market use for ages yet just did the that could beat and to mass market via happy st birthday to the cleverest man of the last few centuries use my if you want to have and free supercharger con video el fin la everything you need to know about model which is starting production,neg,neg
inc earnings mark your calendar motley fool us growth fund managers still bullish on after shares tumble large us electric utility southern company starts deploying can increasingly be a driver for sales seeking alpha big moves in cars motley fool n la mayor with the application of technology can be generated artificially when i was growing up a was the luxury car sitting in i think the maid drives one reasons why model is the of the auto industry however the artificial is quite low in quality level compared with involving mantra etc model has big changes model has big changes model has big changes model has big changes model has big changes model has big changes watch a refreshed model s sort of break a frank pick up the he giving out that pd big moves in cars musk,pos,neg
says only are needed to power the whole world and might be building more will open or more in the us executive in charge of solar roof is leaving the company ahead of the launch in companies like independent directors can fresh the air i so model x man m is going to the delivery event want to meet him watch the video is going to the event you can join him before and after the event key features in model an electric car that could change the world gets some independent supervision watch a model x launch a glider into the air in china a mega opportunity seeking alpha killer selling very quickly executive in charge of solar roof is leaving the company ahead of the launch a hangover cure from a former employee could save your morning i won the lottery in rode in a no joke thanks roger in strategic do you know something we about s model x model x d autopilot wheels k,pos,neg
hackers may have found a new way to hack and steal cars d emergency call live in small country with more than wind turbines less than load still energy by cover short and win most guaranteed via who is ready to from to in minutes inc said peter rive is leaving the company after electric car maker bought for last model s model s p tech pan bids discovery extreme engineering season of transatlantic tunnel via another quick chrome delete w a car like this i might actually enjoy my commute to work s new rival lg to give a run for its money read here a y should i buy stock its lofty did just offer to build a monorail its going down baby does it again gives the vision of the yup to interested mph with the application of technology can be generated artificially however the artificial is quite low in quality level compared with involving mantra etc,pos,neg
solar roof panels will cost less than normal roofs roof prices come cheaper than some had presentation def news classic concert review mi according to a story from a creator via a healer an unspecified number of people use scalar weapons and s solar roofing thats way better in pretty much every way compared to traditional hopefully you are at work next time good luck with the is by far the best car ever built in history and i cannot wait to own one how i feel watching the software videos i can sit and literally watch videos about and all day and have been today be looking at the of a pd moving fast joining and a bunch of other companies in developing month in see pricing details here had my first car accident today taking this as a sign of the charging stations at my work are being used by nice mix of both model s and x i made a video on musk on a powerful mental model that i would like to share with you guys i i i watch as construction of progresses over a year model s model s pd pass autopilot k mi,neg,neg
should we a drop in range with addition of tech for full autonomy sounds like big auto is struggling free supercharging for early reservation holders yes please just welcomed this to its heres why its a big deal for great musk business quotes para en a la con thieves beat security systems heres how via new divide official video park attempts to raid coffers unlikely to be fruitful how many trees can you fit in a strangely starts delivering new battery packs at batteries and mobility a challenge for automakers seeking alpha attempts to raid coffers unlikely to be fruitful seeking alpha en el a r with the application of technology can be generated artificially however the artificial is quite low in quality level compared with involving mantra etc y lo d el pa m con v universal knowledge exists universal truth exists deny either all you like or want both exists regardless el one la a,pos,neg
post on the news about the ban of cars musk says understanding of is limited via one of the best plates ever after all of mine that is generally have between kg of el id y ms el model customers are still being left in the dark cars are outdated i want to drive a computer then you have as close to real tony stark we can have telling us could be real someday y con el sin y en former engineers launch startup to bring mapping and data to rest of the industry well hello beautiful getting detailed before tonights how the industry is catching up with by why musk is wrong about mark and vice versa the model may be more of a luxury car than previously thought in seconds that was fun tops ratings after getting a key safety feature picks top fan made videos opens them to vote for winners at model event,pos,neg
pour yes just started selling the wrong car but it might not matter pretty sick but i managed to doodle my and how to find about your order queue number for model starting this rumor all the batteries in the model are the exact same size range controlled by software i need me one with the application of technology can be generated artificially model buyers already lining up outside showrooms is killing it once again so elegant and stylish love it how about a it can drive you around while you are filming twitter moment of goodness some bumps but buckle up for for those however the artificial is quite low in quality level compared with involving mantra etc model vs bolt battle of the model will begin at pm pt an hour earlier than planned i drove the model and it changes everything the entire world will want this car via hey can you if working on my model the model hand off event i cant stop watching it,neg,neg
now all you have to do is find a parking spot cool view from a model x destination charging in will soon outnumber gas stations move towards a sustainable future comes in all sizes destination charging in will soon outnumber gas stations receives owner satisfaction rating of crazy line for model model n ilk parking at for and even on holiday faces perhaps its biggest challenge yet producing hundreds of thousands of its sedan i have never in my life seen a and not stared needs a heads up display so you have to glance to side for speedometer info goes wild for s relationship to does trump know secrets of hidden to be a part of your dream dream never sleep the news the associated has just delivered the first model s what do you guys think el ya es dos y x with the application of technology can be generated artificially,neg,neg
when visions become reality introducing the battery advances at the heart of model another reason why we love had a drop unsafe at any speed cars are quite hackable and not very secure what its actually like to ride in the model via moment amid his most important milestone musk says he may be bipolar losses stand out among local stocks the mercury news s new solar roof is actually cheaper than a normal roof drag races model s owner should have stayed in their lane accident happens its their fault video is proof the production volume will be k k per month its not problem at all musk to inc employees prepare yourselves for model production hell battery advances at the heart of model via your new interior is not just its dangerous guess who gets to ship all those parts time for a deliveries begin of the model the charging network welcome model the beginning of a new era in affordable electric cars comical,neg,neg
of the who drives fast and well on why he ordered a via on love song model s phone cable installation guide for blind bolstering up to phones if pissed off holding over the past few weeks remember it could always be worse you could be a f shareholder batteries may be used for winter backup on offshore wind farm at the s new is actually than a normal the only compromise is the incredibly uncomfortable seats other than that the is a better than a debuts new electric car on s turf via could soon be competing with in hope they fix the dash before it gets to from offshore wind farm proposal uses batteries to store power model cars will use chips from hes losing his sanity for sure acolytes r tho their utter devotion reminds me the horror scene in heart of darkness heres the true cost of buying a model another reason the model may eat into model s sales with the application of technology can be generated artificially has cap so you could buy it for say problem is of cash is overseas unless gives a tax holiday,neg,neg
is getting reservations per day after the delivery event has completed its first ever solar roof product installations says it will start making solar roofs in buffalo by end of year with the application of technology can be generated artificially cycling to raise money for camp quality better fuel economy than a helped with a huge headache in its cars helped with a huge headache in its cars has completed its first ever solar roof product installations via has billion in cash it could buy and still have billion left however the artificial is quite low in quality level compared with involving mantra etc imagine a car which knows about your meetings through your cellphone and it plans its route accordingly how does the new jacket look reviewers of newest vehicle are unanimous the model has no competition via coming sooner using platform only the crazy never change their mind via,pos,neg
matter one bit since the weakest link is production ramp up and not demand anyways good things come to those who wait this is the spotted next to is awesome when competition develops around who makes the least polluting cars like thats an amazing world vs was fr die just waiting in the for on u go model s model s tech sunroof seats k just drove miles to in my v late and tired after long day realized much safer then i would have been get a has completed its first ever solar roof product installations el model s pd con dos a en is the available in surges after results but wall street still has doubts with the application of technology can be generated artificially finishes first house finishes first house climate changed s model and the transition to the model is further proof of asymmetric war against the auto industry,pos,neg
showroom at cherry creek mall me are these door for style or utility sales guy function hit their heads a lot also great for installing fight advice transportation emissions grow todays news st i have seen ms d there will be more than just our book at booth mail delivery is my favorite part of the day right now there will be more than just our book at booth mail delivery is my favorite part of the day right now of the cool rt die miss the action tomorrow v die consortium to build a rival one last concert before school starts at interesting read driving model changes everything with the application of technology can be generated artificially and from introduced us to a in action i am still shaking in the next months model will rocket to the top sales in will be up over gr in the however the artificial is quite low in quality level compared with involving mantra etc range but with catch in,pos,neg
heres what solar roofs look like in the wild so much fun using the autopilot feature this weekend but so good awesome job is and my driver also we love your model annual demand could surpass units says musk service and businesses running at minus gross margins u helped with a huge headache in its cars am already switching world has been ready r the autos makers and dealerships ready seems and are only ones others smoke reveals stocks that defy the idea of doing your homework complete with beefy battery and permanent magnet motor why not other versions too the model s interior is a study in automotive minimalism via this means it costs us mile to drive a compared to mile for a gasoline powered vehicle with the application of technology can be generated artificially my domain is for sale the is the hottest car this year great affordable for however the artificial is quite low in quality level compared with involving mantra etc says sales beat where it matters is en om t why motors is fueling up on debt checking out some cars,neg,neg
die in oh second of model with s wheels red calipers d amber heard we know the will change the economic landscape of the amber heard the first person to buy a thought never see the car because the company would fail confirms split with ex musks boring company to use technology for its tunnel project under la are a data collecting machine on four wheels the will change the economic landscape of the us tan with the application of technology can be generated artificially the model x pd has magic doors however the artificial is quite low in quality level compared with involving mantra etc stop horizon via water turbines die t,pos,neg
from to heres what report developing electric truck s new is actually cheaper than a normal looking to start testing autonomous semi in platoon formation better highway miles than city miles less traffic better drivers distance roadster roadster registered in mid original model has battery according to filing quietly upgrades hardware in new cars quietly upgrades hardware in new cars quietly upgrades hardware in new cars quietly upgrades hardware in new musk is predicting ridiculous model demand in the future a little autonomous vehicle humor has met with agencies about testing an autonomous semi truck u considers platoons of electric semis massive for will use cells points of view right wing versus left wing a visionary an electric car and subsidies contrast i on nixer quietly upgrades autopilot hardware in new cars meets with on autonomous truck testing,pos,neg
