tweets,price change,Tweet Sent.
motor one semi truck global unveiling in salt la universal knowledge exists universal truth exists deny either as much as you want both exist regardless la el o el y para ms and the the latest the roadster daily auto con y s rechargeable battery can power your home heres how it works motors inc is a zero slides via electric vehicles long tailpipe mapped electric vehicles long tailpipe mapped what is the car even apple know cars now playing late love on model x we love the model s but what do you think of this gull wing power plant o com o trip over bad track record opens new flagship store in prudential tower new total households with s with the grid new with no screws in mm i hope teams up with these guys,pos,neg
increase it to support collects in depth performs advanced to improve its car love song via is about much more than security well its almost a but love saving the planet with my new ride rivals line up against in the race to build offers glimpse of the future on island how gets dressed every morning just solved solar problem how gets dressed every morning issues voluntarily recall for some mobile connector adapters after overheating incidents the tariff battle second battleground of the solar wars a b looks at for want to bring back jobs legend hes revitalized us took a pilgrimage to the today get past security but thats an unmistakable giant white building w red stripe at fun fact most liked tech solar optimum is a certified installer of click the link in our to see see like this lady does register now win a via em e est u,pos,neg
may use a bespoke for its autonomous cars roadshow the code empowers you with a wide plethora of secret tips could start testing its autonomous cars drivers in soon throws its name into the ring for s next with an ace up its sleeve say hello to our new photos are part of our on sign up for free resources lithium play nice wagon but the hot sauce he is hauling cant wait for my model iii q what do you call a stolen a an supercharging s medicine autopilot mode saves car from collision and techniques to take charge of your life and steer it in the direction you always wanted innermost dreams quickly in just weeks you can activate the code will the automotive industry shake things up for the future thats going on the new right resources lithium play i just drew some lines and got lucky a just passed me and the license plate read,pos,neg
if only could make a opens its biggest car showroom in via the empire strikes back against in was van from the universe with help of his secret codes of course if anyone has a looking to give away let me know ill take it off your hands lots of mutual admiration today our model x got a tour of the hydrogen research and fueling facility h station this is why we all need to switch to electric cars for a modest investment you have free fuel for life new was and that was a recharge emotion rear end future drag race the real truth is they want to lose their given to to begin with the program shows you how to achieve everything you have ever wanted in your life reasons why and should select to place operations original prof asks do you own the in your this program offers exact steps to use the secrets of to do anything you want in your life on a scale of where one is bad and is functional will cars be in la mis en la heres why shares of are soaring today it shows you how to make the impossible work possible reasons to buy model s,pos,neg
super trump is meeting with tech and its gonna be awkward exciting new model x on display in tonight first drive next year patrons et d trump en is going to be advising trump i love this con the lawsuit against s horsepower claims is hitting the brakes the of reason to get a bigger tree this year the guide involves several instructions that help you to change yourself have you driven a one of the most innovative cars ever been in for real it enlists some information on new autopilot billion miles so far with new sensor suite arriving now video via your will know about your next meeting and drive you there automatically is changing the landscape of got to learn about the awesomeness of coils thanks to solar shingles pie in the sky new hope a little something for the is theirs the for which i really worked is mine musk will take action against those who abuse superchargers,neg,neg
mall mall on twigs to charging valet its not every day we have a model s in our possession however we do today model s y el model s hardware para en model s front chrome trim insert for truck drivers will still be needed for a few years says musk truck like a grown man in the face big boy great uncle momma these this is great this island in is almost powered by solar panels trump names and as strategic advisors we have something here at for everyone even a click here to check it out futures prototype crossover looks ridiculously fast went for a spin in my first today thanks hello electric work on the supercharger station continues today en after all it is our thoughts that control our actions and actions determine our outcome futures prototype crossover looks ridiculously,neg,neg
s is a sickly shadow of the la es y en l y no the conspiracy theory as well as plenty of stuffs your face after your first model x drive on the highway with model x doors model x drive to supply panels to yesterdays test drive was sick u future smokes a model x in intriguing drag race video and establish your priorities properly why would anybody even consider to spend lots of money for a car that is not model s city auto gallery launches driving in over states objections cool keep us however be fooled into thinking that the information is out of the blue brand new launched in square getting lots of attention miles are same size yes lucid air an appoints and as,pos,neg
mark motors inc is a zero slides possible inadvertent song of songs took my s to a local day at my old ice tuners shop solar power slowly becoming worlds cheapest form of electricity via new supercharger map is up more in to more in to in build a flying automated car you can do it and synergy plan for musks surprisingly simple secret to success en underground parking in a years plus condo this is not the kind of electric car i want in years from now is about to charge drivers a supercharger idle fee one of cars just ran a red light in via superchargers to me he solos a est y yo me s why understanding the customer is not enough best practices from and just received the new supercharging idle push notification musks latest plan is to dig underground tunnels to avoid traffic jams,neg,neg
tunnels pour la la more delays not surprising more delays not surprising super em to supply chips to electronics co ltd ripoff great musk business quotes c the spaceship is in orbit getting close to release new software musk tunnels pour via to supply chips to electronics co ltd whats your model in life if you ask me that question ill will respond without hesitation musk what do you think about this charging fee wants to take stress out of vacationing with an electric car goes after with the hp mission e goes after with the hp mission e electric car goes after with the hp mission e goes after with the hp mission e cracks down on electricity hogs at recharging stations is getting close to releasing v software update team working seven days a week says updated,pos,neg
is about much more than future dismisses financial issues as skepticism and negativity ahead of electric car unveiling executive behind energy storage division leaves the company after years autopilot a look at the camera defrosters making the system work in the snow motors inc wins loses the motley fool via the life of an is not calm the electric car will kill off over the next decade helping a friend get new winter shoes on in shopping slick a great friend automakers really advertising electric as model s p performance now on sale vintage blue crew neck well of course they low key want to dominate the market consumer reports all that crazy about model x d automakers really advertising electric vehicles do em e why makes better than by,pos,neg
the future is electric and its called drove this bad boy today and it was awesome autopilot update makes car obey speed limits off the contra no hay para a la la para a la la a el i pollutant the air in a c i pollutant the air in a again tops owner satisfaction survey would buy it again new china total new double tree north total is the top ranking car brand when it comes to customer satisfaction has a new with stalls there are now stalls at para est mas no em not surprised the factory tour when we picked up was amazing the car is too is for sale helping with a cool new new release in beta sign up for a test drive a defeated man i wanted to illuminate the whole earth says in near interview s new boring company find out,pos,neg
will be s biggest year ever heres whats in store for the company film var ya in fr hat model s model s d u want off your purchase use this referral code at this invented a inspired free energy device for voice of people today merry deus ex on the center screen when it ends why only for model x superchargers with extreme power bolt long on utility short on sexy its the and it works awesome thank you for merry model x i want a next perhaps almost to house for we love a good road trip in the what an amazing car la para a la la la para a la la the has arrived model s d drives like a dream,neg,neg
motors and the transportation revolution hits a new high led by and but vulnerable due to a gap lower hits a new high led by and but vulnerable due to a gap lower d hits a new high led by and but vulnerable due to a gap lower hits a new high led by and but vulnerable due to a gap lower and team up for power as el autopilot el antes announces million in s us solar cell plant the backbone of a model x new radar technology predicts an accident caught on a second later more winning and announce plans to manufacture in buffalo new to make cells in new great news from with to build solar modules in buffalo i would not bet against is in the books around should be in the hands of about more deliveries than last year heres a video of s autopilot predicting an accident before it happened s superchargers should be much faster to invest over million in us plant for solar cells so easy a year old can do it,pos,neg
president only per car is spent on advertising video goodnight motors rolls out an autopilot update meets a deadline activated via model performance specs and news has shared more information model performance specs and news model s signature performance fl car only k mi c vision fails to ruin great rebuttal to poor outline on electric gt set to debut its v model s pd race car next week starts battery cell production preview vs fails to ruin so a a and a plugged into a charge bar in keeps and keeps the in the hoy en las mas la,pos,neg
electric gt unveils model s pd with sec to mph acceleration via great examples of in use en ya con electric gt unveils model s pd with sec to mph acceleration great musk business quotes read i had no idea have same wot a cool guy motors star d pour autopilot rt first stage has landed on just read the instructions model s owners report discounted is taking a huge risk with the model and it may not pay off very nice start of the future of driving is here s enhanced cant wait to get my hands off this ludicrous model s pd could see in sec when stripped down great on mobile fixed my door handle by just had a thought cant you just make it so the cars to a waiting parking spot after charged excited to have exhibiting at great to see this coming to region,neg,neg
modified model s goes from in seconds via does the even deserve all those accolades if its not even on sale nationwide la para a la la the worlds first race car does in seconds has installed to manage peak power demands saw my first today happy is giving away free cars with a catch top five c i just cut off a and felt bad about it sorry says opportunity to work on ambitious efforts was we would to host you on a the valley in a yo you should talk to roman aka hell treat right s roof tiles may be a cheaper alternative to a conventional roof great news for the allows cars to break speed limit again why ambitious model may actually ship on time latest suit proves how important human driving still is presentation is building a stunning rival heres everything you need to know barge landing attempt so in love with best car ever dreams big keep dreaming for me,neg,neg
s latest focus on not power extended period of distraction led to fatal crash of model s quietly released the electric car in the world el the handout kills another thesis lit always so excited when i see a in town wish i could try one one day software introduce en el batteries for and other electric car makers are getting cheaper about the model glass roof will it be possible to tint it with a press of a button or motors inc aims to reduce crash rate by la es s a sea fin la nun km now km on what get wrong final delivery for the day use my referral code to get a credit towards a new until march met my evil twin at a supercharger at miles the model s d is now s vehicle la el en great to have exhibiting at,neg,neg
several feet of powder great people and a few does life get any better than this new drone footage of in musk says to major hardware revisions almost annually will have major car r almost every year u h w bush what does it feel like to reap the riches of the world lose your soul honor in the process less crashes with autopilot sounds awesome the latest the green living tips daily thanks to i got the new stuff for real this time million volts of rock and roll praise be to will have major car r almost every year what does mean when they say to shift gearbox production to via when will the federal tax credit for buyers read here throttling the performance of its will have major car r almost every year if a buyer you were probably miffed when now offers electric car on the market miles may have insane mode but will have ballistic mode y con la en y contra el as es el s la gt con a little bit unsafe but quite exceptional performance from the model x,neg,neg
adapter die kw at cube we fulfilled a small dream this past week placing a booth demo unit in the motors will be the year reigns finally flops via was plus go musk the latest the roadster daily as do a o on the beat man fr for releases new model s d with miles of range longest range in the world releases new model s d with miles of range longest range in the world ac con en la en big has to make a vehicle that the public wants revamp dealer network i like service doing the right thing goes a long way battery pack price evolution no con para la y recharge electric road trip autonomous vs promises major hardware revisions every to months cc for now your will only up to mph roadster this car has only miles on it since it was,pos,neg
head over recruiting engineers for new gig is the reason stock has been rising since well with on this one always hated thieves when will cars learn to apex corners want a as signer musk has trumps ear and wall street takes note short cover quick while i juice up free thanks to lawsuit at least incidents so far man pulls into garage car speeds itself up crashing wall into living room s musk said to float idea of a carbon tax to yes i could buy a but id much rather purchase an the worlds first autonomous aerial vehicle what a friendly waving crowd owners set for largest gathering motors fast in analysts cite trump effect for stock analysts cite trump effect for stock rally model releases model s d with miles per charge analysts cite trump effect for stock rally,neg,neg
price update via source absolutely la model plus ya y y shout out to with his service he does a great job a simple reason why the model is late in examples of evolution not revolution chase your dreams and passions do what makes you happy and leave a legacy lime ridge open space i am grateful for brewery goes biggest sun power installation and combined with is a perfect fit for military ground deployments see where i get my crazy from science battery to charge power sell back to breaking s mobile is their own and third party ones are unresponsive,pos,neg
at the magic per cost of for model battery will be only at the magic per cost of battery for model x will be only model x battery these prices are below the cost of and automatic prof is out done fully electrical this month tons of co saved this is brilliant wait what probably my favorite launch reaction so far pet peeve you have ice with ice use my referral code to get a credit towards a new until march la red ya c has a new million plan for the new dream car store and rolls will get the retrofit for too tunnels are nasty pollution sometimes fires and smoke,neg,neg
s supply lit alb factory year master plan approved ya a en el antes no el ms competition set to arrive strategic policy forum the big five chart service updated for from to valleys biggest tech companies thrash trumps new cheep labor issues brilliant that are exhibiting at c that life tho give her a car musks cities the goal exit the era as soon as possible i swear after i get my my entire family will end up getting id totally be for it save the world drive sexy no orange will become peach soon be resourceful bought an old model s salvaged it for batteries gives min energy only need sec drag races model s mechanical resonance tape via please let it be,neg,pos
final report determines that the crash happened through no fault of the vehicles software or hardware will we see a possible merger between these two companies will we see a possible merger between these two companies will we see a possible merger between these two companies will we see a possible merger between these two companies will we see a possible merger between these two companies will we see a possible merger between these two companies will we see a possible merger between these two companies will we see a possible merger between these two companies will we see a possible merger between these two companies energy storage business powers up tech roundup going for cheaper land in buffalo buffalo is new high tech hub cheap land housing lots to do high tech knew about the pain and read more exclusive tufts professor invents a that holds x as much power interview on i appreciate the desire for a strong economy jobs innovation local manufacturing but sounds like trump support sad la la trump via reasons why are the most secure cars ever made golden girl,neg,pos
village hosted a ribbon cutting ceremony at its new supercharger fireflies gives the power grid a boost house bill appears to target s direct sales model todays shenanigans gives the power grid a battery boost via its only a reservation but so excited first look in no challenge for rented by i house bill appears to target direct sales model s pd sets a new world record for a u moves beyond electric cars with new battery farm are now lighting up grid s former car guru is working on his own company with former model s running wild by autopilot this damn thing drives better than me hills this is happening whether the executive branch is on board or not die electric gt teams brilliant that are exhibiting at c van met rug met met,pos,neg
business today inc started testing four cars on public roads late last year a milestone for in video musk on starting a business have a high pain threshold the great radio controversy by is years old today classic v manager tears up ending passionate speech against ban on direct sale la taxi nos motors inc is now officially inc by has also hinted at its own service s electric car falls short in new crash tests via officially changes its officially changes its officially changes its officially changes its great musk business quotes read seeks to its equipment storage site at port facility motors changes its name to better describe purpose cars needed far fewer disengages in,neg,neg
the company inc is shorting its name to just inc the decision to drop motors from the article focuses only on is leading all d way n has a huge by yrs die support fr in den slaves considering but changed my mind when you on advisory board so much for the environment choice other cars so den anti revolution g community great to have exhibiting at install days are the best days rolling out autopilot to cars built since will limit to mph the same people who buy for its earnings musk of is meeting with tomorrow still want that not a great plug for those fancy wall batteries paper does note result is compared to grid storage still better than no soar first look about first look,pos,neg
by it is estimated that of cobalt demand will come from keeps on with electric semi more upgrades to my drive model s now is a p will do some performance tests later in the week great to have exhibiting at keeps on with electric progress keeps on with electric progress officially launching in this month starting with service center in very telling move and join other companies in opposing trumps immigration ban and join other companies in opposing trumps immigration ban we need to build more like via think about that check out keeps on with progress via well only time will tell if staying on serves a purpose well only time will tell if staying on serves a purpose customers are canceling their model reservation good for for joining the brief how bad does it have to get before you it is really bad already might plug into sooner than bolt ready to take on musk plays differently than you do u,pos,neg
drag races model s fully charged i a con y air model s gt enables availability on navigation reportedly no update needed going to check my car right now starting with thinks s old model logo is a little too familiar so since i wont have in student loans means i can buy a right musk model x that crashed using autopilot u have you seen this est model con y total musk confirms is still working on a semi truck est model con y total trump com e my confused for not the same company the model x pd would destroy this thing in or a drag race no no a en latest over the air update supercharger live status you can see how many stalls and how many occupied keep it up u,pos,neg
use my referral code to get a credit towards a new until march precisely one of the most gratifying results of intellectual evolution is the continuous opening up of new and greater prospects new review getting ready for book read here called it about the time for to listen pd v review we need people to have heroes like not the family what if the summon feature on got messed up and you got hit by your own car pd v review was way ahead of his time interviewing him would have been an awesome are leading the precisely one of the most gratifying results of intellectual evolution is the continuous opening up of new and greater prospects ford to invest b in to take on in vehicle great to have exhibiting at dads joining the club too just picked up my inspirational story of smartest man ever increase your brain power like he did if this works i see a longterm increase from s current stock price pending though welcome to finally its happening thank you thank you welcome u more sound check from our arena show in today check out franks new at arena,neg,neg
make car industry great again team fr the tide is turning and is on top of the musk is at it again hes redesigning solar roofing ill call you guys when i put in my tiles now thats an awesome duo s plant fr die die auto clients pour la future model another new company just launched model x d built this is a beautiful car u a debate begins about at s auto plant got back in before the worst of the on via my sons favorite scientist and certainly one of the greatest the big five chart service updated for la musk es el jobs tension high as prepares to begin production of the model la times continues to solidify its plans toward wait why is building his factory in again drag races model s model,neg,neg
i will be patiently waiting for my ping ball tomorrow autobahn via t t subsidies to t guy sacrifices to save unconscious driver musk offers to cover repair costs via great to have exhibiting at by la model s model s tech leather rear cam k mi if not my next car the one after that has to be the connections between and this goes from to very guy sacrifices to save unconscious driver musk offers to cover repair cost way go guy sacrifices to save unconscious driver musk offers to cover repair costs records the vault was right antes o gringos been minutes since this tweet and no musk is losing support because of trump his gamble better pay off think my sons approve we enjoyed our first and testing the sound system auto union courts workers amplifies buy message via announced you are part of a billion dollar deal to produce electric cars in is this true la dos hombres la is it true is going to produce vehicles in with a billion dollar,neg,neg
para la hombre lo para la hombre lo para la hombre lo para la hombre lo para la hombre lo d para la hombre lo para la hombre lo paid to park but the charge was free so counting that as a win electric or fail model production concerns a pit stop along the electric highway analysts adjusted losses to narrow to cents from year ago striking new i electric saloon car to take on auto i hate people who stop to merge new details lit son dice la hay con y lo great to have exhibiting at c ms km con para a la it seems the model s pd is not so perfect after all c is the companion owners have been waiting for now gainers losers,neg,neg
