tweets,price change,Tweet Sent.
upgrade to led plate bulbs on your life with cats what yours is mine and what mine is mine d superchargers in are coming along nicely recharges balance sheet with debt sale financial times raises billion in junk bond market with the application of technology can be generated artificially is set to raise million more than it sought from to fund the model via compare this cockpit with model is the a dinosaur they need help however the artificial is quite low in quality level compared with involving mantra etc to unlock a model your is the key greatest book on earth great musk business quotes read and too no more for me all the way what is well i said gonna be alright and ill fly with you,pos,neg
for everyone who keeps asking the wheels are just covers you can take them off musk creates a tiny house to feature its energy products just made a futuristic via a para el not really a fan of especially with and in the hardships they did in but i do like musk tows tiny house around with model x via musk been trying to get for now and so far no answer from we are building friendly homes in and need to get prices i want one too yes just that the permitting process is slow corvette hybrid elevated bus energy when can the wall be available in musk lifespan cut shorter seeking alpha neat read s stock surges after analyst warns it is a mistake to bet against the model ramp the incredible story of musk from getting bullied in school to the most interesting man in tech,neg,neg
starts offering home charging installations in certain markets model s performance i have a model s for sale this who do you side with or la y la en filling station mall cars will arrive full years later than needed very upset driving since years my next is a s get your trading swag shop now at pretty satisfied with this combination and the u la drag races model s rigged adverse event patients died robbed us peddles diabetes failed took bailout my shares s birthday th get to know the model get to know the model get to know the model get to know the model get to know the model get to know the model s camper mode looks like a case of finding new use cases for an existing product its always easier to just step away and do nothing,neg,neg
powered tiny house hits the road in my c powered tiny house hits the road in creator joins brain after autopilot stint via releases new autopilot software update adds automatic high beam worldwide and are installing solar rooftop systems on depots and to outfit home depot stores with solar panels proposer double trouble cat black white musk kicks off deliveries of model model s d model s d miles black one coating applied to this listening to the of station with my kids it went from to bitch better have my money gore elites should retire fly their jets to drive their sip lattes when its clean the original paint has striking travel real life see more at real life see more at new radios bring a screen to your truck via com ranks stocks impacts dinging even w sales mostly in cleaner grid,neg,neg
new video from about model interior may not play on mobile a owner shows his grandpa a car from the future con video el fin la a owner shows his grandpa a car from the future grandpa enjoys the wonders of the future in his first ride c a owner shows his grandpa a car from the future is taking a risky new approach to customer service emotion competitor will make its official debut at a owner shows his grandpa a car from the future a owner shows his grandpa a car from the future emotion competitor will make its official debut at a owner shows his grandpa a car from the future a owner shows his grandpa a car from the future new slots tagged vehicle charging a owner shows his grandpa a car from the future a owner shows his grandpa a car from the future nos solo exterior and beckon ubiquitous city charging by,neg,neg
had to wait min at grant pass or charger only chargers a day with a in real life a i do see solar roof as the very cool design fancier higher lower reward stage vs current solar market la hombre a womens tummy control w pocket check it out if this one of the coolest tweets ever got a new model x today cant wait to get my model later next year good to compare to solar nice new roof to know premium paid for roof sq ft vs sq ft b tax credit do i c by pod i found something nice about grandpa and owner you need to read this asap s new bond issue trades below par spy is easy to value in a market economy we drove a model x from to new heres what happened la y la en according to a story from a creator via a healer an unspecified number of people use scalar weapons a owner shows his grandpa a car from the future d the future is now they are so cool congrats on the new car,neg,neg
watch this model x pd go up against a driving a during the causes erectile dysfunction due to lithium battery magnetic discharges roadster photo viewer roadster navigation carbon fiber real life see more at real life see more at will musks fans save deal will musks fans save deal model x takes on the hill climb model x takes on the hill climb model x takes on the hill climb great musk business quotes be the first to see champagne tour an and solar panels go together like heres why used electric cars for sale i think it is adorable watch what happens when a owner gets his year old grandfather into a going to be the first child to be driven automatically to school w y we will go there musk continues to add basic features to cars based on twitter feedback cant make self driving cars fast enough less monkeys on the road is good for other monkeys a of failed predictions d,neg,neg
d con d con d con d con the changes this image completely d con d con judge lawmakers must turn over records to motors inc solid rock why model s owners may resent with the influx of model new drone footage shows just how huge s really is model s en la rate el record ms rate el record ms heading to the service center to see if i can get a grid fin spoiler to complete the ensemble bonds tumble in sign of concern over finances via en la the upcoming new could accelerate to mph in under than seconds by make sure with this before buying a s electric semi is reportedly autonomous and can move in platoons,pos,neg
just published a new article whats on musks to do list just published a new article whats on musks to do list zero is worlds most powerful electric with hp does in seconds scales back ambitions for driving capital are soaring via via unintended consequence of electric cars in ca could be that ca may no longer care to lead fuel efficiency as it does today this in turn may hurt the nation to achieve desired fuel efficiency and reduced emissions for musk announces a bonkers hp lightweight electric beast supercharge me check out this little added feature of the the vehicle puts on a show at mall with the application of technology can be generated artificially how will trucks impact your business en el el para el new features make car sharing easier however the artificial is quite low in quality level compared with involving mantra etc gasoline reaches its tipping point gadfly had the chance to make it to the grand opening tonight great for the city want to know more about s were breaking down this new innovation over on the,pos,neg
model competitor sales in in why to buy them in with the application of technology can be generated artificially however the artificial is quite low in quality level compared with involving mantra etc the conditions you place on running in this mode are so overly ridiculous have you tried a autonomous driving without the hassle d con d con d con d con d con d con d con d con d con d con d con d con d con d con d con storage lithium ion,neg,neg
km a typical internal combustion engine has roughly moving parts whereas an has less than for how tiles are bonded together and electricity is solar die die city baby cant wait for that toy car on my table make mine a good luck collecting on those resale value guarantees when is insolvent racing against unveils truck la y la en what was it like growing up with beats to the party reveals first electric semi designed for short hauls regarding lowest probability of injury of any car ever tested by the us government in internal memo musk says the way most companies is incredibly dumb model x premium package this is a loaded like new model x d simply brilliant email to employees have my loaded up with new winter tires for the of course they make the best watching the final draw of the campaign good luck everyone patent for making solar shingles stick together media us manufacturer beats to stage with electric the mercury news in internal memo musk says the way most companies communicate is,pos,neg
being of oldest in world i may say if u could support in early s on his project will be happy is turning into a paradise is turning into a paradise when will have included d how can these cars get away with no recall in the face of so much photo written evidence when taking pictures of your car never gets old its a thing will tech dethrone the internal combustion engine read here this email from to employees describes what great looks just hanging at a party checking out an all electric stage one more to come from and time to build a according to a story from a creator via a healer an unspecified number of people use scalar weapons anyone can engineer a mistake covering it up while more people crash cars die is what a stock promoter does model s p this well optioned is a rare rear wheel drive p that was a good while people are having difficulty finding gas is all electric go figure miles of maintenance and fuel costs model s s class seam to be roaring into our popularity nice their innovation to revolution,neg,neg
will s fans save deal will musks fans save deal will s fans save deal will s fans save deal calculator estimates the monthly costs of owning a model calculator estimates the monthly costs of owning a model via recently i learned that all airlines currently suck is going to create one soon con video el fin la presentation with the application of technology can be generated artificially chem teacher says remember to label your conversations i want to go to mars goes after with the hp mission e electric car wants to take stress out of vacationing with an electric car wants to take stress out of vacationing with an electric car wants to take stress out of vacationing with an electric car road testing with radio crazy line for the model meet model make your reservation at however the artificial is quite low in quality level compared with involving mantra etc,neg,neg
is under attack by same merchant of doubt behind tobacco industry and climate change denial musk a luxury chauffeur services that is our fleet of cars is the future of transport will get a boost from this currency impact seeking alpha semi could be the biggest catalyst in trucking in decades and cheaper to operate article source great musk business quotes read buffalo loves we have parties in his honor electric says it want to copy does exactly that go green and save by going w perfect with an like but great no matter what sign up with the application of technology can be generated artificially well it took me years but i finally got my car however the artificial is quite low in quality level compared with involving mantra etc ml me a es ya superchargers before hurricane action at work today this is why digitizing everything is a risk one of the down sides of a for malfunctions while driving or gets hacked from to staffers and share more than via,pos,neg
we have a feeling these are the type of robots that is speaking of in the uprising astronaut spacesuit next to crew dragon if you cant pump your own gas in are you allowed plug your in yourself and why and drivers check out s review of and see why it belongs in your car such an awesome day today very emotional very blessed working for making car liners model s in turbines according to a story from a creator via a healer an unspecified number of people use scalar weapons u rt astronaut spacesuit next to crew dragon el a con y festival a la el rock late owners check out national drive electric week in your city read here el model s pd con dos a en interesting us uplift of in is all of the newly installed capacity en we call of the week truck could be biggest catalyst in trucking in decades es no more energy sink roofs,neg,neg
very reason why stands out as it upgraded owners batteries to help flee lost my mind garden blooms totems are finished if you get a new watch series with and use it to talk to and can call your a read the hopeful statement from the family of a man killed while driving a thanks for allowing my to dream of the open road every night autopilots limits chiefs cheat devices probe alleges life goals vehicles magically gained extra range so their owners could flee alums founders mentor startups free via thanks again for being my friend and out my life cause ooh i need you during remotely the range of cars in its path but how a federal agency says an on s contributed to a fatal crash living that life souvenir from visit today to see my girl motors corporate system safeguards lacking in crash on autopilot accident in involving a no one was injured investigators cite autopilot limits in fatal crash news observer has the horsepower for battle gadfly this is a conservative estimate by the us government will make a reality much sooner than,neg,neg
are you talking about has over b rev and close to b net typical clueless long whats the on is set to reveal its first in heres everything we know will challenge with its own electric car batteries car makers this is what wants go build electric cars that people want stop talking about it semi new total new total electric cars are projected to be of all new cars by thinking it will be closer to the high end of that range d c h o s e n spell it out get the in the c the way humans get electricity is about to change forever guess gas stations still serve a purpose with the application of technology can be generated artificially on however the artificial is quite low in quality level compared with involving mantra etc hoping for a bigger state rebate for your model next year have to wait via nick talks about unveils electric at to unveil electric semi truck that musk calls a beast via,pos,neg
according to a story from a creator via a healer an unspecified number of people use scalar weapons is working with to develop its own chip for cars says source the future when well have flying cars la needs it so badly love your test drive an from at how will beat in could install convenience stores at its charging stations when can we details on all future versions of model so that reservation holders know which one to wait for fest highlights big ideas in buffalo spectrum news trounces in worlds greatest drag race mile if buys via still covered in dead bugs you know installations are happening when the stories are starting is bringing its network to city centers ca re pr km i model s model x problem looking to monopolies on the wait while you charge and take note first detailed model review video makes its way to just made a futuristic tiny house how the and phone entry works and user manual,neg,neg
thats actually the paint color showing through the loaners front door panel gap all this talk of an coupe ha to be clear an chip will still underpin the used with vision for a great family brand model currently has no radio and no streaming the worst ergonomic design ever multiple menu levels to adjust direction of air vents etc should b illegal anything can do we can do better thoughts the phoenix more efficient than the worst ergonomic design ever multiple menu levels to adjust direction of air vents etc in is now open in is now open in is now open in northbound is now open a per i musk is now a via mother the future of cars tunnel vision tunnel vision concept looks like an electric car straight from the universe a single battery saved this town m in grid connection costs,neg,neg
big disappointment we our model s to be delivered to our home today and mt got it wrong see the lights no power in n hows business now said musk will be announcing something really special at todays talk musk mission to mars hacking a what we found and what we learned profusely after coming up screaming said stop sucking dick job aids in relief efforts sends systems to help restore power with the application of technology can be generated artificially choices choices which would you chose electric trucks going to change the world not only the but also right this cause of emergency stop human error at the factory sending battery packs to can be paired with panels to help restore grid sending battery packs to can be paired with panels to help restore grid however the artificial is quite low in quality level compared with involving mantra etc,neg,neg
wait with all the newer coming in for all kinds of grief what is lets see how you survive this will spend billion building cars in us via as is tested by tale of two bolt dealers vs according to a story from a creator via a healer an unspecified number of people use scalar weapons used electric cars for sale could they be anymore opposite to the mall buy socks underwear a thank you is shipping hundreds of batteries to aids in relief efforts sends systems to help restore power st take the songs good o how i love see test using ac power thanks is sending hundreds of battery packs to in the wake of major hurricanes a rare pair the biggest energy storage facility in the world is already half finished by in south take a drive across in a review of the model x read here d as is tested by tale of two bolt dealers vs drive a model x across cars in the used marketplace are you bullish or bearish on start with,neg,neg
how does name his cars by sierra makes less than not a surprise seen on the road they are sweet gm is going all electric will ditch gas and cars follow us on model production suffers from bottlenecks roadshow forget ford turns to team for electric cars roadshow we may on just embarrassed itself by badly whiffing on its model goals responsiveness is a make or break in all business arenas when is on equality how will unleash womens true lo el model profit right confirms significant visible to acquire next to lease see how long have to complete the battery project is getting hundreds of batteries sent from el leaf ms la anterior y on updates for long term and has made just model cars,neg,neg
unreal electric truck spotted in d unreal electric truck spotted in unreal electric truck spotted in unreal electric truck spotted in wall street gives stocks the cold shoulder gm worth more than as stock hits record high ford creates team to develop electric cars no no el as es have u called at called is coming bags from here chart has a hammer next door was met term of is great angle from this wrapped model s owners in you doing on i need a with the application of technology can be generated artificially this is ludicrous pd takes on owners saving the world one gallon at a time u this is ludicrous pd takes on comes in all sizes every day is earth day for owners move towards a sustainable future,pos,neg
just the two probably before breakfast as well as es volt el primer auto pas a la la com production actually does prove to be hell via to any reporters who want a real story is overvalued by wow my taxi is a definitely not in partners with bottleneck in model causes missed production target us senate panel puts cars in fast lane lo what about pure energy minerals ltd my no stock pick with a contract with y ms auto companies scrambling to catch up with and tech firms shares gain on new upbeat wall street views the mercury news musk deja para en whales and dolphins studies show the sound frequency they emit is a healing energy not to mention their telepathic we can learn from them auto companies scrambling to catch up with and tech firms analyst says,pos,neg
the daily digest of future news sec watch solo y mas vive on up again i guess well have to wait for q reports for the actual mayhem video musk how i became the real iron man good job test musk has a theme song but and gates need one too working a late concert at know much about this group paint correction general motors executive says car claims are full of crap musks open to rebuilding power grid but theres a with the application of technology can be generated artificially musks open to rebuilding power grid but theres a catch exclusive leases two big office buildings where could work the musk can rebuild power grid the hill q significant profitability implications seeking alpha however the artificial is quite low in quality level compared with involving mantra etc is shipping hundreds of batteries to,neg,neg
new clean sustainable luxury transportation services now available in cent go check it out verge this even seem innocent praying for modulo the electric via according to a story from a creator via a healer an unspecified number of people use scalar weapons honor the birthplace of build the next center in mission e caught testing alongside vehicles ya en arena in next me was this w an older lady she saw i liked it rolled down her windows and said get it why china is becoming a huge market for and the movement read here take another look at the model the latest the green party us daily s mission e caught testing alongside vehicles do it excellent idea es on the same block that i parked are you bullish or bearish on start with is working on a new type of larger movable panel roof applies for a new patent we are officially part of a story now large companies moving in where governments fail,neg,neg
the future with shortsightedness since edition c the future with shortsightedness since edition watch the model assembly line in slow motion seriously work on your ask some of my favorite people and c the future with shortsightedness since edition the future with shortsightedness since edition the future with shortsightedness since edition by no the future with shortsightedness since edition creating the safest car factory in the world st john vi is a perfect size island to go solar dirty mismanaged power do not repeat fresh start now with the application of technology can be generated artificially musk says is still in model production hell the future with shortsightedness since edition st john vi is a perfect size island to go solar dirty mismanaged power do not repeat fresh start now however the artificial is quite low in quality level compared with involving mantra etc the future with shortsightedness since edition clean power plan leaf semi todays car news shareholder alert law announces an investigation of inc embrace the change fight it,neg,neg
semi truck i just used auto park automatic parallel parking for the first time and it was pure magic semi truck semi truck semi truck semi truck semi truck semi truck semi truck semi truck they do exist what is the difference in technology between the old and new model s headlights capital para no y son la a en meses our latest installation i be on that in the listen to episode its about and an electric bus on on autonomous car market will be worth by and by top players f gm,pos,neg
recalls model over safety issue with seats reveals he owns two gas cars and one is his first love recalls model over issue with seats wont stop i get it for it process model x pour sen voluntarily model x for seat thank you for your time i know a busy man and a great one at that with the application of technology can be generated artificially meet model make your reservation at if everyone would drive s the sky would be blue again comes in all sizes drive with in model x cool view from a model x now all you have to do is find a parking spot comes in all sizes cc team of robots gives its backbone this is driving on wind power team of robots gives its backbone longest line ever,pos,neg
will what a great read fired hundreds of employees in past week according to a story from a creator via a healer an unspecified number of people use scalar weapons in den an hey can we work on navigation often takes illogical routes and longer etas compared to other navigation high flying surprisingly flat considering its shorting inspirational men musk has fired hundreds of employees after performance reviews apple also revolutionized mobile phones with just a few models vs s of competitive phones partners with and to offer in and let me guess layoffs were due to come on this is funny admit it in den an tag in in in s pd in sec glad hear just let go of hundreds of employees i recently bought a used model s the custom service was horrible man muss hat alter looks like has deal with for,neg,neg
good evening with partners with liberty mutual for insurance program u musk playfully mocked by ex wife a new battery takes on the problem of energy storage at the scale two different model s portrayed as the same in the latest our new featured product for the week exclusively for you at auto sales featuring stop yo when is the next capital raise or are layoffs err performance cuts sufficient to float a few more mo reportedly shipped to s massive batteries have reportedly started to arrive in reportedly shipped to la production point reportedly shipped to the is theirs the for which i really worked is mine la charge minutes pour km supercharger man muss man fr reportedly shipped to fires employees to solve production problems they claim these layoffs new total new china total new oxford total,neg,neg
