Date,Tweets
2017-05-28," Even your dads got more friends   against the rest put people before profits! , iOS  at Ahora ya nos puedes seguir en . No te pierdas nuestras notcias . Los cruceros de la donde se cometen ms robos a automovilistas y peatones. Sgueme en ,... How to Set a Temporary Profile Picture or Frame on RT GET All the Feeds from  More in ONE PLACE  GET All the Feeds from  More in ONE PLACE  GET All the Feeds from  More in ONE PLACE  GET All the Feeds from  More in ONE PLACE  GET All the Feeds from  More in ONE PLACE  GET All the Feeds from  More in ONE PLACE  d GET All the Feeds from  More in ONE PLACE  GET All the Feeds from  More in ONE PLACE  GET All the Feeds from  More in ONE PLACE  top ten countries with most users Timeline Maker  FbCoverlover  Check Out our NEW Website! Memorial Day  Entrepreneurial Forum Mark Zuckerberg Reveals the Strategies That Help... Entrepreneurial Forum Mark Zuckerberg Reveals the Strategies That Help... Te dira que no eres la contrasea de mi para no olvidarte, pero tengo tan mala memoria que hasta de eso me olvido "
2017-05-29, Il abbandonato e linutile caccia alluomo della pagina  Find Them On  Public Record Search   No.  . Why this former Messenger product manager is investing in   no es solo abrir una pagina de . Timeline Maker  FbCoverlover  Check Out our NEW Website! June Has Arrived! seasonal PostingBlues          Tips for Advertising on in  great insights from . New system screwed up pushing selfreply tweets in series. Native app settings can no longer handle the structure. Facebook is Toxic! REVEALED PULL IN PENNY VIEWS BY ELOITING FACEBOOKS SECRET VIRAL LOOPHOLE Im really into totally free android right now . Hi wilhemprice Thank You for following AVED audiovideoe  like us on yeah actually has a history of excluding  ban of antiMuslim slur sparks outcry via Les compartimos un poco de nuestro video especial de donde hablamos del xito de . com accuses German govt of shortcomings over hate speech bill Stay out of Facebook JAIL.. . Stay out of Facebook JAIL.. .
2017-05-30," gegen Gesetz Eigentor via How to Use to Drive Growth at Different Stages of the Funnel Plz Like page Win prizes, see updates amp our latest Thanks What a great feeling when your Facebook campaign is approved by ! Wish me luck . Timeline Maker  FbCoverlover  Check Out our NEW Website! Do What You Have To Do Dont ask for likes or shares on . EARN them! Great tips on eanding your organic reach . How to Use to Drive Growth at Different Stages of the Funnel         !!   DatoFacebook est trabajando, adems de , en lites, lseres y tecnologa terrestre. In case you havent seen it, I invite you to visit my page Can You Really Leverage Facebook To Get More Traffic to Your BlogWebsite.... .Dc Reportaje realizado para despejando algunas dudas en materia de inmigracin. Video completo en  to on for a discussion on ,  better opportunities. .  Creacin de su presencia en las Redes Sociales is and also and not really, but I hate How s tentacles reach further than you  Asi ser el nuevo smartphone de facebook, .d FB Hacking  Facebook Phishing  Account Hacking  video hub facebook video marketing video Come see my group . In theory.. could sue or even as there arent other options to select if your acknowledging youve read something"
2017-05-31," What really happens to our and social when we die Hillary Clinton made a stinging joke about Trumps mysterious covfefe tweet . We are in control of our actions Check out on  The best tips and spy tools for ads research that will keep you ahead of the game via Head over to our page tonight at pm for your chance to win tickets to this years ! . Things You Must Immediately Stop Doing on  . How Marketers Can Use to Drive Engagement  Generate Leads . Mother of deceased daughter loses fight to access her childs account Ways to Increase Facebook Engagement In  . Wieso macht Co das mitAn deren Stelle wrde ich meine Plattform einfach fr sperren.  VS fingerprints are all over and ... In case you havent seen it, I invite you to visit my page Now Important As For   My new best seller. Thanks Man Convicted For Liking Apparently Slanderous Comments . Uns gibt es brigens auch bei  wir freuen uns ber jedes . Love Speculative Fiction a  in Mays  via "
2017-06-01," Check out INTERNET MARKETERS GUIDE TO FREE TRAFFIC AND ADVERTISING PDF EBOOK  mil millones de personas usan en un mismo da. Sin vergenza, ,copia cada funcin de  es su venganza a a  Udomljavanje ove u toku na stranici . Reportedly Building A TeenFriendly Chat App y han sumado ms de millones de usuarios en los ltimos aos, siendo las herramientas de mayor crecimiento. d en Connect with me on Facebook . Come join us and be apart of a growing Network Check out  MICROSOFT EXCEL TIPS TRICKS AND TECHNIQUES PDF EBOOK FREE SHIPPING Tips to Improve Your Posts . Check out this article about how groups can improve through creating ! New post. A reflection I wrote tonight for . Cmo se valoran los datos en las redes sociale Authors  Bloggers, Join the Group Author Buzz  Get high with a little help from you author friends Mark Zuckerberg says Trumps climate move puts our childrens future at risk Tell , , and to stop supporting .  via Ways To Rock Your Facebook Live Streams .C      Observa nuestras informaciones ms destacadas en !"
2017-06-02,"  of users have ordered products because of ads or comments they saw there. Decid eliminar mi cuenta de . No entiendo porque hay gente que no se da de cuenta por lo que estamos pasando Here is why you may need a Fan Page  le gan un a los padres de una adolescente fallecida y no revelar sus conversaciones. Jajaja es mi perfil falso ok no la gente est cada vez peor Neiva, Colombia Marie Boswell thanks for following. Connect with me also on Clarificationtrained by unlike by OurHASH TAGSITE SLOGANACTUAL TWEETLINK structured follow not Page Its a damn good job that I still have . If not I would have never seen the rainbow tonight.  Reports White House officials helped Nunes view intelligence files  Strategies to avoid Facebook Jail. . ha facilitado el acceso a internet bsico a ms de millones de personas en pases atraves de telefonia movil is so long. Find Them On  Public Record Search   No.  . now appearing on ! please consider following along thank you  walk in . Esta es la maravillosa vista del corporativo de en .u dance ty for . Come visit us on   My fb app is being an asshole. Wtf for Get Paid To Work On   Media   Hottest Work At . My in laws are sending me requests on . We are family now. Theyre very nice people."
2017-06-03," Cul es la mejor red social para una nPblica Para m . Lee aqu porqu We are profiled based on things we do online anyway. My question, why arent using that data to  p.s, us on Kiss Karegi Bi karegi Tera Yr itNa Hojaye ga Tu pe Nhi PR Search Karegi Timeline Maker  FbCoverlover  Check Out our NEW Website! Today I Am Ways Keeps You Addicted Gagnez des pour vos pages  Cmo administrar los comentarios en  You can win a chance to get Free repair. Just go like our Page at  Pueden seguir la pagina de en en   Is Your Content Top of and Feed Worthy Follow me on Facebook Thanks New Updates and Tests Spotted This Week Trying to build your on a personal page Check out this FAQ Uns gibt es brigens auch bei  wir freuen uns ber jedes . Creepy clowns on my page  Were saved! is coming to the rescue!  Follow me on at Up and coming campaign events with can be seen on"
2017-06-04,"   groups help your business when you engage. and criminals go hand and handgotta love Ah oui partag sur et ... Program Manager, Ads Machine ... at in check this out Sell Neighborhoods, Not Houses Mi Primera Boda My First WeddingComediaEspaol n This Controversy Shows Why You Need to be using Email ...  groups help your business when you engage. BB  Food Bloggers ty for . Come visit us on   What Really Happens To Our And When We Die  groups help your business when you engage.  Solutions , Chicago  wanted in . Steal Significant Traffic from the Top Organic Result Steal Significant Traffic from the Top Organic Result OK, Ive gone up levels in . Thats enough time wasting for today.... for now. Facebook aims to be hostile environment for terrorists  MarketWatch Man flashing money on Facebook live busted  abc Action News Na Maloom Afrad leading lady Hania Aamir during Hang ten photoshoot . .comHSawarPhotography"
2017-06-05," . drops , , , integration in  EstebanCRPhoto estebacr.com Lic. Esteban Cceres. Imbabura  I entertain myself! Social Media know your platform user amount. . .  BBC News  probes comments on a closed group AVISOS ZONA SUR Hijo de mafioso mat a su amigo por un Me Gusta en . Not sure what to tweet or share on , or  Find valuable content here appleinsider .Apple drops , , , integration in Is the Web as We Know it Dying . Maldito . Webinar joins us to show you how to get the most of your and spend READ Socal Meda Strateges To Masterng Your Bra MARKET  SOCIAL MEDIA EMAIL ANON now lets you find and contact your reps right from your posts Advertising and Apps that Improve your ROI by . .Apple drops , , , integration in When you are scrolling to find something meaningful on social media in . . .Apple drops , , , integration in  By Tania Gull lbum   VS     "
2017-06-06," First gif. Wait for it... wait for it... . Steal Significant Traffic from the Top Organic Result Post pussy pounding leak. F . Would you suck my cock . Long time lurker, finally thought id give back .   fresh coat .d A little tame, but oh well F . I can spread them f . first post . first post!! What do you think!! . more more more. Inbox me. . wife wants to know what the internet thinks of her . Lil booty with a Lil sideboob For ya . Half way done with my orgasms for today, dirty PMs definitely welcomed . F Some nipple clamps to get the day started . first time posting . F first time posting . Hijo de mafioso mat a su amigo por un Me Gusta en ndula  Segui su GUAD Fashion HOP"
2017-06-07," Catholic priest banned from for posting factual essay on and How to Use to Grow Your Fan Base  Business ...   Types of Ads that Will Win Customers    Recibe puntos gratis por conectar tus cuentas de , e    The Exchange Student is driving around. I think he wants to stop  chat. I his face from his . He waves will share anonymized location data with relief organizations  No s ustedes, pero creo que eso de los va si aplica  Cmo organizar concursos en Facebook new features is testing Are political ads consistent with their democratic vision my name  Canvas Ads Can Now Be Included in Collection , by David Cohen via  Timeline Maker  FbCoverlover  Check Out our NEW Website! No Love No Problem  Uns gibt es brigens auch bei  wir freuen uns ber jedes . How the Top Social Media Platforms Spent Their Marketing Budgets Last Year Free Social Media"
2017-06-08," Catholic priest banned from for posting factual essay on and  quick tips for helping your Facebook business page grow. c Make sure to follow the Unity Fridge program on and . We are always looking for volunteers! MG . VS fingerprints are all over and ... Not sure what to tweet or share on , or  Find valuable content here Verkrachting door van jarig was live te zien op Bizarre beelden Een... I did not draw this, but its hilarious and true none the less. . Limportance des groupes dans la cration de communauts Ok, I did it wonderwomanfilm  Inslito! Mat a su mejor amigo por un Me Gusta en ndula  Thanks for following us! Please stop by our too. Wed love to hear from you Facebook Retargeting  Custom Audience With No Website  free code coupon . Ya estamos en ! Dale Me Gusta a nuestra pgina y sigue el trabajo que realizamos en la regin.  Uns gibt es brigens auch bei  wir freuen uns ber jedes . Mediante pareja comparte momento muy hot Mralo aqu  Inslito! Mat a su mejor amigo por un Me Gusta en "
2017-06-09," to fund training of , workers for via Estamos en ! Seguinos para enterarte de ms novedades c  on is Sickening Welcome to the NewWorldORDER Gets On  See more at How to get the Pride flag reaction on . Read more FB Gotta some just never go away..... Find Them On  Public Record Search   No.  . Steal Significant Traffic from the Top Organic Result  If youre on be sure to keep up with If youre on be sure to keep up with Hijo de mafioso mat a su amigo por un Me Gusta en  The latest Marcys Digital Marketing Update! Link na Bio o Stuck in a rut This tool can help you grow your company page The Facebook Phone Puts Text Messaging Profits At Risk  Forbes  Te recomendamos leer nuestra a sobre cmo proteger tus cuentas en lnea por ejemplo o . Friendly chatter on Facebook could be behind our current housing bubble  CBS News Facebook says people cant stop looking at during TV commercials ADevotedYogi sometimes, you can learn more about a person on please consider following along "
2017-06-10," How to Get More Reviews without even asking Court Issues Death Sentence For Blasphemous Post via If your in area, have a , our group, A Fit Herd of Buffalo! Happy Stepping Court Issues Death Sentence For  Post via Tambin estamos en , nete a nuestra comunidad visitando el siguiente enlace HPL on my page mau like Facebook banyak Yuk join sini  Gets On  See more at Whats your fave or site Let us know. We  RT all comments         !!   DatoFacebook est trabajando, adems de , en lites, lseres y tecnologa terrestre. How does she make upwards of , per week on FaceBook CLICK HERE to learn how for FREE Timeline Maker  FbCoverlover  Check Out our NEW Website! FOMO Sorry I missed today. Im tending to other important matters. Replacing my  How to Launch Your Product Using . Facebook Post Ideas for Biz Before Spending  on Ads featuring . Our very own Social Ads Eert, Torie DeJong, covers Getting Started with Facebook Ads for BB . Puedes seguir nuestra pgina oficial de Adoradores Networks en on"
2017-06-11,"       ..       Big tech stocks likely to be under pressure again after Apple shares downgraded just need your full name, DOB  address to steal your identity, most of which can be found on Gets On  See more at is going up in popularity on ! That means its time for you to do it! GET All the Feeds from  More in ONE PLACE  GET All the Feeds from  More in ONE PLACE   GET All the Feeds from  More in ONE PLACE   GET All the Feeds from  More in ONE PLACE  GET All the Feeds from  More in ONE PLACE  GET All the Feeds from  More in ONE PLACE  GET All the Feeds from  More in ONE PLACE  GET All the Feeds from  More in ONE PLACE   GET All the Feeds from  More in ONE PLACE  Ud para vender, para promocionarhttp Selling On Is Easy If You Follow These Steps.. Nastel thanks for following us! Like us on Over  of with a presence use . A Simple Trick to Improve Ads Engagement via . Love Speculative Fiction a  in this  via "
2017-06-12," We analysed our top performing campaigns Dont miss out on these  advanced tips Boost your efforts with these easy Pixel ideas. Kenapa FACEBOOK Menarik untuk dipahami. Yuk baca ....... Timeline Maker  FbCoverlover  Check Out our NEW Website! No Reason To Stay  The only book this generation read is . How To Show Your Human Side With Stories video via Cold Market Prospecting On Facebook  The Easy Way . Alista tus preguntas para esta transmisin por dale Me Gusta aqu You shouldnt have deactivated your Facebook account. I got calls because didnt send any reminders. Facebook in Talks to Revive Nicole Byer MTV Comedy Series in Scripted Content Push Sabas que xico es el  pas con mayor volumen de usuarios de   mil millones de personas usan en un mismo da. Using as a powerful channel to attract and engage candidates and clients on  Mo danh i tc gi vn bn la o thng bo trng thng Tips to Improve Your Posts . New Comeback Kid Single Absolute Feat Guest Appearance    sharing Facebooks Next Data Center Will Be In Iowa  All Things Digital  Pure Unfoldment a different take,  .   Hi Mind Checking out my Page please at viahttpsStatusbrew.com"
2017-06-13," Boost Your For FREE! D Whats your fave or site Let us know. We  RT all comments YaBoyCed  Whats your favourite or site Let us know. We  RT all comments Revive en Al Senador c ha facilitado el acceso a internet bsico a ms de millones de personas en pases atraves de telefonia movil El y sus mitos... lelos en nuestro o . Real Estate Ninja Tactics Summer Marketing Tips to Prepare Your Winter Campaigns.. brings value metrics to campaigns to help advertisers target the best customers via Facebook   Another reason to despise . . . me as a friend on for all details on my seems to have some major going on for the past couple of days. It keeps freezing up, double... Manager, Marketing P... in at LIKE my Official fan page u How You Make Money on by . TM JNT Vitor cracks down on spammy and sexually suggestive web ads "
2017-06-14," Get ready for money requests on Facebook Archive Comment associer et  Associer Facebook et YouTube, cest combiner la puissanchttp Why are  Industries required to be accountable for their Mind Altering Content  but  are not Is Eanding Its Test of Video Cover Images for Pages Engineer, at in Facebook Reactions Make More Sense When Coffee Is Involved . Facebook Messenger permite enviar y recibir dinero de tus amigos de Pandan ou sou al like page la lew finn like li wap we yn kote ki ekri klike sou... launches cross border insights into key international market opportunities rhttp Vote FUNNY or OFFENSIVE on the site.  Facebook.     has changed the algorithm again! Get the details You can boost your Fan Page results with one simple installation. If youre an active user and love in the world of , follow my s Check out in Social Media!  NK . Well At least took action and shut it down. Still waiting on to do the right thing. . You can now add  seconds of video on your cover image. Videos should be at least x px  Secret women  The Importance Of Facebook Likes, Shares And Comments ! . has joined ! Make sure to follow Catrionas page to get all the latest updates! ."
2017-06-15," asQu la red social ms utilizada por los es . Ms info. aqu Find Them On  Public Record Search   No.  . rolls out the button for comments to all users Yay!!!  . You can find the incredible Toby Randall on at Discover ad testing tips you never thought of that will drive results testinghttp          Our amazing crew have a new page! Check it out If youre on be sure to keep up with Love Speculative Fiction a  in this  via  Revive la a Presidente Estatal del , en  will WhatsApp angeblich auf eigene Server umziehen  via Examples of Companies Successfully Using to Grow Is now part of the big media . addresses , midroll ad transparency problem with publisher lists  .u  Facebook hires Siri natural language understanding chief from Apple  Marketers should really be using Facebooks branded content tool  heres why . Leveraging the power of to make massive income... Check it out! Facebook hires Siri natural language understanding chief from Apple "
2017-06-16," Follow us on leave a comment  . I created a page for my  page  feel free to like it reforz sus herramientas de inteligencia artificial para identificar material de grupos terroristas Anatoma de una exitosa implementacin de by by . Ya usaron el botn de GIFs en los comentarios de  Esta genial! Daddy Yankee will now be be buckling down to make headway on the companys artificial intelligence and machine learning front Recordar que est ya en y A qu esperas para hacerte fowoller o cmo se diga salo told you people Mantente al tanto de nuestras redes sociales, como , para saber qu tenemos para ti. Sguenos en Una de cada personas en el mundo se conecto a en un mismo da . Are Property Can You Really Leverage Facebook To Get More Traffic to Your BlogWebsite.... . Man Facing After Uploading Movie to Realms of Despair is currently offline while work through server issues related to our recent server upgrade. Not getting traction with your new page This article should help! mil curtidas no ... Quem diria, um dia chegariamos... S temos a agradecer a todos!!  Putin sees increased support from GOP What is the difference between a page and group via Creative Me . REVEALED PULL IN PENNY VIEWS BY ELOITING FACEBOOKS SECRET VIRAL LOOPHOLE Facebook built an AI system that learned to lie to get what it wants"
2017-06-17," Tips to monitor your kids usage of apps like or . Want to be more effective with Facebook marketing Here are tips. prayers  How to properly use Live to get leads. .c How to Engage Millennials on and via  Come chiudere un account Vorresti chiudere il profilo Facebook ma non sai come fare Per prima cosa dobb page .  Reality Bites Learning the Future of V.R. at Sundance  The most annoying notifications, ranked via . via     Uns gibt es brigens auch bei  wir freuen uns ber jedes . Gabung Ke Kita Disini Yuk"
2017-06-18," Get Paid To Work On   Media   Hottest Work At . Arbys  . . compr la compaa de britnica Ascenta en el ao Tambin sguenos en y con ms Aplica la Grafologa en tu vida personal, laboral y social! Valuable Reasons Why Data Will Never Match Your Insights via  and drew different inspiration from their own frustration with and  boosts overseas business with Creative Accelerator  Love Speculative Fiction a  in this  via  Catch our daily buzz on our page! A mi nada, gente que publica sus delirios megalomanos en , lo peor es q te estoy hablando de una futura psicologa... En la era puede seguirse manipulando a opinin pblica Cmo En AT !! Kicking off our event at with taking the stage . Anyone know the these are going through Check out our page for the Reasons Why You Need A Page via . Twin Cities comeback soul singer Sonny Knight dies at instant ,    .   ,    . Why Inc FB Should Fear This Social Media Kingslayer ."
2017-06-19," How To Use Audience Insights  The latest TechCorner  Social Media  Web ! We Tested All the Best Advice to Get More Clicks on . Heres What Worked. u Strategies to avoid Facebook Jail. . You are the successor of Jesus. periscope sleepaway camp theme remix by yours truly. peep it! e le quitaron protagonismo a en pero esta app tiene un salvavidas New for Sheryl Sandberg ve a Facebook como una nueva fuente de empleos  . Are you losing money on Ads Free training to help you win. . . Are you losing money on Ads Free training to help you win. . .D !    ... Love Speculative Fiction a  in this  via  Get noticed! posts that can increase ur social media shares  get ur organization more followers! Here are tips for shooting on How to Get Results From Ads on a Budget . Sex offenders, Facebook and the U.S. Supreme Court Follow us on Twitter Why not like us on Facebook . How You Can Use to Grow a Group of Over , People . Hello s You can boost your Fan Page results with one simple installation."
2017-06-20," on  Are you a  COO doesnt think so... Are you a , COO doesnt think so Ad Metrics Ways to Measure The Health of Your Campaign by for If youre on be sure to keep up with How to hack organically and with paid ads Podcast by . Hmmm. I wonder what it could be Too bad Im not on . Man gets ys in for dangling baby from window in . And what would YOU do for likes Less than minutes away! at pm EST on Author Vie Cin page. . registra patente para espiar a sus usuarios The most annoying notifications, ranked via sharing Nokias latest Asha goes social WhatsApp key for some, Facebook for others ..  Blah! Blah blah blah ... blah, blah. Blah, blah, blah Trump, blah, blah, blah, blah Comey, blah, blah, blah, Clinton, blah, blah. . Like pleaseeee  Vision Algorithms Lead,  Do You Have To Over Your To Your Employer The rainbow reactions went live this month as part of s pride celebration, and appear ...  s Lee Family Fued Goes Public on  Quicktake via . Uns gibt es brigens auch bei  wir freuen uns ber jedes .  esos en vivos que dan pena ajena! "
2017-06-21," Top Campaigns on . Catch our daily buzz on our page!  s o meu que esta travando a toa. Toda hora.. How To Double Your Beat Sales Using Facebook Ads.. Were having a grand NOW on our VIP page at Ce que Facebook pense de vous Get Paid To Work On   Media   Hottest Work At . Your is someones success. Dont ever ! Be . , , NewsTechnology s Sandberg Wont Run Uber, But She Knows What It Needs Global internet Economy  el pendejo de adelante revisando su y no avanza y no pasas el semforo There is a new Metroid based page I am a part of now call Check it out! Where are all of the gorgeous men from the dating ads I see on  How does one find them in real life s for is actually not terrible via GET All the Feeds from  More in ONE PLACE  allows animal cruelty and child abuse pages to be up even after complaints Sheryl Sandberg has no plans to leave for Uber. Read more FB Finding the support pages on too much of late so many posting about killing themselves, i can keep me going not you is being a cunt. Notifications arent coming through. Check Out"
2017-06-22," What We Learned From Spending k On Ads  NG is considering changing the Algorithm like . What you need to How to Get Results From Ads on a Budget . I think own is live on right now...go say hi for me!  When visuals accompany posts, users retain  more of that message for the following three days.  When visuals accompany posts, users retain  more of that message for the following three days. Unveils New Buzzwords. Read more FB How to Use Advanced Location Targeting for More Engagement via .U If youre not sponsoring reps on , youre doing something wrong! . th nghim tnh nng bo v nh i din  Lovelyn Rich Ewayan Congrats to my Team ! BE THE NEXT... Slightly Dodgy Advertising Executives You Must Follow on Facebook Releases New on BeverageRelated Conversation Across and So Thailand trying to follow China with NBTC trying to regulate and . Well good luck with that Check it out RT    via  How To Connect Million Facebook Fans  Jeffbullass Blog Has New Vision Beyond Connecting, and It Thinks Groups Are Key. Read more FB LittleKnown Features and Hacks You Can Try Today . ad insights to keep at the forefront of your mind  YEA....... is Back UP!!!"
