Date,Tweets
2016-12-01," has come up with a new version designed just for the older generation. Its called . Carrier Indiana ha facilitado el acceso a internet bsico a ms de millones de personas en pases atraves de telefonia movil How To Share A Post To Your Facebook Page On Mobile on Tis the season to post pics of that damn elf EVERY. . for the next days! get leads and results with th Paid Ads Overview on Download Here Yamaha YFM YFMX Warrior repair workshop Service Manual Nos pueden seguir en  Facebook wins with new camerafirst interface. from  Winners and Losers s Roadkill on En y tambin estamos presentes. os. Make sure to follow me on and for the latest updates and teasers of upcoming publishing JEEP WRANGLER TJ SERVICE REPAIR WORKSHOP MANUAL READ OF THE DAY from C How to Look Like a Pro Using Live Lights, Camera, Action via facebook    facebook    den like a la cuenta oficial de en How to Look Like a Pro Using Live Lights, Camera, Action via kimgarst  based on my avg or LIKES thatll"
2016-12-02," Q TAL FOTITO Q ENCONTRE EN DEL CAMARADA EL   Emanuel Karlsten Det r inte Facebook som skapar hatet, kulturministern!  Lol years ago I said some weird shit . Honda Rebel CMX Service Repair Manual  Facebook threatens LinkedIn with job opening features Forms Partnership to Create Affordable Housing in Silicon Valley. Read more FB Why SMBs should spend more of their Dont put your food on or  share it with your on If Youre Not Selling Beats On Then Youre Missing This.. Quieres publicidad web en y varias webs entra en Quieres publicidad web en y varias webs entra en Quieres publicidad web en y varias webs entra en .....  alguem com problemas pra acessar o pela  Be rich and successful Homewood apologize to woman detained at Walmart incident goes viral in  Dec  PM ET Get more and fresh content from your Facebook Personal Page to your Facebook Fanpage. Marketing. Las de en son Dale Like Te invita FREE community of making  on  drmo Product  invests major moola in affordable housing  "
2016-12-03," A relire  Facebook lance enfin sa version professionnelle baptise Workplace by Facebook rookie. Double uploaded my video To setup a Fan Page for businessmarketing purposes you first need to create your own personal page. This can be basic. Thank you Friends  Family Mei Foo, thenameisaa The Crucial Steps Needed To Actually Drive Sales From Facebook  est listo para lanzar su Aquila que dar internet .d The Crucial Steps Needed To Actually Drive Sales From Facebook jeffbullas The Crucial Steps Needed To Actually Drive Sales From Facebook  The  rule that ensures you BUILD YOUR BRAND Download Now Curta nossa gina , tambm no Ein Versehen. Die Sperrung galt . RT sperrt Tbinger OB . ne RIP photo maps, the best part of that apparently no one else used Ich hab mich selbst bei selbst gesperrt, nmlich durch aus diesem  The Crucial Steps Needed To Actually Drive Sales From Facebook  Thank you so much for being our follower! If you are on too, please share the LOVE  LIKE our new page What customers really want from your page point  and U You posted photos of you picking up your Christmas tree Really I guess wouldve been excessive. The Crucial Steps Needed To Actually Drive Sales From Facebook  is finally working to control their fake news epidemic... a little too late"
2016-12-04," Stay away from these simple mistakes via  managing your Facebook page shouldnt be a full time activity Thank you, . Thank you, . Yep. Exactly how we feel about ! . Do you like Wiazza Make sure to Like us on ! How To Use  Crap !!! Some of my pupils have found my account But how  Now I fear for both my and accounts The Merry Jaynz, thanks for connecting!  Were via  . Las novedades recientes de Facebook Parte I What Is Facebooks Safety Check Disaster Notification Tool What Is Facebooks Safety Check Disaster Notification Tool What Is Facebooks Safety Check Disaster Notification Tool What Is Facebooks Safety Check Disaster Notification Tool c What Is Facebooks Safety Check Disaster Notification Tool What Is Facebooks Safety Check Disaster Notification Tool What Is Facebooks Safety Check Disaster Notification Tool c hack wifi  v Entra a nuestro y participa! Get paid to post to face book"
2016-12-05," socialmediaday  Tricks to Maximize Your Reach on by AmyJeanneOpp   strumenti per la gestione dei profili sui social media New track dropping tonight at pm! Link will be in my bio. . Ignorance is bliss   We know how to use Groovy, contact us Liam Payne hack sur Facebook avec des contenus pornographiques ! Liam Payne hack sur Facebook avec des contenus pornographiques ! Facebook travaillerait sur une nouvelle fonctionnalit  Collections  avec ses diteurs partenaires Facebook travaillerait sur une nouvelle fonctionnalit  Collections  avec ses diteurs partenaires Love to connect with you on Facebook too .C Ya somos en mi pagina de , todava no me sigues Tricks to Maximize Your Reach on by AmyJeanneOpp socialmediaday  Tricks to Maximize Your Reach on by AmyJeanneOpp   sharing Wolfram Alpha Releases New Data From Facebook Project  PC Magazine  Facebook Newsroom Partnering to Help Curb Spread of Online Terrorist Content  looking for leads using  shares some amazing tips in this episodehttp Facebook Workplace, su con anuncia Workplace, una soluci will give you wings. Maybe. . CHECK OUT OUR FACEBOOK PAGE OLDMEN   ..."
2016-12-06," Links Shared on Lead to Higher Search Rankings  ensure that you get it spot on here  . Das lovv .d Once youve opened Pandoras Box... . Please check this out for easy Tips to Boost Your Eure and performance Get the most from via check it out  you and your followers will find it indispensible if you share it   LeftWing War on Websites , , , Take Aimhttp Check out our official page for more photos and info on homes in like this! Come like our page.  But you wont like it. Youll love it! Connect with Silverland on too, just search SilverlandOfficial DJ  .c Facebook hace encuestas para detectar noticias engaosas  RoyaumeUni  il dcouvre sur Facebook que son pouse est aussi marie avec son amant Il dcouvre sur Facebook que sa femme sest marie avec un autre RoyaumeUni  il dcouvre sur Facebook que son pouse est aussi marie avec son amant Il dcouvre sur Facebook que sa femme sest marie avec un autre This new tool from is awesome. Snoy eria XA Ultra revolucin en los Lo hemos comentado en alguna ocasin anterior pero los Sonando Ahora  Manny Montes  Mi Medicina feat. Zety Sguenos en y entrate de todas nuestras actividades."
2016-12-07," wants its users to help spot fake news. Read more FB US tech firms to face new European laws  forcing them to tackle hate speech. Equipe da live adventistassp  Check out this weeks Whats New at TW! Full video can be found on our page,  FREE community of making  on  drmo TackleWarehouse Check out this weeks Whats New at TW! Full video can be found on our page,  Facebook Marketing Comenzar un negocio en lnea  Facebook Marketing Comenzar un negocio en lnea  Facebook Marketing Comenzar un negocio en lnea  Facebook Marketing Comenzar un negocio en lnea   Facebook Marketing Comenzar un negocio en lnea  Hoy un aniversario de compartir eeriencias en con my Friend ..... la quiero mucho Pao Paola Andino... Hoy un aniversario de compartir eeriencias en con my Friend ..... la quiero mucho Pao Paola Andino Alcntara Take your pick! . a ok es una rata... que epico... How To Use  Social Network Leaders Step Up Efforts To Remove Terrorist Content. Read more FB Like us on for more Wiazza news."
2016-12-08," Advertise your business on and make a profit Download free report court filings hint at possible political future for ...  Facebooks year in review Chewbacca Mom laughs at your sadness  CNET Sonando Ahora   Dante Gebel El campo de los sueos VELA otc.watchforumsforumvela  M nok give ret nr jeg endelig bliver gal i lget s kommer brlet frem i mig dog mtte jeg beherske mig Follow me on Devaje Mathis Entertainment Group How to Turn Throttle Into Good Kick off your remarketing by reading our !  tests turning comment reels into message threads  via tests turning comment reels into message threads  via Join us live Friday am PT to elore the latest social media news from , instagram,  more .comkozykrittersbysydney Facebooks Instant Articles Bedrooms  Bathrooms  Car garage Use for ... Beats Ad Blockers Rendre un , un , une page ou autre avec How The FBI  Media Won The Elections . vuelve a hacerlo con su nuevo servicio de noticias colaborativo Collection ... no te suena a "
2016-12-09," If you are on , please share the  our page Eu quero agradecer ao pela retrospectiva e  todos meus queridos amigos. Foi um ano... Eu quero agradecer ao pela retrospectiva e  todos meus queridos amigos. Foi um ano... Get Paid To Work On   Media   Hottest Work At . Ad Networks, Recent Updates  SearchForce Join me on Facebook for more great content and connect on a deeper level Stop complaining and on  is fixing their Ads issues. Do you use for on  PreDesigned Customized Graphics via Play eXtreme on  its blackjack for players! USA players welcome  Marketing Day ad errors NASA on Pinterest  media suppliers  READ OF THE DAY from Freakonomics   We Know U BUT You can also Join Us on , LIKE our HERE  Like Us on THANKS! Futurist Mike Walsh says a posttruthdetecting algorithm could fight fake news  Obrigado! Obrigado!"
2016-12-10," Be sure to like my page! How are newspublishing sites increasing page likes through their own sites FedUp with you engagement Download the types of Content that you should use Solution How You Can Use to Grow a Group of Over , People .U Interesante lectura sobre , , , y la ticahttp Crearon la Asociacin Global de la  , de , y entre otros. Like everything else in life, it depends on your situation and future goals  Confirms New Video Tab is Rolling Out to More Users . You want a website, we can do that new posts about Are to following me on  I post about new and other Visita nuestro Fan Page de , dale y mantente informado de la gestin revolucionaria en  Visita nuestro Fan Page de , dale y mantente informado de la gestin revolucionaria en  Visita nuestro Fan Page de , dale y mantente informado de la gestin revolucionaria en  .......  Introduces New Resources For Business via . Visita nuestro Fan Page de , dale y mantente informado de la gestin revolucionaria en  Join our  Las comidas de nabo abundan en Da de piscina"
2016-12-11," This is how s News Feed algorithm decides what you see in your feed . Entra en nuestro y cuntanos qu deseas para la n en tu pas en .Publicaremos las mejores ideas en nuestra pgina Users in Southeast in Indonesia M Philippines M Vietnam M Thailand M Malaysia M Singapore   in Days on !  Our NEW page LIKE  Hey , we dont ask often, but if you you can follow us!  share the WONDER! Basic Sorganomics Why  Your story is just starting. . Honda Shadow VTC  VTC  Shop Manual Have you seen our page yet  Come give us a like.  Facebook at Feet Not Above India  Wall Street Journal I think Im not just blowing up but Im also blowing up lol oh well sorry for all that but hey this is me lol AdrianFuertes RT VisitaCdelU Encontranos en Dale click   Ya en nuestra cuenta de purotipicopanama.con imagenes del cumpleaos de la Sonando Ahora   Dante Gebel El campo de los sueos management ensures constant growth! De los creadores de Qu te pasa y Un da como hoy, llega para todos ustedes Tu resumen del ao. o Whats on my mind s sn You shd b asking us all what we want for Christmas smh"
2016-12-12," How to Grow Your with Your Personal Page via by Tantissimi Auguri Di Buon Compleanno Figlio Mio GermanoFerruzzi  Carline Belizaire   sur Did you know that the Homepage is also on  Please check it out and Like our page. Need help writing applications using Python, no problem sharing Wolfram Alpha details gender differences in Facebook usage  The Verge  Conoces el orgen de las  Te invitamos a visitar nuestro y conocer sobre esta historia How to build a personal chatbot for Messenger FREE community of making  on  . DigitalChampITA Un falso video erotico di Jessica Alba impalla il computer e ruba le credenziali di  Facebook Live video goes , but not for everyone . Warum gibt es berhaupt noch diese Appanfragen auf  Hat jemals jemand daraufhin gedacht ... Effective promotions on via this should help you and all your followers so please retweet it Confira o que rolou no por todo o mundo em . For the rd time since November has disclosed reporting errors to advertisers. Will hurt growth and dominate Confira o que rolou no por todo o mundo em . Facebook is finally hiring a head of news  Mashable Ready for social media . Like us on if you want more Wiazza news"
2016-12-13," s latest measurement error irks Emmyaward winning makeup artist Lori Klein will be teaching our women her top beauty secrets! Watch LIVE on our page Now! get leads and results with th Paid Ads Overview on Download Here  Training at Retweet Shining bright like the diamonds we are Facebook NY The Greeks invented they called it the telephone what the fuck have you done now. The list on the left, of groups and shortcuts, doesnt scroll anymore and its all stupid.  How To Get Photo Likes In A Days El hashtag en Twitter este ha sido el ao del vdeo  Im going to drop my account . Always people looking for attention. is so much better . Bitesize chunks of info . Great Get more and fresh content from your Facebook Personal Page to your Facebook Fanpage. Marketing. What do you do to get more visibilityreach on and  This is huge. Enabling customers to talk on their preferred channel  Les vidos en direct sur Facebook passent  la   vidos immersives Flourless on link on . Just a little food for thought. Hmmmm.    Weve got a Customers album on ! Send us a pic of you and your Steet Ponte ! FaceBook Book  Your Life FB Book   Convert  My Like us on at ."
2016-12-14," Las disculpas de a un bombero quemado por censurar su foto deleted my account once again for revealing the and fighting for our . They will shut us down censuran en de los enlaces y post de... by via  Close the page ODIO A LOS GATOS  I hate cats  En nuestra cuenta encontrars toda la informacin de inters sobre seguridad ciudadana y prevencin . Con .  Desde . oficial Gua para cambiar el template de tu fanpage de va best practices via what you along with your followers need to find out for free  please retweet to all Follow my artist page to read more!  Frenkie  trabalhando para proteger bandidos e assassinos. Take your pick! . Did you know we are on   Like our page today! is asking for a copy of my after deleting my . Nice try and system Yesterdays My are attracting much more viewers on than  rd DAY of the ! a  ! LIKE, and ON ! The s a pretty big place, but  of all spend goes to just two companies and ! .D"
2016-12-15," En nuestra cuenta encontrars toda la informacin de inters sobre seguridad ciudadana y prevencin . Please check this out for easy Tips to Increase Your Eure and effectiveness This is like the Fox guarding the henhouse! How To Use  Are you on  We are! Looks like plans to crowd source the truth. The latest The Rogue Fan Fic Daily! Thanks to As I said . . is a LARGE part of  revenue stream  th DAY of the ! a LIKE, and ON ! ! Get into the swing of things! . Ich finde es ja gut, dass Werbung verstanden hat. Nur das Wortspiel finde ich eher drittklassig... . the last days of !!!!! if he dont care his clients. hes destination is been forgotten  Its like everybody change your profile picture, except ! LOL Announces Style In It allows to silence opposition  th DAY of the ! a LIKE, and ON ! !"
2016-12-16," Nos vemos a las pm  guess Im not the only netwit wondering if the news that is rolling out anti measures is fake news  the friction of connecting to Deals meets  This is so powerful please Retweet check out this page to Harness the Sheer Power of Hey, its time for your ! . Get paid to post to face book Brainwashing America  Soros Finances Group Helping Facebook Flag Disputed Stories Do you like Wiazza Make sure to Like us on ! Dont forget to like on  you could BIG during our Days of Now! . on  Special Announcement Join Me nite on as I discuss The Power Of The Dig Tyskland truer Facebook med b  qu es un mensaje intolerante de para  Weybridge Locksmiths  or Call anuncia medidas para combatir noticias falsas  . Facebook Live will be upgrading its live video to ... "
2016-12-17," LIKE LIKE Global private MPLS, no problem Rendre un , un , une page ou autre avec U FaceBook paid advertising is probably THE fastest way to scale your business right now. FREE community of making  on  drmo Suggestion Celebrate the season with a delicious feast surrounded by friends  family.  Photo. Levi A. via Get Paid To Work On   Media   Hottest Work At . is having today. Facebook to issue fake news warnings FREE community of making  on  . Snopes is like giving cellmates oversight of the prison. cant be serious.  est colaborando con Unity para crear una plataforma de juegos para PC. updates its app and moves down the bar of functions. Read more FB Miscalculates Instant Mobile Great gift for anyone . Running a page doesnt have to be a full time job  as soon as you avoid these simple mistakes Its like and for . . Social Media Marketing Tips Every Life isnt the same with sharing...! . really "
2016-12-18," You can find assistance with furthering your brand with through , and other social media platforms. How You Can Use to Grow a Group of Over , People . O o          Why Your Facebook Business Profile Reviews and Rating Matter Good evening, ! We have a new up on our page link in . yes but Twitter is to blame just like the two biggest reasons for fake news sites success,  namless bullies all about Like Us On eu to podendo  kkk  claro q eu t . Germany threatens to fine , for each post The Real Question Whats Facebooks True Valuation Without Stay connected and follow us on !  th DAY of the ! a  ! LIKE, and ON ! U Like Now tracking Patents reveal focus for Google, , Amazon, Apple, Facebook  Internet Elorer     How To Sell Beats Using  If Not Check This Out  th DAY of the ! a  ! LIKE, and ON ! Take your pick! . Come like our page.  But you wont like it. Youll love it! Get this Social media posting TOOL , day free trial click "
2016-12-19," Facebook encourages text statuses with new colored backgrounds  TechCrunch tips  improving your brand visibility .c Mark Zuckerberg shares his eerience building an AI platform in hours Want to follow us on Facebook aswell search kingfisher for and well be there waiting for you!! Qu puedes hacer para detectar y denunciar noticias falsas E se Domo Business  Centro Empresarial Domo Come sono usate le Reaction di Facebook A qualche mese dal lancio delle Reaction di Facebook, avvenuto  Rude Woman At Coffee Shop Calls Him A Dirty Biker And His Response On Is Perfect.. Thank you for An with  Like us on  permite que pongamos color de fondo en nuestras publicaciones de texto En tenemos una como , as que no dudes en regalarnos un Gracias! Messenger now supports group video chat via ICYMI Everything Facebook has admitted about its measurement errors Thank you for An with  Like us on  Gagnez des pour vos pages  We have a storefront at View and click the images you like, pay on our webstore Estados originales para tu  Make the most of via check it out  you and your followers will find it indispensible if you retweet it Your story is just starting. ."
2016-12-20," sharing Feds want to eand wiretap law from ISPs to Google, Facebook  Ars Technica  Book Your Holiday Cleaning Service with Apple EcoCleaning Coop  Clientes postean fotografa de maltrato que recibieron en restaurante Powered by RebelMouse introduces live streams in partnership with the  Links Shared on Lead to Higher Search Rankings  make sure you get it right here Which Dean should i become today C Neues Tool Introduces More Ways to Connect and Share Moments RT unionradionet  parte de la comunidad Unin Radio en  poto je od mnogih, preko Facebooka napravio zombije, sada je krenuo i na robore. How Many People Really Get Their News From Facebook Youd Be Surprised.  Slate Magazine Facebook brings live audio to platform, starting with the BBC  USA TODAY Live unveiled for realtime audio broadcasting will give you wings. Maybe. .  Get the latest Wiazza news in your stream.  Hit that Like button! Five Ideas For Generating Facebook Ad Content via with Fatemi un regalo di Natale e seguite la pagina del mio blog letterario  boss Mark Zuckerberg shows off robot butler Jarvis. Read more FB"
2016-12-21," Will Soon Add Original Shows to Its Platform thenameisaa The Crucial Steps Needed To Actually Drive Sales From Facebook  thenameisaa The Crucial Steps Needed To Actually Drive Sales From Facebook  lance Live Audio  du contenu audio interactif diffus en temps rel  The Crucial Steps Needed To Actually Drive Sales From Facebook RTjeffb Faced... Booked  I Love It Papi AYE AYE AYE  Social Media Mgr Software     Write Once Publish My awesome on by via so tired of hearing, what you post on Facebook isnt what real life is, honestly who asked you Facebook messenger getting into the Christmas spirit How To Use Marketing Day Live news GoldieBlox CMO interview  search updates Internal Documents Reveal Bizarre Rules for of  Pick up in Guelph! Check out our Page Cambren Studios for more! DM for inquiries . me trajo un regalo a la oficina .  Sigue al Ministro del Poder Popular para Relaciones Interiores, Justicia y Paz . Distribucin orgnica en Facebook  Descubre cmo funciona su algoritmo Friend us on are the that gave back to ."
2016-12-22," I want to tell you about fake news after my job at Trump to meet tech firms including Apple, Facebook and Google now lets people sign into Android apps instantly with just their phone number. Read more FB Hey, thats the world of . Facebook temporarily banned a social justice activist for commenting on racism . Shoptalk Bridges Mark Zuckerberg Destroyed. Read more FB Want more Wiazza Like us on  Get major eure with this awesome tool, . Check out my page Giveaways, Cover Reveals, Book Reviews, and More!! Like Us on THANKS!D  Mzbel Returns To , Advises Fans To Be Wary of Fake People. Read more FB FREE community of making  on  drmo  this weeks best news stories.from  more . ."
2016-12-23," thank you for following! Need a private version of for your own website Mark Zuckerberg And Sheryl Sandberg Share Facebooks Year In Review  Forbes Government requests for Facebook data up percent  Fox News has gotten to a point where it literally makes me sick. The latest Eleanor Hisey Daily! VIDEO FB Technical Analysis Chart  Damn accidentally blocked my blog. Trying to get it unblocked. Read online that paying for an ad is the best bet. Well see. OK, last  then I gotta go  after , will have to change to Comradebook Have you thought about your activity this way Are you trying to build numbers or build community had to log out of  the chrmas cheer was too much! Just gonna tweet shite on here for the next week! x Top Tips For Improving Your Facebook Posts  Boosting Engagement permite disear christmas. La tradicin de mandar postales de Navidad va postal a familiares y amigos... We Know U BUT You can also Join Us on , LIKE our HERE Join Us On to see our store and items D What is Facebook for Lessons from of the best success stories Lessons from of the best success stories Lessons from of the best success stories So gave me a notification about that dumbass going live"
2016-12-24," Why Is The Paid Traffic Source To Sell Your Beats and Grow Your U A relire  Facebook part  lassaut des sites de vente en ligne avec Marketplace WATCH Bad News For The KKK Man Who Threatened On ! My Testimonial How To Increase Facebook Page Likes  Engagementhttp Find out how to drive your online sales with the help of  Like Mike Broemmel  on  Like Mike Broemmel  on  Like Mike Broemmel  on  Like Mike Broemmel  on  u  Sigue al Ministro del Poder Popular para Relaciones Interiores, Justicia y Paz . Like Mike Broemmel  on   Like Mike Broemmel  on  d Like Mike Broemmel  on   The  rule that ensures you BUILD YOUR BRAND Download Now join me on join me on Brownsville Projects The latest Social Media Where the Pros Go!  Sigue al Ministro del Poder Popular para Relaciones Interiores, Justicia y Paz  Facebook wont flag your friends on a map anymore  Engadget  Engadget Look what I found on ! via"
2016-12-25," est listo para lanzar su Aquila que dar internet .d Shoptalk Bridges Mark Zuckerberg Destroyed. Read more FB Still happy I deleted my Secret rules for deleting content Dunno where to start, how to build your brand, or how to get leads on .. Grab this free report quick The Live Blog December , . Read Blog FB Custom Segments Finally Delivers. Read more FB The Ultimate Ad Dimension Sheet for , ,  Other Social Networks  testing a new post writing tool just appeared on my account . florenceublg ty for following. Heres our latest on on Facebook  The Ultimate Ad Dimension Sheet for , ,  Other Social Networks  New restaurant going into Rhythm  Brews location. Read more FB Mobile Minutes Comcast smart home BlackBerry auto hub AI Startup debt. Read more FB arm to invest , in Hyderabad startup. Read more FB wins imitation game with its copycat strategy. Read more FB su for podcasting Laudio live arriva sul via .u What top NM subcontractors have to say about s bid requirements for Los Lunas. Read more FB Tag us in your Jims pictures on ! Trend Forecast Live Video. Read more FB"
