Date,Tweets
2017-08-14," DatoFacebook est trabajando, adems de , en lites, lseres y tecnologa terrestre. Facebook adds a link to Trending News in the apps main menu Go check out on and cop the . tests to people who visited brands brickandmortar stores via Please read our post on Here is a new post by Fethiye Times on That interview is a powerful indictment of the process, and the horrors it unleashed. The more we know, the more we understand. Hey guys! If you could head over to and like my professional page I would greatly appreciate it! u Kofi Akonnor Nana Dei keeps notifying me that its ya birthday..Aah well Lemme wish you some so that... How to Create an Immersive Eerience  Hey guys! If you could head over to and like my professional page I would greatly appreciate it! C adds a link to Trending News in the apps main menu . LIVETrouble at protest Here are tips for shooting on See how much fun we have  like us on ! Greeting, thanks one and all for the many follow  follow back, greatly appreciated. Plese follow me on .     Like Us on THANKS! Tech Companies Have the Tools to Confront White Supremacy VPN   NAVER      sharing Vin Diesel Says Facebook Owes Him Billions of Dollars  E! Online "
2017-08-15," Lets not let her last words go in vain. my hero. You cant hide from FEAR! Follow us on  Si gustan pueden seguir en contacto conmigo a travs de Effective Ways to Dramatically Boost Your Organic Reach and ban groups in wake of Para facilitar a vida dos usurios, vai mudar o design da Linha do Tempo de seu aplicativo! How to Use s Upgraded Website Custom Audience Pixel The latest Marcys Digital Marketing Update! So This Is Why Wanted WhatsApp So Badly. Read more FB          New and Spotted This Week  Social Todayhttp Estamos trabajando en una aplicacin para poder seguir envindolo. Mientras tambin lo consigues en del sns.Facebook   hola me puedes ayudar con un Like en un vdeo de  Fuck or ....some of yall jus need a fucking .. Top Tips for Using Facebook Pages for Your Business . Hopefully this product rids me of cellulite ... E curte a nossa pgina no Facebook! . Nos vemos en"
2017-08-16," e suas atualizaes Sensacional como as atualizaes esto criativas. Atualize o seu      Mark Zuckerberg slams neoNazis and polarization after OpenVPN  NAVER                How To Make A Lead Magnet For Facebook Ads get leads more effectively . BLOG Seguinos en buscanos como Electromecnica Luma  Hablo del algoritmo de  pues anda que el de ... Kick back and relax while Reveal , tracks, and manages your  . Otro ms, as es Facebook Watch, el nuevo servicio de streaming de rcoleshttp GET All the Feeds from  More in ONE PLACE  Kick back and relax while Reveal , tracks, and manages your  Aqu te decimos cmo usar Live New Features to , Stories via are reportedly using to share images of  Top Facebook Advertising Tips  have effective Facebook ads . BLOG Estoy podrido de los perfiles falsos en , da que pasa me mandan solicitudes que contaminan mi cuenta...  find haven on Dont forget to like our page. Facebook TV, YouTube Mobile Share and Chat, and Facebook Live for Stories ."
2017-08-17," is finally purging annoying fake videos from your News Feed Say goodbye to Social media definition of hate is highly suspect.Its full of Marxist  Islamist censorship. etc are very dangerous now. The latest Marcys Digital Marketing Update! knew Snapchat was flailing even before Snaps IPO. Read more FB errores habituales en via Increase Your Popularity! Real Time Promotion . VPN PPTP  NAVER       Sabas qu .          . Check out our page for some other random content Merdeka! Merdeka! ternyata terdengar, Meikarta! Meikarta! Merdeka! Merdeka! ternyata terdengar, Meikarta! Meikarta! Merdeka! Merdeka! ternyata terdengar, Meikarta! Meikarta! Please read our post on Here is a new post by Fethiye Times on I found something nice about U.S. and Presidential. You need to read this ASAP The Future of Social Media Is Here These Are the Trends You Need to Know U ! is finally purging annoying fake videos from your News Feed via outils indispensables et pour booster les de votre page  Digital marketing in the st century"
2017-08-18," !    knew about s struggles months before the publichttp Selling On Is Easy If You Follow These Steps..    NAVER      Reasons Why You Need A Page via . Google AdWords Glossary Terms You Need to Know Are you on  So are we! Lets connect ! Watchlist twtr fb snap chat . s AR glasses take center stage in newly published patent Select See It First on to view page posts Here are things taught us about handling a crisis  . Avoid These Mistakes  Create That Work via . is practicing on a . Download My Single Aint No Time Waste available on music media apps!! ... web design tips to make your life easier maneras de conseguir ms me gusta en  via El Ganador de las Entradas para ver a es Martn Franzosi, quien particip a travs del . Felicitaciones!       . consejos para en via is an app for schedule messages on "
2017-08-19, C rocknrollreporter.de like our page Please SUBSCRIBE  LIKE  SHARE  Love Speculative Fiction a  in this  via  has changed the algorithm again! Get the details C rocknrollreporter.de like our  devrait me donner leurs mise  jour. Jen ai tellement marre dattendre. Whats your or site Let us know. We  RT all comments Lady Gaga RT  Join The RT  Join The .comLoriMoreno  VPN  NAVER  VPN     How To Make A Lead Magnet For Facebook Ads get leads more effectively . BLOG U Sigue nos en nuestras redes ahora en como C Tips to Improve Your Facebook Posts Lessons Learned from Running Campaigns in One Year. Get lifetime access to your competitors activity  .C Top Website Design Mistakes Timeline Maker  FbCoverlover  NEW Website! Is Always There  Ideas From Influential MarketersInfographic ... Now status updates with background color can be selected through a dedicated option in the update composer. . Top Facebook Advertising Tips  have effective Facebook ads . BLOG Vixens on my page .
2017-08-20," GET All the Feeds from  More in ONE PLACE  dC GET All the Feeds from  More in ONE PLACE  GET All the Feeds from  More in ONE PLACE   GET All the Feeds from  More in ONE PLACE  u FREE Training How To Get Video Views For A Penny Or Less Per View   PlayStations Twitter, Facebook Accounts Briefly Hacked Update How To Get  Facebook Likes in Months How To Get ..  Valentine on my page .u Top Tips for on by on .U  Tricks to Maximize Your Reach on Facebook investingbuddy  GET All the Feeds from  M  Follow us on to play! Kick back and relax while Reveal , tracks, and manages your  . Timeline Maker  FbCoverlover  NEW Website! Jesus Saves  No more need to share first if your brand is tagged in creators original post. More streamlined process. Like Us on THANKS! Interesting results from a study if Facebook daily use! ,  Follow us on to play!  Existen excelentes Maestros, pastores y politlogos que puedes seguir en se los cuales puedes aprender bastante, te recomiendo..."
2017-08-21,"  one of the strongest people ever seeing everything written on his company, , and NOT censoring. Ma sta differenziando lofferta di servizi perch sta calando o crescendo Ottimo articolo de  Catch our daily buzz on our page! Me tienen podrido con el y eclipsame a los idiotas por favor, ya es mucha exageracin y niveles deplorables Watch the Live Solar Eclipse Here, Thanks to NASA and Facebook  Futurism Snapchat Could Overtake Facebook, Instagram Among Young US Users for First Time  Fortune How your digital self ...  Sucks did same stuff . I dont like  acting like they R the Moral Judges Humanity, not right. Found on where there is currently some noise. Sign the petition. U You may really want to look at your timeline on   make sure that friends are really not foes. If you arent following us on youre missing out on a lot of fun culture! Join the fun here Among  See more at How to get endless of leads on for your  Passengers on Southwest Airlines Flight View Solar Eclipse. Credit  Austin Wilson ... Read more FB Digital marketing in the st century Facebook rolls out a dedicated Safety Check page  TechRadar Snapchat Could Overtake Facebook, Instagram Among Young US Users for First Time  Fortune  VPN  NAVER  VPN     Dont forget to LIKE us on Facebook! This Controversy Shows Why You Need to be using Email ..."
2017-08-22," Adrin Andrade   Increase Your Popularity! Real Time Promotion .D Top Facebook Advertising Tips  have effective Facebook ads . BLOG Create a Page for biz, brand, cause and more u Adorable bow up for grabs . Si compraste alguna pieza, ve a nuestro Fanpage en hazte fan y djanos un comentario sobre la calidad de nuestros productos give your boy a like La bella llega a mas de Millon de Likes en vamos por mchisimos mas A and over group where friends are made . Have a passion for the stock market Get your FB apparel and accessories now at En tambin encontrars  de  automatic translation In Yup Yup Yup Yup Yup Yup Yup Yup Yup  French Out Yup who is yup, he is yup who is yup.  English Should You Use A Google AdWords Agency Make With Groups Yes, you can! Learn how to start, grow, and monetize your group in this book. me as a friend on for all details on my"
2017-08-23," Watch Facebook Advertising Mistakes to Avoid Aumente sus y presencia en las Planes aqu Baby Boomers and Bars to cheap to pay for a website are the only users left. Oh and Escorts after Craigslist purged em. VPN  NAVER  VPN     VPN PPTP   NAVER       SEO for Bloggers How to Nail the Optimization Process for You A New Way to Buy InStream Video Ads on and Audience Network Like us on for more great content and for exclusive Facebook promotions! Hello, i have discovered interesting thing.check this  . could be losing teen users to Snapchat. Read more FB me dice buenas noches jjajaja y todavia esta el sol a todo lo que da!! La de por en Para los que no lo saben, tambin tenemos Sguenos y compartamos bendicin! Finding A Google AdWords Specialist Learn how two get hundreds of weekly by only using  If yes, go to  c Facebook se cay y los usuarios se sacaron las dudas en Twitter  . Mi post en est rompiendo mis propios records Yahi to dikkat he pe kar rahe he pe nahi kar rahe inka contract months ka he bas ab has a free software for sound but the outoffocus audiolevel cant be lowered underneath dB so its not optimal yet..."
2017-08-24,"  New post  August , at AM   Shop Now Boa noite!! How to Your to on An Internet Minute  vs RT . friends arent real, judge says How to Grow Your Audience Success Tips . on the .  infotransmission.com... Leirion Hand Creation Facebook page   . Blog SEO How to Search Engine Optimize Your Blog Content . Check social media, webpage, post for Book How Get Rich. Best Ways Guide Hazte fan de nuestra pgina oficial en Cmo descargar vdeos de sin programas va Facebook Marketing Pay To Play  Read . HAHAHAHAHAHA!!!! Stadiums  sports stream is live on Twitter  VPN PPTP  NAVER       sharing Another fumble for Mark Zuckerberg not the Facebook IPO  Los Angeles Times  My favorite part of Facebook Marketing Pay To Play  Read "
2017-08-25," VPN  NAVER      lance lapplication Stickered  VPN  NAVER  VPN     How To Make A Lead Magnet For Facebook Ads get leads more effectively . BLOG u FACEBOOK TAKES ACTION AGAINST VIDEO CLICKBAIT, WHILE TESTING CUSTOMISED NEWS STORIES. Read more FB Digital Marketing Trends In you for An with  Like us on  Find Them On  Public Record Search   No.  . you for An with  Like us on  Verifica la FanPage de via you for An with  Like us on  permet de publier un panorama  directement depuis lapp Top Facebook Advertising Tips  have effective Facebook ads . BLOG culls types of posts that Pages can no longer boost as  . Raquel Lpez Te paso la bendicin de Dios psala a todas  Todo era ms cool cuando no tena recuerdos para mi! Facebook hires former NYT public editor Liz Spayd to consult on transparency via nete grupo de NESPECIAL Informacin relevante materiales educativos y bibliogrficos  Censorship Fascists. Zuck a duck wants to be president too. Calvin Klein Jeans Plus Pull on Legging, Color Dark Rinse , Style R via"
2017-08-26," Und Wie war der Nachmittag ohne  Ever wondered about the basics of  Heres the lesson.   Tpico. Hazte fan de nuestra pagina en . Un seul segment rsiste encore au rouleau compresseur Tips to Stay Ahead in Digital Marketing Silence of the Lambs on my page . Strategies to avoid Facebook Jail. . Own a  You shouldnt ignore ads  likes campaigns Facebooks Hidden Gems Underused Tools for . LIVE Facebook Advertising Mistakes to Avoid Selling On Is Easy If You Follow These Steps.. Esperana Facebook      Esperana Comparte con tu familia . No olvides Seguirnos en nuestras redes sociales.   Video Engagement What We Learned From Analyzing Million Videos  by  Using A Google AdWords Agency Facebook, Instagram eerience outages Saturday"
2017-08-27," on SEO Tips Pastors Launch Christian Alternative to . And now we know who is the poisoned snake whispering in Mark Zuckerbergs ear to censor free speechban people on ... No amount of digital marketing can make up for a lack of creat Women empowering site Behind every , there is a deactivated account Take a look and keep on !!  Timeline Maker  FbCoverlover  NEW Website! Mad Max  This watch a video while you keep scrolling is genius Join our page Send us a message if you need anything, were always glad to assist! Join our page Send us a message if you need anything, were always glad to assist! Like Us on THANKS!  Mark Zuckerbergs paternity leave plan. , , , , . Adds New Branded Content Tools to Better Facilitate Comics on my page . Why Your Website Needs SEO"
2017-08-28," The latest Marcys Digital Marketing Update! Who gets on Twitter for a chat Digital Marketing Ideas That Could Improve Your Brand Growth MOre s is what We need and What is OUR Right  VPNiOSiPhoneiPad OpenVPN  NAVER      moresalesonline Your Data Will Never Match Your Data How To Make A Lead Magnet For Facebook Ads get leads more effectively . BLOG Adolescentes se alejan de Sigueme en mi fan pague en . IF YOU ARE STRUGGLING WITH GENERATION, PAY ATTENTION... Google AdWords Location Targeting .. Im not surprised creator is a liberal. Top Facebook Advertising Tips  have effective Facebook ads . BLOG U   mm      at  publiquen que estn en una relacin, en Top Website Design Mistakes and playing in OH MAN Look at this on eBay . Website To Go Please s cs"
2017-08-29," Possible Tornado Spotted in Louisiana Ahead of Harvey. Credit  Nikki Perrin via St... Read more FB Portable Propane Generator Click here . Facebook habilita seccin de Memorias para todos sus usuarios. . Possible Tornado Spotted in Louisiana Ahead of Harvey. Credit  Nikki Perrin via St... Read more FB  Possible Tornado Spotted in Louisiana Ahead of Harvey. Credit  Nikki Perrin via St... Read more FB PostingBlues          Portable Propane Generator Click here . Google, Amazon, to match M in Harvey donations. Read more FB Want our , Bean, and recipe Check out our ! Attack of the Clones s  SABIAS QUE  GOOGLE Y FACEBOOK IMPONDRN SANCIONES A LAS APPS Y SITIO WEB . at banned me for days for some bullshit. You can kiss my OpenVPN  NAVER        VPN  NAVER  VPN     Is Probably A Much Bigger Idea Than We Thought Nuestra colaboradora Lizbeth Rivas, nos habla acerca del y sus alcances en las redes sociales Like Us on THANKS! outils indispensables et pour booster les de votre page  ."
2017-08-30," is the most popular networking platform not just for individuals, but also for businesses these days GET All the Feeds from  More in ONE PLACE  The Right Ad, the Right Landing Page, the Right Moment A Simple Ads Framework for Local Businesses U Benefits of Creating a Group for Your via Lessons Learned from Running Campaigns in One Year. alreaderz with   Retweeted    is the most popular networking platform not just for individuals, but... Teen shot to death was among the selected who met Mark Zuckerberg earlier this year  Rare.us . Trying to build your on a personal page Check out this FAQ How to Enable or Disable Profile Picture Guard on I just checked on his page Love Speculative Fiction a  in this  via  Mark Zuckerbergs paternity leave plan. , , , , . Ditched The For Relief Caution app users  your August update now uses X more mobile data than before. Turn Facebook Into Your Brands Money Maker"
2017-08-31, Gracias a nuestros amigos de por publicar esta noticia en su . . My new name for Facebook Social Media as Means of Assisted Suicide Facebook update News feed now favors pages that load faster. the new disorder Diagnosis Guilelessness Hysteria . Sgueme en mi de Gracias ni lo record fans if u r on go official account  get ur frame! Follow us on What Is Google AdWords Facebook     La ruche d Comment animer une   Hulu     How To Make A Lead Magnet For Facebook Ads get leads more effectively . BLOG Nation R Tuca Mais esta agora... Vamos prestar mais ateno galera!  Hey oops Im not downloading your shit to my phone ever again. I will wait until Im at my computer Estoy por hacer un directo en mi pagina de . Elicando por que no subo video diario y las cosas que... Despus de meses por fin me dejo cambiar mi nombre! Top Facebook Advertising Tips  have effective Facebook ads . BLOG gets over a billion people a day to their site.
2017-09-01," Nation gets how JW Danforth Co. blocks hiring! s new hub is coming to everyone in the UShttp Case Study How Lange Financial Uses Local to Fill a  Facebook Advertising Ways to Add the Facebook Pixel to Your Website Please repost this for me ,. LIFE INSURANCE, NO BLOOD WORK, NO EXAM, INSTANTLY ISSUED!... Autoplay videos with audio in suddenly happened. Thats aggravating Anda serio el se actualiz y quit las caritas en los comments.. Facebook Brings Change with Delivery Insights, Audience Sharin VPN PPTP  NAVER       Increase Your Popularity! Get More web design tips to make your life easier Technology should solve problems in stead of creating them, as is often the case now. Have you seen what is doing to combat fake news Check it out!  is on , ,  info on pic . Why Your Website Needs SEO Un outil pour faire des recherches avances sur Increase Your Popularity! Real Time Promotion . Digital Marketing Trends In Get Our Android App"
2017-09-02," Google AdWords Glossary Terms You Need to Know If Youre Not Selling On Then Youre Missing This.. HPL on my page . Amazon, Google, and Facebook Just Launched New Tools. Heres What You Need to Know More videos coming up on the and of mindbodysoultv . Do check them . or what  . Act today Subscribe now How to create a posting schedule for Facebook compr la compaa de britnica Ascenta en el ao Guess the Celeb!! Tienes facebook How to Build a Figure Agency from Home in Days via . Worth a read how your network is used for profit and electioneering Tips for Advertising on in via  great insights from . Learn from this guru, a lifetime access to his page for  oneoff payment va Quedan slo das para la cancin ms esperada del ao , youre absolutely right. is better than . I prefer to .          .. me its twitter.. or instagram. Facebook I hardly go on.. just store photos on.. and nosey If youre on join us for the latest news  u"
2017-09-03," Make Sure To Like Our Page For All The Latest News And Updates In The Music World Facebook Brings Change with Delivery Insights, Audience Sharin How to Make a Without One Bit of Code via .                investingbuddy  GET All the Feeds from  M  Fake Facebook kidnapping post causes stir in New Mexico  News  Observer Website To Go Please  Does being attractive help you make more money  Ways Your Page Can Help Your Business . Using SEO to Increase Your Companys Revenue VPN  NAVER      How To Make A Lead Magnet For Facebook Ads get leads more effectively . BLOG  LINE      Not much of a Tweeter Then please connect with us on  Thank you so much. Testing New Feature for Physical Locations with  Store Visits! . Ways to Customize Your Google Display Advertising in South Africa Omg omg!!! People still on ! Thats soooo Love Speculative Fiction a  in this  via  Tips on How To KickStart Your Digital Marketing Career"
2017-09-04," How IAG is kickstarting a digital marketing revolution Vistanos en entrate del mbito noticioso y los mejores vU Little Tips That Bring BIG Engagement Results by . No amount of digital marketing can make up for a lack of creat SATURDAY. Free. Via stream. . BARRY TOMPKINS, Hall of Farmer, on call, me doing color. Fights by .  Hot Convict hits Fashion Week  Thanks for following us Kameleon Rose! Follow us on , , and at  Thanks for following us Best Travel Book! Follow us on , , and at Thanks for following us Katie Dillon! Follow us on , , and at . banned me twice for this meme censored  all Wont reply to me. Wtf! CHECK OUT ON    Visit me on Facebook theres always something new The Great Mission of to connect the world and to lead the huge for new life. Dont forget to follow us on . Posting jobs  fun things there too finally announces video service Watch, but will anyone tune in How to Use Ads to Enhance Campaigns  The Basics of Pay Per Click Advertising How to Remove Someone From Your Facebook Group Lo divertido de es que podes stalkear como en el viejo"
2017-09-05," Facebook updates their like button. Ads Retargeting A Step by Step Walkthrough  Case Study Facebook for you! Fake Si alguien te aparece como sugerido en y hasta TE EST STALKEADO!! Tactful Ways to Get More Views on Your Facebook Videos by Weve got , how about U! Like us on to see how we roll! stellt verteilten Data Store fr Logs vor  via Helping Mark Zuckerberg for release new innovation technology of Facebook VPN  NAVER  VPN     Like us on This Controversy Shows Why You Need to be using Email ... Get Paid To Work On   Media   Hottest Work At . Todays eps of is going to be in mins on it was all on my phone  FREE community of making  on  .  Palestinians, some in Santa suits, clash w IDF demanding access to Jerusalem  Should You Buy Likes  . President Obamas Hysterical Facebook Post  National Review Je mexcuse! Les photos de ma plainte sont sur pas ici. Voir profil. There should be a limit on heow much water u can buy!! bitches A alguien ms se le cay "
2017-09-06," Love Speculative Fiction a  in this  via  has admitted to they sold over , worth of ads during the  campaign to a troll farm. What would you do if you had the power to shutdown someones    When Attackhttps Lannonce de la rouverture de mon site fait un carton sur ma page     Esto opina el fundador de sobre el caso . Increase Your Popularity! Get More  LINE      sharing Facebook brings chat heads feature to its iPhone, iPad apps in update  F..  Watch original video tab launches to all U.S. users via Timeline Maker  FbCoverlover NEW Website! Spongebob   How To Make A Lead Magnet For Facebook Ads get leads more effectively . BLOG September . Best Ad Examples for tons of Inspiration  Update d Find Us  Like Us on . Increase Your Popularity! Real Time Promotion . says it sold political ads to company during electionhttp LIVE The Donskie Show on  Elk  Mather Grand Canyon ."
2017-09-07,"  mil millones de personas usan en un mismo da. How to create a posting schedule for Facebook    .ly  New post  September , at AM   Shop Now ticos Nunca vinculen sus cuentas de y . Cada una tiene segmentos de mercado totalmente diferentes. faces backlash over Russian meddling thenameisaa Top Facebook Marketing Mistakes You Need To Avoid  NEVER assume ANY ad is genuine , always and by a trusted method people ,families  business   NOW asking ppl Donate for a Service Government should provide   ... , etc  wunwittingly agents , etc in a coordinated effort to spread disinformation Tips to Improve Your Posts .c Top social interactions by sportscodes from YTD on    M  Ya somos mil en !.. Smate al mundo de y dale LIKE . Dear can this please fuck off! Lights, Camera, ACTION! is changing the way you watch video with new . HuluVPN     Thank you so much for being our follower! If you are on too, please share the LOVE  LIKE our new page Give us a like on at if you enjoy our tutorials!  me as a friend on for all details on my You FREEKIN IDIOTS have the nerve to JUDGE ME, when YOU havent even read what put in ...ITS HILARIOUS!!!"
2017-09-08," Love Speculative Fiction a  in this  via  How to exclude small online retailers from a campaigns target audience  va Visita mi nueva gina para lo ltimo en mi sica, Is Seriously Cracking Down on Fake Accounts and Ad Spend is a life saver in clearing my profile of old and ridiculous posts Why Get People From Instagram to Facebook CLICK Give us a like on at if you enjoy our tutorials!  ha facilitado el acceso a internet bsico a ms de millones de personas en pases atraves de telefonia movil adds a dedicated Movies section offering showtimes and ticket sales Like Us on THANKS! Join our  Lleg la moda redondeta a ... estamos cercados How to Reduce Data Usage on and . OpenVPN   NAVER        VS      Love Speculative Fiction a  in this  via  Vistanos en entrate del mbito noticioso y los mejores v Hashtag Kullanamamak  Hey, Stop put stuff on your you DONT want to see next year on your timeline, because is in ... "
