Date,Tweets
2017-03-13,"  Una de cada personas en el mundo se conecto a en un mismo da . Inside s Machine by . prueba el botn No me gusta How to Refine Your Facebook Audience for Better Ad Targeting via SMExaminer the join me on  DISPONIBLE PUENTE FESTIVOPiscina Privada,Billar,Rana,BBQ...NETE  ... Like my page to get the latest events and info about my work. . Nueva cuenta de a    Alex B can be found on at          Like these frames Order today for ! Dont forget to like us on and Princeton Hanson  hour ago Group wall post by Princeton Hanson Chad Cobra  hour ago Death To The Trap Vol. LP Coming Soon!!! Chad Cobra shared Neal Blair  minutes ago Group wall post by Neal Blair Jreed Mil  minutes ago Jreed Mil shared his post to the group Hiphop rappers tra If youre on be sure to keep up with  Polica niega pase de ambulancia por va del Metropolitano VIDEO. nos llega un nuevo pedido de nuestros seguidores de Ayudanos a ayudar y dale click en COMPARTIR Gente no  amanh t Fiquem tranquilos  amanh...a partir de amanh as suas publicaes, fotos...Basta colar isso..."
2017-03-14," Key Words Zuckerberg on whether tolerates fake news to boost traffic. Read more FB Is Live a Waste of Time for Your Business via See  Our causes are in full swing! Check out our new for new items! Ways Your Page Can Help Your Business . Remember to connect with us on Facebook  Scam Iggy Azalea  Rocky Asap tape Didnt used to like ads, but starting to love them more cost and targeting are what sells them! Post  videotutorial sobre cmo crear un perfil en para una npblica  Likeadd us on , follow us on   subscribe our va contra desarrolladores espa Las Encuestas llegan a las charlas de Messenger en Mobile va Baking after a day of and playing on guess ill  O tbm postou sobre a novidade l no facebook! .  New research shows students are largely unaware of news personalization . Hey, its time for your ! .  How to Create a For Free Without Codinghttp Ben Affleck opens up about his alcohol addiction on Facebook cinacio RT fromDoppler  Gua, trucos y claves para triunfar en la nueva funcionalidad de "
2017-03-15," Sabas que Facebook guarda copia de todas tus conversaciones borradas Chippewa Valley page created to give hope to struggling addicts. d compr la compaa de britnica Ascenta en el ao the join me on  The Crucial Steps Needed To Actually Drive Sales From Facebook . a mouna no gosta de mim, mais me segue na porra toda no vai entender essas kengas The crucial steps needed to actually drive sales from Hi lovely users! If you happen to have a account, please head over to my If youre on be sure to keep up with en serio ya se estn pasando Can You Really Leverage Facebook To Get More Traffic to Your BlogWebsite.... .  Barry Wolins Starts Mens Line  ...             Measuring social media success. ways to use to appeal to business users . Having trouble adding someone as a page admin Check this out The Crucial Steps Needed To Actually Drive Sales From Facebook launches Town Hall a feature enabling users to find and connect with government representatives Create a more engaging Facebook eerience for your followers with days of Post ideas The Crucial Steps Needed To Actually Drive Sales From Facebook ."
2017-03-16," How cool is this shared my story on . . What kind of content should you be posting on a   tulsa bangbros A Know your platforms all have different ways to connect to create Esta es la verdad escondida tras las fotos de nios enfermos en    Actualizacion en la cuenta en facebook  junto a  Gugudan Puerto Rico Ash officially rolls out  . Vou sair do para poder conseguir assistir Starker Kommentar v zum  Berlin will digitalen Raum der Unfreiheit print Googles fight with Uber over selfdriving cars is heating up Prohibits Developers From Using Data to Help Agencies Surveil Protesters  Heat Street After working for years in the legal industry, you can finally find me on ! Free Social Media Monitoring Tools to Improve Your..   To the people who love to curse on nobodys going to clean your diaper for you so you may as well grow... No mames ahora t tambin eres ... me choca! no lo hagas porfa ha rotto... Le anche su NO! !!! Learn s secrets on how to get into your fans Newsfeed FAST  FREE!.. No Facebook, I dont think I need to be Poking these guys...  Perfil VS Fan page Qu es lo ideal para el candidato electoral lelo en mi blog  tico The choice is yours... ."
2017-03-17," Esta es la verdad escondida tras las fotos de nios enfermos en  Un dialogue cordial sur Facebook  Cest possible, mme entre pro et antiTrump LUE menace Facebook, Google et Twitter de leur infliger une amende If youre on be sure to keep up with Un dialogue cordial sur Facebook  Cest possible, mme entre pro et antiTrump c LUE menace Facebook, Google et Twitter de leur infliger une amende Selling On Is Easy If You Follow These Steps.. Comic Book Collection  More Click Here . bfeccbdeecd  bfeccbdeecd Rendre un , un , une page ou autre avec No se a quien se le ocurri hacer esos cambios a pero QUE MUGRERO. European regulators  largest social media companies regarding concerns. check this out Twitter Bans AntiFeminists for being Politically Incorrect via Valentine on my page Alles rund um das Thema Geld im Internet verdienen. Ugh, , dont give us even more tabs SCE Lead , in at"
2017-03-18," Want More Searches on  Advertise on or DATA  les spectateurs quittent la tl pour aller sinformer sur  debuts its first dedicated virtual reality app, Facebook  . to introduce a personal assistant called M  http . Jai dcid de faire le grand mnage de Printemps... dans mes amis Facebook ! D Jai dcid de faire le grand mnage de Printemps... dans mes amis Facebook ! LEurope menace les rseaux sociaux de sanctions pour leur manque de vigilance LEurope menace les rseaux sociaux de sanctions pour leur manque de vigilance Nouvelle des contenus  jaime ou je naime pas. Les modles seraient et  if you like my education and edtech posts, please consider following my page FACEBOOK AND INSTAGRAM BAN PEOPLE FROM USING DATA TO SPY. Read more FB Agrupacin o is now following Cosmos Tenerife! Do you already know our page Check out my page Avoid Being on  Tip plus Check out CDROM SOFTWARE MILLIONS PDF EBOOK FREE SHIPPING RESALE RIGHTS Follow us on   news, events  more. . Apocalypse on my page Once youve opened Pandoras Box... . Believe it or not ... We created   for Its Free. Please visit"
2017-03-19," botFacebook  boosts overseas business with Creative Accelerator  We hope that you are a member of our community as well. Find us here Tlcharger WHAFF Rewards, mettez le code dinvitation   GS  et obtenez ,!!! Here are tips for shooting on Frases de y para We are giving you the chance to for our next DJ to join ! Check out their tracks via our page. Were so old! Tips to Improve Your Posts . Is discrimination acceptable legal when done by tech companies via algorithms needs to evolveor itll be brutally slaughtered by via Agregame por va AMIGO MO. Live Examples That Generated Sales  by . Advertising GoogleFacebook Why Machine Learning Is a GameChanger for Social Media Managers via . Site de rencontres Site de rencontres JeanFrdric Chapuis en Live Facebook lundi  h C JeanFrdric Chapuis en Live Facebook lundi  h "
2017-03-20," Klout Score...Really! Our new HQ in Lisbon. We like plants. Abacus is . Lifestage, el Snapchat de Facebook para menores de aos . Will This New Feature Start World War  RT  mil millones de personas usan en un mismo da. Is Dead for the Small Business Owner HuffPostBiz VIDEO at Mumbai Office!... Get Paid To Work On   Media   Hottest Work At . Dont cover Ed Sheeran songs on Facebook  USA TODAY Friendly FIXES massive Loseshttp For , isnt an app to be feared... Its a feature to be absorbed.  ,  HUSBAND hoponline Facebook Tests Video Insights for Profiles This Week in Social Media   Thanks for following! Please spread the love and like our Facebook page ! All set to live tweet tonights Raw! Join us on Facebook and lets talk wrasslin! La est en Suivez son parcours en dtails sur sa page  Get into the swing of things! . More on under fire for fake news Find ad testing tips you never thought of  Avoid These Mistakes  Create That Work via ."
2017-03-21," Find tips and information at Danila Dilbas new page. website U Learn s secrets on how to get into your fans Newsfeed FAST  FREE!.. Apples new Clips lets users post their video to , , ,  Vs.  How To Sustain An Engaged Community  Reasons Will Beat All Other Channels This Year .  Crucial Elements of Facebook Ads Landing Pages  website Atrayos Oracle on for originally channeled Angelic Wisdom by automatic writing. Atrayos Oracle on for originally channeled Angelic Wisdom by automatic writing. ... Life isnt the same with sharing...! .cd que no han metido la funcin como Comment Funny To Laugh Working on a digital flyer for . Need a design Contact us for a quote! . Spent the last hour scrolling through memes on best thing Ive seen ... Alunas no curso de Anlise de Dados do . Venha ser nosso aluno! amazing  didnt censor it. Theyll censor political speech like Pyongyang Planos empresariais, atendimento diferenciado e exclusivo, referencia e qualidade! ! . PostingBlues         "
2017-03-22,"  En recientes das un juego ha invadido y tiene a todos los usuarios atentos con un test... ALL ! NO SIGNING UP!  ! Embtant quand la timeline dune page facebook en gestion ne saffiche pas pour un community manager . SDK flaw ees smartphone users accounts at risk Smart Ways to Start Using Live For Your by on . Live makes the overdue jump to desktop via La plataforma de , presenta problemas en sus pginas de fans, segn reportes de usuarios de varias partes del mundo Find out Types of That Your Should on The Psychology of  Why We Like, Share, Comment . Archive Makes Easier To for Usershttp Tips to Improve Your Posts Facebook Cover News BB,  is a Copycat  I Need To Put An Article In The Newspaper...Ohh Yeah I Did .... Nuestros vdeos KMC Health son calidad Full HD p, pero al momento de subirlos por la red ellos se... Get Paid To Work On   Media   Hottest Work At .  change Graph version to what ever I think I like a boy I met, so the st thing I did was added him on FB wished him a belated bday. outils indispensables et pour booster les de votre page "
2017-03-23," If youre on be sure to keep up with How helped keep behind bars  Mar  PM ET Es hora de seguir a en Ways to Make Video Work for Your Business The latest Marcys Digital Marketing Update! Dont forget to join me on my page as well, all kinds of good things at your fingertips! Discover Cure For Queremos ser parte de Ti, Sguenos en nuestras cuentas de e y sabrs... AnnTran  Ways to Make Video Work for Your Business    .  Actualizacin de SM Tru con el saludo de para sus fans Tailandesas. Cr... Esta es la verdad escondida tras las fotos de nios enfermos en Qu me recomiendan para ir a a checar mi y hacer con sosteniendo una con mi nombre Hola!! Brioagro Tech  Gracias por seguirnos!  info en y en nuestro  Saludos desde ! Facebook adopts header bidding to make its ad network more competitive with Googles Clarificationtrained by unlike by OurHASH TAGSITE SLOGANACTUAL TWEETLINK structured follow not Your story is just starting. . my baby was live in totally bunin my mood!!! love you mucchh wish to meet u soongood luck!!! Cinco grupos de vinculados con robo de combustible. Canal de Megacable y tambin por . , , n, si te gusta algo de esto te gusta sguelo! en manito arriba en la pgina! Announces that Anyone Can Go Live via Desktop with a Focus on Gamers ."
2017-03-24,"   Shocking Truths Beh Collection prentiert Hndlerprodukte  via Top Marketing Questions Answered . Elites upset that INTERNET is being used to people about Globalism plans. Eect censorship on to worsen Reactions is over a year old. Now its available in Messenger. After a year, see stats on its popularity. These people sticking a on their page . This will surely make and other terrorists think twice Thank you,  , for never forgetting to remind me of the items in my cart. Una de cada personas en el mundo se conecto a en un mismo da . How to boost a post with the minimal amount of pain. .C Slides WMD  Funnel How To Turn Leads Into Customers Into Raving Fanatics Slides WMD  Funnel How To Turn Leads Into Customers Into Raving Fanatics  That moment when you and your friends discover group video chat on messenger! Cc sexybrunette amazing How We Build Relationships and Why Works Better Than Most . is testing out animated GIFs for comments in its Android app. Read more FB News BB,  is a Copycat   PROFILE PROFILE Top Marketing Questions Answered . Master , Email, , Growth Hacking  More Essential Skills .."
2017-03-25," Sigue la transmisin en vivo de en mi c for and . O portugus do pessoal do  de invejar. Want to keep up with Rap Artist Like Him On For The Latest Music News!! . Villains on my page  Like Us on THANKS! blindtrustfilm va Day  On our last day of filming, Eugenio Siller and Ron  Watch this award winning  Keep up with on Facebook Councilmember Dai Thao responds to criticism after Facebook post  KMSPTV Cest ok ! notre page Facebook a t mise  jour... u Timeline Maker  FbCoverlover  Love Failure Sad Waiting  anuncia que descubri la forma de alcanzar velocidades de transmisin de datos veces mayores que las actuales For more tips as we prepare for the BIG LAUNCH, be sure to follow us on Follow  Question whats your favorite part about  Bekasi, Indonesia Your ultimate guide How to get started with ads  by . mejora los videos en vivo para competir con"
2017-03-26," Top Updates That You Cant Afford to Miss  March Edition . Just MINUTES away from s streaming of ! As opened by ME. Tune in!  God measures us through our faithfulness to determine our promotion in his Kingdom for advancement id Browser Eloit leaked MT  Ways Hackers Can Your Account Infographic c Join Facebook Groups for you for , for , for  . ya uso la app de A que famoso te pareces  n . Ive cut back my use of by about percent and havent missed it at all. Still cant quite bring myself to cut the cord, however. Learn s secrets on how to get into your fans Newsfeed FAST  FREE!..  Facebook     PostingBlues          Join us on or tune into am in Giveaway  on Facebook! is the new newspaper, card club and donut Sunday for Baby Boomers. Debera de haber una reaccin en con una carita as para la gente que escribe pura pendejada y ya te tiene hasta la madre. Procesin de lo Estudiantes ao de jar Foto de Jose Reca . Sgueme en mi Pgina en jar . Imma Need All My Friends  Family To Go Follow My New Page Its Time For A New Change BE TRIPPIN ND ALLLL ITZ LAWD...BUT WHEN ITZ ITZ ONKEYY!!"
2017-03-27," Join my Passion to Profits Group for and Tips, tutorials, ideas, connections with other . Share your affiliate link in facebook and get more profit without investment! What kind of content should you be posting on a   Share your affiliate link in facebook and get more profit without investment! . Join our brand new community and share your !!! Why do geek mfs head up         The Crucial Steps Needed To Actually Drive Sales From Facebook  Apps that use login button seem to be have issues de aMichoacan en  you can now send direct messages to your elected representatives interesting. So what happens if you make new account Would ask for same  thenameisaa The Crucial Steps Needed To Actually Drive Sales From Facebook  Mi en ese enlace Can you match the right Man Toolz product to their bottle size Go to our and answer and you could a Man Toolz Travel permet de partager sa  ses amis en temps rel Weekly VIP sale happening in minutes on ! New and more! thenameisaa The Crucial Steps Needed To Actually Drive Sales From Facebook  T.R.A.F.F.I.C We all want more of it but its hard, well this could be just what you need see here "
2017-03-28," Que PORRA  ESSA Mariquisssss, se pirate moooooooe paila a . Up on the roof Facebook HQ If this were a problem on the rockstar servers Id have it repaired before the end of my shift. Team ,  days  losers Ahora tiene ... Que ns espera ahora.... , jaja  Tiens la fonction Story de est arrive sur lun de mes comptes sur lappli Android. Blasphemers what are you thinking, beyond belief! Is there a way to disable Facebook Direct I cant stand it already. vs  the competition heats up! Is Your Savior Ahora con historia Me pasa que....... Quiero instalar un tema del Carnaval en pero tengo miedito jaaa por primera vez... The movement age distribution  yo  yo comments section yo Own page yo The Most Discussed Issues on and in February Infographic  The Revolution Boyz on The Revolution Boyz on Mark Zuckerberg outrobots his AI robot in saccharine holiday video The Revolution Boyz on The Revolution Boyz on Visit my  page click "
2017-03-29, Boosted posts on are more effective than dark posts Catch our daily buzz on our page! Does REALLY need stories quote  when Toni Morrison said write the story u want hear she didnt mean everyone! Avoid These Mistakes  Create That Work via . steps How to CHANGE your picture into a You got to trust the Word more than what you trust what you see Algum avisa pro Mark Zuckerberg que eu no tenho tantas histrias assim pra compartilhar Facebook Reactions Make More Sense When Coffee Is Involved . Beyourself Beyourself . Scrolling my  and all I see are exes posting to make the other jealous. Be happy w the one youre w  get over it! GET All the Feeds from  More in ONE PLACE  d Im sure this wasnt random either! Gagnez des pour vos pages  A utilidade do se foi agora com a nova atualizao do . much worse than disrespect and rudeness. This limited characters of disrespect is passive aggressive. Eerts Share Their Favorite Ads Strategy via Timeline Maker  FbCoverlover  Check Out our NEW Website! God Aprils Fool Will always follow for the ways they continue to innovate...
2017-03-30," Contact your congressional members how directly through . Contact your congressional members how directly through . Do you know your Ad Relevance Score Clicked to a I was excited to read hit by an that I couldnt close. Funny how fast enthusiasm dies. No, Facebook. I do NOT want to manage my pages IG feeds through . Thats what is for. Make it stooooop. is still better than Lk forward to your next ! there is only ONE ! Top tools that improve your ROIhttp Revisa nuestra galera fotogrfica en  . Fea la actualizacin de Are you using properly Quick Tricks to Boost Your Visits... d yearold has never owned a cellphone Why  Why did you change our ability to tag someone using only their first name pchat .  Facebook Imita a Snapchat, sera Un clon . Mindeporte Revisa nuestra galera fotogrfica en  d Click, Share, Tag, Comment. Reaching the masses to spread  send us your likes at thank you to everyone for your support today Are you taking advantage if your privacy settings"
2017-03-31," How To Monitor and Analyze and Insights  Cmo Monitorizar y Analizar Las Estadsticas de Facebhttp THANK YOU Facebook!  used to get annoyed by traffic and red lights but now I look forward to them so I can catch up on my Entenda como funciona o gerenciador de anncios do !  mil millones de personas usan en un mismo da. Follow The French Radio Show Pulsion Club on Link page  dc e Messenger, stop su alcuni Its ! Check out my page for some posts, including The right way to do advertising via . Pages gets redesigned inbox for and interactions by . FREE Training Steps To Triple Your Engagement For More ,    . Stay out of Facebook JAIL.. .c Stay out of Facebook JAIL.. .  i just deleted my BOY IM HAPPY AF BYE BYE Vintage Dobrador  If you dont want to talk  Learn s secrets on how to get into your fans Newsfeed FAST  FREE!.. D Looks like someone is trying very hard to get into my website"
2017-04-01, Follow us on leave a comment  .U  on my on me on  Ofertas de Al . Curta a nossa pgina no desarrolla herramienta para censurar los mensajes basado en la ubicacin Social Media Mgr Software     Write Once Publish now implementing like stories. Its less about copying and more about desperately looking for new vehicles for . ha facilitado el acceso a internet bsico a ms de millones de personas en pases atraves de telefonia movil The next page is up! What is this they are mentioning us on and . Facebook Cover How to Optimize Your for SEO How to Optimize Your for SEO I will strive to quit likeing on Facebook and other forums! How to Optimize Your for SEO million users had their data harvested by campaign affiliate by How to Optimize Your for SEO  Come and network with me on and join my growing community. Ya nos siguen en  Scam Omg Rick Ross latest revenge tape leaked by cents on campertra
2017-04-02," GET All the Feeds from  More in ONE PLACE  GET All the Feeds from  More in ONE PLACE  GET All the Feeds from  More in ONE PLACE  GET All the Feeds from  More in ONE PLACE  GET All the Feeds from  More in ONE PLACE  Para los que no lo saben, tambin tenemos Sguenos y compartamos bendicin! me on for all updates on what i got going on . What are the ways to increase members of a group Advertising GoogleFacebook Im still loving the new  Media Is Not Just Having A Account...  Tips for Advertising on in  great insights from . Here are tips for shooting on Im pretty sure tazsp and Nadege will like this one! Im still loving the new  What are the ways to increase members of a group researchpre This the main reason I dont use my any longer. That, and too many Republican friends sharing .  Im still loving the new  Fb Cover  Follow us on   Using to recruit Take some tips from on how to maximize your reach."
2017-04-03, Wa.fr a sa Fanpage!!  How to get confident with Live to grow your list and get more  Here are tips for shooting on U Want followers your Business Page! Customize emails sends in Manage Communications With Ya estamos en vivo con Corran a nuestro ! sportbets goes Next days well open a fb site for all our clients and also we ll welcome new ones.Stay tuned!!! MLSPs Affiliates Keys to Becoming Insanely Attractive! Join me on FACEBOOK  Your News Feed is such a mess that is giving you another one. Read more FB Always good to stay current Top tips for Facebook content in How to Use and TOGETHER to Monitor Fan Traffic Join me on  sigue en sus cuentas oficiales a   The most valuable T Check us out on too! When will our first be Make sure to check our page! Wacky ...  ...  cuentas oficiales de  Do Not Know Why.
2017-04-04," Go to on when you can. Were always on the go with you! Facebook Messenger Installation and Crashing Issues Fixed Ya nos sigues tambin en   rinde homenaje a vctimas de accidente en Reforma IF THESE PEOPLE would pull their out of their ,  read something besides or what they heard was on ! POTENTIAL I dont go on and plus many others anymore because of bullying x Find us on ! . Qu significa el nuevo cohete de How to Write Copy for Facebook Ads me on for all updates on what i got going on . Here are tips for shooting on d Dista mucho de Ja tardare en subir peliculas a Yo probando los filtros de las fotos de Face. Edificio Are you stalking that person on social media! No, I call it undercover research Facebook invests in the Silicon Prairie  WOWT Cuando te hackean y te bloquean tu cuenta no queda de otra que desahogarse por We Are Shaped By Our Thoughts Buddha Facebook empieza a mostrar algunas publicaciones con letras muy grandes Get ready for money requests on Facebook Retargeting on  some of the most effective around! X Your Advertising Returns With Ads"
2017-04-05," A CyberTip to NCMEC Virginia man posed as a woman on Facebook to get nude photos of boys via Sur , les ne marchent pas  Facebook Loses Appeal to Block Bulk Search Warrants  New York Times Learn s secrets on how to get into your fans Newsfeed FAST  FREE!..  How to Set Up an Effective Ad Campaign via is hiring a Solutions in , apply now!  s short films depict the terror of sexual harassment. Read more FB Like my Facebook if you love gaming! Snapchat just launched an attack on a key source of s ad revenue SNAP, . Read more FB Facebooks Providing a New Personal Option, Eanding Buttons in Facebook Live Nos despedimos por hoy, tambin nos podeis encontrar en pureGamersClub. Esperamos vuestro follow y like! Buenas noches . Takes Aim at Revenge Porn. Read more FB Hi, on  Feb , The independent UK published my legal Are we connected on  New lets  Se solo Facebook aveva questo... Were live in ! Our first ever! Join and the rest of the Joya Executive team on !  This turned up in my timeline today. Dont know the person that liked it or posted it. So why is it in my feed  Facebook   Facebook  "
2017-04-06," Six Of Crow  Saga Six Of Crow  Leigh Bardugo a ol BREAKING NEWS adds goalbased bidding for app install ads to rival compr la compaa de britnica Ascenta en el ao Like  On Eeriencing content in might become more popular, with live streaming open for all  Muy Contento De Ser Parte De Este Buscamos En  Centro De Formacin Come see my group . Muy Contento De Ser Parte De Este Buscamos En  Centro De Formacin Cracking the Code how its turning our lives into dollars. Watch Monday night on  Drop on by  check our here Leave your calling card to turns to literacy campaign to combat fake news. Read more FB How to Ignite Your Fans with Killer Content! pro advice from  Make sure the kids get home  your friends arent stuck in traffic with Messenger location sharing Quieres descubrir quin le elimin en Facebook no dejes de ver este articulo U Generate Free Leads With Facebook Live and Webinars . I often wonder where the truth lies Twitter Instagram or Facebook where do the phony people live Posting Routine To signals  what you post tells your   Come see my group .D Presiono cualquier parte de la pantalla y Facebook quiere que comparta mi historia. Basta ... STAP! is a great place to connect with people and convert them to leads. Heres how ."
