Date,Tweets
2017-03-27," Now at  Elore new eeriences of Robo Recall, Rock Band VR... by via MT  See how the Digital Crimes Unit in is closing the circle on crime patent is for a in featuring multiples displays with hidden borders releases System Center Configuration Manager Bing on mobile isnt always perfect, but it is always better. Congratulations  and ! cogmotive Congratulations reidhoffman  and ! Monday Xbox Live To Support Custom Gamerpics, New Bookings Tool, Authentication Outage Or I just need a . is moving to be more open. wont reveal new Surface Book at spring hardware event. Read more MSFT Microsoft adds Cortana voice assistant access to Android lock screen  now seen as viable Catching Up to Amazon . patent is for a in featuring multiples displays with hidden borders. Read more MSFT Windows is Great. Releases System Center Configuration Manager . Read more MSFT   Cinco para escanear y editar documentos con el mvil . From to and back to . New post on and . You can install FlexRule on  . ."
2017-03-28," Security eerts find sensitive and personal files shared by default on s document site office     LINE     DWMS APP How to Use Social Media for your Business PCOSPC      and integration now generally available  million people now help test Windows       elimina tras un error muy grave ... UP    , , , , , , , , ,... , , , , , ,  , , , , , , , ,...  UP    , , , , , , , , ,  , , , , , , , ,  , , , , , , , , , , ,... , , , , , , , ,  , , , , , , ,..."
2017-03-29,"  w DONT GIVE !  Caller ID has Results         Windows Weekly  Yammer Yam Jam via UP    Google Launches U disable in Many lessons can be learned from this cautionary tale...  UP    Does Microsoft Edge Really Has An Edge In An Absolute Beginners guide to Storage Spaces Direct  MVPDaysRoadShow  IT Pro Support Managing Windows GPO Issues Running on Windows Server R. Read more MSFT   Cloud Services Surprises beyond Azure. .  Windows Mobile build rolls out to Insiders in the Slow ring. Read more MSFT Windows Mobile Creators Update build is now available in the Slow ring. Read more MSFT MySite Atualizao cias follow . Windows Mobile Build comes to Insiders in the Slow Ring. Read more MSFT Poll Whats your favorite Windows Creators Update feature. Read more MSFT nos habla un poco de la nueva actualizacin de Xbox One ... The Windows Creators Updates best new features Privacy tweaks, Paint D, an... Read more MSFT Windows Creators Update To Start Worldwide Rollout On April . Read more MSFT"
2017-03-30," A massive youre wrong to on change, from , , , and , collectively worth around  trillion. Porque vocs fazem uma pergunta dessas CAD OS LUMIAS Cad o Lumia Xl por aqui Sigam o exemplo da Asus! Tragam para ns! to Open Its Third IoT and AI Lab in Germany. Read more MSFT Windows Mobile Creators Update Available on April . Lawsuit vs over much hated push reported Its easy to increase flexibility by moving workloads to . Learn how . MGL  Join us for some LIVE Astroneer and you could win Mass Effect Andromed... Read more MSFT Windows Mobile Creators Update to start rolling out April . Read more MSFT Creators Update is rolling out for Windows Mobile starting April . Read more MSFT Latest  Demo for The Sales Rep Introduction to JavaScript robotics  New York Software Engineers meetup. . Windows Mobile Creators Update Available on April . Read more MSFT How does your compare . Surface Studio Comes To Australia This April . cogmotive How does your compare Microsoft Solitaire Collection . Azure App Service  API Apps Aspectos Jurdicos de la Contratacin de Servicios de Computacin en la Nube en el CNA u announced! battery vs   . PUE  . PUE  . PUE"
2017-03-31," The latest Initech Daily! has updated its platform for the Windows Creators Update via Whats in store in Windows update. Read more MSFT      office     Determination sets yearold on path to save IT millions of dollars  s platform is getting a boost with the Creators Updatehttp office     Configure App Environment And Create an App In SharePoint Server u office     QUADROtech RT cogmotive How does your compare office     Latest advances in accessibility include Project Torino, updates to OneNote and new Copilot for Xbox One LINE     has updated the platform for the Windows Creators Update  PCOSPC     Microsoft Peter Another dead division I used to track these closely      is named a leader in the MQ for Management Solutions for Analytics via . Download UP   "
2017-04-01,"  News Oculuss head of marketing joins s mixed reality division  Thanks for the follow! Great article ab Why and Are Upbeat about the  Market Realist  Office   Office  Retweeted Visual Studio  Heres a swell overview of the Framework for devs. We get ... The best free alternative to Microsoft Word      office     Tomorrow I will be launching my mini blog series on tips for Student Partners C office     office     office     LINE     PCOSPC          UP    We are hiring Premier Field Engineer Prem , , , , , , , , ,... , , , , , ,   UP   "
2017-04-02,"  Surface Pro  Microsoft Sells Supreme Allinone Tablet PCOSPC          UP     UP    This would be a complete dumb move if did this. Goes to show how social media tries to copy everybody. . Brand new computer, Windows autoupdated right away over wifi, and now wifi no longer works after the update. Nice work, . SQL Server on Linux  AlwaysOn Microsofts redefines .  Thanks for developing just what teachers and learners need for beginning embedded programming! Nooo Clayton   billion startup has officially won over LinkedIn    Whats Your Rank! . Microsoft Pinch Oculus Marketing Exec goes completely Microsoft shakes up server market with plans to run with arm The latest NorthBridge Technology ! Thanks to"
2017-04-03,"      UP    , , , , , , , , , , ,... How has your eerience with been Smooth, bumpy or a little bit of both , , , , , , , , ,...  UP    , , , , , ,  , , , , , , ,  , , , , , , , , ,  , , , , , , ,  , , , , , , , , ,  , , , , , , , , ,... , , , , , , , , , , , , , , , ,  , , , , , , , , ,...  New research on and tips to maximize your benefits No doubt! is the best one! Shes intelligent.. Could they b doing it the same reason as the people from   Do U think theyd still do it if they couldnt make money Ya hay fecha para el lanzamiento de la nueva consola de !  Because is a troll"
2017-04-04," office     rolled out a in . Instead of an Inbox and a Junk folder you now have to deal with three. Bad, bad, idea. office     office     office     LINE     PCOSPC     unless they have a secret that they havent revealed yet they should very concerned about this.      Grid Ert Implementation With Shield UI And Web API UP    GENBAND challenge to boosted by shift cbronline evankirstel Microsoft to Open Its Third IoT and AI Lab in Germany GENBAND challenge to boosted by shift cbronline advises Windows Insiders to check their settings ahead of Creators Update release. Read more MSFT evankirstel Microsoft to Open Its Third IoT and AI Lab in Germany NUNUG mtg Launch Party. Thu Apr pm. Learn more at ! .net Project Neon spreads to Movies  TV app in latest update for Windows Insiders. Read more MSFT  UP    How technology is streamlining Australias Border Force .c"
2017-04-05," Grande video, grande esperienza! Congrats!!! p.s. colonna sonora TOP This is just one of MANY on here via Eles coletam nossos dados!!!  enfim elica quais dados so coletados pelo  Boot camped Windows that can be run as a VM in Parallels, truly the best of both worlds all on my MBP. Help us create more . Available on ,  ! Pledge  QStride is hiring a Senior in Detroit, MI Ciena Jumps on ONAP Bandwagon. Read more MSFT Look at Fazeela Baksh from Greater New York City Area  ! Thats amazing! Isnt it ,  are already influenced by  so what does this mean for s customers  Bing can now find the answers to your questions plans to end Access Services for Online, starting in June. cogmotive ,  are already influenced by  so what does this mean for s   Thats regular MO New Xbox One S owners now have to purchase their Kinect adapters separately. Read more MSFT Microsofts new love for Android is no betrayal via Canaltech lana de cmera inteligente focado na diverso. Windows Cloud Screenshots Leaked  Windows Defender Security Center  via finally graces us with the release of Age of Empires Castle Siege. Read more MSFT"
2017-04-06," RT msphilanthropic Games for good GamersOutreach and Xbox partner to bring more joy to seattlechildr Young technology innovators ready to represent New Zealand. Read more MSFT I secretly go to stores to play with the tablets. . Fazeela Baksh from Greater New York City Area here refreshes Stack preview adds new services by My colleague on loaning on some flights to the US via Sacando el que llevo dentro.  Sacando el que llevo dentro. Fitbit for Windows now available. Read more MSFT Woooooo Just kinda love creator update design language and animation.. but hate you for what u have done with WP The most common problems with Windows Creators Update, and how to fix them. Read more MSFT Hello New Yorkers ! It seems you are trying to build a building, Would you like some help  . Microsoft  Windows  Android    s new love for is no betrayal Do you see what I see of has a . Well doesnt run during the collar O que achou do  Genteeeee teremos o Internet of Everything na em So Paulo! Estarei junto com announces five data transformation and connectivity features for Get  Transform... Read more MSFT The latest Semantic Web Jargon! Android Passes Windows as Most Used Operating System on Internet. Read more MSFT Why You Should and Shouldnt Get Xbox Project Scorpio. Read more MSFT"
2017-04-07," Hmm sent me  for digital purchases, but I dont know why. UP     UP    Gream.A Microsoft AppleMicrosoft  LINE NEWS  Lifeliqe on HoloLens is in the classroom where students prefer mixed reality. Read more MSFT  The IoT is coming! The IoT is coming ... Atencin! Nuestros amigos de tiene buenas noticias para tu a. Thanks to Andy Mac for the follow. Microsoft Surface Pro to Sport Surface Power Connector, Kaby Lake SoCs Thurrot Microsoft Surface Pro to Sport Surface Power Connector, Kaby Lake SoCs Thurrot  Gigabytes Latest BRIX PC Is for IoT.  tan zl in birliu discover how reaps the benefits of the . Specs for Microsofts next Xbox console have been released .  Utility company picks NBIoT, actively spurns rival techs USPs.   An IoT reality check for big data eerts and tech manufacturers. ... Use this vs. TCO calculator and get a quick comparison of pricing  licensing for your . Windows Creators Update Things To Do After Your Upgrade. Read more MSFT The latest Redes sociales y tic!"
2017-04-08," We have  migrations alone, under our belt. Trust the eerts Great Paul Allen Business Quotes  Read . s AI boss elains its secret weapons in the coming chat wars with , , and Dd Elain .NET Core   Credera and Hit the Road to Discuss With Industry  Get Week Start Date  Week End Date Using SQL Server to lend Surface tablets to certain passengers on US bound nonstop  Phone Arena  Just Kicked Off A Big Spring Sale For Thanks to Melting Body Fat for the follow. Serkan Emre Sefa, Turkey. Look at this  Why Decided To Build Why Decided To Build C Companies like did a huge mistake closing their applications.. to death.. no way of linking to the web      office     office     Claims IaaS Crown In Europe To Close Gap On  office     great accessories for the Surface Pro via"
2017-04-09," Quick Measures Preview Keeping focused with Admin Templates in OneNote Havent used in a while until today.What a pile of pants ruined it! Close Combat Gateway to Caen Taming the Panther via Dont miss a fantastic opportunity! And youll be working with an amazing Manager! Surface Book vs. Razer Blade  why dont regret switching to Team Razer. Read more MSFT Check out this  .NET at in New generation Windows Hello USB fingerprint readers finally on sale. Read more MSFT Its time to finally say goodbye to Windows . And Vista. Again. Read more MSFT New type of doesnt need macro enabled files ! New type of doesnt need macro enabled files ! Microsoft Akan Segera Perlihatkan Project Scorpio       office     C Corner Annual Conference  Official Recap office     if you need a boring fortysomething family guy who still uses a to test speakers, Im game. New Leaks Highlight s Alternative Approach office     office    "
2017-04-10," Hackers are Eloiting New Microsoft Office Vulnerability to Drop Malware      office      Join the Office Hours .D Whats new with for the  Windows Centralhttps opens up more on data its collecting with Windows  office     office     office      AWS QuickSight now lets you ert data in CSV format  Chat app Line to end support for BlackBerry and other older operating LINE     PCOSPC          UP    se alista para generar ms ingresos por Minecraft Our dedicated team of certified eerts help you smoothly and safely setup for you  UP    Tax Day is almost here  let TurboTax Online help you get your act together in time for April C I game on PC as well, but this has me excited !"
2017-04-11," office     ok Yaknda Sanal Dnyamz Artacak... ler Gelicek... Fabriklarda LINE     PCOSPC     Go go go!!!      UP    Why Are You Still Using Microsoft Word poison pen  UP    Best Surface Pro Keyboards. Read more MSFT tire un trait sur le plus mal aim des  ADIEU   Hasta nunca, Windows Vista mata al sistema operativo y no le dar ms .. Interesting thoughts on the upcoming console. Definitely worth a read!  Patches Three Under  via With todays KB update, it seems to be OK for getting windows ready to spin about minutes, computers Introducing Microsoft R Server Release Power BI Desktop  Why cloud and security are our big focus CDTAF The latest The WorldConcert Daily! patches actively targeted zeroday Word vulnerability. Read more MSFT"
2017-04-12," New Features for Gamers with the Windows Creators Update. Read more MSFT Internet of Everything . things we hate about the Windows Creators Update. Read more MSFT Microsoft Tawarkan Layanan Langganan Game  Xbox Game Pass  RCP Editors Choice Awards Best Products for Partners i knew it The MD Flag  a drift hand, wont be gettin my wallet EVER AGAIN, Bank on it bitches! is getting ready to release Project Scorpio. Hear what its made of! NewsTechnology Word day was actively eloited by strange bedfellows and do not belong in the same sentence is Insider Fast release notes   The autismfocused virtual career fair will be held April between p.m. and p.m. PST.  Its official is holding a big event on May nd, but dont eect a Surface Pro... Read more MSFT Now its called and it inherits all the antifeatures and MORE Poll Are you running Windows Creators Update. Read more MSFT If not , needs another device category to ensure successhttp Who is trying to team up in Titan fall Xbox one! Windows Creators Update Introduces New Pause Update Button. Read more MSFT Training News Learn, earn, and show the world. Know it. Prove it. returns on April , Office and dise una Xbox porttil ..."
2017-04-13," has started blocking and updates on newer systems Microsoft has started blocking Windows and security updates on newer systems properties Mastering Project MS course  Avail  OFF Use Code SAVE has started blocking and security updates on newer systems Digital Tre..  Tech Tip Easy Ways to Backup Your Data       If folks are more interested in making their minds up before theyve gotten to touch a game, cant win over existing fans. Period office     ASUS Republic of Gamers is bringing together Xbox ONE and PC gamers in Singapore. Read more MSFT office     office     Sway Gains Audio Recording, Closed Captioning Features. Read more MSFT office     Setting up a Shiny Development Environment within Linux on Windows LINE     Fast Ring Windows Insiders get an updated Feedback Hub, makes sharing easier. Read more MSFT Will you buy  Comment Below! PCOSPC         "
2017-04-14," WEBINAR Whats new in the Windows Creators Update for IT professionals. Read more MSFT Surface Pro Intel Core i GB, GB RAM. Highpower. . C Tage war bekannt, dass Framework sich in fremder Hand befindet. Keine Warnung an ua. um Lcken zu schlieen. properties The network is a living organism sets May as original s retirement date  works with the NSA to provide backdoors. Why would it take action. Microsoft. Doesnt. Care. About. Its. Users. Installing DHCP Server Role On Windows Server D confirma que mostrar la en el ALERTE Machines vulnrables Divulgation de failles par   millions es Its been two months since announced , so how does your look . releases new Windows preview with serial device support in the Windows Subsys... Read more MSFT s Brad Smith Growing consensus on need for international treaty on state attacks. Read more MSFT Leaked pointandpwn hack tools menace Wink to Windows  The Register release on SMB service. Block and at your network perimeter. Why is THE ideal for  cogmotive Its been two months since announced , so how does your look  Windows s new Start menu design revealed in leaked screenshot  Miguel, gracias a ti! No olvides que puedes contar con nosotros cada que presentes una consulta referente a . ensea cmo es el kit de desarollo de la consola Project ... ..."
2017-04-15,"  News quietly patched Shadow Brokers hacking tools  Bora ver essa Att do Depois da Att se tudo der certo... vai ter Very cool filming of the Inaugural episode of LIVE at the Store in in  Kafay yemeden V. Studioyu brakmam gerek. Ulan ldracam kendi ekledii projenin .dll dosyasn bulamyor.Hatta oluturmuyor. Soy psimo en  Le Monde du Fouque is out! Is and using tablets for  hdmi officially ends support for a bunch of . Read more c      Application Engineer Phoenix, AZ US office     did not provide any eta on a fix, they are still investigating. office     office     office     LINE      .   !!! PCOSPC     s Quiet Patching of Shadow Brokers Hacks Signals Policy Win"
2017-04-16," Sorry its been a few days! Busy times! But dont forget to get this belter on Xbox live from today!  What is an MS Access Database An Approach To Better Registration And Login In Windows cken jetzt geschlossen. bf is hiring! .NET in , apply now! U New Surface Laptop From Could Challenge Forbes  RT ModernMsp Review has introduced a lengthy list of improvements to , most prominently to s      office      Show Tab Previews  Another feature I admired in web browser. Comes in handy when you have many tabs open... . Nokia Lumia Full Specifications . office     office     office     LINE     PCOSPC     Im now awaiting or to use my as a or .      UP    Hackers Warn of Microsoft Apocalypse After Latest NSA Leaks"
2017-04-17," One Black. intro  How can help for and  The latest Best Stories On Twitter This Week! hacking an unconnected computer with a drone...  Send Telemetry to Splunk Enterprise from Azure Resources via Azure Monitor Python tools in your language      office     PowerApps, Flow add connectors, SharePoint usability, outreach to deskless workf... Read more MSFT office     imagined.  office     office     LINE      updated! Check it out!  PCOSPC          UP     UP   "
2017-04-18, Font Action Man Shaded. UP    continues to eeriment with . Ex Steve Ballmer launched a transparency database Ex Steve Ballmer launched a transparency database Ex Steve Ballmer launched a transparency database Latest Windows Insider update targets battery hogs with Power Throttling Launches Literacy Tool For Its Edge Browser. Read more MSFT  UP      am   Microsoft Data Amp  . Gii php IoT cho nng nghip dnh gii cao nht Imagine Cup Register Today for DevDays Asia Taipei Hackathon! decode Data Platform    This man built his own iPhone s from spare parts . This Guy Built an Entire iPhone S Using Spare Parts He Bought from China . Switching from an iPhone s to an iPhone SE A Hidden Opportunity Could Be Waiting at . Read more MSFT  Need to maximize the benefit of  Great advice and perspective here Microsoft To Buy Intentional Software . Microsoft replaces the password with a phonebased login .
2017-04-19," introduces its new task manager app ToDo in beta. Read more MSFT UP    What a beautiful day in Phoenix today! CloudSummit  UP    Wow! Microsoft Office Incorporates  Where can I find the cheapest trainz  Learn from the eerts how designs, deploys  supports mobility at . Sign up for the webinar C RTF Execution OneNote Class Notebook now supports readonly parent or guardian access. Read more MSFT makes a move to eliminate the NewsTechnology Automatic posting for BLOGGER BLOGSPOT   HyperV Enables  Heres what Marys Place is doing with . million from Starbucks, , others. Read more MSFT How Cortana will help you reach inbox zero . Cortana Pi and Minty Pi . Accelerating Business Transformation with Cortana Intelligence Solution Templates Heres what Marys Place is doing with . million from Starbucks, , others. Read more MSFT ToDo is a new app that replaces Wunderlist  The Verge Connectria Hosting Launches Managed Service For Azure. Read more MSFT Outlook Groups Coming to Android, iOS and Mac Devices . Debuts New ToDo Wunderlist Replacement. Read more MSFT"
2017-04-20," Technology Management Concepts the provider selected to Inc. List . Makes Short Work of Large Listshttp Improved performance, , and Shared Memory in  UserMade Patch Lets Owners of NextGen CPUs Install Updates on Windows  Checked your yet How do you compare to your peers .dDC News Pro for iOS review A solid newsreader with a few quirks. Read more MSFT Unofficial Patch Unblocks Windows and Updates for Kaby Lake, Ryzen. Read more MSFT Hear how is building scalable services using . Read d Usercreated patch lets Kaby Lake and Ryzen PCs receive Windows updates. Read more MSFT Amanh tem video sobre no blog e no canal do youtube! QA Monday Blue Screen of Doom  A Palmer Luckeys Tale Donald Trump, Chrono Trigger, and grand  to drop million on Israeli cloudmonitoring and analytics startup ! Windows  Runtime Broker ClipboardBroker Privilege Escalation Eloit   Windows  ManagementObject Arbitrary .NET Serialization Remote Code Execution   news  Halo Wars Definitive Edition is now avaialble on Xbox. , rebuilding their  foundations without anyone noticing  Going live come by and say hi will now release major Windows updates twice a year. Read more MSFT reasons to move your to Online via ."
2017-04-21," tambin festeja al o aprovecha esta n con Suministros Tuxtla Tuxrecomienda... UP    has hidden the color mixer  UP    Azure Time Series Insights Simplifies Business Senior Desktop Support Specialist USVAArlington Even Patent Bullies Like and Find the Patent Trial and Appeal Board PTAB Useful actualizar Windows cada seis meses ... Core Anatomy Part   UseMvc How to use LogNet with Core for logging  with   em  de e Application Insights Planned Maintenance    Final Update DOS will be with us forever. Former Vice President Brad Silverberg Those bright people with their predictions finetunes WebAssembly for Edge browser. Read more MSFT Surface Pro Intel Core i GB, GB RAM. Highpower. . Govt attorneys accuse of using its monopoly position to bully, bribe and attempt to collude before Gates paid it Actualzate con . Seeing stars photography by me on a Lumia xl  QA Wednesday Screen Saver Group Policy"
2017-04-22," This is huge for getting more Creatives to useswitch to . Microsoft Introduce aMonth XBOX Game Pass Subscription Service In Turkey are many people. For example Serkan Emre Sefa.  , de , april ,  am build challenge looki Open letter to re via   !!! Leaked document confirms and a competitor. Read more       Actility Snags Millions in New Capital for IIoT Solutions. ... office     Second teaser for the sketch check it out dropping rd April . s Central s Centralhttps office     Now THIS is an Order   , ny sunday, april ,  am youthspark camp office     office     LINE     PCOSPC    "
2017-04-23, opens up more on data its collecting with Windows  Ready to work for a company of the future Microsoft is ready for . Cheapest is  and standard is  ...      office     Are you a .NET in  is waiting for you!  office     office     office     LINE     Is Windows Worth Waiting For PCOSPC          Are you Bullish or Bearish on  Start MSFT with .  Leverage. . UP    has hidden the color mixer Nordic Account Manager Dublin Azure Analysis Services   UP    High minded haughty elitist aholes...Harming AmericaThat means u 
2017-04-24," Microsoft eeriments with putting tabs in every Windows window       office     finds another use for LinkedIn with CRM integration. Read more MSFT office     office     office     Set up a CICD pipeline with unit testing and code coverage for your Team Services extension LINE     PCOSPC            ,  ,      ...   !  ,     ... s Nadella banks on data to challenge  UP    and launch joint offerings .  UP    Embedded Linux becomes a vassal of crooks and criminals from seehttp Microsoft Video Whats new in R Server and SQL R Services  Halo Wars Definitive Edition now available as a standalone title for Xbox One, ... Read more MSFT MicrosoftMR"
2017-04-25,"      office     office     office     Windows To Get Cumulative Nonsecurity Updates Each Month . office     LINE     Thanks to Magdalena for the follow. integra los datos de en su tecnologa  PCOSPC          UP    Our Product Manager, discusses new MediaValet functionality  InApp Viewing and Editing of  Graph Database in SQL Server  UP    Microsoft opening European IoTAI lab  Blogs KB Configuration Manager clients reinstall every five hours because of a recurring retry task a Penny Pinching in the Cloud Lift and Shift vs App Services  When a VM in the Cloud isnt what you want Emma Stone   Microsoft lets you crash drones and robots in its new real world simulator "
