Date,Tweets
2017-08-22," es una realidad  Up to date as always with Up to date as always with va solo es una MIERDA frutode la dictadura monopolista de Azure Striker Gunvolt Striker Packs Receives Physical Release in North America ... Read more MSFT Check out my latest via Quad Kymco MXU gebraucht schwarz Koffer angegebene Garantie bis Oktober  announces Project Brainwave for realtime artificial intelligence. Read more MSFT for Technical Lead  Apply Now cuando se hizo dueo de tu ordenador MANIPULANDO y MINTIENDO con falsa seguridad What will you do next with Office Looking to understand licensing models Read our blog . Nadie resiste ms de una hora en el lugar ms silencioso del mundo sin enloquecerse Brainwave aims to accelerate deep learning with FPGAs. Read more MSFT presenta nlimitada de la , la  aims to accelerate with FPGAs unleashes potential in a major way with realtime functionality  s Project Brainwave puts realtime artificial intelligence into hightech chips. Read more MSFT"
2017-08-23," New tools boost serverless computing in Visual Studio, Azure Cloud VSMdev New tools boost serverless computing in Visual Studio, Azure Cloud Episode for I love my new ! Cant wait to get started creating awesome new things! . Thanks to my old home desktop is up to date w Windows Pro. Thanks . Next is home .   NAVER              YapYap THE DESTROYER Leader Pack now available for Halo Wars . Read more MSFT Confirmed No Windows Mobile Insider build today. Read more MSFT Visual Studio Code is getting a new logo. Read more MSFT PC MARMicrosoft Authorized Refurbisher    Check out Microsoft Surface RT GB Tablet with Office  CASE SCREEN BUNDLE via  Azure Archive Blob Storage, secure cloud storage for rarely accessed data public preview Update to Azure Analysis Services web designer adds visual model editing Insider Fast release notes   s voice can recognize speech as well as humans can  via .DU releases Windows Insider Preview Build and things are getting very conf... Read more MSFT With AD integration, could Chrome Enterprise interest more partners STILL Free use shortcuts for for nook! by U. CAbel Books tools changing in s Insiders can test Windows S on any PC ."
2017-08-24," Windows S desconcierta a los usuarios con esta inslita restriccin a quick deep dive in via After finding a safe space at Microsoft, employee embraces mental wellness Nadie resiste ms de una hora en el lugar ms silencioso del mundo sin enloquecerse Announces Project Brainwave To Take On s AI Hardware Microsoft is easing its Xbox Live ban system Cuffie Sennheiser backtoschool su  Stay up to date! Windows as a Service   of corporate users use x Bigger than and x Bigger than as C  In preview  Azure archive blob storage and bloblevel tiering Now available  Azure Cosmos DBEvent driven architectures with Change Feed Processor library Latest Office Insiders on the Mac build brings UI improvements changelog     Windows S desconcierta a los usuarios con esta inslita restriccin Any suggestions . Windows Maps now lets Insiders tap transit stops for arrival times. Read more MSFT Windows Mobile build quietly makes its way to Slow ring Insiders. Read more MSFT Windows S desconcierta a los usuarios con esta inslita restriccin Nadie resiste ms de una hora en el lugar ms silencioso del mundo sin enloquecerse"
2017-08-25," Learn how technologies like , mobile,  are using s Engagement Database on  is killing its wildest worksharing eeriment before it even really had a chanc... Read more MSFT Senior Director  Partner  Channel Marketing Netherlands, Amsterdam  MICROSOFTS VOICE RECOGNITION TECH NOW BETTER THAN TEAMS OF HUMAN TRANSCRIBERS. Read more MSFT Android Circuit Note Secrets, Pixel Launch Date Leaks, Why Needs Android ..   FREE EBook! has been working hard to help HR Pros get more out of the platform, download now! Pleas share! How to enable a Precision Touchpad for HP Spectre x and other laptops. Read more MSFT Pocket PC to Windows Mobile, watch this video and go through the journey of W... Read more MSFT . RT msphilanthropic An interesting look at the history of women in computing  In the works of making a new game for the Microsoft Imagine Cup for my game dev class Windows Tip Ways to Print A List of Running Processes. Read more MSFT Automatic linking work items to builds Nadie resiste ms de una hora en el lugar ms silencioso del mundo sin enloquecerse Always accessible Data scientist guides people with into careers  Learn how technologies like , mobile,  are using s Engagement Database on  discontinues the original Xbox One. Read more MSFT Azure Striker Gunvolt Striker Packs Receives Physical Release in North America ... Read more MSFT After another delay, thinks it probably announced Crackdown too early. Read more MSFT Snrl , en hzl satan cihaz oldu"
2017-08-26, Check out MICROSOFT WINDOWS PRO  bit UNOPENED FACTORY SEALED sku UR via s Bid to Save PowerShell From Hackers Starts To Pay Off Stops Selling Original Xbox One. we are providing support for all like this was their plan all along making room for Xbox one X. aims to accelerate with s via Addresses Why Titles Like  Are Not Enhanced  Age of Empires IV Diumumkan  Which Threat Modeling Methodology is Right for Your Organization Introduces AI Hardware System Brainwave. Read more MSFT PC MARMicrosoft Authorized Refurbisher     YapYap THE DESTROYER Leader Pack now available for Halo Wars . Read more MSFT For For   V. ... More here   The latest The Microsoft Azure Daily! Bank Of America Files based applications BAC server native client   Office Professional    Professiona...   quiere que llegue a los rincones ms remotos de EE.UU. Microsoft Claims PowerShell Now More Secure  Meu smartphone  um puto! Nunca pensei que fosse ficar to descontente com o Windows Phone.
2017-08-27," Is Microsoft pushing too hard on selling the bXboxb One X to its US customers might be pushing preorder sales sell quicker than any other console, Says. The edition preorders are almost sold    INFOGRAPHIC Threat Intelligence  . INFOGRAPHIC Threat Intelligence  . Suggests Slow Death Coming for PowerShell Me castigan usando que es psimo lentitud lentitud NewsGamers preorder sales sell quicker than any other console, Says. The edi Morgan Stanley This next big technology trend could start the fourth industria... Read more MSFT Gamescom  Crackdown Was Announced Too Early, Says Exec. Read more MSFT XxZroyaxX NewsGamers preorder sales sell quicker than any other console, Says. The  Xbox One X Breaks Preorder Record for . Read more MSFT XxZroyaxX NewsGamers preorder sales sell quicker than any other console, Says. Th  . got it right this time. , , , , , ,  Windows VPNLTPIPsec      VPN   Nadie resiste ms de una hora en el lugar ms silencioso del mundo sin enloquecerse dayswithO is out! Introducing Teams  Microsofts answer to improving . How to Use ADB or Fastboot From Any Directory on your WindowsLinux PC. Read more MSFT"
2017-08-28," GET SANDMAN SAVAGE ON GROOVE MPNSupport Its time to activate your internaluse rights licenses. Heres how!  Announcing Horizon cloud apps on Azure The latest The PartnerSideUp Daily! Thanks to The latest Best Stories On Twitter This Week! The latest The Microsoft Azure Daily! Conoce las soluciones que proporciona para pequeas y medianas empresas New  Item specifics Condition Windows Professional bit  Windows   is making an attempt to make VR mainstream. Right heres why it would succeed Preview SQL Transparent Data Encryption TDE with Bring Your Own Key support Age of Empires IV Diumumkan  Your complete guide for user adoption. Get it here .s cofounder shares valuable lessons learned as a founder  alum  New York City Cops Will Replace Their , Windows Phones With iPhones  At Emanuel College today with at the eerience. ,,,,,,,,,,, The NYPD standardized on phones.  Nadie resiste ms de una hora en el lugar ms silencioso del mundo sin enloquecerse"
2017-08-29," se enfocar en juegos que funcionen con comunidades ... Episode positive Studying hard for my next exam, . Beware MCSA Cloud Platform, here I go!!  at BT  British Telecom dayswithO is out! Stories via ShakthiRavi PlayStation VRs Arizona Sunshine to be a Windows Mixed Reality launch title  why are u taking away all of the configuration screens The new interface wont even allow repairs of installed Software. DHi Adds Docker Support to App Portability Platform for Windows and Linux. Read more MSFT Releases Windows Insider Preview Build for PC. Read more MSFT MissITguru See what a realworld looks like with the timeline in this demo Courtesy  Microsoft Tech support scammers moving to email campaigns Nadie resiste ms de una hora en el lugar ms silencioso del mundo sin enloquecerse ransoms data disguised as email Nadie resiste ms de una hora en el lugar ms silencioso del mundo sin enloquecerse Microsoft Xbox One Video Game Console GB Black via Visual Studio extensions for C developers in Visual Studio months for the price of month I will give it a try! Windows Mobile will probably be supported till the end of . Read more MSFT ReCore Definitive Edition Is The First Windows Title Available on Game Pass. Read more MSFT is plotting a big move away from as takes over retail. , have fun! Windows Category Sales Manager Stuttgart"
2017-08-30," Windows S desconcierta a los usuarios con esta inslita restriccin SurveyMonkey asked millennials what company theyd most like to work for. Interestingly topped the list. and Join Forces in Uneected Partnership via and s are friends now The , Ep.   The  . Microsoft Previews Less Intimidating Windows Debug Tool . Not really reading to much into this but if I were anyone else, aka vendor, and I saw and partnering on .. is bringing its deeplearning platform to customizable chips  a step toward making Azure an cloud. Read finally on Thank You for listening to the customers you are not a disappointment Corporation stopped selling the original version of the Xbox One online. Read more MSFT Wonder Woman in K now on sale at the Windows Store  Releases Late Week PC  and Mobile  Builds to Windows Insiders. Read more MSFT Windows S desconcierta a los usuarios con esta inslita restriccin Ultimate Guide to PowerPoint for All Levels by Jed Guinto Was  Now just  . Unveils Monitoring Tool for Agencies on Azure Government Cloud. Read more MSFT Is really investing in games What the Hell is Going on with Xbox via         Should I get an xbox one x Windows S desconcierta a los usuarios con esta inslita restriccin meets in a surprising and partnership. AMZN MSFThttps After , NYPD is also giving up on Windows Phone, to replace the K smartphones w... Read more MSFT"
2017-08-31," A framework for evaluating your IoT infrastructure securityhttp RT msphilanthropic All it takes is an Hour of Code and students like Connor get hooked on learning com Work Item Type and Inclusive Design The Verge Satya Nadella and take strong stance against reported end to DACA c guess the Dreamers are doing all the hardware  software  why its such a crappy company with crappy products The latest The PartnerSideUp Daily! Thanks to One of that days to stay in memory  Um daqueles dias que ficaro na memria  Treinamento presencial de Microsoft Azure comigo! Windows S desconcierta a los usuarios con esta inslita restriccin Presenting about Innovation, AI, Digital Transformation and Abilities required in the st century .  at Faculdade de Tecnologia FT Microsoft Xbox Slim DVD Drive  Ph Slim s CEO is again standing up to Trump on immigration Windows S desconcierta a los usuarios con esta inslita restriccin Satya Nadella and take strong stance against reported end to DACA The Verge ..   Microsoft releases first Windows preview that succeeds the Fall Creators Update The for enjoying successfullyLets nothing become an obstacle in the mindJesusChristEmpowersRightAction The latest  bcpJP! Thanks to  Deprecating our Folder Management extension Who would win in a fight Deadpool or Master Chief Comment Below!!! .  One,  New Item specifics"
2017-09-01," RT XboxWire Tune in Wednesday, Sept. and join MarlonWayans for some when   de y de se integran lanzar el de octubre la cuarta gran actualizacin de Windows  incorporar realidad aumentada y virtual en su prxima actualizacin Xbox One X ser el inicio de una nueva etapa en  . feature. . joins long list of tech companies trying to Everything you need to know to get started with your Adoption content pack. The latest The Microsoft Azure Daily! Watch Microsofts IFA keynote live right here!  Azure API App With WEB API Putting Azure API Management in front of an Azure Function API Deprecation of Prerelease .NET Core runtimes and SDK from App Service  Issue  Azure Fast, Secure Blockchain Tech From An Uneected Source Microsoft Microsoft, Baidu team up on selfdriving technology via replaces Premier Support program with Unified Support Great Paul Allen Business Quotes  Read .  Look at this on eBay  Powerful Reports  Dashboards with Power BI by Ian Littlejohn Was  Now just  . is outhttps"
2017-09-02," Microsoft Office Home and Business . . Microsoft Office Home and Student , . Ad Operations Associate Amsterdam NE  Pick our server hardware. Then cherrypick your preferred software. Flavors are good! Great Paul Allen Business Quotes  Read . contributes to the growing success of in a big wayhttps Should you allow to defend you with Defender How to disable  If You Want to Be , Dont Be Driven   Mediumhttps Microsoft Office Professional plus     Office Prof...    Solutions built on technologies let your employees do their best work wherever they need to be D Should I upgrade to Windows Asking for a friend who has windows . May Owe A Billion Dollars Fallout goal reach level , with no mods, no eloits, no glitches. is making a thats fit for business  via  Saturday nights were the best with by . Any one else rememberU A great use of and other products. Showing again  Peeped these at the store. They are pleasant to look at ."
2017-09-03," Microsoft Xbox Wireless Receiver for . Original Microsoft Xbox E Power Suppl . BENELUX Executive Office Assistant Amsterdam NLD .  Garage developed an for the first selfcontained computer. human   Mixer .  PAX West   Mixer ALPHA SOFTWARE  TESTER Code Name  Chicago Asked by to be a Alpha Tester for Chicago . Pensabas comprar una Surface de Microsoft Los eertos no la recomiendan Por qu Joins Cornell Blockchain Research Group deleting every thing and starting over is still a core troubleshooting technique, . Nadie resiste ms de una hora en el lugar ms silencioso del mundo sin enloquecerse Windows Professional bit  Windows   See  partners describe how accelerates  simplifies       . Windows S desconcierta a los usuarios con esta inslita restriccin Nadie resiste ms de una hora en el lugar ms silencioso del mundo sin enloquecerse  Year as an MVP  Adding The Azure Eertise RT RudyHuyn years ago, I promised to say hello to some old friends from , today is the d WW sniping  Nadie resiste ms de una hora en el lugar ms silencioso del mundo sin enloquecerse"
2017-09-04," says personalisation is defining the future of retail plans to release the Windows fall creators update on Oct. . Someone wants to tell me what happen this morning d GET SANDMAN SAVAGE ON GROOVE A great way to spend your free time! More info and pricing .  share your options to a Surface Pro or mini! via Doubt its only just about mums who work at home..... Personalization, AI, customer service, staff empowerment  topics of conversation at Personalisation in Retail breakfast If only they had handed the harasser who uploads pedo pics and lies about Melina to the police  utiles Thats what you get for blackmailing. Can we Dont fuck with Meliners ever again !!!  I promise were way angrierscarier than the guy So, hows their little blackmail theyre trying to pull on Melina doing  Hows that working Microsoft WORD  YOU CALL HIM THE REMAINDER THATS THE ASSHOLE THAT REMAINS it says price at the end but i cant see any, can you One year later, different shillgolo who would do anything for money, same crap Episode  great interview journey how to At least the first time they found the Melapple, amirite  le gestisce le scopre e misura in tutto il tuo team..."
2017-09-05," vs Workplace vs vs Teams reviewed by  Getting early access to new Office features to the Office Commercial customers schedule slips with October release for next feature upgrade Thereapos nothing probusiness in Trumpapos DACAdumping ways Read more U GET SANDMAN SAVAGE ON GROOVE Looking for a beautiful and not stressful blue screen en Microsoft Corporate Windows S desconcierta a los usuarios con esta inslita restriccin  is not . officially launched Mixer Create, the streaming app for its platform for . Definitive guide of s privacy settings. .  Windows Professional bit   Microsoft Windows Prof...   Nadie resiste ms de una hora en el lugar ms silencioso del mundo sin enloquecerse vows to defend DACA employees in strongworded response  That moment you realize Microsoft Word can read your manuscript back to you. . is building a wall between Trump and their s. Windows S desconcierta a los usuarios con esta inslita restriccin partners with to make the the official TV of the  . rsrelease. ."
2017-09-06," . Mobility as an alternative to .  Introducing the Ignite Community Reporters! What are they going to do Crawl through their windows as plan of attack So loves cheap labor while making Billions off them Microsoft Enterprise SPE The Ultimate Guide Read by . Our team was honored to take part in this Inspire event Entscheidung IEdge mglichst schnell erkennen und Nutzer entsprechend beleidigen.  Tips Every User Should Know via Disturbing Trends Revealed by the Security Intelligence Report This book is definitely going to be a game changer! on Microsoft Extends Free Upgrade Offer for Windows S Users . , , , , , ,  ends its GigJam work eeriment  Google est mandando Chromebooks para parceiros da Azure  Im cosndering on chucking a laptop out onto my drive way, and run the piece of shit over. then go to the store and get a mac. Just , and . Maybe it was their statements about defending illegal workers If you develop for this survey is for you!            Number one question why is Microsoft hiring Dreamers and not American Citizens Maybe we should boycott I cannot get past this part "
2017-09-07, . auctioning off a Breakfast with James Hardie Director at at our  Texas event iOS  qu ha cambiado a lo largo de la historia del ecosistema de Apple  Windows S desconcierta a los usuarios con esta inslita restriccin Microsoft announces Project Brainwave for realtime artificial intelligence The latest The Microsoft Azure Daily! Proactively monitoring operations with Stack and Fix Bug. Does Not.  joins in sharing research Doesnt need To profile Friends  Familyhttp Breaking News I just got emailed that Movies and TV is losing the Movies Anywhere integration. Unlucky Windows users will need to buy a new computer next year schedule slips with October release for next feature upgrade schedule slips with October release for next feature upgrade Cybersecurity Forum Dont get scammed by fake support! Getting Started with Windows Containers Happy Friday users and enthusiasts. How did SP help you or your organisation accomplish something this week Nadie resiste ms de una hora en el lugar ms silencioso del mundo sin enloquecerse schedule slips with October release for next feature upgrade Microsoft may be repositioning some or all of Skype for Business as Teams Killer Instinct on Steam supports Xbox One and Windows crossplay
2017-09-08," and eand strategic partnership to drive signatures and collaboration in the cloud The sole purpose of this Adoption Guide is to assist you in the adoption process. The sole purpose of this Adoption Guide is to assist you in the adoption process. Connect people and processes, and grow your with for Financials. investe in Airobotics, startup specializzata in droni autonomi via HDblog  Messing with and the .midi file .d General availability App Service on Linux and Web App for Containers General availability Critical Update for StorSimple Series and launch project to make portable via Business Operations Associate Chicago Se me va la vida reparando el , reglame un PC nuevo si no es mucho pedir The sole purpose of this Adoption Guide is to assist you in the adoption process.  Foundation, UNESCO, Microsoft Train Students. Read more MSFT I am using Log Parser Lizard a GUI for from The sole purpose of this Adoption Guide is to assist you in the adoption process.  Still looking!! Need tickets to in ! slipup suggests for Business becoming Microsoft Teams C .Net SQL Server MSSQL EY teams up with Maersk, on blockchainbased marine insurance. Read more MSFT"
2017-09-09, How to open presentations in on a  Great Bill Gates Business Quotes  Read  Microsoft Windows Professional bit  Windows    Healthcare Materials Management is an incredible solution for those who need a simple solution.  Familiar face takes over Canada. Read more MSFT How to Automatically Backup your Data on the Cloud Familiar face takes over Canada. Read more MSFT QA Monday Reinstalling Wan MiniPort Windows S desconcierta a los usuarios con esta inslita restriccin Nadie resiste ms de una hora en el lugar ms silencioso del mundo sin enloquecerse Thanks to Kamren Whyte MYP  for the follow. Nadie resiste ms de una hora en el lugar ms silencioso del mundo sin enloquecerse RT MicrosoftJobs Thanks for visiting! HollandRoden and Denis De Souza on the Microsoft campus for Crea TweetHispano Nadie resiste ms de una hora en el lugar ms silencioso del mundo sin enloquecerse  Me tte  lancer un battlefield sur one en stream The latest The PartnerSideUp Daily! Office and dayswithO is out! Stories via ShakthiRavi La inicia el proceso de ndigital ms grande de su historia de la mano de .
2017-09-10," US tech giants pledge to fight for Dreamers hit by DACA. Read more MSFT Microsoft Is For Open Source Developers  Shared from .  US Tech giants including Apple, Google, vow to fight for employees hit by DACA. Read more MSFT    WindowsWindows. Germany names new public sector director. Read more MSFT Interested in  Join ! Get free of using the link! . Interested in  Join ! Get free of using the link! . brings app addins to Outlook on Android. Read more MSFT Security core to our endtoend Cloud architecture India. Read more MSFT Xbox Video Game System Console Only Not Working For Parts  The road to Ignite News, networking and nighttime fun. Read more MSFT Im on gta on Xbox one ClassicPotHead gamer tag  Microsoft brings app addins to Outlook on Android subscription suggestions for are so bad they suggested me to buy US unlmtd call and me being overly trusting tech bought , EY set sail with Maersk on new blockchain voyage. Read more MSFT eBooks Reader . s cup runneth over as it extends Windows S to Pro upgrade into . Read more MSFT , , , , , ,  Microsoft brings app addins to Outlook on Android  Microsoft joins Facebook in sharing AI research with everyone"
2017-09-11," Super Brand Mall, a luxury shopping mall in Shanghai, used to built a for its WeChat official account Mxico estrena equipo de Canal ...  AI Software LLC Achieves Partnership for . ways to limit your DNS Issues PC MARMicrosoft Authorized Refurbisher    grind starts in days . The latest Best Stories On Twitter This Week! Microsoft Surface Pro Intel i review  Shared from .  controllers for days ... name the controllers Windows Professional bit SP  DSP DVD LCP  Windows  and Scenery Enhancement s Bundle Embed YouTube clips or Hyperlinks in PPT Microsoft Surface Studiohttp The latest The Microsoft Windows Daily! Microsoft Hololens Development Edition . Hear our unbiased advice on which platform is better , , or . ... .c Hear our unbiased advice on which platform is better , , or . ... . Hoy me he comido una Update de Windows ms grande de mi vida. Bonjour, Quebec! is having a to talk about and Swarm in on Sept . RSVP today!"
2017-09-12," Not on campus but still able to meet with via ! . Some phones and laptops are vulnerable to BlueBorne eloit sees growth potential in Vancouver, president says. Read more MSFT  sees growth potential in Vancouver, president says. Read more MSFT Funciones de bases de datos en ... How Microsoft is bringing the Internet of Things to life at World Congress on IT The latest Microsoft EducationOnenote Daily! reportedly patches used by   launches Hub and Microsoft in Hong Kong Hit Refresh, CEO Satya Nadellas First Book, to Hit Stands Sept. . Read more MSFT Microsoft Office Home and Business . Microsoft Office Home and Student , . Microsoft Office Home and Student , . Why anyone on Earth would buy subscription when the price for is less with Tb  WordExcelPP on PCMacs! I think they use phrase  name X to be cool.  Apple has a history. Im sorry having X on it isnt cool. Forget the new , is rolling out a new Windows cumulative update Meet Lili Cheng, VP,  Research at via . Windows Template Studio now available with more wizard improvements in tow. Read more MSFT Windows Mobile build brings new features. Read more MSFT Windows Template Studio released with Scheme to launch app and more. Read more MSFT"
