Date,Tweets
2016-12-01, Look what Ill be unboxing tonight. An USB SSD from      innovative products that failed badly office     office     office     office     Work the way you want to with devices. Find out more in our ondemand  LINE     preparing for the remaining  of Adoptionhttp   shareholders eress fear that the company is abandoning mobile   shareholders eress fear that the company is abandoning mobile    shareholders eress fear that the company is abandoning mobile   shareholders eress fear that the company is abandoning mobile d PCOSPC       shareholders eress fear that the company is abandoning mobile       outlines November updates for Excel Get  Transform and Power Query ad... Read more MSFT UP    details December Update to Gears of War . Read more MSFT
2016-12-02,"   Handson Windows Mobile build video   Handson Windows Mobile build video   Handson Windows Mobile build video It just got real up in here! Offers Additional Guidance for Moving Away from SHA Encryption. Read more MSFT      UP     UP    Talking DevOps, hardcore air hockey and more with Donovan Brown. Read Blog MSFT  Head in the clouds Nope, but Computing brainy schedulers now available on Quick Game Setup Tour!  my kids unboxing review of the surface studio  and Specs, Price And Features Building FFmpeg using WSL Selling Edition with Games  added a Shared with me tab in Word, Excel,  PowerPoint! What interns and new grads really get paid at top tech companies NewsTechnology Surface Phone specs, rumors The ultimate  to be released in var La Liga espaola se ala con para crear servicios en lnea ..."
2016-12-03," or playa PCOSPC          UP    PCOSPC      UP          asaService on  s Color Binoculars App Lets People See The Normal Way. HackRead s Color Binoculars App Lets People See The Normal Way. Open source has won, and has surrendered Foxconn  HMD Global to buy feature phone unit ,    .     ReCore will get a brand new TNK corebot DLC early next year  just raped das wel een vorm van Azure hoor in combinatie met SCCM van ... geen directe ervaring nog.. wel onderzoek waard! , Premio MC al compromiso con el  va To se zase pedvedl.U vc jak dn nefunkn .hotmail.com vpadky .com fakt sr na to vykalu a koupm si Great Bill Gates Business Quotes . Finally. After more than a year considering it, I gave in."
2016-12-04," How Microsoft Lost In Court Over Windows Upgrades disable in Microsoft still doesnt get it. What The Acquisition of Means for   , silent re tracking . refused.  EU piles pressure onto US tech giants , , s YouTube and to improve office     office     Windows Media Center ehshell.exe XML External Entity Vulnerability   Authorization Manager azman XML External Entity Vulnerability   Excel Starter XML External Entity Vulnerability remote  office     Its everywhere, all this new tech and a massive amount of bugs also!!!! Who are these poor coders j pode trazer de volta o office     Windows Media Center ehshell.exe XML External Entity Vulnerability   LINE     fixes battery problems, againhttp PCOSPC     prepara para "
2016-12-05," Power BI on Twitter Were pleased to announce a ask a , see more Pretty much . y salen a la caza de diseadores  UP    MA Super buys stealth  busy comp. others has a new AI chatbot and it doesnt want to talk about Tay Depois que meu grande amor at hoje me abandonou, a minha vida estourou a exceo NullReferenceException el precio de la hasta el de Microsoft Debuts Zo, A New AIBased Chatbot Researchers Say AI, VR, Chatbots Will Take Off in . Read more MSFT is letting users try a new on the app Kik, nine months after it shut down an earlier bot that... Microsoft Researchers Offer Predictions for AI  Deep Learning Hoy he tenido que leer tanto de tecnologas y su familia .NET, que no poda seguir si no destapaba una cerveza. Roja. Facebook, Microsoft, Twitter, and YouTube are creating a database of terrorist content forged his sword, . or wordsmiths rivaled the , but mingled like oil and water! Computer Science Education Week An opportunity to bring st century skills to everyonehttp Microsoft Store st day of its Days of Deals! Save up to K on PCs! Shop now . Implementing Windows Hello for Business at Microsoft Webinar Were pleased to announce a ask anything event! Ask questions  share feedback w the product team. Power BI on Twitter Were pleased to announce a ask anything e , see more"
2016-12-06," Following the failure its controversial Tay, is back with its new Zo was the first giant to take the leap into legal  heres howhttp Great Bill Gates Business Quotes . Slides de mi presentacin en el TechTour , Microservicios de .NET Core en Docker Containers de  LifeCam Studio review A hidef webcam for business or pleasure. Read more MSFT La Commission europenne autorise avec rserve le rachat de LinkedIn, devra respecter certains  details the preview of Relationship Insights for  Surface Pro Intel Core i GB, GB RAM. Highpower. . Partnering to Help Curb the Spread of Terrorist Content Online blog.googletopicsgoogleeuropepartneringhelpcurbspreadterroristcontentonline  Check out Microsoft Xbox One GB Black Console With Kinect, Controllers, and Cords. Enterprises face ...  deal cleared by regulators, opening new doors for people around the world.  aprueba la de por parte de  As, el gigante estadounidense deber permitir que Windows Creators update loads up on features for IT s AI will describe images in and for users  via  engines can ... sometimes, into a countrys culture means erasing certain colors, as in s Polish ad. Uhm!! Early technical preview of JDBC for SQL Server Released! Microsofts second try at social chat bots arrives in Kik Ever wondered what VM Elorer was capable of Join us and see!"
2016-12-07," The Office Hub, will arrive on the App Store  UP    All Apps in are tested by . Code InstalledUninstalled on clean system now connects to Kafka to manage device links. Read the details via  releases for Hub which can be used to read telemetry data. Read via  MicrosoftIoT now connects to Kafka to manage device links. Read the details via eWEEKNews now connects to Kafka to manage device links. Read the details via eWEEKNews oDigital essa  a chance que sua empresa tem para dar mais um passo rumo  Transformao Digital . Store ...  . MSCloud releases for Hub which can be used to read telemetry data. Read via eWEEKne philipwmorris now connects to Kafka to manage device links. Read the details via eWEEKN MicrosoftIoT now connects to Kafka to manage device links. Read the details via eWEEKNews now connects to Kafka to manage device links. Read the details via eWEEKNews news  Heres whats new in Windows  news  Narrator and keyboard brightnes Store . Call of Duty Infinite Warfare!  Value Holoportation  Microsoft invente le tlphone du futur My wife got me a Surface Pro for my birthday sorry my old Asus. First thing to do is to get . List the lunch allergy info, like almond meal, this year, ICU visits suck. I Would rather spend k in the store.... List lunch allergy info this year like almond meal ICU visits suck. Rather spend k in the store...."
2016-12-08," Compra licenciamiento en Ingram Micro y llvate un regalo sobre ruedas! The latest  bcpJP! Thanks to  cierra la compra de por  millones de dlares Done deal completes . billion via... by via Sadly my Band updated version is developing the crack of death time for a new system . My blog Understanding Microsoft AppSource and Dynamics  Well its official now owns the networking site . Eight Microsoft computer scientists have been named Fellows of the Association of... by via What dreams are made of     Always open announces on partnership with , but done right this time  via destaca los avances tecnolgicos al servicio de la sociedad a . e GF Only . Celeron N  GHz  . SLC EM MS Technical Support Sales Liuzhou China Final proof of Surface Phone Microsoft announced full Windows for ARM . Everything announced at  on , PCs, and more! by  Congratulations to all of our student that completed the Office Readiness Series!! You guys rock!! . "
2016-12-09," Working in Microsoft Retail via Has Found A New Solution To Its Mobile Conundrum via . office     officially closes its .B acquisition of  Pokmon Sol y Luna, eectativas superadas Working in Microsoft Retail Review WaterField Designs Syde Surface Book Case. Read more MSFT Office AddIn Pickit Free Images. Read more MSFT sought for location. system admin with over years eerienced required,  ms s december , act december , boar Hunting for the dragon balls . Universal Windows Platform apps in the Enterprise kills a contract option Enterprise Advantage for is dead, even before it was available. Surface Pro gets HD Audio firmware update and nothing else for December . Read more MSFT  event the event to sql in slovenia Facebook, Twitter, Google and join forces to combat terrorist content online. Read more MSFT Clueless Gamer Battlefield  With Terry Crews  CONAN on TBS via Surface Pro picks up small audio driver firmware update. Read more MSFT Fathyms IoTenabled WeatherCloud enhances driver safety during inclement weatherhttp"
2016-12-10," office     office     LINE     Microsoft officially closes its .B acquisition of LinkedIn PCOSPC          Check out MICROSOFT OFFICE SMALL BUSINESS RETAIL UPGRADE, WINDOWS, PRODUCT KEY via UP     UP    integrar la identidad y red de a y . The Rate For US Corporations And Many of UKs NHS trusts continue to rely on Windows . Read more MSFT Now tracking to Announce based Tablets and PCs with BuiltIn Cellular ... Surface Pro Intel Core i GB, GB RAM. Highpower. . for  researchers on what to eect in and im here at fashion valley store for change my band IoT Connects to Apache Kafka to Manage Device Links via . updates their virtual assistant on iOS and Android  Scholastics The Magic School Bus Elores the Solar System Jewel Case Old  msftmfg IoT Connects to Apache Kafka to Manage Device Links via"
2016-12-11, Leaked from  light modifying headset that generates a report when fashionistas do yoga. Should I buy Im tempted.. Microsoft Surface Pro  Surface Hubs user guide now available  Microsoft... LIVE BF  AO VIVO AGORA NO BEAM       office     office     office     office     LINE                announces a new file eerience for groups in  PCOSPC          How many of these innovations from do you know about UP    Outmaneuvers For Turned out to be winnertakesall.  UP   
2016-12-12," Get an overview  best practices on how to manage based services within your org. Download the eBook  If youre interested in business apps on the Cloud platform, the blog is the place to go!  If youre interested in business apps on the Cloud platform, the blog is the place to g If youre interested in business apps on the Cloud platform, the blog is the place to go!  wants to achieve more on with impactful Massimiliano Fuccilo rides wave of hot Surface sales, summons tech execs, s photo feature via Les ventes de Surface battent des records suite  la dception du MacBook Pro via Ventures launches fund dedicated to and unveils new Google taps Van Jones and Anil Dash to discuss race and algorithmic bias Worth noting...  Building a snowman to bring to with screens in Holiday sale! Surface Books for ,  off MSRP, no tax outside NY , Amazon, Facebook y Virgin renen fondos contra el ... ..."
2016-12-13," . shares new training  discounted certifications. Now on the blog phone  charger purchased from on  burst into flames on  damaged bedroom . officially launches Zo.ai, more botbuilding tools Open letter to re via Imagine connecting customers directly with C leveraging acquisition!       . ,     Now tracking develops new eye motion tracking technology  Dont worry, MSDOS will live on after all New Windows Insider Build allows you to shut down your PC with your voice. Mam, esta nevera habla y la lavadora le contesta I have a TMobile iPhone S, will it work on Metro PCS if its not unlocked Samsung Galaxy Note Smartphones to Be Disabled in Recall Effort Pokmon Go Wasnt The Exercise Regimen It Was Hyped To Be . Electronic Arts  le contrat dexclusivit avec Porsche eire enfin .C Speaker for is must have to compete. app handicapped bc its buried in my phone. Really Touch, swipe, press.  Microsofts new service turns FAQs into bots  Patches Dangerous Backdoor In For OS X  Trump is the new JFK says  boss says new president will unite country through innovati... Lumia phones are out of stock in some European countries "
2016-12-14," New Skype desktop update brings high DPI support  This week, Microsoft has free... is bringing Cortana to fridges, toasters, and thermostats via . LINE     PCOSPC     Gigantic Hero Spotlight Voden GetFileHash  Calculer un avec PowerShell      Ja, det dr var ju kul dags att dra till sngs d antar jag .c UP    s new plan is to flood your entire life with , , , , , , ,  Find a free cloud training in a city near you! , , , , , ,  UX Product Designer London UK  UP     Half of owners play titles  Never thought Id see a headline like this in my lifetime. The of today is a real contender to .  To Launch Asias First In  Microsoft To Launch Asias First Consortium In Taiwan OttLegalRebels RT KaarloHietamaki .Uber is trying to keep up with tech giants like and by inv"
2016-12-15," Offers Azure Blueprint for FedRAMP High Baseline. Read more MSFT The Surface Phone Could Be The True iPhone Killer. Read more MSFT Its a creative career, so there are less rules. by via How to Avoid Backstage View When Saving Files in Office . Read more MSFT Wowser! The Store is now officially cooler than the store. Learn how to image to with satisfying results. . The latest The PartnerSideUp Daily! Hot! Xbox One S GB Console  Minecraft Bundle by  NexGen Cloud Huge Partner Opportunities In DevOps As Clients Demand Automation ... Read more MSFT      to Offer Software for Local Governments to Regulate and Tax Legal Cannabis office     Two of our eert consultants share how to integrate web apps with existing virtual networks office     office     Microsoft is looking into custom gamerpics for Xbox Live . LINE     Upgrades without downtime with . Sounds like some sellout eerts who went to work for and one got fired and died"
2016-12-16," Getting some refueling after partners meeting at office with and Brian Iinuma . Getting some refueling after partners meeting at office with and Brian Iinuma . releases first updatehttp PCOSPC          Updated shared beta app for Windows now available... Report Microsoft To Acquire... UP    arstechnica How an old Drawbridge helped Microsoft bring SQL Server to Linux by drpizza Here and extend mapping deal, eanding into connected  I wish had laptop specs as well... any website recommendations Microsofts new plan is to flood your entire life with AI .  UP    joins AMIS to form consortium in Taiwan office     RT  joins AMIS to form consortium in Taiwanhttps office     MSNH  Microsofts new plan is to flood your entire life with AI  Working Geek PayScales data guru Katie Bardaro shares tips for managing work a... Read more MSFT"
2016-12-17," Cortana is about to become your allpurpose productivity bot VentureBeat  Corta Rflexion dun gars qui ny connat rien. to the fucking hell . Sr Business Program Mgr Redmond WA Cortana is about to become your allpurpose productivity bot VentureBeat ..       office     Microsoft Windows pro   office     office     office       Microsoft Surface Pro Release Date, Specs  Rumors Coming Up Spring ...   Microsoft Surface Pro Release Date, Specs  Rumors Coming Up Spring ...   Microsoft Surface Pro Release Date, Specs  Rumors Coming Up Spring ...   Microsoft Surface Pro Release Date, Specs  Rumors Coming Up Spring ...   Microsoft Surface Pro Release Date, Specs  Rumors Coming Up Spring ... LINE     PCOSPC     still working to fix sync issueshttp Releases Dataset To Help Researchers Create AI Tools"
2016-12-18," Learn how intelligence tools are using so everyone can benefit . The first time engineers tried to use their own , they failedhttp chinooktelescop Saw a needle disposal unit in the bathroom. Dont know if that says more about their employees  MicrosoftNokia       office     office        rich af office      Lumia XL Now Available For Just  In The MSPoweruser  LINE     PCOSPC     adds basic to  Check out Call of Duty World at War XBox Live via office     UP     UP    Program Manager India Hyderabad Windows IoT Core now available commercially ... Office now has million subscribers  Microsoft posted revenue of ...."
2016-12-19,"      office     office     office     office     offers bots as a service as demand rises for automate online interactions PCOSPC     Overview Of Core Web API With AngularJS Dependency Injection in MVC Views      UP     UP    We are hiring Microsoft IDC  SeniorPrin Are you an LD thought leader with global depth  team leadership eerience s tools can now predict the outcome of eye surgerieshttp Deploying production workloads with Azure Resource Manager Webinar Office meets evolving eDiscovery challenges in a cloudfirst world Technical White Paper  Nueva operacin de Microsoft contra la piratera digital va Winwin Open source .Net pays off for devs By opensourcing .Net Core, is reaping the rewards  as are the developers"
2016-12-20," Hey , stop fighting. We love you all! . Dead Rising DLC Out Today, PC Players Have Apparently Been Naughty. Read more MSFT The Worlds Largest Software Company Now Resembles A Startup. Read more MSFT Hot! Xbox One S GB Console  Battlefield Bundle by   The latest The PartnerSideUp Daily! Haha, in . year later  same fears for privacy. From one tech to another  Step into the playground of fun Whats new in .NET  elains it all Microsoft disponibiliza o SQL Server vNext CTP   Hier ist es erneut Der Klassiker Minecraft von auf dem AppleTV  jetzt als Download im AppStore. news  The Vudu app is now UWP compati Flock Adds APIs to Spur Collaboration Ecosystem. Read more MSFT CMake support in Visual Studio  whats new in the RC. update apps get Integration, improved accessibilityhttp Amazon Is Killing Its Competition In The Cloud AMZN wins  million contract statementhttps Why Windows users have better antivirus protection Skype DOWN  Microsoft messenger and video chat app NOT WORKING across the UK Configmgr Technical Preview main new features brings F to Jupyter Notebooks on . Read more via "
2016-12-21," Advances in accessible internet could empower billion people with digital... by via office     Microsoft updates Beam streaming to better compete with Twitch First look at The eerience left our writer impressed and hopeful for the technologys future. How , , and mastered the art of CSM Working with the HBase Import and Ert Utility Microsoft updates Beam streaming to better compete with Twitch Advances in accessible internet could empower billion people with digital... by via Upset after their screwup the girl had the nerve to tell me she dont know if Im going to return the package .really  Advances in accessible internet could empower billion people with digital... by via Review Nokia Lumia   RT  ence  How fixes vulnerabilities updates Beam streaming to better compete with Twitch u Norton Satellite  Windows Apps on Microsoft Store Microsoft updates Beam streaming to better compete with Twitch  This is a bit misleading... i got to replace a hard drive, hope i still get my windows free again Crashed Could The Rumored Surface Phone Take Down Upcoming  Rumor New Xbox One Elite Controller To Have Detachable Triggers  U Rumor New Xbox One Elite Controller To Have Detachable Triggers"
2016-12-22," Heres How You Can Upgrade the Components on a Surface Studio Video. Read more MSFT office     Azure Stack Hopes to Succeed Where Private Clouds Fail. Read more MSFT awarded  million Department of Defense contract via Here is whats new in the Office administration December update. Read more MSFT We Suffered for This Me  Mine has a vision for Office Planner integration with Teams. Read more MSFT Have a Happy Holiday from us at Get Reward points for every dollar you spend on select games from the Window... Read more MSFT Legacy code  LifeCam Studio review A hidef webcam for business or pleasure   Slatecube Founder Chris Kwekowe Turned Down To Create StartUp  Installing and Configuring purchased elite controller dec product broke out of warranty days wont replace Microsoft... The Cloud Needs to Get a Whole Lot Greener in Trump to meet tech firms including Apple, Facebook and Google President News This researcher wants you to know he did not harass Ivanka on a plane ... , Yahoo, and other tech giants looking to Cyanogen  Gulp watching files  nodejs"
2016-12-23," n a Holics  Store n a Holics  Store... innovative products that failed badly Microsofts biggest wins, fails, and WTF moments of office      The first employees Where are they now More than just a ragtag group of Cool! Amazon Exclusive Gears of War Collectors Edition  Outsider by  Enroll in the preview and let Cortana schedule your meetings  Microsoft CMO Forced Windows upgrades were pretty painful  Ellen Van Dusen Elores Color  Pattern with Interactive Book I suddenly have a lot more respect for Word. . Flashback to Episode  How to Trade Microsoft Stock   MVC and Web API .net Licensing Specialist Microsoft admits it went too far forcing Windows install .      office     Surface Pro Intel Core i GB, GB RAM. Highpower. . "
2016-12-24,"  Microsoft worker arrested for child porn after company tips police  A yearold Microsoft employee  Microsoft worker arrested for child porn after company tips police  A yearold Microsoft employee  Microsoft worker arrested for child porn after company tips police  A yearold Microsoft employee  Microsoft worker arrested for child porn after company tips police  A yearold Microsoft employee  Microsoft worker arrested for child porn after company tips police  A yearold Microsoft employee  Microsoft worker arrested for child porn after company tips police  A yearold Microsoft employee CMO admitted they went too far in pushing Windows updates... Thoughts   Surface Phone could target the enterprise segement   Surface Phone could target the enterprise segement Withings products disappear from Apple stores following Nokia patent kerfuffle .   Surface Phone could target the enterprise segement U   Surface Phone could target the enterprise segement   Surface Phone could target the enterprise segement  In wake of Nokia lawsuit, Apple promptly removes Withings products from its stores .d Apple has pulled all of Nokias Withings products from its online store .      Workarounds upon workarounds just to adjust minor settings ...typical products office     That Macy Gray commercial is on point... "
2016-12-25,"      here is Cortana Cortana and Skills Kit Devices SDK. Read more MSFT feted to be the first trillion dollar tech company office     Surface Pro Intel Core i GB, GB RAM. Highpower. .  office     office     Office and office     LINE     London Police testing body cameras connected to PCOSPC     Quick Update s Groove, Password, Infused , Groove,      Thanks to Kamalu Manango for the follow Learn More  UP    Flow available for C , , , , , ,   UP        "
2016-12-26," anoints update as current business branchhttp PCOSPC     recommendation APIs recommending to take a break from writing a recommendation engine API Quota finished. .c      UP    Como mostrar texto en columnas en   UP    A must read article!         Discover how Execs are driving the companys strategy. Read via  Corp. is Private Trust Co. NAs th Largest Position. Read more MSFT Difference  and equals Gua de Inicio Rpido de Microsoft PowerPoint  tem tudo para ser a  empresa a valer US trilho Monday CMO Says Forced Windows Issue Was Painful, M DoD Contract, New ... Read more MSFT Streaming now . introduced a certificate based authentication to Check out the latest tech deals here!  . Check out the latest tech deals here!  ."
2016-12-27,"  Microsoft accepting loyal fans into the First League program, inviting them to a  Microsoft accepting loyal fans into the First League program, inviting them to a  Microsoft accepting loyal fans into the First League program, inviting them to a  Microsoft accepting loyal fans into the First League program, inviting them to a  Microsoft accepting loyal fans into the First League program, inviting them to a  Microsoft accepting loyal fans into the First League program, inviting them to a  Microsoft accepting loyal fans into the First League program, inviting them to a  Follow for more generated tweets. . Please retweethttps If this isnt a moment, I dont know what is. ,  are remaking themselves around . Weeks best Apple deals Best prices on refurb Apple Watches and iPhones . Apple iOS Latest News iOS Update Intensifies Bad Battery Life Issue . iPhone Update rd Variant Drops Home Button iPad, iMac, MacBook Release In Too .  Ways Dynamics Helps You ReInvent CRM via Senior Revenue Accountant Amsterdam Windows build ISO leaks onto the web unveiling new features Microsoft Windows Update Latest Qualcomm Partnership Could Lead To New Generation Of Windows Windows Start Menu to Feature Folders in Redstone Perks of , you bump into inventors, authors in hallways. Nice meeting . tem tudo para ser a  empresa a valer US trilho"
2016-12-28," Heres some of the big things we can eect to see from in ! Heres some of the big things we can eect to see from in ! Heres some of the big things we can eect to see from in ! Heres some of the big things we can eect to see from in ! Check out MICROSOFT WINDOWS SECOND EDITION BUNDLE LOT GET ALL via , , , , , , , Public preview New TSQL language features are available in premium tiers of Azure SQL Database even in being a useful idiot much getting a stack trace in PowerShell tips and tricks to make you productive like a boss on Windows . Ive always been passionate about the fight against human trafficking. Well done office     office     office     Windows Game Mode Will Improve PC Gaming Eerience office     LINE     PCOSPC          UP   "
