Date,Tweets
2017-06-13," updates keep Windows protected against statesponsored attacks. Read more MSFT VSMdev From Visual Studio Live! Washington, DC PowerApps and Flow take RAD tools to another level Security Patches Company Issues Fixes For WannaCryLike Security Vulnerabilities. Read more MSFT Retweeted Kaspersky Lab  With risk of Destructive Cyber Attacks, to update again... joins the open source Foundry extends TEAL program review  is taking the next step in our support by joining the Foundation as a Gold member. Blog Due to eloitability of , released patches even for Windows , and Vista. warns Exchange Server users to avoid .NET Framework Nintendo E announcements Switch games beat Sony and with fresh news. Read more MSFT MS OSS Localization Meetup   . Microsoft is remastering the original Age of Empires in glorious K  Microsoft is remastering the original Age of Empires in glorious K   The Xbox One X is aspirational in the purest sense of the word. Read more MSFT Check out Microsoft Bundle Surface Pro Core iGBGB with Warranty until  via I can have a xbox one x good job i love it Sony tries to defend their refusal to open up crossnetwork play. Read more MSFT The new Xbox avatar designs are coming this Fall. Read more MSFT We were live w to talk about the release of the ! Check it out in the archive ICYMI! ."
2017-06-14," Releases Patches for Remaining NSA Eloits Planning Recoverable Items Fix for Exchange Server . Read more MSFT WSJ Reviews Surface Laptops Good, Bad and Filthy. Read more MSFT AI Achieves Perfect Ms. PacMan Score. Read more MSFT  verb the act of decreasing productivity oftentimes, but not limited to forcing updates wo warning. WannaCry attacks prompt Microsoft to release Windows updates for older versions New Blog  Chat Bots and Machine Learning for NonTechnical People quiere crecer con Internet de las cosas e artificial ... Xbox One X La nueva superconsola de llega el de ... ... May Owe A Billion Dollars Windows S desconcierta a los usuarios con esta inslita restriccin Windows S desconcierta a los usuarios con esta inslita restriccin Windows S desconcierta a los usuarios con esta inslita restriccin Microsoft Planning Recoverable Items Fix for Exchange Server . Windows S desconcierta a los usuarios con esta inslita restriccin Fox News Microsoft, others spearheading a smart cities initiative for everyone Xbox one x! Reading about Phil Spencer thinking resolution is more important than high frame rates is hilarious. Windows S desconcierta a los usuarios con esta inslita restriccin"
2017-06-15,"   How to sell ur car . Keep Edge from becoming default app Senior Data Scientist United States, Redmond WA Senior Systems Engineer Lexington, MA, United States year review check out this full video The Surface Laptop makes the new Surface Pro mostly a nonstarter ud Eands Surface Device Distribution. Read more MSFT E  s E Press Conference Was the Most Talked About on Social Media. Read more MSFT s beats Ms. PacMan Windows S desconcierta a los usuarios con esta inslita restriccin beats beats ok s AI beats Ms. PacMan Literally, WTF are you Doing with this . This is a Ridiculous scheme for Server Licensing and Updates. Insane. . increases market availability of lightweight Surface Laptop, Surface Pro devices  Surface Studio desktop likely meant North Korea when it patched on Tuesday over nationstate megaworm worries Office ya est disponible en la Windows Store para ... ... Finger Foods Scenographic Tool Demoed by Cirque du Soleil on Stage at Build  Traders"
2017-06-16," Always on small box on website to upload document . Call of Cthulhu! Fingerprint ID klingt ja doch irgendwie bekannt oder ansatzweise Applelastig Windows S desconcierta a los usuarios con esta inslita restriccin My Life On  I chose an Xbox One S instead of an Xbox One X, and I dont regret it. Read more MSFT Windows Server to copy Windows , get twiceyearly feature updates How to save time On watching YouTube . Google chrome hack . Microsoft Office finalmente disponible en la Tienda Windows Search box for app . Google chrome hack . Nadie resiste ms de una hora en el lugar ms silencioso del mundo sin enloquecerse  Surface Pro review Incremental improvement isnt enough  Surface Pro least repairable ever Surface Laptop is made of glue. Read more MSFT Eeriencing Data Access Issue in Azure Portal for Many Data Types    Investigating SIRI help . Windows S desconcierta a los usuarios con esta inslita restriccin During E Xbox had a press conference, here is my rant about it!  GoPro      Come check me out awesome stream!"
2017-06-17," Isso  um clssico mdss Cidade Lder Bypasses for Admin Access via Surface Pro review is now just another PC builder  Ars Technica UK  est fini dans le monde du mobile Pix can now turn your photos into art, thanks to AI . s Modern Keyboard Has Something More Than Meets The Eye A Hidden Fingerprint Se... Read more MSFT Xbox One X  E  World Premiere K Trailer va apparently wont make a profit from This product is so perfect WindowsvistaOS Announces Virtual  OpenDev on June sthttp Heute bitte das israelische CloudSecurity Startup Aorato The bowling shirt from from seems to be working great. . Nadie resiste ms de una hora en el lugar ms silencioso del mundo sin enloquecerse Nadie resiste ms de una hora en el lugar ms silencioso del mundo sin enloquecerse names as a leader in the MQ via A teardown of Microsofts new Surface laptop reveals that its almost impossible to repair s  So thats Updates in a row that has mashed up my computer Thanks Gonna have to try a roll back to older version Nadie resiste ms de una hora en el lugar ms silencioso del mundo sin enloquecerse Xbox Ones in stock!"
2017-06-18," Power BI Premium  Power BI Report Server  GA  Installing new fonts in Microsoft Word New photos of the courtesy of . CLIP Create a formal letter in MicrosoftWord Get the Intelligence Report for the top insights on the latest trends in global  Serving AI with   Recap of the Workshophttp Transitioning to Mac isnt as hard as you might think getrepost  .       Thanks to Sam Goosetree for the follow. Find out how is teaching systems to read, answer and even ask questions msft.socialKPGwZA Lets gooo! s Modern Keyboard has hidden fingerprint reader Loving these concrete blocks. . It could be real!  I wish had something for for a family, like , if you get what I mean. Million Endpoints Eed on Public Internet via FileSharing Services. Read more MSFT With Whole Foods purchase Amazon is now a Azure customer. Read more MSFT Users of Current Exchange Server Should Avoid Updating to .NET Framework . Read more MSFT Computer Network Defense Incident Response Support USA Ft. Meade MD Business Development Consultant Amsterdam"
2017-06-19," Outlook for Mac now lets you send emails later, track messages  more D Special  ! . High turnover rates in the tech industry  ELAINED The goal is to be driven, right Well, says, not so fast. There are other issues, too. se quiser me doar um Xbox  one eu ficaria muito agradecido, nunca te pedi nada I use phones with windows since , hardware has always been the best, I currently have a lumia     Microsoft         isnt user friendly or empathetic to senior citizens. I downloaded the wrong program and they wont exchange it for the right one How To Boot To Advanced Startup Settings Automatically on Windows . Read more MSFT Another day, more annoying bugs on my . Thanks but it really is time to move to a reliable product   office ,     Microsoft Surface Ethernet Adapter  Mega V An apology email to a friend for the evil that is and the rest of the destroying the Community and . The now includes Spark support and bindings. What does that mean Find out will ride Artificial Intelligence, Cloud Computing to higher share price, says Morgan Stanley. Old saying,  is the of the world. Heres further proof. If you needed any more. In the grocery store Weve got backback events w Seattle Accelerator past  present! Keep an eye right here for highlights starting moro!                   Why exactly would I Idk. Some might."
2017-06-20," Say hello to the new elevator service era Shout out to my classmate for being on the frontier of medical education!  Outstanding Innovations Coming With Giant ...  launches a new startup program at Station F in Parishttp Se algum tem que ganhar, j que  uma feira de jogos, ganha quem ofereceu mais! Mais poder, jogos, mais opes! Do you understand just how big a threat is to your  does. Well, another good move Technology Management Concepts the provider selected to Inc. List . s latest eerimental app adds voice dictation to via beginners tips for Windows users switching to Mac Surface Pro Office   Winter Solstice at defends disabling antivirus solutions incompatible with Windows beginners tips for Windows users switching to Mac There seems to be an unspoken rule for OS I try to get help from the chat, but to be able to ask a Q, guess what I have to... Log in! Look out fans! and revive an old classic! Azure GPUDL LPtech         NewsBeast Windows S desconcierta a los usuarios con esta inslita restriccin Admin  Linux tools you need for Windows"
2017-06-21," very interesting read  Inside s Artificial Intelligence Comeback.  Updated Version of the Source Code Generator! Link in bio . Heres whats new, fixed, and broken in Windows Build for PCs   This Ally Is Gearing Up to Take on and  Masjid project with D Builder app on Windows . dos  x IOCTL WmiQueryAllData WMIDataDevice Pool Memory Discl... dos  IOCTLVOLUMEGETVOLUMEDISKEXTENTS volmgr Pool Disclosure       Lots of improvements for IT Pros come to Windows   Narrator, Calculator see improvements in Windows   Windows Insider build now lets you easily talks more about its Shell eerience in Windows preview for PCs. Read more MSFT releases monster Windows Fall Creators Update Build to the Fast ring, a... Read more MSFT lanza para transcribir en  Reserve your free seat for Roadshows  learn about  Cloudhttps Posting updates to Teams from Flow Microsoft creative director on reviving Age of Empires and making PConly games  is racing to catch up to  Facebook in deep learning. Its future depends on it. via   Off Excel  From Beginner to Eert in Hours"
2017-06-22," Great day with Surface Studio and Hololens. . Sway for iOS updated with the ability to embed videos, Remix designs and more. Read more MSFT Hololens Girlpower . Accelerator Shanghai Jump Starts the Evolution of Startups, The Total Valuati... Read more MSFT Windows Fall Creators Update Build causing major problems for some Insi... Read more MSFT Time to Upgrade Surface Tools for IT Pros Updated. Read more MSFT Two Arrested For Network Intrusion. Read more MSFT Adobe CEO Touts Partnership NASDAQADBENASDAQ. Read more MSFT How to Pronounce Ectox RT Windows S desconcierta a los usuarios con esta inslita restriccin mobile app marketplace Read how collaborative events highlight our digital transformation at ... by . Sony continues insults against in wake of E defeat. Read more MSFT , , , , , , , , ,... , , , , , , ,  , , , , , , ,... , , , , , , , , ,  , , , , , , ,  , , , , , , , , ,  , , , , , , ,"
2017-06-23," dont get hate cuz busnes beiung byusness take two did nothing wrong cuz busness but glad modding getting back Why LinuxWhy Linux Mint . Kinect XBox Motion Sensor Bar Video game attachment bar with Nyko Great Bill Gates Business Quotes  Read . Because its Friday Mario in the Park TB of Windows internal builds, core source code leak online. Read more MSFT Playing Super Mario Bros. in real life with augmented reality looks awesome. Read more MSFT Microsoft briefly disables antivirus software for New to Office in June Classroom eeriences in Teams and more. Read more MSFT in hours. Lets see how long it will take Microsoft to pa  Google, LinkedIn or Yahoo connections will no long Watch this guy play Super Mario Bros. IRL in Central Park using HoloLens Internal builds and source code for Windows revealed in massive TB leak. Read more MSFT Someone has Tried to Hack Window S. Read more MSFT Forms Preview Available for Office Business Users. Read more MSFT DETIENEN A DOS JVENES QUE INTENTARON A u Microsoft Forms Preview Available for Office Business Users . LOL, so much for its   security brought down by, of course, Word macros presenta un teclado muy moderno ... Teams se abre finalmente para el sector educativo a nivel ... ..."
2017-06-24," Technology tips Cool Tech French Sales Associate Liverpool, United Kingdom Maybe should use their own software Stopped using Apple Maps Cool Tech Best iPhone S Plus Deals The best S Plus contracts in June . Gearbest Cube WP G Phablet review Musicresponse Radiohead OK Computer OKNOTOK  . Microsoft Cortana Speech Recognition Now Allows You To Dictate Text In Office Apps video . and Spin Camera app Cool Tech d Twitter followers Cool Tech Apple doesnt solicit feedback Cool Tech . , , , , , , , , ,  , , , , , ,  , , , , , , ,  , , , , , , , ,  Cool Tech  , , , , , , , ,  , , , , , , , , ,  , , , , , ,"
2017-06-25," , , , , , ,   , ma , june ,  am get to know do more Top Windows Alternatives! . Mac OS . Ubuntu .   New opening at in ! .NET The latest Microsoft EducationOnenote Daily! Learning lots on the Microsoft Store tour! is now at  , tn did you know always get off at microsoft sto Do you need any kind of Help Create Excel ... Tech  Ed Roundup June    ICONIA TAB Winoffce ,   Gears of War  Gears of War    One Item specifics Condition Brand New An item centre  , tx , june ,  am vex camp begin Proud Together . How I tried to get Microsoft to turn me away from MacBooks  CNET The latest The Florida Pirate Party Daily! to public ."
2017-06-26," The latest Best Stories On Twitter This Week! wants OneNote to be the goto classroom app. Read more MSFT Nadie resiste ms de una hora en el lugar ms silencioso del mundo sin enloquecerse Nadie resiste ms de una hora en el lugar ms silencioso del mundo sin enloquecerse Nadie resiste ms de una hora en el lugar ms silencioso del mundo sin enloquecerse Server Is Here Today. Gone Pretty Soon contraataca a y aumenta los dispositivos compatibles con en va  My Eerience at Cloud  Datacenter Conference Germany One of the best articles I have read in quite a while. Brilliant analysis..... PHOTOS The Microsoft Graduation Ceremony Windows S desconcierta a los usuarios con esta inslita restriccin  has hidden the color mixer D Microsofts on the promises less than ms stream delay. This is a great platform for creators. . El Comecocos, videojuego daino para la juventud turca announces ASD formally certified an eanded range of and services on the CSSL Nadie resiste ms de una hora en el lugar ms silencioso del mundo sin enloquecerse Google, among companies urging court to back gay workers. Read more MSFT  Malware Protection Engine    RCE  How Carlsberg Group hops to it with Azure to learn more about its beer customers"
2017-06-27," bringing back as a builtin part of Amazon is selling Nokia and Moto E with lockscreen ads . Moto E, Nokia  Others Join Amazon Prime Exclusives . Windows Fall Creators Update Gets Smarter About Enterprise Threat Protection Patch your Skype and update your end points   Office   Office  Si en el infierno hubiera Internet ilimitado, muchos ni siquiera se daran cuenta de que ya han muerto. Te enteraste quin se hizo marica No, che, quin es Si me das un besito te lo digo... Microsoft Office Home and Business .U Microsoft Project   Fantastic four , , and form a counterterror club .D Hey, SF! Were hosting a meetup tomorrow night HQ to talk running microservices on Azure w. Join here to release securityfocused Win update. Read more MSFT says its took a s d Got pizza RSVP to tonights Brisbane O and EMS User Group here  Inside s Surface Laptop and Surface Pro How to get regular free security updates for Windows and Vista. Read more MSFT , please stop doing things for our own good via Adds Enablement Services for SCOMPowerBISQLServer"
2017-06-28," Speed of dotnet run vs speed of dotnet for published apps plus selfcontained .NET Core apps , y anunciaron la creacin del Foro Global de contra el ...and now I want chocolate cake. Great metaphor . Would use Gsuite or O for k  what say you and why suite Are you taking full advantage of your benefits Find out more about the Monthly Credit. Outlook Woes for June, Take . Read more MSFT  Choosing Windows for your organization should get you fired. Read more MSFT to Jaylan  , in  He only started weeks ago!!! Security Essentials Gvenlimi  Arkadalar son gnde esoftwareedrive klasrnn iinde ...  Microsoft will tap your Windows PC to build its new antivirus to Edgardo, , in at . Dennis! , . WEBINAR How will change deployment operations Join us! . Nuestra comunidad bien atenta en nuestra charla Mobile apps with Firebase aqu en Dominicana. . BrandPost NVM Eress Has Transformed Fast Storage in the Cloud  and its Comi... Read more MSFT Update on Petya malware attacks  Is Xbox One X parity a real problem GamesBeat Decides  The latest The Rod Trent Daily! Thanks to Windows Spotted Aboard the U.K.s Newest War Ship"
2017-06-29," UCLA professor believes shes the inspiration behind Cortana .d New Nokia Feature Phones Appear On TENAA As TA, TA . They Built the First Phone You Loved. Where in the World Is Nokia Now . Princess Nokia Shares Swaggy Video for New Song G.O.A.T.  Watch . GST sale cool gadgets you can buy at discount . Super blog on how fits into the emerging space. Great integrated solutions to be built on    plans a friendly future for its server platforms via  NewsTechnology s acquisition of Cloudyn will help Azure customers manage and optimize their cloud usa Full House! Call of Duty Ghosts llega al sistema de retrocompatibilidad de Xbox One .d Buying Cloud Optimization Startup Cloudyn. Read more MSFT Latest Attack is a Brutal Reminder of Importance. This is why Services Account Executive Montreal, QC, Canada reasons to choose for your ! cd joins the Foundry Foundation Olha o espertalho! Esse no rasteja mais. Claudio, Ruani. to deploy AI in newest update The best games under  confirms plans to acquire Cloudyn. Read more MSFT ISVs find their cloud footing on Azure"
2017-06-30," How to Create a Retention Policy and Apply it to User Mailboxes in Exchange Online. Read more MSFT MicrosoftLed Investigation Results in Arrest of Four Tech Support Scammers . NewsTechnology made its AI work on a  Raspberry Pi The latest Initech Daily! IT System error with Commonwealth bank. Microsofts Dictate uses Cortanas speech recognition to enable dictation in Office UCLA professor believes shes the inspiration behind Cortana . How to Get Cortana to Shut Down Your PC in Windows .d Nokia Appoints Eamsung North America CEO As Its New Head Of Technologies Division . iPad turns on but camera doesnt show my face Windows S desconcierta a los usuarios con esta inslita restriccin Thank you Brian Jones for the tour! . Its amazing how far and wide this message of empowerment has spread  today we screen in Liberia thanks to ! . NewsTechnology made its AI work on a  Raspberry Pi Im still so proud of and all the good its doing in the world. Thank you  ! Windows S desconcierta a los usuarios con esta inslita restriccin Core Anatomy Part   Invoking the MVC Middleware Microsoft is bringing Cortana to fridges, toasters, and thermostats   Best New and Rising Games for Windows . Read more MSFT is set to reorg its organization around strategy..."
2017-07-01," NewsTechnology made its AI work on a  Raspberry Pi Top from eerts Microsoft Partner on Twitter  CEO,  , see more Top from eerts Microsoft Partner on Twitter  CEO,  , see more I want to know more about sexy adverts   office ,     Fast fluid performance with standalone security features .NET for the solution. Aparecen fotos reales de la que cancel el Simple, Realtime  Smart Cloud solutions for MSFT Partners coming . First we had the Unlimited Storage fiasco now they stopped supporting their own REFS filesystem. WTF is wrong with you  Microsoft Surface Ergonomic Keyboard .d Learn to grow your business a , , y forman grupo para combatir terrorismo Microsoft Xbox Wireless Receiver for . NewsTechnology made its AI work on a  Raspberry Pi Thanks for renewing my MVP award today, for the th year! Apple cuts prices of iPhone, iPad,  Mac in India as part of tax reform rollout . Move Away Apple. OnePlus Becomes the First Andriod Phone To Beat iPhone In Speed Test . Apple cuts prices of iPhone, iPad, Mac and Watch take a look Cortana Intelligence solution evaluation tool How to Get Cortana to Shut Down Your PC in Windows ."
2017-07-02," Apple slashes prices of iPhone, iPad and Mac in India . NewsTechnology is laying off thousands of staff in a major global reorganization  NewsTechnology , Trump administration clash over email searches Deal Get free rubberized grips when you buy any Xbox Design Lab controller  NewsTechnology made its AI work on a  Raspberry Pi Chrome Dominates Browser Market Share While Edge Sputters Even With Windows At ... Read more MSFT General Counsel Brad Smith offers help to Mozilla employee denied entry to US. Read more MSFT Steve Ballmer famously slammed the iPhone  here are other times bosses got i... Read more MSFT I dont know about fun, but Ive accomplished a lot! Including working on a laptop for family. Apply now to work for as .NET in !   MS    consolidates its mobile management tools under Azure. Read more MSFT Cisco Systems, Lead DJIA Lower on Thursday. Read more MSFT Systems Integrators Bridging Industrial OTIT Gap Are Changing The Game, As Und... Read more MSFT This was how decided to give for has some pretty awesome new features, and ! by . NewsTechnology , Trump administration clash over email searches Corporation and Box have struck a deal. Read more MSFT Like swimming in a pool of sharks  less than one in , Met Police PCs runn... Read more MSFT First impressions of the NuVision inch Windows tablet. Read more MSFT"
2017-07-03," Las vegas casino in budapest  Nokia lumia geant casino . Nokia Ramps Up VR Plan Nokia . Microsoft wont deliver Timeline as part of Windows Fall Creators Update .u Microsoft Confirms Windows Timeline Feature Wont Be Ready For Fall Creators Update . How to use Alexa .  Et maintenant la raction de aprs la bourde de Sony sur trucage du trailer . Microsoft Surface Ergonomic Keyboard . Uh...what the hell Is Mr. Robot becoming a reality  all now at .share. Hacked . s Calls The And Has About  Microsoft Xbox Wireless Receiver for . has hidden the color mixer u The Windows Timeline feature will not come with Fall Creators Update. Read more MSFT Original Microsoft Xbox E Power Suppl . plans layoffs in sales force shakeup reports. Read more MSFT ARMS, lucha cuerpo a cuerpo a distancia Honor  preparado para combatir y su razn es el precio is far behind in the classroom, according to new study Microsoft Azure OpenDevJune "
2017-07-04," Why are Microsofts chatbots all assholes , , , , , , , , ,... , , , , , ,  , , , , , , ,... , , , , , , , , ,  , , , , , , , ,  , , , , , , , , , , , , , , ,  Why are s chatbots all assholes. Read more MSFT Does Tech Still Have More Room To Fall AMZN AAPL GOOG GOOGL MSFT FB BABA s Arrow Launcher gets updated with new features for beta users. Read more MSFT Taller en  TICAL in San Jos Issues OutofBand Updatehttps Legal Assistant Amsterdam MicrosoftD! MakerBot       Nadie resiste ms de una hora en el lugar ms silencioso del mundo sin enloquecerse Exam Finder Helps Search Exams by Technologyhttp Samsung Also Planning To Release Smart Speaker .c Amazons Alexa passes , voice skills, more than doubling since beginning of the year . Alexa is learning more new skills every day ."
2017-07-05," This could be useful! just launched a new keyboard with a builtin fingerprint reader . Windows  Everything you need to know . Amazon Echo vs. Google Home vs. Microsoft Cortana Which one is smartest . Samsung Reportedly Developing BixbyPowered Vega Smart Speaker Latest Nokia Leak Hints At BezelLess Design, Iris Scanner . First Focus Prompts More Sales Reorganization at First Focus Prompts More Sales Reorganization at Get the handson eerience you need with free product trials  tools. Try Cloud Essentials and I repping at !! Bryan passed the latest Exam!! Great job on being a eert Bryan!! We love our Team! !! Bryan passed the latest Exam!! Great job on being a eert Bryan!! We love our Team! !! partners with Baidu for the Android of autonomous cars. Read more MSFT Indie Title Cuphead Confirmed To Be Xbox One Exclusive Today in Startup Spotlight vets launch text, a messaging platform connecting with customers Episode  Functions Local Debugging and More with Donna Malayeri  Cover Showhttp Want to find out more about Data Science Register now for a with Data Scientist, Jin Yu"
2017-07-06," reasons to get excited about  Get Inspired in Your with This Chat Taking steps to notify some employees that their positions will be eliminated. Says , , , , , , s chatbot breaks loose from its chains Quran is very violent has hidden the color mixer d The best enterprise tips and tricks for Windows Alexa now has more than , skills under her artificially intelligent belt . How IBM Watson is using AI technology in the health field . Microsoft Delays Major Windows Fall Creators Update Feature How to Use Windows Dynamic Lock to Automatically Lock Your PC Fake Flash Player Updates for Windows and Other Browsers Still Abound New Nokia smartphones to again feature Zeiss optics . upgrades , jobs to the cloud . NewsTechnology laying off thousands of workers in shakeup confirms thousands of layoffs in cloudfocused sales reorganization. Read more MSFT releases a minor update with Build  for Insider Fast Ring, tests serv... Read more MSFT No real surprise.  is reportedly about to lay off thousands of staff begins latest round of amid reorganizationhttp"
