Date,Tweets
2015-12-01," Im a few points away from a free gift card via . Visithttp to sign up  we both get gift card waited all evening for my prime order. Its still arriving today apparently but cant imagine how. Ron Boyce is one of to have played with at Order the book from Spirit Mound in American History is an best seller in . seller Compra en y envia a con  get free , , and other gift cards with . Use my link for a bonus Mega Deal LEGO Star Wars  Millennium Falcon from LEGO customer reviews RRP . Strict Leather Premium Red and Black Leather Bondage Whip  Russia plans sanctions against Turkey noto solo ora che sono a tweet. Domani mi manda un pacco regalo Im a few points away from a free gift card via . Visit to sign up  we both get gift card McDavid Waist Trimmer  Amazon  Amazon!!  Happy December ALL! . get free , , and other gift cards with . Use my link for a bonus Order your copy of They Played with Bobby Moore  The West Ham years , ebay yearold girl battling breast cancer Availabe now Broken Love Is A Drug Ink  Its Tuesday and heres Best In Store! In Stock, Fast Shipping. No  surprises! Oh you know, just reading some marriage article... yet again, just seems to get me."
2015-12-02," Astronaut Boots . Launch party. Congrats to for the launch. FREE ch Risqu Frances fashion rebels  Announces TopSelling Anime Disc and of  Another , this time issued to Bestseller HAVE NO SHAME is not just a book an eerience.  Instant Pot IPDUO in Programmable Pressure Cooker, QtW, Stainless Steel Cooking Pot  Instant Pot IPDUO in Programmable Pressure Cooker, QtW, Stainless Steel Cooking Pot Michael Kintzs book is an bestseller in . DEC th My is your ... The Top Things All Should Know About via  Instant Pot IPDUO in Programmable Pressure Cooker, QtW, Stainless Steel Cooking Pot SUPCASE Amazon Fire Phone Case  Unicorn .C Hacking it   Enter to an ... Hacking it   Want to win an ... Rocks Off Naughtyboy Double P Spot Silicone Massager, Black  I Love Paleo Shirt  The Internet Of Things Dominates Recent Mergers  Acquisi  RT and follow us to enter our to win a  voucher! UK only         "
2015-12-03,"                       SB              ofertasamazon Conjunto deportivo Calvin Klein para bebs de meses en Qu precio! will be available on amp Dec. Huion  x  Graphic Drawing Tablet .  off Sencillo Tutorial de como Comprar una Gift Card Amazon, Aqui  HEX JaJa Pressure Sensitive Stylus .  off Invicta Mens k Rose Gold IonPlated Watch .  off Diamondback Bicycles Sorrento Hard Tail Complete Mountain Bike .  off My newest is on The Chick Who Could Not Kick   Kurofune                        ay                  AMANOGAWA                     G       Jovivi Mak               "
2015-12-04," Floors Washed  Find the Best Deals Fate can blindside you in an instant. Set Looney Toons Marvin The Martian Playing Cards And Headlines Tee  X  VIDEO How has IS raised so much money by is !   Nathan no pensaba dormir ni un segundo esa noche yMartinis SelfLimiting Behaviors Successful Entrepreneurs Never   Panasonic  FFP LRRJAS     Panasonic  FFPLRRJAS     Anker PowerPort W USB   iPhone iPad     C Aterm MRLN B LTE  OCN  ONE     Anker PowerCore mAh     Quick     OCN  ONE LTESIM ,      eria Z SONY         Amazon Apple Made for iPhone iPhonecsPLUSiPad AiriPad      microSDHC GB EXCERIA MBs UHSI Class TOSHIBA     Enter to a  from Police disbelief at no cuts decision     KCQ BO"
2015-12-05," No, The Siberian Ice Maiden Is Not A Man .c Firms charged in US over Bitcoin scam ghd Pink V Vintage Styler hint hint Ive been a god girl This Country Picking Fight With A Russian Billionaire Who Use my referral link to get a  coupon at Amazon for signing into the Amazon App the first time BMR Bluetooth Visor Handsfree Speakerphone Car kit for iPhone, Samsung, HTC and all other Cel... Playskool Heroes Transformers Rescue Bots Energize Chase the PoliceBot Figure  Opinion Russian pilot deserves honor Canadian Miss World barred from China  by on   gift card! Preorder new Single NO CUFFIN  ..  NBAs oneseason wonders    this BLACK FRIDAY ONLY ! Free Cable, PPV, with Fire TV STICK  Mindy    this BLACK FRIDAY ONLY ! Free Cable, PPV, with Fire TV STICK  Mindy Caveman Foods Caveman Bar, Wild Blueberry Nut, ea    Nerf NStrike Elite Mega CycloneShock Blaster STAR WARS Battlefront  PlayStation Standard Edition by Electronic Arts  Sale..."
2015-12-06," Las tres TOP LINK USAhttp LINK ESPhttp            DX     JRA ! rd Edition         mmm     !      DVD      !       de      Panasonic   NISA   DVD  in      M                   RFAAAA   DVD    Bluray     BANK    DVD     Bluray     eightcolor              PROMISE KEEPER Novel , Jesus raises dead, Adults  Childs, , ."
2015-12-07," Would anyone like to gift me this for Christmas My How to Get Over Your Ex on Check out  by on  My Girl w  L. Hill Cameron warns of long Syria campaign Looking for an ineensive and tasty stocking stuffer Check out this Ice Breakers Cool Blasts bundle on !  Samsung MZEB SSD EVO, GB,  SATA III, NeroGrigio  Paris suspect may have escaped to Syria My Girl w  L. Hill RACCONTAMI DI TE, una storia damore intensa e struggente Day Free Trial  Enjoy over million songs! Music        Community that stood up to coal Black Prostate Massager Male Sex Toy  Adult Mens Product  Day...  Episode. is coming soon! BECAUSE IM A MAID! Episode  A SCRAMBLE FOR KAREN! BROTHER LOVE KNOWS NO B... Surprise sale tomorrow on ! Stay tuned... it only lasts a few hours! These are perfect for home  mini kinesthetic  off at Telefono BLU Vivo Air  Desbloqueado  Blanco Dorado  Todays include SIGNED , and Ebooks. Gift card in time for ... Get free and other gift cards with . Use my link for a huge bonus"
2015-12-08," get free , , and other gift cards with . Use my link for a bonus Doctor jailed for mass HIV outbreak  , and more! Attic Amazon Sexflesh Venereal Vinnie Suction Cup Diseased Dildo  On Sale Now Mount Factory Articulating Tilting Television Wall Mount For    TVs  .  ,... GalaxyBoard,Self Balancing Hoverboard Wheel Scooter. Year Manufacturers Warranty....  ApollosCreed Another Books To Believe In book is an Bestseller  On Board   Use my referral link to get a  coupon at Amazon for signing into the Amazon App the first time Product Review and My Terrible Technology Skills! If you have one, please comment! Amazon Echo Theres still time for Shopping, especially w this ! Ends  get free , , and other gift cards with . Use my link for a bonus Amazon   Amazon!!  this boxed set for only ! Alphas  Millionaires by is live on ! Seasonal a  from  Sign up here! , , . Este mes estaremos premiando clientes fieles con tables . sguenos en nuestras redes para saber si eres feliz . Greece warned of Schengen suspension Availabe now Broken Love Is A Drug Ink  Vintage Navajo Rugs  How To Be Generous With Your Adult Children Without Causi"
2015-12-09," Go Pro  Steps to Becoming a Network Marketing Professional Eric Worre Author  ... Charm Bracelet Studio Klutz Contributor , Sales Rank in Books was ,... Get free , , and other gift cards with . Use my link for a huge bonus Get free , , and other gift cards with . Use my link for a huge bonus get free , , and other gift cards with . Use my link for a bonus Green Companies Offering Discounts For Black Friday, C The perfect gift .. A Credit Card Tool buy in .. The Black Friday Click Here! Theres still time for Shopping, especially w this ! Ends  Wiiiiiiiilsoooooon!!!!! Hockey Wednesday Rivalry Night Como comprar una Gift Card Amazon....!! Consultalo aqui VIDEO What happens if climate summit fails has this under the search terms toys teen boys...the amazing power of algorithms!  gift card! Killing Is Easy by authors US Como comprar una Gift Card Amazon....!! Consultalo aqui Orion Rugs  Theres still time for Shopping, especially w this ! Ends  VIDEO Building Kenyas giant new mall s on . Dont let the Evil in "
2015-12-10," How To Keep Sales High When The Holidays Over  RT and follow us to enter our to win a  voucher! UK only stfc Enter To Win of  Amazon Gift Cards Apple Updates tvOS For Apple TV And watchOS for Apple Wat Use my referral link to get a  coupon at Amazon for signing into the Amazon App the first time Fifa vicepresidents suspended Clearance Sale Function Egg Vibrator, Clitoral Stimulator Waterproof...   IMax B V  LCD FHD p Wide Angle Dashboard Camera Recorder Car Dash Cam with...  Amazon  Amazon!!  U.S. military Combat positions for women The easiest way to make money with  York  Sarkozy, rhubarb and Frances National Front In WILD RASPBERRIES, Callies logo was artfully included on the novels cover. Come and try to a  Gift Card from !  HP S  Altavoz porttil . mm, W, USB, blanco HP S  Altavoz porttil .... rica Hiram, el fenicio de  Get Sergio Michel s on  !   Sockwell Womens Circulator Compression Socks  Enter To Win of  Amazon Gift Cards"
