date,snippet,price change,tweets
2017-05-16,"Heres what you need to know at the end of the day Celebrate the revival with sweet ish dresses, saddle shoes, Americana jeans and a tee taken from the boys Ryan Sean Davy, a South African filmmaker, faces a , fine for climbing part of the worlds tallest mountain without purchasing a permit Try a creamy pasta, scallion meatballs, or a pavlova Or, skip the recipe for a party board, using some cured meat and whatever cheese is in the fridge As with many of Mr Putins maneuvers, his offer to release a record of a recent White House meeting involving top Russian diplomats seemed designed to unnerve and confuse Photos and videos showed people kicking and punching demonstrators outside the ambassadors residence as the police tried to intervene Wednesday Understanding those big green letters, basking in the hot weather, and preparing your summer todo list The network promoted reboots of Roseanne and American Idol, as well as a musical based on The Little Mermaid, during its presentation to advertisers Without greater federal funding of cuttingedge technologies, corporations such as Google will be the ones that own the future",neg,strategies to avoid jail looking to use for connect has collected the best of t engineer at this is to promote your business using provides new tools to help make better use of platforms via ms a el link en canal para con nearly dutch woman arrested to fulfill bucket list check out notes on how to launch a campaign on and the usually preach free speech yet staff is censoring critical by deactivating their accounts on our on u as for various other content ill present and all of it posted on aka the big via para levy no es entrepreneurs club thanks for following connect with me also on my pro wrestling content will be featured on the big of today on growth hacking for come visit us on the new ads manager for excel supercharges campaign reporting give us a like on at if you enjoy our tutorials
2017-05-17,"Do not close your ears to opposing points of view Otherwise you cannot learn A yearold boy from Texas took less than a second to answer the word problem in the Raytheon Mathcounts National Competition Maria Sharapova, back from a month dopingrelated ban, has secured direct entry into the Wimbledon qualifying draw, but still needs a wildcard entry to Paris, the coming Grand Slam event Julia Moskin has delivered a wonderful new How to Make Salad guide Why not follow it tonight, or in the coming days More notable chefs and restaurateurs than ever are heading to the area, among them Galen Zamarra of Mas Farmhouse in Manhattan, Frank DeCarlo of Peasant, and Philippe Delgrange of Le Bilboquet Data protection watchdogs in France and the Netherlands ruled that the social network had collected too much information on users in those countries The government was demanding the removal of dozens of pages that it said had illegally insulted the monarchy a few weeks after the video was widely shared online The major networks are unveiling their offerings for the coming television season to advertising buyers Our reporters discuss what they saw on the second day A Greenwich Village sibling of the Brooklyn restaurant Pig Beach impresses with seafood, sandwiches and, running through it all, smoke The streaming giant Netflix doesnt see theaters as essential, but in France even TV channels have a vested interest in theatrical releases Its uniquely French Elected Republicans wont stand up to Trumps abuse of power, like his asking James Comey to halt the FlynnRussia inquiry So now you have a choice Heres what you need to know to start your day President Vladimir V Putin has called repeatedly for unity in fighting terrorism President Trump seemed to take up that call, at least momentarily, on Tuesday Times readers shared thousands of comments about President Trump revealing highly classified information to Russia In this weeks newsletter, we take a trip through the New York Times archives and invite subscribers to an event with beer and literary discussion Researchers think they may have found a clue for why the critically endangered apes nurse longer than any other mammal environmental fluctuations in food",neg,ya en y ms maker trust in the lord with all your heart cars link no las a las pm con en no las the talented trio of are back with a new page for fans to follow give us a like on at if you enjoy our tutorials can help your seriously heres how by book your life book convert my authorities have backed down on their threat to shutdown after it missed deadline to remove posts pros and cons of instant articles for publishers follow me on son ideas mas o archive you can now on and others using buffer college student goes missing after boyfriend about early
2017-05-18,"Watercress has a bright, peppery bite, and many excellent uses Take a break from political news with stories about fake beauty marks, Americans lawn obsession and hardshell tacos Both the Facebook executive and the acclaimed poet lost their husbands at an early age Their books offer others a path forward after tragedies Our Top  Comments of the Week Readers debate the physical and emotional repercussions of birth, the firing of James B Comey and open marriage Often maligned for selfies and flame wars, the internet is playing an important role in tracking down lost pets But they still need collars Uber and Waymo are headed to court Britains health service is hit with a ransom attack, and Snaps first earnings report is a disappointment I am obsessed with a video game console I dont own A handy list of updated Oval Office standards Linda Yaccarino, the head of advertising sales for NBCUniversal, has reoriented herself to take on even online behemoths Ad buyers will spend billions, as they did last year, to be a part of the TV season, knowing that, ratings aside, television still reaches more people than digital ads A rare cancer of the immune system, linked to implants, has had devastating effects on women, many of whom had reconstructive surgery after breast cancer The surreally wholesome dessert enthralled Dale Cooper and devotees of the cult TV series Now, as the show returns, we go looking for the recipe The new investors represent the latest show of support for a company that lets users make free wagers on major games in real time The elegant, lyrical work from The Black Photographers Annual, a fourvolume anthology published between  and  that showcased black photographers, is now exhibited at the Virginia Museum of Fine Arts",pos,mind tricks that help increase ads conversion via en hows this for a genuine its true has been my old to stream baseball games read more fined m by over data calls mount for to how it collects data on insecure young people the numbers behind s growing influence on our lives in the past five years as for various other content ill present and all of it posted on aka the big es my pro wrestling content will be featured on the big of today on is not becoming another as i said about years twitter now is another with char limits if you are on you can find me there too just search lives and other come hang out come see my group come see my group discover ad testing tips you never thought of that will drive results this is becoming ridiculous for the
2017-05-19,"Joe Marchese fills a role that had been vacant since September and will oversee advertising for the Fox Television Group, Fox Sports and FX The products and services of Amazon, Apple, Facebook, Google and Microsoft have become essential and inescapable Which ones would you ditch if you had to NCTA, the Internet and Television Association, calls for light touch regulation, not public utility regulation Readers explain why they would or would not administer an opioid antidote to an overdosing stranger Chances are she already has the stuff she needs On this holiday, give a gift that says you get her The parent of the messaging app Snapchat reported earnings that missed Wall Street expectations in almost every regard Five Tony nominees performed songs from their shows as part of our Tonys In Performance concert In , a quiet high school kid managed to get himself and his camera into the Monterey Pop Festival in California, where he witnessed Jimi Hendrix setting his guitar ablaze Larissa Waters said she was shocked by the attention she got after feeding her infant in the Senate, adding that the response showed a need for more female lawmakers New York Times readers responded to President Trumps firing of FBI director James B Comey After the parent company of the messaging app Snapchat announced its first earnings as a public company, and the results were dismal, investors dumped the stock Also, getting clothes back from an ex sleeping arrangements on vacation for a granddaughters boyfriend overtipping a manicurist The social media company is burning cash, new users arent showing up fast enough and Facebook is treating Snapchat like its own research and development lab Galas were held for the Metropolitan Opera, the Alzheimers Drug Discovery Foundation, the Society of Memorial Sloan Kettering and the International Center for Missing and Exploited Children Photos taken by a French astronaut sparked a discussion about their beauty  and also raised questions about energy use Sugar snap peas and crab get introduced in this fast and vernal weeknight dinner Snaps turbulent first few months as a public company are sending a cautionary signal to startup founders thinking of taking their companies public Photos by The New York Times and by photographers from around the world Readers respond An Ecuadorean prepchef explains how hes become one of the fastest marathon runners in New York City Readers respond to the idea that writers workshops can be isolating environments and more Sheryl Sandberg, the chief operating officer of Facebook, spoke to Virginia Techs class of  at commencement ceremonies on Friday",neg,fr strafe via the latest social media web thank you to the for featuring tribute to us on their page video in la las cola targets users based on they share on marketer cola targets users based on they share on marketer shares dip after report that is doubling down on wants to help me my friends in regency will stream games for free this season via take your marketing to the next level at marketing next week at here are tips for shooting on needs a setting that says a brand new shopping is here bring buying to social media knowing when to respond to negative reviews is the battle heres the other via ads strategy how marketers can win with link photos
2017-05-20,"The general counsel of the Internet Association takes issue with a Sunday Review article Organizers of a rally to be held on the th anniversary of the citys handover to China say they have been denied permission to use a park that is the rallys usual starting point Andrew Bolton, the curator for the Costume Institute at the Metropolitan Museum of Art Adrian Joffe, Ms Kawakubos husband and Vanessa Friedman, fashion director for The New York Times discuss the Met exhibition On the southern edge of Singapores Chinatown, Keong Saik Road has transformed from a famous redlight district to one of the citys trendiest places The Big Five tech companies increasingly dominate our lives Could you ditch them Amazon, Apple, Microsoft, Facebook and Google dominate our daytoday activities Imagining being forced to give up some of them could lead to hard choices",neg,archive and wife plans to start check this out on new song how to increase traffic with case study learn more everything you need to know to run a successful contest archive helps west attract clients i wonder what employees do to waste time at work check out massive web traffic made easy free shipping resale rights attack victims remembered as investigation continues me as a friend on for all details on my find out how popular your is in twitter and la en el next time you are on please like beyond an en con y approximately a day commit would at least of my en the is right to take on but mere fines protect us from tech giants the guardian this stupid shared by not able to get he is his big lifestyle the hes sold the us highest bidder paid trolls start using fake accounts will launch accounts to confuse be careful the is right to take on but mere fines protect us from tech giants the guardian
2017-05-21,"After a slow start, some publishers are gaining traction on Snapchats mediarelated section Discover and making money off it Tech firms are in a race to dominate consumers digital lives, and their services increasingly overlap each other The convergence helps customers The yearold daughter of President Trump and Marla Maples, his second wife, will follow in the steps of two of her siblings It used to signal a quiet, anonymous life Now privacy is a premium that may be out of reach for ordinary citizens Hiroshi Sugimoto is continuing his surreal Theater series, a meditation on the nature of time that captures the splendor of cinema and the majestic opulence of Italian opera houses Does your online persona prevent you from expressing yourself in a real way, and if so, are you interested in changing it",neg,everything has admitted about its measurement errors via and the major threats to sector tons of examples of heres just a few video amp what kind of content should you be posting on a how to grow your page ads yes all you need to know live click here been making it up all along and were left holding the bag how does she make upwards of per week on click here to learn how for free be a follower make decisions for yourself and forget to follow me on and if on be sure to keep up with here are the rules that guide on sex terrorism and violence read more has become a for and theres more to see on when you like my page audience size quality of the product for specific audiences is why you need to take seriously for in the latest digital marketing update on disturbing content if it keeps people safe and raises awareness post it nous plus stress
2017-05-22,"The couple met at Tuskegee, the university in Alabama, but lost contact and reconnected over Facebook Some publishers are minting profits off Snapchats nascent media venture And thats helping Snap challenge its much larger rival Over the weekend, Mr Buffett urged fellow executives to start worrying about rising health care costs and how they put American businesses at a disadvantage As online marketing continues to starve newspapers of revenue, Philadelphias newspapers test one way to stay viable and still do good journalism The law, which seeks to prevent the local authorities from limiting cooperation with federal immigration officials, was opposed by some city police chiefs The social network has taken out ads in British newspapers to warn against misinformation, though campaigners say it could do much more Millie Bobby Brown, the yearold star of Stranger Things, won the genderneutral acting award for a television series The artist produced a threestory mural in Dover, England, over the weekend that showed a workman chipping away at a star on the European Union flag",pos,in spears thanks for following us like us on retro business card copyright retro business card copyright thanks for following connect with me also on what you should know about as readies the feature s t production team is coming together and casting video submission deadline is in days forget to follow us on and modern copyright dump founder calls for creation of new world order global superstructure to control us is important sign the petition to tell to bring back the purple flower no surprises that s is popular on panel is now ads are el a leaked guidelines highlight s challenges policing in are likes bringing you business u updates and tests spotted this week via id rather call him the ultimate scumbag archive discover your best for and with
2017-05-23,"Also, shut out by a sister, drumming up dates, and going through the motions with a congregation A look at the SpringSummer bridal collections from some of the top wedding designers The Republican proposal to limit coverage for those with preexisting conditions has become the most emotional element of the health care debate The artist and inkmaker Jason Logan illustrated your emotions using inks he foraged from around New York City Chimamanda Ngozi Adichie talks about demystifying feminism in her new book, Dear Ijeawele, or A Feminist Manifesto in Fifteen Suggestions Our new cochief theater critic, Jesse Green, offers his take on Ms Wiests work in this Beckett revival Follow him on Twitter JesseKGreen and Facebook jessegreencritic The last adults standing may be succumbing to the lures of technologyassisted infantilization Photos by The New York Times and by photographers from around the world Apple continues to mint money at an almost inconceivable pace But it hasnt come out with a technological game changer in years Investors, take heed Mike and Farhad chat about Facebook, Angies List and, what else, Uber As a White House official, Ms Trump may send the wrong signal by plugging Women Who Work on Instagram and Twitter, but violates no laws, ethics experts said Raw Google search data proves that we are not who we say we are on social media She is a lifestyle blogger and he is a reporter for Newsday",neg,watch mark tour his old dorm read more live live with live chat with friends via w a la pleas like my page on y y a our business page is not connecting and all we have is this attached come up anyone else d r lo ms las archive s dislike could just be how to develop buyer for ads via the latest digital marketing update listen to my song a soul on visit my page users check times a day study says secret guidance on graphic content leaked profile button disappear join my campaign and for more updates on my gives brands celebrities more engagement than via
2017-05-24,"Financial results will arrive for big tech companies, and Microsoft plans to make a big splash around its Windows software with an event on Tuesday The game agreement makes the basketball league the first womens professional sports group to sign a rights deal with the social media service Descriptions of black people fatally shot by police officers, even complimentary ones, often raise debate over how AfricanAmericans are perceived Heres what you need to know at the end of the day The new FCC chairmans plan to slacken net neutrality rules is a boon to tech giants and a bane to competitors and innovators We want to explore which commercials push our readers buttons, and then ask the people who created the ads just what they had in mind Mark Zuckerberg, the companys chief executive, said he would hire , more people to monitor posts and live video as the site nears  billion users Most free online services will probably cost you some personal information, but a few simple tips can help stem the tide  Dismantling net neutrality would help cement the power of internet behemoths like Apple, Amazon and Facebook and Microsoft, according to one analysis The cofounders of the challenge take issue with its characterization in a news article Senior administration officials erroneously claim that they are proposing a middleclass tax cut that will be paid for by economic growth Our new cochief theater critic, Jesse Green, makes his reviewing debut with this Sondheim musical Follow him on Twitter JesseKGreen and Facebook jessegreencritic Three teenage photographers from different backgrounds learn the power of visual documentation When I get it right, said one of them, I kind of feel like Im on top of the world",pos,a la en y n the best advertising features right now reportedly lining up content for shows read more est para d who better to share insights than itself we like the part where they say play more its on the page updates trending topics to highlight more sources come see my group come see my group how does she make upwards of per week on click here to learn how for free messenger debuts a new look focused on improving navigation u if on be sure to keep up with and lobbyists try to stop new protections as one might ways your page can help your business generation protesting against or enjoying day out with friends not sure the law for own profit and that human breaks the law for own profit s personal tool exits beta now supports additional categories read more have you heard about what live is offering check it out
2017-05-25,"Facebook said it had erroneously blocked the account of Guo Wengui, who has accused the relatives of Chinese government officials of corruption Farhad and Mike discuss Facebooks developer conference, plus a startup that sells juice After broadcasting himself dangling the girl by the neck from a building on the resort island of Phuket, the man killed himself, the police said Mark Zuckerberg now acknowledges the dangerous side of the social revolution he helped start But is the most powerful tool for connection in human history capable of adapting to the world it created Critics say the social media giant has played a big role in the polarization of information But getting to the truth wont be so simple Instagram, now with  million users, resembles Facebook in  to , when it went from being something people used occasionally to something they use every day The company posted its first decline in revenue since its initial public offering in , but its results still beat investors low expectations At Crotona Park, a stylish new clubhouse is about more than topspin Its the home of a tennis and tutoring program for underserved children Photos by The New York Times and by photographers from around the world For this weeks issue, a companys struggles Also, insensitivity about a disability and learning to live with being out of the loop Privacy experts said the specific answers posted in response to the meme could be used by marketers to target ads or by hackers to breach secure accounts The New York Times is expanding its coverage of Australia and the region and were inviting subscribers to help us shape the project with questions and discussion The transportation hub serving about , daily passengers desperately needs an overhaul So far, the New York governors plans dont begin to address the problems",pos,i just joined new platform to show off my inspired come check me out also on maker orange flower drawing be sure to know all your local and do with targeting even before you dive deep into be sure to know all your local and do with targeting even before you dive deep into what are the reasons for using listen to murder was the by on channel the latest social media web en mi a en el a en has rolled out a redesign of and already forgotten what it used to look like yo era el en mi y en ti me as a friend on for all details on my lead generation how to generate leads on for book your life book convert my how to increase the visibility of your local business tips to improve your posts now offers support for amp read more engineer at in d cold market prospecting on the easy way
