date,snippet,price change,tweets
2017-08-30,"ResearchGate, a Berlinbased social network growing in influence and funding, links scientists worldwide, providing realtime feedback on research Jost Franko photographed the global path of cotton  from plantation to factory  where the corporate quest for cheaper production sometimes obscures the human cost",pos,is the most popular networking platform not just for individuals but also for businesses these days get all the feeds from more in one place the right ad the right landing page the right moment a simple ads framework for local businesses u benefits of creating a group for your via lessons learned from running campaigns in one year with is the most popular networking platform not just for individuals but teen shot to death was among the selected who met mark earlier this year trying to build your on a personal page check out this how to enable or disable profile picture guard on i just checked on his page love speculative fiction a in this via mark paternity leave plan ditched the for relief caution users your august update now uses x more mobile data than before turn into your brands money maker
2017-09-06,"Heres what you need to know to start your day No more than  vaquitas are left in Mexicos Gulf of California Experts propose keeping some in captivity as a last resort If you believe the quality of customer care has declined, youre not alone in feeling frustrated or angry Herere tips to get what you want",pos,love speculative fiction a in this via has admitted to they sold over worth of ads during the campaign to a troll farm what would you do if you had the power to shutdown someones when la site carton ma page el el increase your popularity get more line sharing brings chat heads feature to its in update f watch original video tab launches to all us users via maker new website how to make a lead magnet for ads get leads more effectively best ad examples for tons of inspiration update d find us like us on increase your popularity real time promotion says it sold political ads to company during live the show on elk grand canyon
2017-09-07,"After years of photographing in various parts of Colombia, Alvaro Ybarra now wants to put his photos, and hopefully those of others, into an archive that will help the country heal Monday A notable New Yorker, OffBroadway Week and reflections before Lent The stunning gaffe instantly became the central theme of the awards ceremony And just as quickly, PwC had a major brand crisis on its hands",pos,mil en how to create a posting schedule for new post at am shop now y faces backlash over meddling top marketing mistakes you need to avoid never assume any ad is genuine always and by a trusted method people families business now asking donate for a service government should provide etc agents etc in a coordinated effort to spread disinformation tips to improve your posts c top social interactions by from on m ya mil en y dale like dear can this please fuck off lights camera action is changing the way you watch video with new thank you so much for being our follower if you are on too please share the love like our new page give us a like on at if you enjoy our tutorials me as a friend on for all details on my you idiots have the nerve to judge me when you even read what put in its hilarious
2017-09-09,"Computer chips are still made in the United States, but foreign competition is looming The industry wants President Trump to help In considering a North Carolina law that bars sex offenders from using some social media, the Supreme Court discussed how such platforms have transformed civic life The first month of the administration has been headspinning Here is a guide to what matters, and what doesnt",neg,tots inseparable at orphanage then one got adopted and and are providing you have you are to shout about can you really leverage to get more traffic to your when you are watching and the guy in front of you checks his tired of wasting money on ads make em better albums on my page now live with working on going according to dub who spotted some new on sharing how much is one fan worth study says feels good to finally delete my account finally free of that garbage how you can use to grow a group of over people rise of membership medicine plans fees raise concerns wins loses targeted propaganda free promotion click here amigos a like a mi y con y earn money click here me as a friend on for all details on my
2017-09-12,"StopFake News, which is overseen by the journalism department at the KyivMohyla Academy in Ukraine, debunks fake news from a basement television studio Executives at Sony were cautious about the virtual reality headsets, but after four months of robust sales, the skeptics are converting The online streaming service is building relationships with cable and cellphone operators worldwide in its bid to expand internationally",neg,um geld en ya ms mil likes el en el call in stalker zones page for built with his coordination was today deleted by i am not surprised analytics vs universal analytics is testing a feature for peer to peer saw it on live and i love it so much gets fined m for spying on apparently big brother likes to profiles latest move is a powerful lesson in emotional intelligence via top marketing mistakes you need to avoid me as a friend on for all details on my we just reached on that other page already deleted his personal page long ago recently bullied him into changing his page details to include to pay millions for a reality show on lynch read more to pay millions for a reality show on lynch read more its clear that has their eye on him and its clear that certain will report for everything he does
2017-09-13,"Those calling for the gallerys closing say it promotes hate Its founder says she is being punished for not being politically correct Our Top  Comments of the Week Readers debate new planets, transgender issues and pizza toppings Putting together a list of companies selling Trump products has transformed Shannon Coulters life, and not always for the better",pos,is reporting inflated user numbers what does it mean for the giants report will likely be similar to the one gave congressional investigators on what about and stop harping people came out for hate not democracy secrets top six tips for recruiting with using secrets top six tips for recruiting with using secrets top six tips for recruiting with using yuk just stuck with a perpetually unanswered friend request from an account thats nonexistent now takes over platform as deb grows marketplace like a mi trump clear warning on you can now our live recorded at add us on and build project to make more portable via follow us on was on for years been off of for years now miss at all martin jailed for post offering to get a strand of hair bail revoked judge finds post in which offered for a strand of s hair showed he was a danger to the public jailed after post about a good decision hes an erratic dangerous felon get all the feeds from more in one place
2017-09-14,This years Pictures of the Year International contest recognizes the work of photographers on daily newspaper assignments or longterm projects to recognizing new ways of visual storytelling,neg,everyone suddenly starts to realize been by laser cats excellent bars advertisers from altering news headlines a new center for on via s crimes unlawful to help foreign nationals violate ban on foreigners placing electioneering ads ac are first and foremost refugees abused raped at camp is dead me they refuse to allow access investigators about hackers allows hatred record rt if it possible to hate enough already s crimes unlawful to help foreign nationals violate ban on foreigners placing electioneering ads ac awesome this is why i avoid like the plague that site is like a fever swamp so unhealthy riddled with crap launches effort while agency investigates ad features mistakes to avoid more i already my account perhaps should put up some free advertising for non violence and peace that would actually help haters ads
2017-09-15,"The Olympic silver medalist didnt return to Ethiopia after gaining international attention for crossing his arms above his head at the finish line in a defiant gesture at the Rio Games The ridesharing company lurches from scandal to scandal to scandal, and Apple is set to open a very round new office",pos,a how do the top use via ha el a a ms en pases key themes in h patient care where is this data from c its faces follow us on our social media for sin plan para fin festival y fut en la para ms agenda cool avoid these two advertising pitfalls to make sure you get the most out of your ad campaigns can we count on your support a joker a a poker u picks as site of new lab still know the extent of ad buys in election a en the companies list wanna hey can you add social media on like and and some more common marketing mistakes and how to fix them via launching program in to thwart election integrity initiative maker new website banner check schedule on and long post on woof meow d
2017-09-18,"Readers respond to recent reviews of Michael Tomaskys Bill Clinton, Elliot Ackermans Dark at the Crossing and more Petrograds expatriates provide a running commentary on the fall of the czar in Helen Rappaports Caught in the Revolution Its a big city, with plenty to do, see, hear and watch Heres a sampling of cultural highlights this weekend and over the week ahead Among them, the conductor Herbert Blomstedts surprising performance with the New York Philharmonic and a Facebook Live concert and interview with the tenor Javier Camarena",neg,by hoy en a las h lib el est a a giveaway is taking place on our page exclusive screening on set to demand firms act faster to remove illegal content hoy en a las h lib es la en y love speculative fiction a in this via rt s reckoning draws nearer says to fix its problem must break itself via already at r important heres how s s and s audience size estimates companies need to be stay connected up with by forget to like our page check out our page for more employee solutions if you migrate that crazy story to posts people will believe these stories people been killed
2017-09-19,"Detective Rick Lee, who became known as the Hipster Cop during the Occupy Wall Street protests in , is taking his style with him into retirement",pos,resigns inside story to attack on airbase plays into extremists hands started a page so you can get showcase info right on your head over give us a like no party like a party and book of love via how colonizing mars could spark new kind of human evolution group for ask specific questions to customer service how to create image posts that engage with on the data mass persuasion called the election via if db gen domino yes peters trying out his homemade web shooters in the park as spider funk plays ya y para heres video of what i found in analysis of my marketing spend spoiler alert is making some new drastic changes to its ad policies to keep its community safe how to make a without one bit of code via yo el here is why big brands are struggling with engagement on snooze button temporarily hides people in your feed removes major targeting options to fight discriminatory advertising
2017-09-20,"How careful are you online, and how much could your activities online affect your career A scuffle over a case of beer left in a South Bronx doorway ended with an aspiring rapper shot dead and an expectant father in jail Friday Weathercontrolled moods, weekend events, and good news Before being accused in the death of Kim Jonguns half brother, Doan Thi Huong was one of millions of Southeast Asians living abroad in search of work Political outsiders have felt the wind at their backs since the election of President Trump, and many embrace their resemblance to him",neg,how to ignite your fans with killer content pro advice from ad campaign examples critiqued for conversion creation a d a con para a las mm us para y el la ad campaign examples critiqued for conversion will add more human review of options on in you have to beat the algorithm to win the game ad campaign examples critiqued for conversion democrats in the us to debate future maker new website let god i see what you did there document in but posts beautiful petition asks trump to release tax returns ad campaign examples critiqued for conversion
2017-09-21,"In addition to the caged and battered dogs in a garage in Queens, officials found training equipment suggesting the dogs were being trained to fight The Malaysian police said the substance, listed as a chemical weapon, had been identified from samples taken from the skin and eye of the North Korean leaders estranged half brother Heres what you need to know to start your day Photos by The New York Times and by photographers from around the world",neg,the peace dove looks like its pooping flowers insights to go touts ability to target ads based on store visits purchases calls brand tarnished by touts ability to target ads based on store visits purchases calls brand tarnished by did mark successfully diffuse the potential around ad biz en y y and hrs ago have each donated to also are you in y la why now why not u tell the congress last year before the election accuses of ordering death squads hits says it will ban pages which repeatedly share fake news from buying ads intent a en y reveals messenger day usage as messenger climbs to b gens want to see footage from tonights celebration visit on increase your popularity get more how to make a lead magnet for ads get leads more effectively intent a en y is building an autonomous car
2017-09-22,"A new book documents the internment of JapaneseAmericans during World War II through images by Dorothea Lange and others, including Hikaru Iwasaki, who had been sent to a camp Thursday A circus comes full circle, the end of the Kosciuszko Bridge, and the Met sees an anniversary Our guide to pop and rock shows and the best of live jazz Reviving a law not used since , officials brought charges against a man who made an antiIslamic demonstration on Facebook President Trumps acrid comments about Sweden come at a time when Swedes themselves are questioning their generosity toward immigrants and its potential limits",pos,i think this is a great idea do it the mile transatlantic cable aka made by and is completed how to create a posting schedule for a little late but glad sanity struck at regarding our community is growing be sure to follow everywhere and big undersea cable is finally finished another with evil plans is down it crushes once opened following me is latest hoax can democratize retail how to optimize your posts with audience insights join range field on our page today should you buy likes friend request tepid unlikely to go viral when it comes to platforms like post to improve engagement visibility c today in history for march th est do est do
2017-09-23,"A big question about the IPO of Snap is why its creators retain such outsize voting control The answer lies in their history with a venture capital firm Gavin Grimm, , whose initials are on a case heading to the Supreme Court, has become the new face of the transgender rights movement As automation reduces the need for human labor, some Silicon Valley executives think a universal income will be the answer  and the beta test is happening in Kenya This tiny melting pot serves up an exhilarating array of food, culture and night life",neg,team duplication but a unique way to generate leads free event university teacher booked for post against goddess the showbiz minute gaga craven on my page ad scandal a fail its a feature by la la land stone win at learns human reactions after watching hours of est en lites y to to click here peep the latest of live at forget to and leave a comment says she was victimized over show top benefits of for your see more at just cant handle page this days as in too much fake news bluffing and those stuff top benefits of for your see more at great meeting you tonight and i liked your page as well hidden gems underused tools for nous radio electro pop music nous radio electro pop music
2017-09-25,"On two latenight talk shows, a relatively soft approach and a more pointed one have emerged in comedy about the new president Icelands president told high school students that that pizza topped with pineapple should be outlawed Fans of the topping were outraged Financial startups hoping to become the Facebook of banking have had to work with the financial industry instead of displacing it The Foreign Ministrys website now highlights articles it considers to be false, but critics say that the ministrys designation should be considered a medal Americas JCCs are being threatened We need a more forceful defense Heres what you need to know at the end of the day On the Oscars broadcast, the message will be working together to overcome challenges But these days, can even invoking unity be a risk for a brand Pyongyang denied involvement in the killing at the Kuala Lumpur airport, even as it refused to acknowledge that the victim was Kim Jonguns half brother She has been a fan of his ever since they met at Le Club in  Now that he is president, her cheerleading has consequences",neg,increase your popularity real time promotion mil en plotted looks like it worked totally took lied it over over so glad i had more fun on twitter even now understanding the psychology behind likes est en con lo y en mi page en is technology making our minds redundant an interesting question follow us on on the best of extreme join us gimme on page at en en a great move by relicensing jest flow and lets be friends on too i will accept your friend request only six years huh does your use to attract clients via new live post album release party website football we carve some awesome wooden plaques look us up on heres a fast company cover with my space from my space was huge back in the day will target ads to people based on store visits purchases calls to businesses via sharing exec things i hate about working here c hey will probably be stuck in my head for a week after those comments could have avoided many of its problems had been central to its overall strategy via
2017-09-26,"Corporations have crisis management firms at their behest Smallbusiness owners have to rely on their own wits to respond to political animosity You could follow a recipe, sure, or you could make leftovers quesadillas out of whatever you have in the fridge Meet Iain Armitage, who rose to fame with a YouTube channel where he offers reviews of Othello and Cats",neg,fake accounts linked to the government helped spread stories about and even organized one of the rallies there reasons why you need a page via can absolutely control its algorithm w breaking news new details about ads las tan en pretty soon we will see the future advance more rapidly patience is key die hat war how not to get your ads account disabled click creating a public figure page and why you should la menace en regulator threatens to block for noncompliance with personal can you really leverage to get more traffic to your banned in in and this is why you need us when in and you move to a new place users r me el y no me ms as me lo a o ac s deal for watch shows includes sharing ad revenue a lo no querying test for injection save w go on amazing new check out s first
2017-09-27,"Wednesday Sinatras New York, New York, a bull escape in Queens, and representatives around town",pos,of do you yet regret somehow attaining my ideas in concept and name known as from whoever are get all the feeds from more in one place how to create and set up profitable ads d en you for an with like us on knew about meddling well before the us how to make a lead magnet for ads get leads more effectively details s response to s humanitarian crisis you for an with like us on to help promote your brand on mark responds to trumps claim that has always been against him how to launch your first lead in minutes top advertising tips have effective ads d i regret keeps dismissing issues with my pg i have been having since tempo no do no at me all if you wanna reach more support click on my music group meet the right free on trump and fake news is a total cop out a en
2017-09-28,"The two companies agreed to reduce the price Verizon will pay for Yahoos internet businesses to account for the impact of two huge data breaches Is such a thing even possible Farhad Manjoo, despite his love of social media, set out to avoid news about the president It was not easy A program in Northampton in which officers would greet elementary school students ended after a month in response to some children feeling uncomfortable Heres what you need to know to start your day New York City was not only the birthplace of American photography, but also the setting for some of its most substantial early commercial and technological developments Coverage of President Trump may eclipse that of any single human being ever I discovered several truths about our digital media ecosystem when I tuned it out",pos,like or follow my page on maker new website hello please be mine weer mag camera para est para d ms con y videos follow nab nail bar on social media via please read our post on here is a new post by times on and tails create from string loading slow click here colluded with is a enemy of freedom from the inside is what to worry from tweeting my by wants to be best alternative to appreciate your kind support as always y el how going resulted in shares warns twitter to comply face regulation the place where people with problems and issues go for attention
2017-09-29,"A former member of the Norwegian Parliament, she presided over honors awarded to Tunisian prodemocracy organizations and to the president of Colombia",pos,en el a en doing what i love doing metrics to measure the success of videos by needs to slow down and consider consequences among see more at such a partisan hack how to optimize your posts with audience insights among see more at are we friends on if not we need to be send me your name finally a stable release time to package and submit for review brew house suggests kill kneeling players in comment la thank god send screen shot notifications that would make my petty extra hard and face difficult choices over and get paid to work on media hottest work at new video up on my page check it out here vivo no a semifinal do do do administration demands info on activists via will original content rival red love speculative fiction a in this via
2017-09-30,Mark Zuckerberg says he wants to help the news media Heres what he needs to do,neg,should you boost posts on please visit like the page at thanks autonomous cars no y dale me a has someone lied and said you need in your heres the truth of it i only have one credit left until i graduate after this quarter like state insurance on for news updates and friendly banter follow us on leave a comment has been involved in the manipulating of s dating back to when they brought you sous reverses aux enabled la contra to introduce facial recognition for account recovery lo firm con la videos en en to propose tax in share articles with your readers via free a heres a joke as we wait to see if i get control of my page again o is now admitting they were over took by to harm the country when will you stop these
2017-10-01,"Tuesday Getting rid of gum, trekking from New York City to Canada, and celebrating Black History Month Google produced a horde of millionaires in Silicon Valley when it debuted on the stock market in  Many in Los Angeles hope Snaps IPO will have a similar impact",neg,follow us on get all the feeds from more in one place get all the feeds from more in one place get all the feeds from more in one place get all the feeds from more in one place get all the feeds from more in one place get all the feeds from more in one place get all the feeds from more in one place get all the feeds from more in one place get all the feeds from more in one place take a look at my page for my lets connect la en el shut off from friends statuses life is pretty dark ill die living as free as every hairpin turn zombies on my page as o en y all that glitters is live on next tomorrow o o post do no era things you doing on but probably should via y dale me en no
