date,snippet,price change,tweets
2016-12-01,"Popular messaging app WhatsApp said on Thursday that users around the world had been unable to access its service for a brief period, but that access for its  billion daily users had since resumed ",neg,has come up with a new version designed just for the older generation its called carrier ha el a a ms en pases how to share a post to your page on mobile on tis the season to post of that damn elf every for the next days get leads and results with th paid ads overview on download here warrior repair workshop service manual nos en wins with new interface from winners and losers s roadkill on en y make sure to follow me on and for the latest updates and teasers of upcoming publishing jeep wrangler service repair workshop manual read of the day from c how to look like a pro using live lights camera action via den like a la en how to look like a pro using live lights camera action via based on my avg or likes
2016-12-02,"Ms Zuckerberg, a former executive at Facebook, said that a passenger made lewd comments toward her and that flight attendants brushed off her complaints",pos,q q en el r years ago i said some weird shit rebel service repair manual threatens with job opening features forms partnership to create affordable housing in silicon valley read more why should spend more of their put your food on or share it with your on if not selling beats on then missing this web en y webs en web en y webs en web en y webs en com o be rich and successful apologize to woman detained at incident goes viral in pm et get more and fresh content from your personal page to your marketing las en son dale like free community of making on product invests major in affordable housing
2016-12-03,"Republican US Rep Joe Barton, Texas mostsenior member of Congress, announced Thursday that he wont seek reelection after a naked photo of him circulated online and a conservative activist released past messages of a sexual nature from him Under pressure from the NAACP, American Airlines is promising changes in the way it trains employees and handles passenger complaints about racially biased treatment",neg,a lance version workplace by rookie double uploaded my video to setup a fan page for purposes you first need to create your own personal page this can be basic thank you friends family the crucial steps needed to actually drive sales from est para d the crucial steps needed to actually drive sales from the crucial steps needed to actually drive sales from the rule that ensures you build your brand download now no die rt ob rip photo maps the best part of that apparently no one else used the crucial steps needed to actually drive sales from thank you so much for being our follower if you are on too please share the love like our new page what customers really want from your page point and u you posted photos of you picking up your tree really i guess been excessive the crucial steps needed to actually drive sales from is finally working to control their fake news epidemic a little too late
2016-12-04,"Is Santa Claus coming to town Wall Street thinks so, even though stocks have already exceeded most expectations this year A video of a beagle at a Virginia animal shelter scaling her cage in an escape attempt has generated calls of interest from across the country",neg,stay away from these simple mistakes via managing your page be a full time activity thank you thank you yep exactly how we feel about do you like make sure to like us on how to use crap some of my pupils have found my account but how now i fear for both my and accounts the merry thanks for connecting were via las i what is safety check disaster notification tool what is safety check disaster notification tool what is safety check disaster notification tool what is safety check disaster notification tool c what is safety check disaster notification tool what is safety check disaster notification tool what is safety check disaster notification tool c hack v a y get paid to post to face book
2016-12-05,"The viral publisher Bored Panda is thriving on the social network despite the algorithm changes that doomed its competitors Blue Apron cofounder Matt Salzberg is stepping down as chief executive and being replaced with Chief Financial Officer Brad Dickerson European Union governments could be stripped of their veto power on EU tax rules under proposals being prepared by the EUs executive arm, an unprecedented move that could unblock reforms long resisted by smaller states   Alaska Airlines said Thursday its investigating a claim that flight attendants allowed a passenger to sexually harass a former Facebook executive on a flight Police in Massachusetts say a yearold man apparently accidentally shot his grandson in the chest during target practice when the younger man stepped in front his grandfather just as he fired The ALS Association says a man credited as one of the cofounders of the viral Ice Bucket Challenge that swept social media in  has died after a yearslong battle with the condition known as Lou Gerhigs disease Anthony Senerchia was  A high school soccer player from Florida is missing and authorities believe she is traveling with a yearold soccer coach",pos,tricks to maximize your reach on by per la social media new track dropping tonight at pm link will be in my ignorance is bliss we know how to use groovy contact us hack hack nouvelle collections nouvelle collections love to connect with you on too c ya en mi no me tricks to maximize your reach on by tricks to maximize your reach on by sharing wolfram alpha releases new data from project magazine newsroom partnering to help curb spread of terrorist content looking for leads using shares some amazing tips in this workplace con workplace will give you wings maybe check out our page
2016-12-06,"Outraged Garrison Keillor fans deluged Minnesota Public Radio Thursday with complaints about the firing of the humorist over alleged workplace misconduct The government fears that political activism online hurts the state, but regulating internet content will hurt it even more Former Association of Southeast Asian Nations SecretaryGeneral Surin Pitsuwan has died in Thailand He was ",neg,links shared on lead to higher search rankings ensure that you get it spot on here d once opened box please check this out for easy tips to boost your and performance get the most from via check it out you and your followers will find it if you share it war on websites take check out our official page for more photos and info on homes in like this come like our page but you wont like it love it connect with on too just search c para son est son femme son est son femme this new tool from is awesome ultra en lo en anterior mi feat en y
2016-12-07,"Shares of Facebook, Apple and other technology heavyweights dropped on Wednesday, creating uncertainty over whether the topperforming sectors recordbreaking rally this year is ending or merely taking a break  Snapchat is separating what friends share and what media organizations publish in an attempt to appeal to a broader range of users Stocks that moved substantially or traded heavily Wednesday Facebook Inc has eliminated transaction fees on donations made to nonprofit organizations on its platform, Chief Executive Mark Zuckerberg said on Wednesday, a change that could help the worlds largest social media network expand its presence in Facebook Inc said on Wednesday it was temporarily disabling the ability of advertisers on its social network to exclude racial groups from the intended audience of ads while it studies how the feature could be used to discriminate  Alaska Airlines is investigating a sexual harassment claim by Randi Zuckerberg, a Silicon Valley executive and sister of Facebook Inc Chief Executive Mark Zuckerberg The Latest on online messages, occasionally of a sexual nature, that US Rep Joe Barton of Texas sent to a conservative activist all times local A Vietnamese appeals court upheld a bloggers year prison sentence for Facebook posts alleged to be antistate propaganda, her lawyer said Thursday, in the second tough sentence imposed on dissidents in a week that drew a rebuke from the US go",pos,wants its users to help spot fake news read more us tech firms to face new laws forcing them to tackle hate speech live check out this weeks whats new at full video can be found on our page free community of making on check out this weeks whats new at full video can be found on our page marketing en marketing en marketing en marketing en marketing en hoy en con my friend la hoy en con my friend la take your pick a es how to use social network leaders step up efforts to remove terrorist content read more like us on for more news
2016-12-08,"Use up some of that leftover cranberry sauce lingering in the fridge in a version of the sandwich, and call that your norecipe recipe for the week Last weeks Modern Love column drew a number of impassioned responses from readers Here are some of their comments, along with a note from the editor Gov Jerry Brown of California will headline ClimateTECH, a new conference from The New York Times, on Wednesday night Heres how to watch and what to know Facebook is pledging  million a year to match disasterrelief donations, part of a bevy of tools and efforts around charitable causes the social media giant announced on Wednesday Senators who voiced concerns about the tax bill say everything will be fine because Trump said so Then he sold them land in the Everglades",pos,advertise your business on and make a profit download free report court filings hint at possible political future for year in review mom laughs at your sadness el vela m give gal i s i dog follow me on entertainment group how to turn throttle into good kick off your by reading our tests turning comment reels into message threads via tests turning comment reels into message threads via join us live am pt to the latest social media news from more instant articles bedrooms bathrooms car garage use for beats ad blockers page how the media won the elections a con collection no a
2016-12-09,"Facebook said on Wednesday that it was removing  percent of content related to militant groups Islamic State and al Qaeda before being told of it, as it prepared for a meeting with European authorities on tackling extremist content online The settlement seemed likely to be the final legal development in a police shooting that led to huge protests in Minnesota After long debate, and despite opposition from many doctors, the state of Victoria legalized assisted dying for some terminally ill patients who request it Over the last decade, a few giant corporations became an inescapable part of online life Gutting net neutrality would cement their power Portuguese soccer star Cristiano Ronaldo muscled his way into Instagrams topfollowed ranks this year as he documented his career and growing family, but pop star Selena Gomez still reigned supreme on the social media platform  The Minnesota city that employed a police officer who fatally shot black motorist Philando Castile during a traffic stop last year has reached a settlement with Castiles girlfriend and her daughter, who were in the car with him when he was killed Microsoft is overhauling its longtime headquarters with an building construction project that will make room for another , workers Instead of one blended feed of information, Snapchat users will now see a social stream on the apps left side, and a media stream on the right Snap Inc launched a redesign of its Snapchat app on Wednesday that centers on separating posts from a users social circle from those sent by publishers and content creators, seeking to simplify navigation and attract new users",pos,if you are on please share the our page e amigos um e amigos um get paid to work on media hottest work at ad networks recent updates join me on for more great content and connect on a deeper level stop complaining and on is fixing their ads issues do you use for on customized graphics via play extreme on its blackjack for players players welcome marketing day ad errors on media suppliers read of the day from we know u but you can also join us on like our here like us on thanks futurist mike says a algorithm could fight fake news
2016-12-10,"Its planning to end net neutrality while opposing the Time Warner and ATT merger This doesnt make sense SoftBank is offering to buy shares in Uber at a  percent markdown Investors could cash out, but the promise of more could cloud their thinking ATampT Inc and Time Warner Inc argued on Tuesday that their proposed  billion merger was procompetitive and proconsumer, as they sought to refute US Justice Department allegations that the deal breaks antitrust law A yearold Pennsylvania woman had told authorities that her exboyfriend threatened her and installed a tracking device on her car in the weeks before he apparently killed her and her mother the day after Thanksgiving For instance, India can teach us the power of digitized data A conservative activist who for years exchanged online messages with Texas Republican Rep Joe Barton says that when he occasionally steered the topic toward sexual themes, she long dismissed it as thats just Joe",neg,be sure to like my page how are sites increasing page likes through their own sites with you engagement download the types of content that you should use solution how you can use to grow a group of over people u y la la global la y like everything else in life it depends on your situation and future goals confirms new video tab is rolling out to more users you want a website we can do that new posts about are to following me on i post about new and other fan page dale y la en fan page dale y la en fan page dale y la en introduces new resources for business via fan page dale y la en join our las en
2016-12-11,"The chairman of the Federal Communications Commission, Ajit Pai, accused social media company Twitter Inc of being politically biased on Tuesday as he defended his plan to roll back rules intended to ensure a free and open internet A New Jersey woman who got roadside aid from a homeless man in Philadelphia has raised more than , for him  enough to buy a home and his dream truck and provide him with a small annual salary A man accused of killing his neighbor later opened fire on an officer at a highway rest stop in the Arizona desert, setting off a shootout with law enforcement that left the suspect critically wounded, authorities said",neg,this is how s news feed algorithm decides what you see in your feed en y para la n en pas en las ideas en users in southeast in m m m m m in days on our new page like hey we ask often but if you you can follow us share the wonder basic why your story is just starting shadow shop manual have you seen our page yet come give us a like at feet not above wall street journal i think not just blowing up but also blowing up oh well sorry for all that but hey this is me rt en dale click ya en la el management ensures constant growth y hoy para o whats on my mind s you b asking us all what we want for
2016-12-12,"Covered in colorful dried fruits, these chocolates from Comparts are ready for the party season British lawmakers are investigating whether Moscow influenced the  referendum The social media giants have promised information within weeks Lee Mingcheh was sentenced to five years in prison in the first case in which China has convicted a Taiwanese citizen of state subversion What is net neutrality, and what is at stake if it is repealed In acquiring the meetingorganization company, WeWork is seeking to again extend its business beyond office space into more facets of customers lives The Latest on Alabama Senate race all times local Two teenagers have been arrested in a shooting that killed a yearold and wounded five other boys, a crime that has put a spotlight on a surge of youth violence in Cleveland The publication of a longlost Dashiell Hammett story was itself an act of sleuthing App Store Official Charts for the week ending November , ",neg,how to grow your with your personal page via by did you know that the homepage is also on please check it out and like our page need help writing applications using python no problem sharing wolfram alpha details gender differences in usage the verge el las a y how to build a personal for messenger free community of making on video alba computer e live video goes but not for everyone es hat effective promotions on via this should help you and all your followers so please it o no o em for the rd time since has disclosed reporting errors to advertisers will hurt growth and dominate o no o em is finally hiring a head of news ready for social media like us on if you want more news
2016-12-13,"Whether homemade or storebought, lemon olive oil is a bright and fragrant contrast to roasted mackerel As a crucial election nears, leaders like Matteo Renzi are on high alert for fake news and foreign meddling Quotation of the Day for Saturday, November ,  Thousands of officers moved against a sitin led by a firebrand cleric that has paralyzed the capital, with at least six deaths and  arrests The region has seen the biggest spike in ICE arrests during the Trump administration, and undocumented immigrants in the suburbs are trying to lie low The United States Navy identified the men as Bryan Grosso, Steven Combs and Matthew Chialastri The holiday is over Maybe its time to make food that tastes nothing like Thanksgiving A former privacy policy adviser at Facebook takes issue with an OpEd article All Points West Distillery makes a mellow gin and a wheatbased vodka filtered through charred bones An acquisition deal is a lucky break for Time Incs shareholders because its goitalone strategy looked doomed Nine lawmakers were forced to resign because they are dual citizens Scholars have a few ideas about how to change that Vinegar Revival, by Harry Rosenblum of the Brooklyn Kitchen, covers flavored vinegars and recipes, too Bergdorf Goodman and Ladure have collaborated on gilded chocolate macarons filled with salted caramel Mimo, a Spanish company from San Sebastin, is now selling jarred pickles, seeds and spreads in America As the big joint families splinter and younger Indians move elsewhere for work, an increasing number of older people are living alone in India Nguyen Van Hoa was convicted of spreading information about the discharge that killed marine life and sickened people along a mile stretch of coastline If youve cooked for a crowd, feel free to relax, but if youre energized from the holiday cooking, weve got you covered At Liquor Lab in SoHo, nonprofessionals will learn to shake up classic cocktails",pos,s latest measurement error irks winning makeup artist will be teaching our women her top beauty secrets watch live on our page now get leads and results with th paid ads overview on download here training at shining bright like the diamonds we are the invented they called it the telephone what the fuck have you done now the list on the left of groups and shortcuts scroll anymore and its all stupid how to get photo likes in a days el en twitter ha el going to drop my account always people looking for attention is so much better chunks of info great get more and fresh content from your personal page to your marketing what do you do to get more on and this is huge enabling customers to talk on their preferred channel en direct la on link on just a little food for thought got a customers album on send us a of you and your book your life book convert my like us on at
2016-12-14,"This weeks Australia newsletter includes additional photography and stories from Manus, and a dash of American Thanksgiving Loosening rules on internet providers would let big companies charge more for their services But a suit to block a merger signals a tougher stance against big business Eight people were rescued and a search was underway for the other three, the Navys Seventh Fleet said It was the fleets fifth accident this year Twitter should scrap a founding principle  everyone gains equal footing and any behavior is tolerated  and create a new system that rewards positive contributions The big feast is tomorrow, so take it easy tonight and focus on the lastminute details A reader says he never converted to the new religion Someecards had a great idea that went viral Then Facebook, responsible for much of its success, almost killed it A Thanksgiving note from a columnist to readers Youve got this Just remember the turkeys done cooking when it reaches  degrees Wherever Mark Zuckerberg goes in Silicon Valley, he seems to generate a housing problem, including at an RV community where residents were evicted this month Theres so much to do with those Thanksgiving leftovers, whether you make a turkey salad, a spiced turkey pav or a brothy noodle dish In Haven, Sarah Blesener looked beyond stereotypical portrayals of the South Bronx as she photographed a group of lifelong friends coming of age The mobile app for the social network can be a bit of a battery hog, but you can do a few things to rein in the power grab A little bit of meat goes a long way, wrapped Sicilianstyle around cheese and prosciutto and roasted with bay leaves and olive oil Beyond the mystique surrounding fortified wines, this sherry can be wonderfully complex and satisfying, and surprisingly good with many savory foods",pos,las a deleted my account once again for revealing the and fighting for our they will shut us down en y post by via close the page a i hate cats en la inters y con para el template best practices via what you along with your followers need to find out for free please to all follow my artist page to read more para e take your pick did you know we are on like our page today is asking for a copy of my after deleting my nice try and system yesterdays my are attracting much more viewers on than rd day of the a like and on the s a pretty big place but of all spend goes to just two companies and d
2016-12-15,"But real books, records and brick and mortar stores will take us back with open arms With the country so divided on so many issues, companies are increasingly finding themselves in the middle of controversies Theyre realizing it may be the new normal A social media star, the former labor secretary extends his critique of big moneys influence on politics with a new documentary, Saving Capitalism It has no incentive to do so I would know  I worked there The  cup shows two interlocked cartoon hands Some conservatives accuse the company of promoting a gay agenda The Kitchen by WP Design, a shop open to the end of the year in NoLIta, has gifts and special tasting events Culatello di Zibello, a cured meat from Parma, is now available in America Gruyre dAlpage is made the traditional way with summer milk from cows that forage in the Alps Teak mapleleaf servers give an autumn feel to the holiday table A rollback of net neutrality regulations would represent a significant victory for companies like ATT and Comcast and would amount to a strike against consumers Heres a starter art collection for the newlyweds on your gift list that needs no wall space, just a kitchen or dining table The onetime gatekeeper of Chinas internet, who purged Chinas social media of its most beloved personalities, has been detained and is under investigation Our devices consume our time and dilute our social interactions The app still functions in China, but its fate there is unclear as the government moves against foreignrun tools for online communication Pazar Food Collective is a standout among a wave of fusion restaurants The Justice Departments suit to block the ATT and Time Warner merger was a stark departure from decades of leniency toward similar tieups Facebook said it was planning to roll out a new tool so you can figure out whether the page or account you followed or liked was run by Russian agents",pos,en la inters y please check this out for easy tips to increase your and effectiveness this is like the fox guarding the how to use are you on we are looks like plans to crowd source the truth the latest the rogue fan daily thanks to as i said is a large part of revenue stream th day of the a like and on get into the swing of things es gut hat the last days of if he care his clients hes destination is been forgotten its like everybody change your profile picture except announces style in it allows to silence opposition th day of the a like and on
