date,snippet,price change,tweets
2017-02-24,"Two Times tech reporters discuss the weeks events and developments in Silicon Valley, including a certain Apple iPhone event Heres what you need to know to start your day The web is not as open as it once was, with nationstates exerting their power over the internet Facebook and other tech companies are dealing with the consequences The social media giant owes it to its users to let them know if they interacted with what amounts to a digital spy And thats just the start Behind the scenes, Facebook is involved in highstakes diplomatic battles across the globe that have begun fragmenting the internet itself Rolling Stone influenced a generation That it can no longer survive on its own suggests that something about our culture has been lost How does Facebook pit companies against countries in the battle over the control of online speech A British television news report said that the online retailers algorithms were automatically offering items that could be used to create an explosive device Karen Leibowitz and Anthony Myint, who started Mission Street Food, have new ideas for the Perennial, their restaurant that promotes sustainability Sheryl Sandberg, Facebooks chief operating officer, promised more human review and oversight to make sure offensive terms arent used to target ads Facebook, Google and Amazon are coming under increasing pressure by regulators concerned about their growing power Some of the best dishes at Wus Wonton King on the Lower East Side are the simplest, along with the whole suckling pig A series of scandals have opened up the possibility that the company may have created something it cant fully control The company said it would turn over , ads linked to Russia to Congress after growing scrutiny about its role in last Novembers presidential election You dont have to like social media, but when a natural disaster or emergency strikes, it can provide essential travel tools Apples Watch has a bug, Facebook might be undermining democracy, and Amazon is telling us how to make bombs Tech news is weird right now",pos,take a peek of our casual update watch it in its full glory at or our website ways to increase your engagement by on give us a like on at if you enjoy our tutorials what feature would you get rid of if you had control what feature would you get rid of if you had control est en lites y reasons your with no description provided d mar join and myself at our event look for us on stop complaining and on las las mis van a las looking to hire can help with that how to use donates to to regain trust among a by pizza party deja en el crazy how the great spirit on is so different than on
2017-02-25,"The Times concluded that Melvin Redick on Facebook was a fake American created by Russia as part of its propaganda campaign But where did the mans photos come from The social network, which hopes video will become an increasingly part of its business, said it would limit ads from appearing on unsuitable content Though we may still pop headphones in to watch a YouTube rant, social media has cultivated its own mute visual culture A Facebook group said little beyond that clowns planned to appear late at night, but news coverage breathlessly described the group as a chilling threat Both companies said they would change how their ad systems worked in response to two separate news reports exposing the issues",neg,witches fairies on my page el pas ms the crucial steps needed to actually drive sales from the crucial steps needed to actually drive sales from the crucial steps needed to actually drive sales from the crucial steps needed to actually drive sales from beautiful day for an impromptu pickup tournament be part of our awesome community by joining our group link in at state beach drummer free community of making on go like page now la website header shop cover design website for to see more of my jewelry other items please like my page a like love free community of making on d mommy happy mommy happy the crucial steps needed to actually drive sales from la lo
2017-02-26,"Our top  comments of the week Readers discuss the socalled Dreamers, incarcerated women fighting wildfires, and a nurse arrested in Utah Facebook disclosed last week that it had identified more than , worth of ads purchased by a Russian company linked to the Kremlin Make a playlist of songs you heard on your trip, organize your photos by location and use a checkin app The page, posing as an activist group, was one of hundreds of fake accounts Russia used in an information campaign during the election, a revelation that has put Facebook on the defensive",neg,follow us on go like page now free community of making on landscape layering u have create a social media network and blow and out of the water call it mil en go like page now unite a escape the runway event page check back for and its all about accountability need independent measuring tools that are standard throughout the by unlike by structured follow not checkout our page we have lots of prints to show you how we got around s silly rule about text in dialog boxes can you really leverage to get more traffic to your our page ma talking ads cc here are tips for shooting on
2017-02-27,"The office search indicates the company is growing more positive about its prospects in mainland China, where it has been unavailable for nearly a decade Facebook said that fake accounts and pages had bought , ads focused on divisive social issues, including race and immigration Posing as ordinary citizens on Facebook and building warlists of Twitter accounts, suspected Russian agents intervened last year in the American democratic process Heres what you need to know to start your day Despite their denials, web conversations reveal that two borough candidates knew a political operative was creating phony Facebook pages to tar their opponents Healthy democracies have transparency in political advertising That doesnt matter to Facebook The Kremlins stealth intrusion into the American election was broader than previously believed",pos,join k other fans and us on for more news dank and more at stay out of jail stay out of jail whats your for this years in typographic website like us on thanks our via our via our website f r e e tool to analyze your how does your fan page rank quick guide to asking for your data by en son y is on remember to hit that like button the latest la community manager life the same with sharing the third party in relationship breakups these days challenges over personal transfer no
2017-02-28,"Internet companies annexed much of our public sphere, playacting as little democracies  a charade they gave up last week The nonpartisan Congressional Budget Office is in President Trumps cross hairs But its projections are vital to passing complex legislation A revolving door Watch the bestselling author and New York Times Opinion contributor in conversation with our journalists and viewers on Facebook Live The social network does not offer help by telephone, so dont get fooled by scammers claiming to provide personalized assistance Reports about the tech giants bullying of the New America Foundation raise concerns about how it shapes policy debates Four lawyers are under review for social media posts that mocked people in Family Court in Queens An analyst pointed out that the company said it could reach  million more young Americans than last years United State census says exist",neg,teens haunts with ghostly image emotional posts may be scams warn new en y la nos video me header cover cover header free social media management tool media media for running an effective why is the paid traffic source to sell your beats and grow your sorry but ya gotta do it la a a spot a step up in advertising trials ads in how to get without spending any money please rt k follows likes daily con para para follow our for updates and and or email with your ready to ramp up of its drone
2017-03-01,"Five versions, in institutions on three continents, will be reunited on social media, and a Facebook Live on Monday will feature live commentary on each The company did little to ease concerns about its future, posting financial results that missed Wall Street expectations The social media giant has quietly authorized the release of a Chinese version of its Moments app, a highly unusual move that raises transparency questions An internet platform like YouTube or Reddit is more than just an app or URL for some users, it can be an identity that informs everything they do online America has held a largely romantic view of the tech industry that is at odds with reality Weve rushed headlong into a hyperfragmented mess, with a jumble of ondemand services that, added up, cost more and often offer less than the old cable bundle Insurance rates are projected to rise significantly next year because of uncertainty created by the president Days after clashes in Charlottesville, Va, protesters toppled a statue of a Confederate soldier that had stood in front of the old Durham County Courthouse in North Carolina for nearly a century For many on the island, which is home to major US military bases, being prepared for emergencies posed by earthquakes, tropical storms or even hostile countries is second nature And picking up the dinner tab for traveling friends revealing a case of PTSD to ones boss and feeling competitive with a married, pregnant sister The arrival of Apple, Facebook and Google means that the hypercompetitive world of scripted TV is going to become even more ferocious",pos,con la a win a pair of knee sleeves weekly on from website wraps on link on no lo en con how sellers can use marketplace to reach more consumers via are you looking for talents here we go win a pair of knee sleeves weekly on from la en vivo hoy en vivo el la here are tips for shooting on reasons why you need a page via yep sure to see this on too lots of testing going on with ad placement is fighting thoughts with new technology la artificial para giro la en vivo hoy en vivo el la me on updates on novels and more a y custom
2017-03-02,"Also outrage at a baby shower hosted by a mothertobe the case of the missing blender and a forgotten salad order arouses suspicions of dementia The cookbook editor, who died Wednesday, inspired and sometimes intimidated the chefs and writers she guided The most distinct summer travel destinations vary greatly depending on where you live Also how to stuff a wildly hungry brotherinlaw withholding the elevator and letting them eat halfeaten cake The prime ministers nephew has declined to give in to government demands that he apologize for comments on social media considered critical of the countrys leadership The accusations against Mr Khan by the female lawmaker have led to social media attacks on her, illustrating the rise of such vitriol in a nation considered highly dangerous for women Promoters of ivory from the extinct animals say its an ethical alternative Others fear it may give cover to the blackmarket elephant ivory trade In an invitationonly group, wives grapple with issues from finding a home in a new city to living with a players debilitating concussive injuries After Google fired an engineer who wrote an antidiversity manifesto, the tech industry is under the microscope for penalizing dissenting opinions In a Facebook Live conversation, two technology reporters discussed and responded to questions about a Google engineers antidiversity memo The worlds largest social network is trying to coax its two billion monthly users to stay around and watch more videos Also, an annoyingly selfdeprecating coworker, a constantly canceling sisterinlaw, and a young neighbor defying gender norms or just playing",neg,as s lose steam pushes menus over chat the space between your fingers are meant be filled with mine comparing snap twitter and read more now shooting in contact us at for bookings check our messenger adds option for chat bots to avoid chatting read more rt are you using live our own shares lessons lea pour win a pair of knee sleeves weekly on from when your husband splashes water on his eyes and say he is crying because left stop surfing or and enjoy a new movie here stop surfing or and enjoy a new movie here messenger adds option for chat bots to the ultimate to get on for any in hours or less have you all in your feelings high cost and low engagement track measure and go again ads are a must as a primary audience targeting consider the entire archive comment lier et lier et p how to sell beats using if not check this out free community of making on
2017-03-03,"The Instant Articles feature disappointed many publications that tried to work with the social media giant, but it is developing a tool that might drive subscriptions Also, boycotting a former bosss baby shower, requesting a family visit, and wondering whether sexual fantasies are cheating Trumps people never spoke to any Russians, and if they did they forgot about it, and if they didnt forget, it was just socializing Got it Trump keeps touting his economic record but recent data show the postelection boomlet is fading President Trump met with three New York Times reporters for an exclusive interview in the Oval Office Peter Baker provides an inside look at key takeaways from the meeting that may not have made it to print The city is newly stylish, with hyped restaurants and an Ace hotel, thanks to a steady flow of Carnegie Mellon grads who decided to stay The recent struggles of Apple, LinkedIn and Facebook show why the number of tech companies willing to have a try in China is dwindling The posters were found as Chinese enrollment at schools in Australia grows and as the country confronts concerns about Chinese influence in its politics and economy His agenda stalled, the president has settled for barring a few thousand transgender Americans from serving in the military Facebook executives have been cautioning investors that the socialnetworking giants growth might start to slow The latest earnings report suggests that hasnt happened yet",pos,we think groovy is pretty groovy get paid to work on media hottest work at a y curious about the how does it compare to or ya en c peter former chief of staff to join trump as deputy read more join me now over on lets talk about ways get your smile back page u just added almost national flags to its profile frames feature like like us on ah the twists and turns of the crucial steps needed to actually drive sales from en nos all free tool to analyze your fan page head over to on or to check out my new short flick on everest were on directly to your a new will allow users to do just that directly to your a new will allow users to do just that
2017-03-04,Facebooks last major consumer product in China was partly blocked as Beijing increases its grip on the internet The social giant is working with media companies on a new tool that would push Facebook users to buy subscriptions to news outlets,neg,top vines of josh w titles josh vine compilation co vines johns vine compilation w titles all johns vines best how to see who has shared your on tip how to see who has shared your on tip ways hackers can hack your account via the join me on bugs a son amigos hoy solo new this weeks collection of marketing resources rt ways hackers can hack your account hackers hate it when people switch this on has started to flag fake stories nun ya a how to double your beat sales using ads
2017-03-05,"Also suspecting a friends teenage son is gay worrying about a chance meeting and making conversation with an elderly neighbor Both personal and professional users have seen their accounts suddenly go missing, but there are ways to report the errors, and precautions to take Three Times tech reporters discuss Snaps difficulties as a public company, and the socalled net neutrality debate To understand Facebooks new emphasis on private groups, I joined more than , ranging from gardeners to flatearth truthers Only a small percentage of people on Facebook use private groups Naturally, the company sees an opportunity for growth Facebooks mobile app can automatically play news feed videos with the sound turned on, but you can turn it all off",neg,rules for effective marketing o are and ads now showing on via messenger bots are going to get a lot more verbose read more boy scout calendar and much more click here what kind of content should you be posting on a launches city guides with booking for restaurants awesome page post ideas for small businesses ya en hundreds of marines accused of sharing nude photos in secret group u great mark business quotes come reaction a reaction no use interesting times please like our page principles that will improve your hidden features only power users know newsletter patches jamboree pins medals knives and more click here
2017-03-06,"After the Pulse nightclub shooting, there was an outpouring of support for LGBT and Latino communities But MuslimAmericans became even more vilified European leaders want to force internet companies to police extremist content But free speech and the sharing of information would suffer We asked The New York Times audience on Facebook, Whats in your warmweather wardrobe The artist Josh Cochran illustrated their answers Conversation starters and context, drawn from the days news in Australia A new law will impose fines on companies like Facebook and Twitter if they fail to swiftly remove illegal or hateful content on their platforms The Bay Area tech scene has startup incubators and hacker spaces But what do you do when you want to figure out your next move Facebook and other online forums have become the connecting tissue for Vietnams increasingly public dissident voices And the government is fighting back Where can you be honest about your life if not Facebook The bestknown video celebrities gravitate to the mass audience of YouTube But some others are carving a niche on the worlds biggest social network Googleowned YouTube has been the internets goto destination for both viewers and wouldbe stars Now its getting some competition from the leading social network The British publicist has a moment in the media glare as the broker of the  meeting between Donald Trump Jr and a Moscow insider",pos,damn sorta forgot twitter existed for a couple months think twice before that post about a via el cine come see my group resolution digital document ya el no me en cover para camera zoom professional what does your social media use say about your personality this i want to see who you liked el cine celebrates international womens day c like us on if you want more news cede ante y la no me the question id legitimate as transforms from to its own el cine life the same with sharing
2017-03-07,"The board is considering Travis Kalanicks future and the recommendations of Eric H Holder Jrs investigation into the companys culture You could order in or make a beautiful braised chicken with salami and olives Or you could take today to plan for the week ahead To date, little has changed to achieve the executive orders stated goal to tighten up vetting of people trying to get into the country Interracial Love and Marriage While the Revolutionary Armed Forces of Colombia started laying down their arms this year, Federico Rios turned his gaze to the National Liberation Army, or ELN, the nations secondlargest rebel group In Nick Biltons American Kingpin, the former boy scout who started the Silk Road is brought down by federal agents in a dizzying manhunt Monday Advice from a host at the door, hot weather, and celebrating Loving Day Aleksei A Navalny, a leading Putin critic, was detained outside his home in Moscow as an extraordinary wave of antigovernment protests swept across Russia Couples shared stories of their interracial marriage, describing the struggles and triumphs in their lives Pork gyros seem like a project  but theyre not Cheat a little, and get them on the table soon The remains of a huge Aztec temple and a ceremonial ball court are coming to light Taimoor Raza, , was convicted of posting derogatory comments about the Prophet Muhammad on Facebook and WhatsApp Ms Kelly responded to criticism of her decision to feature Mr Jones, who has called the  Sandy Hook school massacre a hoax, on her news program Shares of Netflix, Apple and other giant technology companies that have powered a market rally have taken an uncharacteristic pause In a time of political division, Washington residents are coming together to protect an iconic species in the city Rival versions of the TrumpRussia scandal are fighting for narrative supremacy, leaving news veterans wondering, What if Watergate happened now",pos,friendly fixes massive right wing daily right wing reports stop complaining and on keep up the good work hopefully twitter will still let a conservative view on not like us on fake news shocks the world why such mishap magnate pare a chi begins flagging fake news with disputed tag via tips to grow your network increase sales on not only who knows what we are all up to we give our information to etc free gratis to make billions for and con super ultra k la a fake news shocks the world why such mishap share photos thoughts reviews on we enjoy hearing from are reactions a good idea advisor begins fake news crackdown with disputed story tag roll out i still have slots open for the march th takeover event begins flagging disputed being sold
2017-03-08,"Photos by The New York Times and by photographers from around the world Readers respond to AO Scott and Manohla Dargis rank the best films made since  The prosecution rested its case Friday, suggesting that Mr Cosby used drugs with women as more than a party tool Homemade shortbread is a cinch to master and makes a wonderful counterpart to soft summer fruit The company, rooted in the most mundane auto products, is remaking itself in an effort to become the technological backbone of selfdriving cars Friday  phone numbers, summery weather, and the Belmont Stakes Technology stocks stumbled on Friday and Britains election results sent the pound sharply lower Its grilling time Seize the warming days, and make jerk ribs or scallion lamb  even garlic bread or poundcake For many, a summer gathering means meat on the grill Heres an elegant way to do it Ranking every Beatles song, the feline friends of foreign correspondents and tips on smiling at your enemies Officer Jeronimo Yanez, who has been charged with manslaughter, said in court that he was scared to death when he shot a man he pulled over last summer A tough Saturday puzzle by Mark Diehl Our Top  Comments of the Week Readers debate the Comey testimony, British election results and the sad state of American air travel The photographer Daniel Arnold spent the month of May camped outside the New York City Clerks Office, documenting couples getting married in irreverent, wild, untraditional  and sometimes very traditional  ways Preparing for the Tony Awards is a strenuous, extended rehearsal for The Timess theater reporter Uber and Careem, its chief competitor in the Middle East, rejected the request, but it could soon be law  perhaps a recipe for sweeping surveillance The moment is ripe The means are another matter Sorry, Mark Zuckerberg The epiphany is not a dangerous lie She is an Olympic ice dancer he is a scout for the Detroit Red Wings At a salute for The End of Advertising by the former ad executive Andrew Essex, those in the industry clung to the belief that creativity would win the day",pos,on and rt ask is considering changing the algorithm like what you need to companies as exciting as to work for via steps to fix a failing page via free social media management tool media media how messenger evolved into a chat camera live con en n yeah we know that en la para never me live profits free social media management tool media media no l did you know we are on like our page today fails to remove child pornography even after numerous users reported it
