snippet,price change,News Sent.
"Guillermo del Toros latest film is an unlikely and lyrical love story, inspired by Creature From the Black Lagoon Amazoncom Inc on Wednesday announced its adoption of Kubernetes, a popular opensource technology, in a sign of increased competition in the cloud computing business, which Amazon Web Services has long dominated In a story that Nov , and previously moved on Nov , Nov , Nov  and Nov , about powerful men who have been accused of sexual misconduct, The Associated Press reported erroneously that celebrity chef John Besh had been accused by  w European hedge funds Bodenholm Capital and Westray Capital Management revealed they had taken short selling positions on some media companies, bets that their stock prices will fall, on the back of changing consumer habits  Office workers who fumble through dialing into conference call numbers could soon have Amazons Alexa start the meetings for them Amazoncom Inc wants to be your new executive assistant at work",neg,pos
"The album, which was released three weeks ago and withheld from streaming, is already the bestselling record of the year Express Scripts Holding sees Amazoncom Inc, which has been reported to be interested in entering the pharmacy market, as a possible partner rather than a competitor, the chief executive of the pharmacy benefit manager PBM said on Thursday on CN The latest landmark  Dow ,  reflects optimism about rising profits and lower taxes, and a seeming imperviousness to unsettling news The worlds most popular freetodownload game is only as successful as the device that houses it",neg,neg
"European Union governments could be stripped of their veto power on EU tax rules under proposals being prepared by the EUs executive arm, an unprecedented move that could unblock reforms long resisted by smaller states   Kroger Co issued an upbeat holiday forecast and betterthanexpected quarterly results, helped by aggressive discounts that lured more shoppers to its supermarkets, and shares soared as much as  percent",neg,neg
Blue Apron cofounder Matt Salzberg is stepping down as chief executive and being replaced with Chief Financial Officer Brad Dickerson,neg,neg
"Story Terrace, a Londonbased company, has writers that turn personal history and family legend into books In the new Amazon show JeanClaude Van Johnson, the seemingly washedup Muscles from Brussels gleefully sends up his action star image Our new gender editor offers insights and updates on the sexual misconduct scandals roiling our society We look at President Trumps role in the Republican tax plan and at the furor he set off by sharing extremist videos Sears Holdings Corp cut its third quarter loss by almost  million compared to a year ago, the company said on Thursday, benefiting from lower operating costs as it shut scores of Kmart and Sears outlets ",pos,neg
"Notable new seasonal releases from a wide variety of artists, including Gwen Stefani, Sia, Herb Alpert and Liz McComb And some goldenoldie reissues An Arkansas judge has dismissed a murder charge in a case involving evidence gathered by an Amazon Echo smart speaker Amazoncom Inc on Wednesday announced its adoption of Kubernetes, a popular opensource technology, in a sign of increased competition in the cloud computing business, which Amazon Web Services has long dominated A preview of the film In the six months since it began, NYC Ferry has been more popular than forecast, luring some commuters from the crowded and delayplagued subway Companies are more susceptible than ever to our outrage and our moral suasion Mr Doroshow organized pageants in the s, before the gay and transgenderrights movements had gotten rolling He hosted them as Flawless Sabrina The internet retailer used an annual conference to show how machine learning will spur growth at Amazon Web Services, its most profitable business While standard marital advice has us studiously marking out nights to keep passion alive, theres no phrase for time spent preserving fiscal harmony As shoppers have bought TVs and toys so far this holiday season, theyve shown a desire for deals but also an inclination for some impulse spending, retail experts say",pos,pos
"The Nasdaq posted its biggest oneday drop in more than three months on Wednesday as investors fled highflying technology  stocks and shifted to banks and other pockets of the market that could benefit from improving economic conditions, lower re French supermarket chain Carrefour could be under  pressure to do a deal with the likes of Amazon, after a deal between its French rival and a British online specialist threatened to leave it trailing behind in ecommerce Microsoft is overhauling its longtime headquarters with an building construction project that will make room for another , workers The price of a single bitcoin has pierced the , level and some experts say it could rise further The worlds most popular virtual currency allows people to buy goods and services and exchange money without involving banks, credit card issue The holiday season is supposed to be about joy, giving and spending time with our favorite people But just as you might pack on a few extra pounds over the holidays, you might pack on some extra debt, too The holiday season is supposed to be about joy, giving and spending time with our favorite people But just as you might pack on a few extra pounds over the holidays, you might pack on some extra debt, too When Mark Aselstine started online wine retailer Uncorked Ventures, he thought he should offer discounts  so gave  percent off to people buying wine baskets or subscriptions for monthly deliveries But as he analyzed the sales, he didnt  Emily Steel, a media reporter for The Times, uses encrypted messaging apps and plenty of new tech But she still harbors a love for the telephone",pos,pos
"Over the last decade, a few giant corporations became an inescapable part of online life Gutting net neutrality would cement their power Amazoncom Inc on Wednesday said members of its shopping club Prime could purchase tickets to an early screening of Sony Pictures Jumanji Welcome to the Jungle in more than , US cinemas, in its latest move to court subscribers The American government has yet to compensate any of the families of the thousands of civilian casualties from the USled battle against ISIS Why Two senators have argued that big corporations are being given preferential treatment compared with passthroughs The problem that is wrong",neg,neg
"The rugged Vikings returns for its fifth season And The Marvelous Mrs Maisel arrives for streaming The software giant plans to invest billions of dollars in renovating its campus in Redmond, Wash, to create a more urban atmosphere",neg,neg
"The latest ratings show that viewers are tuning out NBCs funandgames approach and flocking to the politically engaged Stephen Colbert and Jimmy Kimmel Since The New York Times published allegations of sexual harassment and assault against Hollywood mogul Harvey Weinstein in October, multiple men in entertainment, media and politics in the US and beyond have faced allegations ranging from inapp",neg,neg
"AfricanAmericans are going meatless in growing numbers, for reasons that range from politics to pop culture Months before a wave of scandals, creators like Aziz Ansari, Lena Dunham and Tig Notaro explored sexual abuse, particularly the role of the bystander Its planning to end net neutrality while opposing the Time Warner and ATT merger This doesnt make sense",neg,neg
"Ms Streisand takes her fans on a tour of the way she was in Barbra The Music  the Memries  the Magic Employees at several ecommerce companies recently acquired by Walmart are finding that their coverage will come at a far higher price At staff meetings held soon after the Meredith Corporation reached a deal made possible by Koch Industries, Time Inc employees have hard questions Ms Gerwig discusses Lady Bird, the film she wrote and directed And a new Smithsonian series delves into aviation innovations Is it possible to avoid having an artists biography influence the way we see his or her work Or does that excuse inappropriate and sometimes reprehensible behavior Her star turn in The Marvelous Mrs Maisel  the first major comedic role in her career  comes at a moment when its crucial to reclaim womens place in standup history We look at the messy public fight for control of the governments top consumer financial watchdog and at the deregulatory pressures it faces In acquiring the meetingorganization company, WeWork is seeking to again extend its business beyond office space into more facets of customers lives Rachel Brosnahan kills as a housewife in transition in this slowtodevelop but effervescent comedy about comedy, set in a stylized s Manhattan",pos,neg
"From the stylish to the tense, from the goodgood to the goodbad, theres something for everyone Balderton Capital has closed to new investors a new,  million fund dedicated to European technology startups, marking one of the years largest such capital raisings in the region, the company said on Monday US media company Meredith Corp said on Sunday it will buy Time Inc, the publisher of People, Sports Illustrated and Fortune magazines, in a  billion allcash deal backed by conservative billionaire brothers Charles and David Koch Weeks of deals didnt stop people from heading online to shop on the Monday after Thanksgiving Terrence Howard portrays a Memphis pimp with lofty dreams in Hustle  Flow And Le Havre sings a warm French immigrant song WalMart Stores Inc is within striking distance of matching Amazoncom Incs online prices for the first time, a key milestone in its effort to regain the low price leader title  WalMart Stores Inc is within striking distance of matching Amazoncom Incs online prices for the first time, a key milestone in its effort to regain the low price leader title  Heres what you need to know to start your day A string of armed robberies in the Midwest has led to what could be the most important case on electronic rights to go before the justices More business moguls come out against the Republicans latest stab at tax reform Germanys Delivery Hero reported a  percent jump in thirdquarter revenue on Monday, showing no let up in pace of growth of takeaway food apps Wall Streets major indexes ended little changed on Monday, retreating modestly from record highs set during the session, as gains for Amazon countered losses in shares of energy companies Cyber Monday was on track to become the biggestever internet shopping day in the United States as people snapped up bargains on toys and electronics, with many more buying from their phones",neg,pos
"The driest Thanksgiving weekend in five years may have helped holiday shopping, despite an overall decline in foot traffic But some shoppers just took notes in the hopes of finding an even better deal online Former adversaries see advantages in partnerships as they face the threat of interlopers like Amazon But will consumers benefit or face a lot less choice Accelerating glacial melt in the Andes caused by climate change has set off a gold rush downstream, letting the desert bloom But as the ice vanishes, the vast farms below may do the same Ambiguities in the yearold Outer Space Treaty may be getting in the way of entrepreneurs seeking opportunities elsewhere in our solar system Heres what you need to know to start your day Thousands of Indian sellers have shipped bedding, jewelry, kitchenware and clothing to Amazon warehouses to serve bargainhunting Americans US media company Meredith Corp said on Sunday it will buy Time Inc, the publisher of People, Sports Illustrated and Fortune magazines, in a  billion  billion pounds allcash deal backed by conservative billionaire brothers Charles and Though the image of the glamorous business traveler persists, doctors say that frequent travelers report a negative toll on their bodies, and that more research is needed",neg,neg
"Shares of Amazoncom Inc, Macys Inc, Kohls Corp and other US retailers rose on Friday on early signs that consumers are on track to spend more this holiday shopping season than in previous years  Following are five big themes likely to dominate thinking of investors and traders in the coming week and the Reuters stories related to them Ron Howards Beatles documentary has its broadcast debut And Denzel Washingtons adaptation of an August Wilson play streams on Amazon and Hulu The marketplace for makers had created a distinctive work culture Then Wall Street showed up Holiday shopping has already made the season merry for Amazon founder Jeff Bezos Parking lots were full and shopping bags were plentiful in some places Saturday as holiday giftseekers were out looking for bargains, even as the competition among retailers to offer earlier deals and snag customers first has pulled sales forward Economic policy driven by presidential pique Jennifer Gammell has turned the holiday shopping event into a tradition, with lines at Target and Toys R Us and a Thanksgiving buffet at Kings Hawaiian",neg,pos
"Technology stocks led the SampP  and Nasdaq to record closing highs on Friday, with the SampP ending above , points for the first time, while Amazon and retail stocks got a boost from signs of a strong start to the holiday shopping seas",neg,neg
"The Latest on Black Friday all times local US stores offered deep discounts, entertainment and free gifts to lure bargain hunters on Black Friday, the traditional start of the holiday retail season, but some shoppers said they were just browsing the merchandise, reserving their cash for ",neg,neg
"Retailers across Europe chased shoppers on Black Friday in a test of consumer demand, particularly in Britain, where the spending spree imported from the US looked set to outdo last year Shows and films caught up in harassment scandals have become radioactive, and the culture is wrestling with where to draw the line Workers at a half dozen Amazon distribution centers in Germany and one in Italy walked off the job Friday, in a protest timed to coincide with Black Friday to demand better wages from the American online giant",pos,neg
"US stocks set more records in quiet postholiday trading Friday as technology companies again did much of the heavy lifting Energy companies rose with the price of oil Retailers across Europe chased shoppers on Black Friday in a test of consumer demand, particularly in Britain, where the spending spree imported from the US looked set to outdo last year",pos,neg
"Retailers worked hard to attract shoppers to stores on Black Friday, offering inperson deals meant to counter the ease of shopping by phone on Amazon Indulge your s nostalgia with a new adventure of Hey Arnold Usher in the holiday season with Love Actually",pos,neg
"Some information technology companies are growing so concerned about their inability to find enough digital talent that theyre training their own An indigenous tribe that journeyed hundreds of kilometers to flee the economic crisis in Venezuela has been trapped in limbo near the border in Brazil, after it was moved off the streets of the Amazon city of Manaus In which we look back at our own rough drafts of history ",neg,neg
Doug Jones has had crucial roles in many of the directors projects this is the first time hes been the star  and a romantic hero at that,neg,neg
"Workers at Amazons main distribution hub in Italy are planning their first ever strike for Friday, trade unions said, while they are also striking at six warehouses in Germany, threatening to disrupt one of the years busiest shopping days Some information technology companies are growing so concerned about not find enough digital talent that theyre training their own",neg,neg
"Shoppers are hitting the stores on Thanksgiving as retailers under pressure look for ways to poach shoppers from their rivals Amazoncom Incs Australian arm began an ordertaking trial on Thursday, giving life to the hype which has preceded its arrival in the worlds No  economy and weighed on the shares of the brickandmortar retail sector Tech stocks remain the largest net sector exposure for equity hedge funds, which are set to deliver their strongest returns since , Goldman Sachs said on Wednesday in a note on the industrys most and least favoured areas of the market",neg,neg
"Young shoppers influenced by videos and social media are spending their money on eye shadow and lipstick, and brands like Ulta and Sephora are thriving Small companies, which have increasingly turned to the internet, worry that a payforplay system online could price them out of doing business Once the forks are put down for good, Americans will begin their holiday shopping in earnest Televisions promise to offer some of the best deals",neg,neg
"The Thanksgiving episode is a tradition all its own Our list of streamable classics offers something for everyone, from family reunions to reawakened vengeance demons Except for Amazon, most major retailers have scaled back plans for hiring temporary employees during the years biggest shopping season, and Walmart is adding almost none",pos,neg
"Donning leather and helmets sometimes, they roar along Libyas hairraising, potholed roads on carefully polished Harley Davidsons and Kawasakis Black Friday tends to be when prices for great TVs drop to their lowest But there are pitfalls, so we put together a playbook for how to snag the best TV for you Herrrrrres Paul Reiser Jamaicas government says it will protect nearly , hectares , acres in a northwest region dotted by mines that features forests, rivers and cultural sites Britain announced measures on Wednesday to tackle tax avoidance by tech giants and to hold online marketplaces like eBay and Amazoncom accountable for tax evasion via their platforms Tech stocks remain the largest net sector exposure for equity hedge funds, which are set to deliver their strongest returns since , Goldman Sachs said on Wednesday in a note on the industrys most and least favored areas of the market With Black Friday having stretched into a November full of deals, stores will be stepping it up as holiday shopping begins in earnest",neg,pos
"Battered by ecommerce competition, Macys real estate is now worth more than its market value And the company has been selling off parts or all of its most distinctive buildings Amazoncom Inc has told its Australian sellers to be ready to take orders on Nov , according to a retailer, the first time the global retail juggernaut has given a start date for sales in a country Billy Crudup is having a blast as a Midwestern sad sack and his English alter ego in David Cales oneman, doublelife play at the Vineyard Amazoncom Inc has told its Australian sellers to be ready to take orders on Nov , according to a retailer, the first time the global retail juggernaut has given a start date for doing business in the world No  economy After suffering their biggest decline in sales volumes for fourandahalf years in October, British retailers are pinning their hopes on Black Friday discounts to get shoppers spending again  Mr Mugabe has resigned as president of Zimbabwe after nearly four decades in power Will he be remembered as a tyrant, or as a hero",neg,neg
"A rollback of net neutrality regulations would represent a significant victory for companies like ATT and Comcast and would amount to a strike against consumers The European Union has agreed a plan obliging online retailers operating in the bloc to make electrical goods, concert tickets or car rental available to all EU consumers regardless of where they live Some European Union members are resisting EU plans to raise the tax bill of tech multinationals, EU draft documents seen by Reuters show, in moves that are likely to cause a public outcry after several disclosures of corporate tax avoidance scheme With everyone hopping on and off the couch, its not the best time to start a particularly involved series Heres a collection of holiday albums reviewed by The Associated Press For you and me, the Federal Communications Commissions plan to repeal net neutrality rules can be boiled down to two questions What might happen And who do you trust",neg,neg
"The head of the US Federal Communications Commission unveiled plans on Tuesday to scrap landmark  rules intended to ensure a free and open internet, moving to give broadband service providers sweeping power over what content consumers can ac",neg,neg
"Skype, Microsoft Corps internet phone call and messaging service, has disappeared from app stores in China including that of Apple Inc, indicating the latest setback for a foreign tech service in the country After suffering their biggest decline in sales volumes for fourandahalf years in October, British retailers are pinning their hopes on Black Friday discounts to get shoppers spending again  In a departure from the days when tech firms preferred old converted warehouses, they are now moving into newer highend offices",neg,neg
The business community is buzzing about the FCCs plan to dismantle net neutrality regulations and the Justice Departments lawsuit to block ATTs bid for Time Warner Have you been paying attention to the headlines this week Take our question quiz and see,neg,neg
"While standup comedy remained largely the province of men through the s and s, a few women had begun to appear on club stages and late show couches In the Marvelous Mrs Maisel, the creator of Gilmore Girls introduces another brainy, mouthy heroine, this time in the maledominated comedy world of the s Tencent Holdings Ltd has racked up some impressive gains this week  becoming the first Chinese firm to be worth more than  billion  billion and surpassing Facebook to be the worlds fifthmost valuable company Theres a growing sense that Congress is, for many women, a hostile workplace Senator Kirsten Gillibrand is trying to change that",neg,neg
"The onetime gatekeeper of Chinas internet, who purged Chinas social media of its most beloved personalities, has been detained and is under investigation The company has carved out a lucrative niche by securing valuable licensing rights and moving quickly to capitalize on surges in fan demand Our devices consume our time and dilute our social interactions In a sweeping proposal to be revealed on Tuesday, Ajit Pai, the chairman of the FCC, is preparing to scrap the net neutrality rules, said people familiar with the plan Chinas biggest social network and gaming firm Tencent Holdings, which last week reported forecastbeating quarterly results, is close to making Malaysia the first foreign country to roll out its WeChat ecosystem, an executive told Reuters A new Agatha Christie adaptation streams ahead of its theatrical release And a documentary miniseries explores the death of the rapper Tupac Shakur Asian stocks rose Wednesday after Wall Street hit new highs ahead of the twoday US break for the Thanksgiving holiday",neg,neg
"Many of the countrys more than , temporary foreign workers make less than minimum wage but feel they cant complain, a new survey showed Streaming services have more stage offerings than ever  from great actors in early roles to recent Broadway musicals, captured live Plus Hamlet in Lithuanian Mr Tambor denies the allegations, but said he could not return to the show given the politicized atmosphere that seems to have afflicted our set Jeffrey Tambor, the Emmywinning star of the Amazon web series Transparent, said on Sunday he did not see how he could return to the show next season after a second person leveled allegations of sexual harassment against him David Lettermans prize ceremony has Alist guests And Baltimore Rising paints a portrait of the city after the death of Freddie Gray In August, a dozen inventors gathered around a fire pit outside the headquarters of the US Patent and Trademark Office in Alexandria, Virginia, and set alight patents they said had been rendered worthless by an overreaching federal government  In August, a dozen inventors gathered around a fire pit outside the headquarters of the US Patent and Trademark Office in Alexandria, Virginia, and set alight patents they said had been rendered worthless by an overreaching federal government ",pos,neg
"The Justice Department plans to file a lawsuit aimed at blocking ATTs  billion bid for Time Warner French retailer Auchan AUCHUL said on Monday it had not been approached by Ecommerce giant Amazon about deals or partnerships in Europe, with speculation still rife that Amazon may be eyeing European transactions Monday Crews in white protective suits are clearing wildfire debris, Charles Manson dies, and get ready for turkey trots and Thanksgiving dinners Chinas biggest social network and gaming firm Tencent Holdings, which last week reported forecastbeating quarterly results, is close to making Malaysia the first foreign country to roll out its WeChat ecosystem, an executive told Reuters Amazon goes into the holiday season with a newly magnified brickandmortar presence, giving it more opportunities to sell its Kindle ereaders, Fire tablets and other gadgets BlackRock Inc is turning to the robots for its next big investment idea",pos,pos
Beijing has fully embraced the concept  but in ways that show just how cynical it can become Republican lawyers and lawmakers are working together to install conservative judges at a rate not seen in decades,neg,neg
"Welcome to the latest edition of the Smarter Living newsletter This fall, the balance of that power has shifted, with exhilarating, destabilizing results",neg,neg
