snippet,price change,News Sent.
"Cold noodles, hotandsour tofu, chicken curry The warm days ahead should be packed with simple dinners The bride is a marketing executive at Amazon, where the groom is a senior content acquisition manager The bride is a marketing executive at Amazon, where the groom is a senior content acquisition manager Cold noodles, hotandsour tofu, chicken curry The warm days ahead should be packed with simple dinners Officials from the Organization of the Petroleum Exporting Countries will review output cuts amid slipping compliance Internet companies, banks and automakers will release earnings Officials from the Organization of the Petroleum Exporting Countries will review output cuts amid slipping compliance Internet companies, banks and automakers will release earnings Glenn Thrush, a White House correspondent, joins us to help make sense of a busy few days at the White House Glenn Thrush, a White House correspondent, joins us to help make sense of a busy few days at the White House",neg,neg
"Ben Horowitz is helping define the modern tech age His father shaped the s radical left  before taking a hard right turn Family chats get interesting The city is newly stylish, with hyped restaurants and an Ace hotel, thanks to a steady flow of Carnegie Mellon grads who decided to stay The president also attacked the media and Hillary Clinton in a series of earlymorning tweets The president also attacked the media and Hillary Clinton in a series of earlymorning tweets Should every company create its own selfdriving program Mike and Farhad debate Should every company create its own selfdriving program Mike and Farhad debate He throws his weight around Then floats above it all But gravity has a way of catching up He throws his weight around Then floats above it all But gravity has a way of catching up Innovation is overrated When it comes to technology, we need to celebrate upkeep",pos,neg
"Friday Reaction to OJ Simpsons parole hearing, what happened when Syrian refugees moved to Fresno, and the story of Californias wild parrots Friday Reaction to OJ Simpsons parole hearing, what happened when Syrian refugees moved to Fresno, and the story of Californias wild parrots If youre up for a zombie movie, an Oscarwinning biopic and an Italian horror film, heres what to watch this weekend If youre up for a zombie movie, an Oscarwinning biopic and an Italian horror film, heres what to watch this weekend Tips to make the most of your weekend Innovation is overrated When it comes to technology, we need to celebrate upkeep The recent struggles of Apple, LinkedIn and Facebook show why the number of tech companies willing to have a try in China is dwindling",neg,neg
"Exhibit A for investors bullish on the companys future helped profitability last quarter more than double from a year ago Exhibit A for investors bullish on the companys future helped profitability last quarter more than double from a year ago A spurned woman confronts the question When you lose love, should you even try to get over it All the latenight hosts weighed in on OJ Simpsons victory before a parole board on Thursday All the latenight hosts weighed in on OJ Simpsons victory before a parole board on Thursday After Mosul, Iraq, was liberated, two Times reporters encountered a group of women who still believed that the Islamic State had taken over the world After Mosul, Iraq, was liberated, two Times reporters encountered a group of women who still believed that the Islamic State had taken over the world If China truly wants to be a climate leader, it needs to address its global climate footprint If China truly wants to be a climate leader, it needs to address its global climate footprint",neg,neg
"Before Dunkirk, the director made nine films that, viewed in sequential order, demonstrate the continuity of his vision All are available to stream Before Dunkirk, the director made nine films that, viewed in sequential order, demonstrate the continuity of his vision All are available to stream TV shows, movies and more have moved their promotional efforts offsite and off the charts Get ready for genetic swabbing, too TV shows, movies and more have moved their promotional efforts offsite and off the charts Get ready for genetic swabbing, too Tips to make the most of your weekend",neg,neg
"The hedge fund Jana Partners, which sought changes at the grocery chain before its  billion deal with Amazon, has sold its  percent stake in Whole Foods The series  for  remembers soccers first pop icon, the Manchester United player George Best And you can restream Atlanta, Donald Glovers Emmynominated comedy The series  for  remembers soccers first pop icon, the Manchester United player George Best And you can restream Atlanta, Donald Glovers Emmynominated comedy The Last Tycoon, a nineepisode series, is the latest goodlooking attempt to adapt F Scott Fitzgerald for the screen Exclusive audio from The Timess wideranging interview, in which Mr Trump discusses Vladimir Putin, Jeff Sessions and James Comey Exclusive audio from The Timess wideranging interview, in which Mr Trump discusses Vladimir Putin, Jeff Sessions and James Comey",neg,neg
"A preview of the film Congressman Tom Rooney thought that being in the majority would solve everything He talks about the daily frustrations of governing in Washington In October, Iraqi forces set out to retake Mosul, one of Iraqs largest cities and ISISs biggest stronghold in the country It would take them nine months and cost thousands of lives Congressman Tom Rooney thought that being in the majority would solve everything He talks about the daily frustrations of governing in Washington Misscliks, a channel on the video game streaming platform Twitch, aims to be a safe space for underrepresented gamers, with no tolerance for sexism or bullying Women made up only onethird of the onair talent paid at least , by the broadcaster in the past year The Last Tycoon, a nineepisode series, is the latest goodlooking attempt to adapt F Scott Fitzgerald for the screen The social giant is working with media companies on a new tool that would push Facebook users to buy subscriptions to news outlets The social giant is working with media companies on a new tool that would push Facebook users to buy subscriptions to news outlets The hedge fund Jana Partners, which sought changes at the grocery chain before its  billion deal with Amazon, has sold its  percent stake in Whole Foods",neg,pos
"The companys acquisition of Whole Foods sets up a clash between two vastly different visions for the future of labor The companys acquisition of Whole Foods sets up a clash between two vastly different visions for the future of labor Two more Republican senators said that they would oppose the bill to repeal the Affordable Care Act What happens now Two more Republican senators said that they would oppose the bill to repeal the Affordable Care Act What happens now Most of Hampton Creeks board resigned last month, another setback in Silicon Valleys push to innovate beyond the hightech industry Most of Hampton Creeks board resigned last month, another setback in Silicon Valleys push to innovate beyond the hightech industry",pos,neg
"A cadre of British tech whizzes grapple with their newfound wealth and their mouthy American boss And Rachel goes home with the four remaining suitors We get to know the de facto leader of President Trumps commission to investigate the  election We get to know the de facto leader of President Trumps commission to investigate the  election Mr Peltzs Trian Fund Management is seeking a board seat at the consumer products giant, signaling a ratchetingup in the size of the corporate targets of activist investors A preview of the film",neg,neg
"One week after the rappers album debuted on Tidal, it became available for streaming and download on other services, and rocketed to top the chart Now that Sunday nights mean Game of Thrones and Twin Peaks, our TV critic is craving shows that feel a little more real Now that Sunday nights mean Game of Thrones and Twin Peaks, our TV critic is craving shows that feel a little more real If you want to brush up on your Jodie Whittaker before she makes her debut as the first female Doctor, great news  shes in a lot of stuff, and shes terrific If you want to brush up on your Jodie Whittaker before she makes her debut as the first female Doctor, great news  shes in a lot of stuff, and shes terrific John S Varley, the former chief executive, and three other former top managers will answer charges about arrangements with Qatar, and the European Central Banks president will talk policy John S Varley, the former chief executive, and three other former top managers will answer charges about arrangements with Qatar, and the European Central Banks president will talk policy A cadre of British tech whizzes grapple with their newfound wealth and their mouthy American boss And Rachel goes home with the four remaining suitors",pos,neg
"The ballerinas Dorothe Gilbert, Teresa Reichlen and Olga Smirnova talk about their roles in Lincoln Center Festivals production of this  ballet Tips to make the most of your weekend Donald Trump Jr sends an email Hours later, his father gives a speech Conspiracy or coincidence Donald Trump Jr sends an email Hours later, his father gives a speech Conspiracy or coincidence By teaming up with Yandex on an East European venture, the ridehailing giant is again choosing cooperation instead of conflict Faced with waves of store closures, malls look far and wide for new visitor magnets Golf, anyone Karaoke Three of the betterperforming stock funds scored with picks as varied as wellknown technology companies, microcap stocks and Asian innovators Companies across the board are repurchasing their own stock, to the delight of some investors But there are plenty of downsides Heres where you can stream most of the major winners of the th Annual Primetime Emmy Awards If youre up for a detailed biopic, a rediscovered documentary or a scary childrens film, heres what to watch this weekend If youre up for a detailed biopic, a rediscovered documentary or a scary childrens film, heres what to watch this weekend Heres what you need to know at the end of the day A highpowered Silicon Valley attorney dies His exwife investigates, and finds a web of drug abuse in his profession Three Times tech reporters discuss Snaps difficulties as a public company, and the socalled net neutrality debate Three Times tech reporters discuss Snaps difficulties as a public company, and the socalled net neutrality debate Mr Bachman was a pioneer in the field of database management software, and modern digital commerce sites like Amazon and eBay owe an intellectual debt to his work Cersei Lannister wreaks havoc from the Iron Throne as HBOs fantasy epic begins Season  And Michael Palin of the Monty Python troupe plays it straight Cersei Lannister wreaks havoc from the Iron Throne as HBOs fantasy epic begins Season  And Michael Palin of the Monty Python troupe plays it straight Welcome to the latest edition of the Smarter Living newsletter Welcome to the latest edition of the Smarter Living newsletter A marketing effort to get free razors in the hands of young men for their th birthdays has sometimes reached the wrong target Mr Bachman was a pioneer in the field of database management software, and modern digital commerce sites like Amazon and eBay owe an intellectual debt to his work Online technology lets independent advisers pose a direct threat to the old model of huddling with brokers in paneled offices in big brokerage houses Nelson Peltzs Trian has begun a proxy fight at the consumer products giant, the biggest yet waged by an activist shareholder Nelson Peltzs Trian has begun a proxy fight at the consumer products giant, the biggest yet waged by an activist shareholder Monday Big Surs isolation, a looming marijuana crackdown and Venice Beachs shrinking housing supply One week after the rappers album debuted on Tidal, it became available for streaming and download on other services, and rocketed to top the chart",neg,pos
"Hundreds of companies coordinated a huge online protest on Wednesday against the Federal Communications Commissions plan to scrap net neutrality rules Are you using your friends exboyfriends parents password to watch the latest television shows Youre not alone Are you using your friends exboyfriends parents password to watch the latest television shows Youre not alone Got a halfhour and a sense of humor How about seven hours and a sense of intrigue Weve got suggestions Got a halfhour and a sense of humor How about seven hours and a sense of intrigue Weve got suggestions References to  A Space Odyssey, The Night of the Hunter and Carnival of Souls are seen in a recent hour of Mr Lynchs revival References to  A Space Odyssey, The Night of the Hunter and Carnival of Souls are seen in a recent hour of Mr Lynchs revival A new CW series goes for Indiana Joneslike adventure but doesnt quite succeed And  for  explores the chemistry between Mike Francesa and Chris Russo A new CW series goes for Indiana Joneslike adventure but doesnt quite succeed And  for  explores the chemistry between Mike Francesa and Chris Russo As big retailers like Dollar Tree expand in New York City, independent stores are changing inventory and emphasizing their local roots But some still fail Was Donald Trump Jrs meeting with a Russian lawyer politics as usual The history and logistics of digging up dirt on political opponents Was Donald Trump Jrs meeting with a Russian lawyer politics as usual The history and logistics of digging up dirt on political opponents For all the influence of the Objectivist principles set forth in The Fountainhead and other works, some prominent followers have run into trouble A list of the  Emmy nominations, announced on Thursday",neg,neg
"A new CW series sends a pair of adventurers around the world in search of the usual precious artifacts New York Times reporters who had obtained emails to and from Mr Trump gave him until  am Tuesday to comment He met the deadline in a surprising way New York Times reporters who had obtained emails to and from Mr Trump gave him until  am Tuesday to comment He met the deadline in a surprising way The law requires companies to store Chinese users information in China, and Apples move suggests other foreign technology companies may have to do the same",neg,neg
"As the rise of AI creates demand for new computing hardware, the giant chip maker is using acquisitions and new products to try to stay ahead Corrections appearing in print on Tuesday, July ,  Corrections appearing in print on Tuesday, July ,  Heres what you need to know to start your day Julie Delpy and Ethan Hawke return as Celine and Jesse in the final installment in Richard Linklaters Before Trilogy And a new series riffs on a millennial Cosmo girl Julie Delpy and Ethan Hawke return as Celine and Jesse in the final installment in Richard Linklaters Before Trilogy And a new series riffs on a millennial Cosmo girl Connecting the dots on Donald Trump Jrs communications last summer Connecting the dots on Donald Trump Jrs communications last summer Tuesday Retail woes, a Yankee wins Home Run Derby, and World Population Day The authorities said the smart home device made an emergency call, but Amazon and a  official said that was not plausible Siri is so five years ago How a sleek, smoothtalking cylinder from Amazon stole our hearts, bamboozled our spouses and enchanted our children The law requires companies to store Chinese users information in China, and Apples move suggests other foreign technology companies may have to do the same Hundreds of companies coordinated a huge online protest on Wednesday against the Federal Communications Commissions plan to scrap net neutrality rules The company, Moon Express, is aiming to win the  million Google Lunar X Prize competition and become a payload delivery company A new CW series sends a pair of adventurers around the world in search of the usual precious artifacts",neg,neg
"Andy Samberg plays a narcissistic pop star and a dopedup cyclist And The Salesman, a best foreignlanguage film Oscar winner, arrives on Amazon Andy Samberg plays a narcissistic pop star and a dopedup cyclist And The Salesman, a best foreignlanguage film Oscar winner, arrives on Amazon Weirdly, were still building corporate campuses like its the s The literary establishment condemns his work But people are buying it Dr Dre and Jimmy Iovine get the star treatment from HBO And a recently discovered photograph may solve the mystery of what happened to Amelia Earhart A group of news organizations plans to ask Congress for the right to negotiate with the online giants, which are gaining greater shares of digital advertising and distribution Dr Dre and Jimmy Iovine get the star treatment from HBO And a recently discovered photograph may solve the mystery of what happened to Amelia Earhart Amazons annual deals blowout, Prime Day, is back again  but not all the deals are worthwhile Luckily, we can help Heres what you need to know at the end of the day President Trumps son was promised damaging information about Hillary Clinton before meeting a Russian lawyer Plus, Rukmini Callimachi is on the ground in the Iraqi city of Mosul President Trumps son was promised damaging information about Hillary Clinton before meeting a Russian lawyer Plus, Rukmini Callimachi is on the ground in the Iraqi city of Mosul Amazons annual deals blowout, Prime Day, is back again  but not all the deals are worthwhile Luckily, we can help The authorities said the smart home device made an emergency call, but Amazon and a  official said that was not plausible The Oscarwinning writer and director is working on a film adaptation of Baldwins If Beale Street Could Talk, a love story set in Harlem, NY The Oscarwinning writer and director is working on a film adaptation of Baldwins If Beale Street Could Talk, a love story set in Harlem, NY The common refrain is that Amazon and other etailers are killing retail jobs, but one new statistical analysis begs to differ",neg,neg
"David Lynch has said that his featurelength Twin Peaks prequel is crucial to understanding the new episodes on Showtime Heres a closer look Okja is incredibly dark for a childrens film But it doesnt feel entirely like a fantasy for grownups In other words, its a Bong Joon Ho film Okja is incredibly dark for a childrens film But it doesnt feel entirely like a fantasy for grownups In other words, its a Bong Joon Ho film A preview of the film A preview of the film The layoffs cut the streaming music sites work force by about  percent and could be a way to make it more attractive to a buyer The layoffs cut the streaming music sites work force by about  percent and could be a way to make it more attractive to a buyer Employers added , workers in June, a healthy showing, but a tightening labor market has not followed historical patterns in driving up pay Warren E Buffett announced a plan to buy Energy Future Holdings, the longtroubled Texas power giant, to gain its Oncor utilities arm Donald J Trumps life and career have been defined by his legal battles But what will they mean for his presidency Donald J Trumps life and career have been defined by his legal battles But what will they mean for his presidency Consider the jalapeo with salmon, stuffed, in pasta or a queso fundido  even in tartar sauce Tips to make the most of your weekend",pos,neg
"In the slow summer TV months, try movies First Wives Club is streaming Also, fans of Ms DiDonato, the mezzosoprano star, can see her on medicitv North Koreas test of a missile that could potentially strike Alaska has crossed a line, and underscores a dilemma for President Trump The combination of soaring tech stocks and everpopular exchangetraded funds has traditional fund managers scratching their heads The combination of soaring tech stocks and everpopular exchangetraded funds has traditional fund managers scratching their heads Amazons Kindle ereaders and tablets have been able to play music for years, and there are a few ways to move your listening library to a new device Amazons Kindle ereaders and tablets have been able to play music for years, and there are a few ways to move your listening library to a new device",neg,neg
"The explosion in indextracking ETFs and soaring tech stocks have put traditional mutual fund managers like those at Parnassus Investments on the defensive Snowfall, the latest entry into the goldenage TV genre of drug dramas, has its premiere on FX And The Boss Baby is streaming on iTunes Medicaid now covers more Americans than Medicare does, and it has played a major role in stopping the Republican drive to repeal the Affordable Care Act Two separate takeover bids for Britains Worldpay, including one by JPMorgan Chase, signal the latest battle to control how consumers pay for goods Even if you have a laptop with the newer USBC connections, you can find cables and adapters to hook up your small screen with a big monitor Even if you have a laptop with the newer USBC connections, you can find cables and adapters to hook up your small screen with a big monitor Fine jewelry, swimsuits and cocktail dresses are among the many items you can live with free for a while till its time to pay up or wrap up From Game of Thrones to a promising TV adaptation of an F Scott Fitzgerald classic, the summer slow season is pleasantly packed The explosion in indextracking ETFs and soaring tech stocks have put traditional mutual fund managers like those at Parnassus Investments on the defensive News of the cuts comes a week after the company described sweeping changes that will shift resources to selling cloudcomputing services",pos,neg
"Fireworks light up the skies over New York and Washington, and Americans recite the Declaration of Independence, Constitution and Bill of Rights Fireworks light up the skies over New York and Washington, and Americans recite the Declaration of Independence, Constitution and Bill of Rights An advocate generals recommendation to Europes highest court said that France could prohibit certain types of transport services it deemed illegal",neg,neg
"The Minions proved unstoppable, but the Sony heist movie Baby Driver, written and directed by Edgar Wright, beat analysts expectations Welcome to the second edition of the Smarter Living newsletter How can America have a feelgood birthday when one of the pillars of our yearold republic is under neardaily assault from the highest levels of the government No sand or surf this holiday weekend Stream a few of the  summery tales on Fandor Or sleuth alongside Marta Dusseldorp, one of Australias busiest actresses No sand or surf this holiday weekend Stream a few of the  summery tales on Fandor Or sleuth alongside Marta Dusseldorp, one of Australias busiest actresses Were halfway through the year Heres where things stand",neg,neg
"The whole point of training wheels is that eventually you dont need them anymore As a targeted travel ban goes into effect, the Trump administration has defined whos close family, and whos not, for visitors from six predominantly Muslim nations Central bankers signaling a move away from low rates, presaging the end of hyperliquidity, has sent many shares sliding Suggested reading from critics and editors at The New York Times Heres everything you need to know about the new streaming service  a joint venture by the Criterion Collection and Turner Classic Movies If youre in the mood to watch an animal adventure movie, a documentary about kids or an Iranian road trip film, heres what to watch this weekend More than two dozen women in the tech startup industry spoke to The New York Times about being sexually harassed by investors and mentors Eva, an eggshape vibrator for couples, taps into a profeminist market The Smithsonian Channel explores the lives of the countrys first ladies And MLB Network celebrates the th anniversary of The Pride of the Yankees The Smithsonian Channel explores the lives of the countrys first ladies And MLB Network celebrates the th anniversary of The Pride of the Yankees",neg,neg
"I remember when anything I needed magically showed up at the door Those were the days Charlie Hunnam mesmerizes as a British explorer lured time and again into the Amazon And a French pediatrician obsesses over a woman who may or may not be dead Charlie Hunnam mesmerizes as a British explorer lured time and again into the Amazon And a French pediatrician obsesses over a woman who may or may not be dead A tweet may have implied support for legislation helping states force online retailers to collect sales taxes But that is already Amazons practice Tips to make the most of your weekend Rooney Mara, Michael Fassbender and Ryan Gosling play lovers in the Austin, Tex, scene And Naomi Watts takes a tame walk on the wild side",neg,neg
"New movies and TV shows are added to streaming platforms each month Here are the titles we think are most interesting in July President Trump has taken credit for a surging market this year But tech stocks, the Fed and the president himself could change that picture The British authorities on Thursday asked regulators to further examine st Century Foxs deal for the European satellite giant Nearly all of the top lenders in the US passed the governments stress test, freeing them to pay out their chunkiest dividends in a decade The United States says it wants to defeat the Islamic State, not fight the Syrian government But its getting harder stay out of the civil war A new startup incubator in Paris symbolizes Frances tech ambitions, but can the land of the hour workweek overcome its cultural and regulatory barriers to surpass London and other tech hubs I remember when anything I needed magically showed up at the door Those were the days",pos,pos
