snippet,price change,News Sent.
"What a halfcentury of medicine  and a population in the Amazon  can teach young people about living longer The th and final group of Annenberg fellows was announced, and the upandcoming artists include one who performed for President Obama Great reads, from Dean Baquet Love it or hate it, La La Land finally dances onto streaming services And in In a World  , Lake Bell writes herself a role worthy of her talents Love it or hate it, La La Land finally dances onto streaming services And in In a World  , Lake Bell writes herself a role worthy of her talents How Bashar alAssad of Syria, a mildmannered ophthalmologist, became a ruler who uses chemical weapons against his own people How Bashar alAssad of Syria, a mildmannered ophthalmologist, became a ruler who uses chemical weapons against his own people Great reads, from Dean Baquet Dedicated video streaming platforms like YouTube and Twitch are looking for ways to sweeten the deal for streamers so they produce more live content Investors have been energized by the electriccar makers upbeat outlook for delivering its massmarket model Now its chief, Elon Musk, must deliver Investors have been energized by the electriccar makers upbeat outlook for delivering its massmarket model Now its chief, Elon Musk, must deliver Toni Erdmann, Maren Ades deliriously silly Oscar nominee, arrives on streaming platforms And dont miss Aisha Hinds as Harriet Tubman on Underground Toni Erdmann, Maren Ades deliriously silly Oscar nominee, arrives on streaming platforms And dont miss Aisha Hinds as Harriet Tubman on Underground My colleague Jeremy Peters discusses the growing perception that Mr Bannon is in trouble in the White House, and his deteriorating relationship with Jared Kushner My colleague Jeremy Peters discusses the growing perception that Mr Bannon is in trouble in the White House, and his deteriorating relationship with Jared Kushner The commercial was a novel but potentially invasive marketing tactic that came as more Americans use voiceactivated devices",neg,neg
"Heres what you need to know about the weeks top stories Todays striking advances in artificial intelligence owe a lot to research in Canada over the years But the country has so far failed to cash in Todays striking advances in artificial intelligence owe a lot to research in Canada over the years But the country has so far failed to cash in Salted pretzels the size of steering wheels Chicken sandwiches with waffles for buns Salami bites All will soon be available at AMC Theaters The th and final group of Annenberg fellows was announced, and the upandcoming artists include one who performed for President Obama Julia, an autistic yearold Muppet, debuts on Sesame Street And Better Call Saul and Angie Tribeca begin new seasons Julia, an autistic yearold Muppet, debuts on Sesame Street And Better Call Saul and Angie Tribeca begin new seasons Why Mr Trumps decision to launch missiles into Syria is at odds with nearly everything he has said about Syria Why Mr Trumps decision to launch missiles into Syria is at odds with nearly everything he has said about Syria What a halfcentury of medicine  and a population in the Amazon  can teach young people about living longer",neg,neg
Salted pretzels the size of steering wheels Chicken sandwiches with waffles for buns Salami bites All will soon be available at AMC Theaters Heres what you need to know about the weeks top stories,neg,neg
"Once we would brag of not needing very much of it Now deep slumber is a coveted state achieved with gadgets, apps, gizmos and classes The new book, Old School, is billed as a defense of traditional values and includes advice on how men should treat women respectfully Initial sales are strong The new book, Old School, is billed as a defense of traditional values and includes advice on how men should treat women respectfully Initial sales are strong Once we would brag of not needing very much of it Now deep slumber is a coveted state achieved with gadgets, apps, gizmos and classes",neg,neg
"Our roundup of the news and feature stories about young people that have recently appeared across sections of NYTimescom Our roundup of the news and feature stories about young people that have recently appeared across sections of NYTimescom We navigate through a historic day in the United States Senate and a troubling day in Syria We navigate through a historic day in the United States Senate and a troubling day in Syria In I Am Flying Into Myself, the selected works of poetic outsider Bill Knott are often touched by a brutal humor In I Am Flying Into Myself, the selected works of poetic outsider Bill Knott are often touched by a brutal humor The sites eclecticism  subgenres on top of subgenres  combines daily film news aggregation and a library that bridges cult and mainstream The sites eclecticism  subgenres on top of subgenres  combines daily film news aggregation and a library that bridges cult and mainstream Pete the Cat No  on the picture books list is now starring in a puppet show, a musical and an upcoming Amazon TV show",neg,neg
"The Oscars were just over a month ago, and a handful of the nominees and winners are only recently available to stream on digital platforms People love to hate online adds, particularly the automated kind dropped into websites or videos But proponents say critics are overstating the issues People love to hate online adds, particularly the automated kind dropped into websites or videos But proponents say critics are overstating the issues Heres what you need to know to start your day Heres what you need to know to start your day Nicole Kidman plays Gertrude Bell, the British adventurer, archaeologist and linguist who has been labeled the female Lawrence of Arabia Nicole Kidman plays Gertrude Bell, the British adventurer, archaeologist and linguist who has been labeled the female Lawrence of Arabia Pete the Cat No  on the picture books list is now starring in a puppet show, a musical and an upcoming Amazon TV show American Playboy rides the sexual revolution with Mr Hefner And the first season of Baz Luhrmanns The Get Down returns to the disco floor American Playboy rides the sexual revolution with Mr Hefner And the first season of Baz Luhrmanns The Get Down returns to the disco floor",pos,neg
"President Trump sits down for an exclusive interview with The Times President Trump sits down for an exclusive interview with The Times Members of a unit struggling to curb the jungles destruction include an environmental activist, an Arctic oceanographer and a science teacher What some Bolivians with the worlds healthiest arteries might tell us about cardiac fitness What some Bolivians with the worlds healthiest arteries might tell us about cardiac fitness A writer explores our preoccupation with the apocalypse  and general catastrophe and survival A writer explores our preoccupation with the apocalypse  and general catastrophe and survival Facial recognition and other technology are set to further personalize the driving experience Facial recognition and other technology are set to further personalize the driving experience The electriccar maker is the latest company to become a market darling based not on what it has achieved but on a vision of a dominant future The electriccar maker is the latest company to become a market darling based not on what it has achieved but on a vision of a dominant future The Oscars were just over a month ago, and a handful of the nominees and winners are only recently available to stream on digital platforms",pos,neg
"Standing with a reusable booster and a model of a capsule for carrying humans into space, the billionaire disclosed that he had been financing his rocket company by selling shares in his company Heres what you need to know to start your day Heres what you need to know to start your day",pos,neg
"How will space travel be used in the future  for industry, countries, companies, and for ordinary, individual Earthlings Heres what you need to know to start your day Heres what you need to know to start your day President Trump treats the Syrian president as a potential ally Will Tuesdays deadly chemical weapons attack change that President Trump treats the Syrian president as a potential ally Will Tuesdays deadly chemical weapons attack change that The thriller picks up nine weeks after a waspfilled cataclysm and introduces Dennis Quaid to a cast of characters facing environmental catastrophe Members of a unit struggling to curb the jungles destruction include an environmental activist, an Arctic oceanographer and a science teacher Standing with a reusable booster and a model of a capsule for carrying humans into space, the billionaire disclosed that he had been financing his rocket company by selling shares in his company",neg,neg
"The internet retailer agreed to pay about  million for the streaming rights to  games, according to a person briefed on the deal At this retail intermediary on the Lower East Side of Manhattan, you never know which rookies will catch on How will space travel be used in the future  for industry, countries, companies, and for ordinary, individual Earthlings",neg,neg
"The thriller picks up nine weeks after a waspfilled cataclysm and introduces Dennis Quaid to a cast of characters facing environmental catastrophe The internet retailer agreed to pay about  million for the streaming rights to  games, according to a person briefed on the deal",neg,neg
"Jonathan Weisman and Jennifer Steinhauer talk about the nuclear option in the confirmation hearings for Judge Neil M Gorsuch The case was viewed as a test of social media companies ability to push back on information requests from prosecutors At this retail intermediary on the Lower East Side of Manhattan, you never know which rookies will catch on",neg,neg
"As the application season opens for HB visas for foreign workers, the Trump administration warns tech companies they will face more scrutiny As the application season opens for HB visas for foreign workers, the Trump administration warns tech companies they will face more scrutiny Eight years later, Prison Break is back  and as preposterous as ever And Louis CK is at his best as he tackles  in a new Netflix special Eight years later, Prison Break is back  and as preposterous as ever And Louis CK is at his best as he tackles  in a new Netflix special Jonathan Weisman and Jennifer Steinhauer talk about the nuclear option in the confirmation hearings for Judge Neil M Gorsuch",neg,neg
"Players steal balls and hearts on Meow Madness And Abortion Stories Women Tell visits a state with some of the countrys strictest regulations Players steal balls and hearts on Meow Madness And Abortion Stories Women Tell visits a state with some of the countrys strictest regulations We talk with Emily Steel, who has spent months reporting on Fox Newss  million in settlements for harassment allegations against its biggest star We talk with Emily Steel, who has spent months reporting on Fox Newss  million in settlements for harassment allegations against its biggest star Researchers are studying the effects of antibioticresistant genes in the oceans The case was viewed as a test of social media companies ability to push back on information requests from prosecutors Officials financial disclosure forms raise more questions than they answer and provide no assurance of ethical behavior Officials financial disclosure forms raise more questions than they answer and provide no assurance of ethical behavior",neg,neg
"Tips for making the most of your weekend Tips for making the most of your weekend Seeking amusement after a tough week, sweetie darlings Absolutely Fabulous The Movie comes to HBO Red Dwarf, the scifi comedy, is on BritBox Seeking amusement after a tough week, sweetie darlings Absolutely Fabulous The Movie comes to HBO Red Dwarf, the scifi comedy, is on BritBox Officials in El Salvador showed exemplary foresight in banning mining of gold and other metals Officials in El Salvador showed exemplary foresight in banning mining of gold and other metals The startup has undertaken an extraordinary experiment in behavioral science to subtly entice an independent work force to maximize company revenue The startup has undertaken an extraordinary experiment in behavioral science to subtly entice an independent work force to maximize company revenue Researchers are studying the effects of antibioticresistant genes in the oceans",pos,neg
"Companies that have embraced environmental goals are represented on White House councils, offering influence that advocacy groups hope theyll use We talk about the Washington drama with Representative Devin Nunes at the center, and why young men in India are intentionally calling wrong numbers We talk about the Washington drama with Representative Devin Nunes at the center, and why young men in India are intentionally calling wrong numbers On World Backup Day, heres a quick guide to safeguarding your digital photos, videos, documents and emails by creating second copies of them On World Backup Day, heres a quick guide to safeguarding your digital photos, videos, documents and emails by creating second copies of them The rapper and actor on the new album of his thrashmetal band, Body Count Black Lives Matter and his shift from shocking to philosophical music The rapper and actor on the new album of his thrashmetal band, Body Count Black Lives Matter and his shift from shocking to philosophical music Find the best new movies and TV shows to stream on Netflix, Amazon Prime, Hulu and HBO in April Find the best new movies and TV shows to stream on Netflix, Amazon Prime, Hulu and HBO in April Here are the titles we think are most interesting, broken down by service Here are the titles we think are most interesting, broken down by service",neg,neg
"The Amazing Race throws caution to the wind in its new season And dream of sunnier climes with some beachy diversions Forget the political For the , coal miners in the United States, this is just about daily life We called one of them Forget the political For the , coal miners in the United States, this is just about daily life We called one of them Our streaming columnist provides a budget and genreconscious way for viewers to binge, purge and watch movies on demand Our streaming columnist provides a budget and genreconscious way for viewers to binge, purge and watch movies on demand It is the industrys highest sales figure since  and its best percentage gain since  Companies that have embraced environmental goals are represented on White House councils, offering influence that advocacy groups hope theyll use",neg,neg
"The White House said its next move to deregulate broadband service would be to jettison the Obama administrations net neutrality rules, which were intended to safeguard free expression online The Brooklyn neighborhood synonymous with poverty is working to remake itself without giving in to the forces of gentrification The Brooklyn neighborhood synonymous with poverty is working to remake itself without giving in to the forces of gentrification The use of a rocket booster that had flown once before may open an era of cheaper space travel, particularly for business ventures like satellite companies The use of a rocket booster that had flown once before may open an era of cheaper space travel, particularly for business ventures like satellite companies The Amazing Race throws caution to the wind in its new season And dream of sunnier climes with some beachy diversions",neg,neg
"Trumps promise to do away with Obamas legacy on climate change, and Theresa Mays farewell to the European Union One new show, FXs Legion, wraps up its maiden season as another, Imaginary Mary, has its premiere on ABC It is the industrys highest sales figure since  and its best percentage gain since  Edward Lampert was a Wall Street wunderkind And department stores still had promise What a difference a decade makes Edward Lampert was a Wall Street wunderkind And department stores still had promise What a difference a decade makes Reusing boosters are not a new idea, but SpaceX proved on Thursday the technology works It may be a faster gateway to the solar system Reusing boosters are not a new idea, but SpaceX proved on Thursday the technology works It may be a faster gateway to the solar system The White House said its next move to deregulate broadband service would be to jettison the Obama administrations net neutrality rules, which were intended to safeguard free expression online",pos,neg
"Viacom is hoping James Gianopulos, who previously ran th Century Fox, can bring stability to a studio that lost  million in its last fiscal year Richard Nelsons trilogy of plays, The Gabriels Election Year in the Life of One Family, is on BroadwayHDcom And Bones ends its run on Fox President Trump wanted a faster battle plan Iraqi leaders wanted quicker airstrikes Is that why about  civilians are now dead in Mosul President Trump wanted a faster battle plan Iraqi leaders wanted quicker airstrikes Is that why about  civilians are now dead in Mosul Richard Nelsons trilogy of plays, The Gabriels Election Year in the Life of One Family, is on BroadwayHDcom And Bones ends its run on Fox One new show, FXs Legion, wraps up its maiden season as another, Imaginary Mary, has its premiere on ABC Trumps promise to do away with Obamas legacy on climate change, and Theresa Mays farewell to the European Union",neg,neg
"Mr Jenkins, the filmmaker behind Moonlight, will write and direct this series based on Colson Whiteheads awardwinning novel Mr Jenkins, the filmmaker behind Moonlight, will write and direct this series based on Colson Whiteheads awardwinning novel In collaboration with the research firm CB Insights, The New York Times presents the top  venture investors this year, many of whom have moved around from  In collaboration with the research firm CB Insights, The New York Times presents the top  venture investors this year, many of whom have moved around from  Viacom is hoping James Gianopulos, who previously ran th Century Fox, can bring stability to a studio that lost  million in its last fiscal year",pos,neg
Heres what you need to know to start your day Canadian sponsors of Syrian refugees at the end of their yearlong commitment what happens now that the Republican health care bill failed Canadian sponsors of Syrian refugees at the end of their yearlong commitment what happens now that the Republican health care bill failed,neg,neg
"Mr Driver gets behind the wheel  and turns his musings into poetry  in Paterson And an expectant mother goes on a killing rampage guided by her fetus in Prevenge The online retailing giant is trying to bring its own formula to traditional retailing If it is successful, it could change how all stores operate Travel through Victorian England as the Bront sisters prove themselves in a mans world Then take a Mediterranean vacation with some passionate couples Travel through Victorian England as the Bront sisters prove themselves in a mans world Then take a Mediterranean vacation with some passionate couples As Congress acts to roll back regulations limiting access to consumer data, several states are considering laws that could have a wide impact As Congress acts to roll back regulations limiting access to consumer data, several states are considering laws that could have a wide impact Heres what you need to know to start your day Kirsten Green is unusual for a number of reasons She never worked at a venture capital firm before starting her own, and shes a woman in a maledominated field Kirsten Green is unusual for a number of reasons She never worked at a venture capital firm before starting her own, and shes a woman in a maledominated field",neg,neg
"Closing your social media accounts can help protect your privacy, but it can also mean cutting yourself off from friends, family and opportunity It was supposed to be a historic day for Republicans as the House voted to repeal President Obamas health care law That, at least, was the idea The online retailing giant is trying to bring its own formula to traditional retailing If it is successful, it could change how all stores operate Mr Driver gets behind the wheel  and turns his musings into poetry  in Paterson And an expectant mother goes on a killing rampage guided by her fetus in Prevenge",neg,neg
"Heres what you need to know to start your day Heres what you need to know to start your day Closing your social media accounts can help protect your privacy, but it can also mean cutting yourself off from friends, family and opportunity",neg,neg
"With losses mounting, Sears Holdings Corporation said in its annual report that there were substantial doubts it could continue operating With losses mounting, Sears Holdings Corporation said in its annual report that there were substantial doubts it could continue operating On Day  of the confirmation hearings for Judge Neil M Gorsuch, senators want to know for whom he works the president, corporations or regular Americans This essay collection finds a firebrand author railing against modern feminism and groupthink at American universities March Madness driving you crazy Ease your mind with Jim Jarmuschs portrait of Iggy Pop, or with a quirky film lineup chosen by Ms Slate March Madness driving you crazy Ease your mind with Jim Jarmuschs portrait of Iggy Pop, or with a quirky film lineup chosen by Ms Slate The House Republicans finally have everything they need to overhaul the health care system as Mr Ryan dreamed of in  So whats the problem The House Republicans finally have everything they need to overhaul the health care system as Mr Ryan dreamed of in  So whats the problem Explosive feelings, personal and political, are the subject of a strange and wonderful exhibition at the Onassis Cultural Center Explosive feelings, personal and political, are the subject of a strange and wonderful exhibition at the Onassis Cultural Center The purchase price for Souqcom is pocket change for the online retailing giant, yet overseas buyers have found this market challenging The purchase price for Souqcom is pocket change for the online retailing giant, yet overseas buyers have found this market challenging This essay collection finds a firebrand author railing against modern feminism and groupthink at American universities It was supposed to be a historic day for Republicans as the House voted to repeal President Obamas health care law That, at least, was the idea",neg,pos
"The retail giant has formed an internal venture arm to hatch new online businesses by incubating startups in emerging technology fields Americas top intelligence officials say the words President Trump never wanted to hear  under oath, on the record and on live TV Americas top intelligence officials say the words President Trump never wanted to hear  under oath, on the record and on live TV The pioneering cookbook author, who has Alzheimers disease, no longer cooks much But a special diet and persistence keep her as kinetic as ever On Day  of the confirmation hearings for Judge Neil M Gorsuch, senators want to know for whom he works the president, corporations or regular Americans Shots Fired, a new drama, complicates the debate over police violence in America And Pedro Almodvar presents another woman on the verge Shots Fired, a new drama, complicates the debate over police violence in America And Pedro Almodvar presents another woman on the verge",neg,neg
"The  billion deal would create one of the worlds largest cellphone providers, with roughly  million subscribers in the country Alter do Cho in Brazil is among the worlds most alluring beach towns, even though it is far removed from the sea in a remote corner of the jungle After acquiring Jet and ModCloth, the company is forming an internal venture to create startups and support new online retail businesses After acquiring Jet and ModCloth, the company is forming an internal venture to create startups and support new online retail businesses The pioneering cookbook author, who has Alzheimers disease, no longer cooks much But a special diet and persistence keep her as kinetic as ever With enough success, these businesses go from enabling transactions to controlling entire economies But these raised stakes also create tensions that are becoming harder to ignore With enough success, these businesses go from enabling transactions to controlling entire economies But these raised stakes also create tensions that are becoming harder to ignore The retail giant has formed an internal venture arm to hatch new online businesses by incubating startups in emerging technology fields",pos,neg
"Federal investigators continue to pursue the people behind a  attack compromising user accounts, despite filing charges in a  cyberattack Federal investigators continue to pursue the people behind a  attack compromising user accounts, despite filing charges in a  cyberattack In some countries, endangered species are whats for dinner Heres an alternative Alter do Cho in Brazil is among the worlds most alluring beach towns, even though it is far removed from the sea in a remote corner of the jungle Dancing With the Stars returns for its th season on ABC And the vampire comedy What We Do in the Shadows is streaming on Amazon Dancing With the Stars returns for its th season on ABC And the vampire comedy What We Do in the Shadows is streaming on Amazon Times reporter Kevin Sack talks about his yearlong investigation into what happens when SWAT officers storm into homes to execute search warrants Times reporter Kevin Sack talks about his yearlong investigation into what happens when SWAT officers storm into homes to execute search warrants The  billion deal would create one of the worlds largest cellphone providers, with roughly  million subscribers in the country",neg,neg
