date,snippet
2016-09-08,"A study in the journal Science Advances said that when vendors with equal selling reputations sold the same products, women received lower prices than men Prosecutors offered a sharp rejoinder to Apples position that refusing to help the government was a matter of protecting customers privacy Holding rallies in three cities hundreds of miles apart, Mr Sanders urged the states Democrats to show the world that democracy is alive and well here in Nevada Several Republican candidates have criticized Apples stance on the FBIs request to help it unlock the San Bernardino gunmans iPhone, but Mr Trump is the first to call for a boycott Gov John R Kasich of Ohio has practically written off South Carolina, looking toward the more moderate political climate in the Midwest and Northeast When the word broke on Saturday that Justice Antonin Scalia had died, the field of Republican candidates had already spent time in South Carolina discussing the possibility of a vacancy Robocalls targeting Republican senators who have pledged to block hearings or a vote on any candidate President Obama nominates to succeed Justice Antonin Scalia are just a part of the increasing political activity springing up around the fight For the third time in three weeks, voters will head to polls and caucus sites on Saturday to choose a winner among Republicans in South Carolina and among Democrats in Nevada Morgan Freeman is narrating several ads for Hillary Clintons campaign ahead of the Feb  Democratic primary in South Carolina, where she and Senator Bernie Sanders are courting black voters An NBC NewsWall Street JournalMarist survey found that  percent of likely Republican primary voters in South Carolina support Donald J Trump, while  percent back Senator Ted Cruz In January, the billionaire was leading him by  percentage A handful of key shows, including Zac Posen and XlyBet, put a more diverse fashion industry on display In a state known for dirty politics, presidential candidates are embracing campaign strategies that often straddle the line between underhanded and dishonest Its like being caught between two parents fighting An uproar ensued over an image of a professor at an evangelical Christian school and a caption that said that Christians and Muslims worship the same deity A film company had uploaded footage of a man who appeared to be Bernie Sanders being arrested at a protest, and on Friday his campaign confirmed it was the Vermont senator In general, Times coverage of Justice Antonin Scalias death was impressive, but it was not without a few bumps along the way The former first daughter, pregnant with her second child, has been campaigning nonstop for Hillary Clinton and knocked on doors in Las Vegas on Friday Five decades after leaving for Los Angeles, David Geffen is returning to New York, bringing with him all the clout  million can buy Besides meditations on Apple, Tidal and Zenefits, Farhad renders his considered opinion of Kanyes Twitter feed, as Mike dines on cannoli Along which brain science, stone tools and Scotch appear The Miami police union encouraged other groups to join in a boycott, saying Beyonc had aimed to divide Americans by promoting the Black Panthers during the Super Bowl halftime show Caution should be the first rule, experts advise, followed by piecing together the financial picture The Internet company said on Friday that its board had formed a committee of independent directors to consider the best path for its core business New regulations will forbid any foreign company from publishing online content in China without the governments consent"
2016-09-09,"Donald J Trump said it was disgraceful that Pope Francis questioned his faith and suggested that his presidency would be the answer to the Vaticans prayers because he would protect it from terrorists if elected An adviser for Senator Marco Rubios campaign handed out to the news media copies of what he said was a completely invented photo that had just appeared on an antiRubio website paid for by Senator Ted Cruz, the Florida senators rival for the R The TrumpFrancis conflict spilled onto the campaign trail on Thursday, turning the final days before the South Carolina primary into a surprising clash involving religion and politics The gathering, held at the National Urban League, centered on how the senators policies would address economic injustice, overhauling the criminal justice system, protecting voting rights and addressing institutional racism Photos from Iraq, Turkey, Yemen and Spain The senator said he had talked to the head of the states most powerful union to make sure tens of thousands of casino workers can take part in the Democratic caucuses on Saturday Mr Sanders has cut Mrs Clintons national lead with likely Democratic voters almost in half since last month, according to an NBC NewsWall Street Journal poll A college student whose family has been in upheaval told the Ohio governor that he had found hope in his campaign The former New York City mayor bemoaned a lack of solutions from the  presidential candidates, the most explicit rationale he has offered for why he is considering a thirdparty campaign Scheduled to speak at a conservative forum  one stocked, by the looks and sounds of it, with supporters of Senator Ted Cruz of Texas  Marco Rubio abruptly canceled late on Thursday His campaign says it sent political leaders to represent Mr Ru Donald J Trump, who has made his claim of having opposed the Iraq War in  a centerpiece of his stump speech, was asked by Howard Stern in  if he was for invading Iraq Mr Trump answered Yeah, I guess so Does longterm use of artificial sweeteners cause weight gain or contribute to metabolic syndrome The Nevada rancher Cliven Bundy and his sons, Ammon and Ryan, were among those indicted over a  standoff involving cattle Catch up on reading, make some paella and more ideas for the weekend The latest attack, which killed an offduty Israeli soldier, came as Israeli officials clashed over the degree of force to be used against Palestinian minors with weapons Anyone hoping for dramatic confrontations or big plot twists at Yahoos mobile developer conference was sorely disappointed A complicated set of factors influences the reactions of technology companies to government demands to unlock a path to customer data An abundance of opinions in nearly , comments on Apples opposition to a court order to unlock an iPhone used by one of the San Bernardino killers Both candidates tried to prove their commitment to immigration reform at a bilingual town hallstyle forum on Thursday, days before Nevadas Democratic caucuses Donald J Trump appeared to soften his tone in his fight with Pope Francis, and Jeb Bush also revealed a lighter side, during a town hall forum hosted by CNN on Thursday Robert James Campbell died homeless and isolated in Vermont Then Jessica Ferber spent  years trying to piece together his biography Friday A booming entertainment industry, plastic pollution in our waterways, and the citys craft beer scene A new documentary reveals the tangled role of paid sources in FBI terrorism investigations A prep school gymnasium packed with  people hoping to see Senator Marco Rubio, one day before voting in the South Carolina Republican primary, was disappointed to learn that the Florida senator had to pull out of the morning campaign event at t Hillary Clintons wonky immersion in policy details paid off for her when the topic of immigration came up at the MSNBC and Telemundo townhallstyle event in Las Vegas, after Senator Bernie Sanders had answered the question before the same audien At a campaign event a day before Republicans vote in the South Carolina primary, Gov Nikki Haley praised the imagery of her and other elected officials who are supporting Senator Marco Rubios presidential run What the new conservative movement If Hillary Clinton and Bernie Sanders tie for individual delegates on Saturday, the winner will be determined by drawing cards Its been a busy week for acolytes of Donald Trumps Twitter feed At nearby rallies, supporters of Mr Trump and Mr Cruz echoed the candidates language and themes  a sign that the bitter feud between the candidates has seeped into voters Hundreds of the independent contractors, incensed over the ridehailing services recent fare reduction, are attempting to organize and force the company to address their concerns Photos from Uganda, Greece, Sicily and the United States"
2016-09-10,"Twothirds of the population is under , and that generation has outgrown the authoritarian style and patronage system of Prime Minister Hun Sen The World Press Photo contest winners were announced, with a moody blackandwhite image depicting the hardship of the Syrian migration crisis winning photo of the year The New York Times also won five awards ExDeutsche Bank Analyst to Pay , Over Ratings The Tech Industry Gets Confrontational For senators from places where good governance and political courage are viewed as inherent state virtues, a critical editorial can still sting And Republican pledges to block President Obama from submitting a nominee to replace Justice Antonin S Its becoming easier to see how the Republican race will shape up after the South Carolina primary on Saturday Its less clear how it will shake out A document that Donald J Trumps campaign distributes to volunteers and staff members in South Carolina lays out, in elaborate detail, where large signs bearing his name can and cannot be staked into the ground  touching on local law and the uns An audience member at a rally in South Carolina for Senator Marco Rubio called Hillary Clinton a traitor, prompting an objection from the candidate A new national poll from CBS News found that Donald J Trump still holds a dominant lead atop the Republican field of presidential candidates, suggesting that he remains in a strong position ahead of the coming wave of primary elections Thursday Work before dawn, nearfreezing weather and the gold beneath our feet Political advertisers hoping to attach their ads on YouTube may be out of luck in Nevada and South Carolina Theres essentially no reserve inventory left on the popular platform ahead of the coming primary elections and caucuses there Donald J Trump, who had kind words for Gov Nikki Haley of South Carolna early in the week, ripped into her as weak on immigration on Wednesday after she endorsed his Republican rival, Senator Marco Rubio, and the crowd of Trump supporters booed "
2016-09-11,"A rift opened between Representative James E Clyburn and the Clintons in the  race, but it seems to have been mended enough to score Hillary Clinton an important endorsement before the South Carolina primary The Rev Franklin Graham, a son of Billy Graham, is on a state tour, and Jerry Falwell Jr, a son of Jerry Falwell, has endorsed Donald J Trump Together, Mr Rubio, the son of Cuban immigrants, and Ms Haley, the daughter of Sikh immigrants from India, hope to form a powerful contrast to an older generation of Republicans who have long controlled the party Wall Street was higher for the third day in a row, buoyed also by a pickup in factory output The rally has erased about half of this years losses Professors Robert Gordon and Jeffrey Sachs debate whether the era of strong economic growth is over or whether innovation can revive Americas future The ties run deep between startups in the nascent industry of virtual reality and science fiction novels and movies Companies are even hiring novelists to help them envision new immersive worlds The battle between Apple and law enforcement officials over a terrorists cellphone is heading toward an eventual victory for tech companies Should companies, like Apple, have to unlock encrypted communication in the case of a crime With the prospect of a nomination by President Obama, Washingtons liberal and conservative advocacy machines are roaring to life in record time We rated four free tracker blockers that can give you some privacy from ads that seem to follow you around the Internet"
2016-09-12,"Jeb Bushs dry wit was on display in South Carolina with reporters who cover his presidential campaign The former Florida governor got contact lenses while he was home the day before and was trying them out on Tuesday Bernie Sanders courted black voters in South Carolina with promises that he would combat institutional racism, reform police departments and make getting an education and a wellpaying job easier Photos from Mexico, North Korea, Gaza City and the United States While some Republican rivals are trying to tar Mr, Trump as a Michael Moore Republican, Mr Moore says he finds the candidate and his campaign frightening Speaking in Harlem, Hillary Clinton offered jobtraining and education programs for poor and minority communities, part of an effort to speak directly to AfricanAmerican voters heading into the South Carolina primary Mr Trump outpolled Ted Cruz among likely Republican voters in South Carolina  percent to  percent, while Hillary Clinton was ahead of Bernie Sanders by  percentage points in a new CNNORC survey Citing his wifes achievements, Mr Clinton suggested that a Hillary Clinton administration would continue the work of the Obama administration Fresh off the news that Gov Nikki R Haley had endorsed a rival days before the South Carolina primary, a visibly frustrated Mr Bush took advice from voters on how he could be a better candidate Rumors have replicated through social media and word of mouth, frustrating Brazilian officials as they grapple with a mysterious pathogen A  million project will transform a landmark department store into luxury apartments, a hotel, retailing, restaurants and entertainment venues Residents of Hailey, Idaho, say the town has been changed by the threats that came after the release of Sgt Bowe Bergdahl Science fiction is both shaping the language that virtual reality companies use to market the technology and defining longterm goals for developers Hwaida Saad, a journalist in The Timess Beirut bureau, has grown online connections to people on all sides of Syrias civil war The destruction of the Amiriya bomb shelter in Baghdad killed over  civilians at the start of an American entanglement in Iraq that has yet to end Debate over the bill has polarized Italy, one of a few countries in Western Europe that dont recognize samesex unions in any form Software designers for companies like Apple and Google are working to bring digital assistants past the uncanny valley, where technology becomes unsettling Six New York Times photographers have blanketed the early presidential campaign states during the last three weeks, challenged by carefully constructed stagecraft Should physicians be held responsible for patients who die of prescription opioid overdoses The candidates have a chance to explain their positions in a manner that comes across on the campaign trail, but rarely on the debate stage Mr Trumps popularity continues to rise nationally, according to a new Quinnipiac University poll that shows him with more than double the support of his closest Republican contender Things are tighter for the Democrats, where Hillary Clinton le President Obama is back in Washington, but the Senate remains out of town on the Presidents Day holiday recess  and that has its benefits and disadvantages as the Supreme Court fight heats up The  presidential campaign has unfolded largely on television, so its only fitting that the final days of the Republican primary in South Carolina and the Democratic caucuses in Nevada will play out in televised townhallstyle meetings Wednesday Results of the Westminster Kennel Club Dog Show, sunnier weather, and how to hack the lamp posts in Central Park Donald J Trump also laced into Senator Lindsey Graham, the South Carolina lawmaker who has been deeply critical of Mr Trump The guy is a nut job, Mr Trump said on a morning news show of Mr Graham Hillary Clintons campaign manager briefed some of her most loyal and active fundraisers this morning about the upcoming Nevada caucuses and responded to frustrations among some of her donors that the campaign needed to do a better job of demonst Donald J Trump is not going this week to Nevada, where Republicans will hold their caucuses on Tuesday Senator Marco Rubio received the endorsement of South Carolinas governor, Nikki R Haley, a stamp of approval that could prove significant as his campaign tries to break out in the states primary on Saturday Photos from Turkey, Uganda, Russia and Germany The NBC NewsWall Street Journal survey found that Mr Cruz had erased Mr Trumps lead nationally, leaving them in a virtual tie heading into the South Carolina primary The Ohio governor is not planning to stay in South Carolina on Saturday as voters go to the polls, and instead is turning his focus to Vermont and Massachusetts The candidate says he wants to be in a better negotiating position, should he capture the presidency"
2016-09-13,"Abu alMajd, who fought with government forces, also struck up a relationship with Times correspondents Then he was sent to Palmyra, and disappeared The candidates both made their case at Victory Missionary Baptist Church, with Mr Sanders emphasizing his desire to reform police departments and Mrs Clinton bringing along a civilrights leader The world now is a thoroughly awful place, compared with what it should be But not compared with what it was New guidelines urge policy changes to allow more women to breastfeed In these previously unseen photographs, the former New York Times photographer Don Hogan Charles Jr reveals Harlems residents as fully rounded people  counter to the fearful perception that was reported in the s If Donald J Trump wins the Republican primary in South Carolina on Saturday, it will be after reverting to the stormthegates populism that led to his political rise It will also raise the stakes for party leaders who want to stop his candidacy Right to Rise, the super PAC supporting Jeb Bush that has dominated the adspending battle so far, has canceled up to a third of its ad reservations in March  primary states, according to media buying sources Senator Ted Cruz took aim on Monday at the judicial record of Donald J Trumps sister, calling her a radical proabortion extremist unfit for the Supreme Court The Prince of Tides novelist says he plans to fight it hard Liar Liar Nuts Unstable Liar Those words made up the rosary of attacks that Donald J Trump hung around Senator Ted Cruz in in South Carolina The ad from Stand for Truth, the super PAC supporting Mr Cruz, attacks Mr Rubios record on immigration Some South Carolina voters received a recorded phone call on Sunday from James C Dobson, the evangelical leader, calling Ted Cruz the only real alternative to Donald J Trump Mr Trump appears to be hoping that any memory of his  demand to see the birth certificate of the nations first black president is a distant one in South Carolina Mr Sanders said his meeting with seven or eight residents of Flint, Mich, to talk about the water crisis, was one of the more difficult meetings that I have ever attended in a long political life The radio host theorized that Mr Trump might have deliberately criticized the Bush administration over the Iraq invasion to turn out Democrats and independents in a state with an open primary Keep the Promise I said it would also increase its field operations in the state, as Mr Cruz and his allies hope to capitalize on Donald J Trumps perceived weakness in ground organization The Republican National Committee said only  tickets for the debate on Saturday went to donors, which meant the boos Mr Trump heard must have come from elsewhere in the audience of , If the Senate Republican leaders refuse to consider a Supreme Court nomination from President Obama, what effect could that have on the November elections As the race for the South Carolina Republican primary winds down to the final five days, it has become a battle for the soul of the party  between Donald J Trump and the partys last president, George W Bush Alumni and students reacted with annoyance after a vote to fold the worlds oldest undergraduate program devoted to the hospitality industry into a new business college Heres what you need to know to start your day Recent recommendations aimed at chipping away at the social standing of lesbians and gays have caught most human rights activists in Jakarta by surprise From medical issues to roommates, transgender patients face barriers to good health care Some institutions are trying to change that For the past ten years, Mindaugas Kavaliauskas has been zipping through airports, traveling extensively to produce photography events He eventually slowed down, capturing the beauty in moments of familiarity A battery of drugs, some new and some long known, have been proven to give addicts support in staying off drugs and alcohol after rehab Republican senators who are thought most susceptible to a political backlash for blocking any new Supreme Court nominee appear to be shaking off concern and joining the call to wait for the next president to fill the vacancy caused by Antonin Scal Though Senator Bernie Sanders of Vermont has received the endorsement of several black politicians and artists, he still trails Hillary Clinton in South Carolina, where AfricanAmericans are likely to make up more than half of the electorate Cats dont hold a grudge if you limit their food to help them slim down, a new study shows Senator Bernie Sanders of Vermont will meet with the heads of several civil rights organizations, an effort that comes as he continues to court black voters ahead of the Democratic caucuses in Nevada and the partys South Carolina primary Senator Bernie Sanders of Vermont will meet with the heads of several civil rights organizations, an effort that comes as he continues to court black voters ahead of the Democratic caucuses in Nevada and the partys South Carolina primary The citys Education Department is allowing seven schools to set aside seats for lowincome families, Englishlanguage learners or students engaged with the child welfare system Tuesday What to do with kids this week, warm weather tease, and the Brooklyn Bridge for rent In his speech aboard the USS Yorktown in South Carolina, Senator Ted Cruz  days ahead of the states Republican primary  called for increasing the number of active duty forces as well as improving the nations Air Force capabilities Hillary Clinton met with the National Urban League in Harlem, including the Rev Al Sharpton, before heading to give a speech on race relations"
