date,snippet
2015-12-01,"A prosecutor said Wednesday that Officer Brentley Vinson will not face charges in the Sept  shooting of Keith Lamont Scott, whose death set off days of unrest"
2015-12-02,"Next summers Lincoln Center Festival will bring together the Paris Opera Ballet, New York City Ballet and the Bolshoi Ballet for the works th anniversary Gab, a social media network built like a hybrid of Twitter and Reddit, bans very little and has become a conservative bunker of sorts Investigators say Abdul Razak Ali Artan, the student who wounded  people at the university, may have been inspired by a Qaeda propagandist, or by the Islamic State The ruling military junta has begun a voluntary program calling for government employees to exercise once a week during working hours"
2015-12-03,"Over the past year, Diego Ibarra Snchez has traveled to Sinjar, Iraq, whose Yazidi population was subjected to atrocities by the Islamic State"
2015-12-04,"TEDs new curator of science, David Biello, explains why he sees hints of hope in Earths emerging Anthropocene age of us Once known for its disappearing messages, Snap, the parent of Snapchat, has moved into news and, with Spectacles, consumer devices Snapchat started in  as an app through which people could send messages that would disappear Now it has many features and a large user base Using video cameras, still cameras, audio recorders, social media and plain old notebooks, we hear the voices of a city in pain"
2015-12-06,"A writers spouse had extensive ties to a subject of her OpEd essay, but readers were made aware of the potential conflict of interest only in passing Wednesday Things to ask yourself when considering a dog, more rain and the World Chess Championship tiebreaker"
2015-12-07,"The holidays are in sight, and the Hollywood awards machine is cranking into gear Will the postelection blues affect it Why is the presidentelect afraid of free speech"
2015-12-08,A student who ran over people with a car and used a knife on the campus in Columbus was reported to have spoken about a sleeper cell
2015-12-09,"Leaflets dropped over the besieged city warned inhabitants, If you dont leave these areas quickly you will be annihilated"
2015-12-10,"Readers respond to Zadie Smiths By the Book interview and more Beyond the urban working poor, the effort is aiming at those frustrated by an economy no longer producing middleclass jobs they or their parents once held"
2015-12-11,"The minute orchestral work Stravinsky wrote at  was rediscovered in  It will be performed in St Petersburg, Russia From fake news to a censorship tool to a slow draw on removing hate speech, the social media giant is struggling to deal with the ethics of its business Congressional Republicans are eager to move forward with their longtime goal of privatizing the government health care program for the elderly"
2015-12-12,Heres what you need to know to start your day
2015-12-13,"From media pundits to tech companies, more and more people are preaching empathy  as long as it serves their own interests"
2015-12-14,"Its dangerous to promise that a social network will vet whats true With Trump aggravating religious tensions in America, a Muslim author focuses on training leaders to spread interfaith values When Arthur Bondar came across the negatives of a Soviet war photographer, he realized he had stumbled upon an important cache of images of World War II that gave an intimate look at that countrys side"
2015-12-15,"The documentary, broadcast on a network owned by the Qatari government, accuses Egypt of abusing its recruits, and the country was quick to denounce it Heres what you need to know to start your day"
2015-12-16,"After almost being killed in New Jersey, a Guatemalan immigrant returned to his hometown to help provide jobs and training so people wont have to leave Monday How to quiet a noisy radiator, the sun before the storm and Fidel Castro in New York A Japanese theme park tried to draw visitors by freezing , fish beneath its ice rink, but a public outcry forced it to close the attraction after just two weeks The cable news network will shut down the social media app and absorb its  employees, who will work to persuade younger, more skeptical viewers to tune in A man veered his car onto the sidewalk at the campus, leaped out, and stabbed several people with a butcher knife, law enforcement officials said The awardwinning author, most recently of Americanah, is now the face of No, the makeup brand owned by the pharmacy chain Boots Tuesday A day of generosity, new heights for Hamilton and local flights to Cuba Often used to describe a farright, white nationalist movement and criticized by some as euphemizing extreme views, the label has emerged as a linguistic flash point In Wisconsin, elections officials said on Monday that a recount of the states nearly three million votes would most likely begin on Thursday"
2015-12-17,"Mr Bannon courted politicians who share his dark, populist worldview of a ruling class preying on working Americans and the JudeoChristian West in a war against Islamic fascism The clash of emotions common in Cuban families is reflected in a grandfathers loyalty to Mr Castro and a granddaughters glum view of conditions in her country A twoday memorial and a period of Duelo Nacional, or national mourning, will offer Cubans a chance to pay their respects to the longtime leader Advisors to Presidentelect Trump see little merit in NASA emphasizing Earthcentric science Heres what you need to know to start your day The social networks efforts to placate German authorities provide a case study for its moves to combat fake news and hate speech online worldwide After the murder of Chico Mendes in , a new brand of green governance developed on Brazils rain forest frontier, but political instability poses fresh threats A researcher who cowrote a paper in the s on a crucial artificial intelligence technique feels overlooked by todays stars in the field People of all ages are spending more and more time online Does this trend improve lives or hurt them A reader writes that the spread of misinformation is the symptom, not the source, of a deeper systemic problem Liberals and conservatives, on campus and off, have spent too much time in their own political bubbles"
2015-12-18,"The Hungarian writer Szilard Borbely created fiction about the village past and poetry about the urban present Ms McFarland, an aide in three Republican administrations, was named deputy national security adviser, while Donald F McGahn II was chosen as White House counsel Mara Einsteins Black Ops Advertising is about the increasing trickery of stealth advertising and branded entertainment Five men who were arrested in Strasbourg and Marseille were directed by a commander in Iraq or Syria, the French authorities said Friday No  Michigan faces No  Ohio State on Saturday in a game emotionally similar to one in  when Harbaugh was quarterback and Schembechler was coach A computer science student in a former Soviet republic found there was money to be made in mixing real and madeup stories, as long as they were proTrump Residents of Mastic Beach, NY, voted this month to return to the Town of Brookhaven amid fears of rising taxes and lagging services She said they helped elevate her consciousness, a photographer says of the high heels preferred by To PorchonLynch Drones, mainly associated with missiles, are poised to deliver medicines in Madagascar A weekly comic strip featured in the Sunday Review Mindfulness is supposed to ease the stress of modern life, not add to it Foster Campbell, a Democrat, is not expected to beat Republican John N Kennedy in Louisiana, but that hasnt stopped Democrats from around the country from one final push Some opponents of Donald J Trump are seeking recounts in Wisconsin, Michigan and Pennsylvania, states where his margin of victory was extremely thin Viktor F Yanukovych, the former president of Ukraine, said that his main mistake was not declaring martial law, but that he did not want to cause a civil war"
2015-12-19,"Well over , people have fled Venezuela in the last year alone, the most in more than a decade, scholars say, with the sea route posing special dangers Using the court of public opinion, John Neschling, who has not been charged with a crime, questions whether Brazils graft fight also entangles the innocent A something American falls in love with Ukraine Readers respond to recent reviews of The Earth Is Weeping, Algren A Life and more Were in the land of leftovers, but its still a time to keep cooking"
2015-12-20,"These are some stressful affairs, these dinners Take a little time for yourself Friday Black Friday on a budget, weekend events, and a humpback whale is euthanized The body of a woman whose mutation keeps her on the brink of starvation may hold the secret to treating obesity In British Bikelife, Dan Giannopoulos has captured bikers at rest and at play, in standoffs with the police, but above all doing the thing they love most"
2015-12-21,"Mahmoud Abou Zeid, known as Shawkan, has been in a Cairo prison for over three years He has now received an International Press Freedom Award The choice of the former neurosurgeon suggested that Mr Trump was seeking diversity in an administration that has started off predominantly white and male Heres what you need to know to start your day Some complain of being unfairly accused of bigotry Others say discrimination needs to be directly addressed President Obama could step in to protect everyones safety and pressure the sheriffs officers to stand down in North Dakota Even as she fought cancer, the singer Sharon Jones lived for the stage as a powerful, soulful presence From legendary theaters to sweltering Midwest venues, she gave it her best Advertisers say featuring models with Down syndrome helps them to communicate their values and connect with customers who value inclusiveness Presidentelect Donald J Trump has chosen Gov Nikki Haley of South Carolina to be ambassador to the United Nations Here is a look at five cases Some of the people involved apologized One denied being responsible And another said his actions had been misconstrued Heres what you need to know to start your day Connecticuts state government is doling out funds to investment firms to persuade them not to leave the state, but not everyone is persuaded it is a good allocation of resources Wednesday Readers share their thoughts, inflating balloons for the parade, and Cuomo aides are indicted Wednesday Worries over Thanksgiving after the election, a crisis of malnutrition among Salinas Valley farmworkers, and a lastminute holiday recipe from Bar Tartine Technology has made cultivating relationships easier, but also shallower China is a tempting market for Facebook, which has been banned there since  But to get in, the social network may have to compromise on its mission Voluntary guidelines will be issued amid a spike in traffic fatalities in the last two years Mike Isaac, a reporter for The New York Times, weighs in on Facebooks new censorship software, which was created to help it get back into China A market debut early next year could get Snap trading ahead of anticipated stock sales by older ventures including Airbnb, Palantir, Pinterest and Uber Were capturing the scene with reporters around the country showing what it looks and feels like at American shopping malls, retailers and discount stores Donald J Trump, who had made coming job losses at a Carrier plant a campaign issue, said he had reached out to the company Ms DeVos, a philanthropist, activist and Republican fundraiser, has worked to give families vouchers to attend private schools and pressed to expand charter schools Love scored  points, including  to set an NBA first quarter record Areas of the northern port city of Haifa were ablaze, with homes damaged, dozens of people slightly injured and tens of thousands evacuated Miracle Messages has recorded more than  videos, delivered  and reunited  families A websifting exercise that helps students of all ages figure out how facts or fakery flow online"
2015-12-22,"Heres what you need to know to start your day The social network, blocked in China since , has developed software to keep posts from appearing in users news feeds in specific geographic areas, current and former employees said Moat awards different scores depending on whether an advertisements audio is on or how much of it streams, a seeming leap forward in a confounding realm of analytics Facebook and Google are under fire for spreading fake news, but given some of the ads it runs, The Times should take a good look at its own house"
2015-12-23,A Washington pizzeria has been the victim of a barrage of false articles on social media and fake news sites saying their pizzeria was a front for a child trafficking ring led by Hillary Clinton The venue was shuttered in September after the deaths of two teenage clubgoers its closure was lamented as a blow to the citys night life
2015-12-28,Activists and lawmakers say a phone call can have more weight and be harder to ignore than an email or social media post
2015-12-29,"A small group of superrich Americans  the presidentelect among them  has laid the groundwork for an unprecedented legal assault on the media Can they succeed Weve heard about its power to help us empathize with others But what if, instead, its just cocooning us with our friends Conservative news outlets are busy cataloging the reactions of aggrieved celebrities who are inadvertently energizing the opposition Tuesday An old favorite returns for Thanksgiving, how to blow up giant balloons, and saving for college"
2015-12-31,"What can social media companies do to prevent misinformation from proliferating online A new book features the photography of Jack London, along with his words, chronicling poverty in London and the aftermath of the San Francisco earthquake"
2016-01-01,A Washington restaurant is reeling from menacing calls and online abuse after a fake story that Hillary Clinton abuses children there
2016-01-04,"Mohamed Rafik Naji told an informer that ISIS wanted to stage an attack in Times Square similar to the one that killed  people in Nice, France, the authorities said"
2016-01-05,"If Americans hate the direction their next president takes, they have the right to demonstrate peacefully Heres how protesting has succeeded"
2016-01-06,"How my home state became Trump country Reading from a script in an update on the transition, the presidentelect struck a softer tone, avoiding topics like terrorism and immigration"
2016-01-07,"Officials retesting urine samples have found scores of violations from the  and  Games, and medals are being stripped from dozens of athletes In his final news conference on his last foreign trip as president, he argued for a foreign policy in which America continues to take on major global problems Were not saying you cant talk about politics on Thanksgiving But here are some conversation starters about science and medicine for your dinner table As the mainstream news media work to separate fact from fiction, Facebook  which has gobbled up much of the online ad market  must do its part On Sunday we were reintroduced to the Hilltop colony and its loathsome leader One way of avoiding offensive people on Twitter is to block them from following you Should a president be able to do that Matthew Abbotts largeformat photos of the outback have an eerie, bleak quality, with imperfections from dust and grime only adding to the mystery"
2016-01-08,"What will TheDonald do when the Donald is no longer running What you do online can help elect a president Ms Tovar, known as the Sweetheart of Mexico, also performed in silent films and Westerns and helped to promote Mexican cinema How a misinformed Twitter post the night after the presidential election fueled a nationwide conspiracy theory and became a talking point  even as it was being proved false After playing only three songs, the rapper cut short his Saint Pablo show in Sacramento following a minute monologue The JK Rowlingscripted fantasy is a boon for the studio, whose last three bigbudget efforts drew cool reactions from critics The meeting, with Indian executives linked to an apartment tower bearing Mr Trumps name, raises questions about how he will separate his business dealings from his politics The time to prepare is now  for the Thanksgiving feast, and the days leading up to it Monday Tales from the turkey trade, our favorite recipes, and a weekend of protests Monday A debate over dead trees, a bastion of red in deepblue California, and a look back at the  occupation of Alcatraz Some designers have announced their disdain, and a website plans a new approach Shares of the meat producer Tyson Foods tumbled after it disclosed disappointing fourthquarter results and said its chief executive would step down The photosharing social network, which is owned by Facebook, is offering users the ability to share live videos and ephemeral messages The demonstration occurred a day after hundreds clashed with the police, who used water cannons against protesters"
2016-01-09,"In a Facebook post Friday, Mr Zuckerberg said the company was considering thirdparty verification, better automated detection and simpler ways to flag suspicious content Our Top  Comments of the Week Readers debate the mechanics of the Trump transition, womens gestures of political solidarity and athlete activism Vaccines usually take a decade or more to develop, but researchers say a Zika vaccine could be available as early as , thanks in part to experimental DNA technology How parents fight back against their kids obsession with smartphones and social media Facebook and Twitter faced fallout from the ways they had been used during the election, and Snapchats parent released videorecording glasses Our increasing addiction to the constant stimulus of updates, likes and posts is damaging our ability to concentrate deeply and focus on work that matters In the chaos that often seems to surround Presidentelect Trump, his soninlaw injects optimism and reinforces Mr Trumps world views and instincts What will you do when they start rounding us up Technology exploded in  But if you blinked, you missed it"
2016-01-10,"Someone else will have to shatter that highest glass ceiling The question is if it now seems too daunting to try The expert also said the government should investigate allegations of military reprisals against Rohingya Muslims instead of brushing them aside Hoaxes are not just bouncing around among conspiracy theorists candidates and elected officials are sharing them, too Fake news should be shunned, but the discussion of it misunderstands a new media world in which every story is at risk of being discredited, not by argument but by sheer force The polls were off and so were my predictions What can we do about it"
2016-01-11,"Social medias political sway is a given in places like the Philippines, Indonesia and Colombia, where false news often emerges to influence the vote This AE show, which has just announced that this season will be its last, figured out early that viewers didnt care if their chosen reality was real The producer of All Def Comedy and Def Comedy Jam talks about the shows and about how he hopes to bring new talent to the public Within the professional political class, Mayor Bill de Blasio and Gov Andrew M Cuomo now seem to be elevating their longstanding rivalry to one for the role of progressive opponent in chief James Rackover, , and Lawrence Dilione, , are accused of killing Joseph Comunale, , in Manhattan, then burying his body on the Jersey Shore Photos from The New York Times and photographers from around the world How will the nation respond to fears of Islamist violence Those of cities  particularly in the West  rejected Trump by huge margins By publishing fake news and disrupting standards of truth and civility, tech companies allowed Trump to spread his message Friday Architecture plans that didnt pan out, hatecrime hotline, and things for which youre thankful The interment in a cemetery for Philippine heroes was supported by President Rodrigo Duterte, whose ruthless tactics have been compared to Mr Marcoss Organizers of the Womens March on Washington, scheduled for the day after Donald J Trumps inauguration, are facing a difficult task gathering women who remain fiercely divided on many issues Our secessionary mood is an emotional reaction to the election of Donald Trump and a reflection of the power of our own brand of liberalism A gay actor in California and his father in Kentucky talk at length about how they feel about each others votes Readers respond to recent reviews of Caroline Leavitts Cruel Beautiful World, Ruth Whippmans America the Anxious and more The feast approaches, the todo list is long Were charging forward Are you Gillian Walshs oddly titled work, a meditative dance piece that draws on multiple sources, is being performed at New York Live Arts Political scientists say false stories posted to the social network have played a role in elections around the world for several years The actress Geneva Carr lives in an artfilled apartment in Harlem Twitter is hardly the only platform people are sick of using"
2016-01-12,"Wednesday Festive market stalls return to the city, a former mayor on the rise and the Astor Place Cube The organization, the Islamic Research Foundation, was banned after accusations that the preacher, Zakir Naik, promoted terrorism through his speeches Prime Minister Hasina must rigorously investigate her own party, the Awami League Information sources need to provide reason and facts, neither of which is partisan We asked readers to tell us what dishes they put on the table each year There was the traditional stuff, sure, but then things started to get interesting Officer Jeronimo Yanez shot Mr Castile after pulling him over in Falcon Heights, Minn The aftermath was streamed on Facebook Live by Mr Castiles girlfriend The temporary hotline is meant to draw attention to gender discrimination in the workplace and will be staffed by gender experts The election of Donald J Trump, the rise of Bernie Sanders, and the momentum behind Brexit and ISIS all show the newly global gravity of social media It hit No  on the Billboard singles chart this week after becoming the de facto soundtrack to the Mannequin Challenge, an online video craze Heres what you need to know to start your day What some people did this past week, from interfaith vigils to weaving therapy to group meditation sessions, once the votes were counted Mr Cohen, who was known for working slowly, had picked up the pace considerably in recent years His manager said he died in his sleep after a fall Heres what you need to know at the end of the day Facebook promises to increase use of outside measurement services for ads and to expand use of metrics services, among other measures President Obama, appearing with Chancellor Angela Merkel of Germany, also warned Donald J Trump to take the presidency seriously The bank will roll out its first advertising campaign aimed at getting individuals to replace highercost credit card debt with a lowercost personal loan The return of Timothy Polin and Joe Krozel Juan Carlos Torres, the brands chief executive, also wants to expand its reach in the American market Joseph Comunale, , was reported missing on Sunday and was last seen at a luxury residence in Manhattan For the first time, a US president will have extensive business ties around the world Are you traumatized by the election of Donald Trump Heres the program for you At , Veronica Lopez knew death Ultimately it caught up with her on a Chicago roadway A stint at a London call center led Jos Sarmento Matos to explore the lives and aspirations of Indian and Filipino workers who have flocked to the industry in their homelands Glennon Doyle Melton reads her memoir, Love Warrior, about how she learned that personal crisis can be an opportunity How are social networks helping to fundamentally rewire human society and even alter the course of global events Heres what you need to know to start your day The United States authorities are expected to announce a settlement with JPMorgan Chase in a bribery case involving the hiring of Chinese leaders children Thursday Alternative workout classes to keep the holiday pounds at bay, flawless weather and a  subway ride The purpose of the chatbots was to rant, confuse people or muddy discussions on Twitter in the days before the election, an Oxford University report found Its been a tough week for Mark Zuckerbergs company First it was fake news complaints now its acknowledging bad user metrics Neither is good Those who feel misogyny carried the day are taking stands against a maledominated world, from the workplace to rituals like holiday cards Baltimore City Public Schools said the teacher was no longer employed, and a school district official said she had crossed the line"
