date,snippet
2016-02-17,"Abby Wambach says she abused alcohol and prescription drugs for years until her arrest for driving under the influence in April Facebook Inc will learn from a mistake it made by deleting a historic Vietnam War photo of a naked girl fleeing a napalm attack, the companys chief operating officer said Facebooks Messenger application, which now boasts a billion users, is introducing new capabilities that will make it possible to pay for goods and services through Messenger or though bots, or automated programs, that use the messaging app A single French Islamic State jihadi has emerged as the link among at least four plots to attack France since June, three people with knowledge of the investigation said Facebook, Google and YouTube are complying with up to  percent of Israeli requests to delete content that the government says incites Palestinian violence, Israels Justice Minister said on Monday An attempt by Austrian privacy activist Max Schrems to have a data protection case against Facebook heard as a class action suit moved a step ahead on Monday when Austrias Supreme Court referred the question to the European Court of Justice CJEU A Vietnam War veteran has his lighter back after losing it almost  years ago Democratic presidential candidate Hillary Clinton said Monday that shes feeling better since falling ill at a  memorial ceremony, but she never lost consciousness and didnt think her pneumonia diagnosis was significant enough to disclose bef The mission to merge Yahoos assets with AOL and Verizons will lead to some job changes according to AOL CEO Tim Armstrong Instagram, the photosharing app owned by Facebook Inc on Monday launched a keyword moderation tool to allow its users to control the comments posted on their pictures A host of celebrities seek to highlight the plight of refugees in a video in which they read a poem listing items people have grabbed as they fled their homes Heres what you need to know at the end of the day Major technology companies including Facebook, Google and Twitter are urging Congress to support a plan for the US government to cede control of the internets technical management to the global community, they said in a joint letter dated on Tu Heres what you need to know to start your day Mr Antar expanded his business from a single Brooklyn store, founded in , into the largest consumer electronics chain in the New York metropolitan area The beer brand said its survey of about , men ages  to  found that whats interesting now is different from a decade ago, when it hired its longtime spokesman The police chief, Gen Zarawar Zahid, was visiting an outpost when explosives detonated The Taliban claimed responsibility for his death It began with what felt like a punch in the throat Congress has failed to pass any reforms, and President Obamas executive actions are stalled The rodeo star who advises the Republican nominee on agriculture Even satire has a shelf life A new book on the making of the Beatles debut film offers previously unseen images and new insights on their ascent to global superstardom Monday Parties pick their candidates, remembering , and the hotblooded election of  Barcelona striker Neymar is making a leap into the world of music"
2016-02-18,"Two years after a small South Carolina police chief was fired because she was gay, the same chief said her hometown fired her again in retaliation for having an outside agency investigate a sexual harassment complaint Heres a look at the Week  matchups around the NFL and predictions for each game A Texas mattress store that used bedding to stage a mock collapse of New York Citys Twin Towers in an ad for a Sept  sale on Friday said it was closing after facing a barrage of criticism that described the pitch as tasteless and offensive Characters and actors with disabilities are rare on TV, which makes ABCs Speechless all the more important to our critic With a new promise of  million to help defeat Donald Trump, billionaire Facebook cofounder Dustin Moskovitz becomes one of the top Democratic donors of the election SpaceX chief executive Elon Musk is calling last weeks launch pad accident the most difficult and complex failure in the companys year history SpaceX founder and chief Elon Musk said on Friday he was unsure why one of the companys Falcon rockets burst into flames on its Florida launch pad last week, destroying both the rocket and an Israeli communications satellite it was due to l Pictures taken by a smalltown Ohio police department showing a couple allegedly overdosed on heroin in their car, the womans son ignored in the back, circulated widely on social media on Friday as evidence of an epidemic in use of the drug The Latest on the firing of an openly gay police chief in South Carolina all times local Get recommendations from New York Times reporters and editors, highlighting great stories from around the web Today, great reads from Amanda Hess, Damon Darlin and others Twelve people were killed late on Friday in two suicide bombings claimed by Islamic State at a shopping mall in eastern Baghdad, police and hospital sources said The Haggler finds out that an Alabama businessman actually is in jail  for defrauding the federal government But customer complaints about his business sent him there early President Vladimir V Putin shows skill at rallying the support of the Russian public no matter what the circumstances Two culture and fashion impresarios start New York Fashion Week with different kinds of happenings  and very different results Because of an NCAA rules violation, the Buccaneers could have a severely diminished roster when they face the thirdranked Seminoles Our top  comments of the week Readers debate college diversity training, climate change, an epidemic of loneliness and more A California prosecutor said criminal charges would be filed after a monthslong investigation into allegations of officers having sex with a teenage prostitute Mr Moskovitz said Donald J Trumps campaign had raised such fundamental questions that he and his wife, Cari Tuna, felt compelled to intervene The social network was criticized for removing the image of a naked girl fleeing napalm, renewing questions about the companys role in what can be published online The man who tried to assassinate President Ronald Reagan has been released from a Washington mental hospital for good, more than  years after the shooting With a new promise of  million to help defeat Donald Trump, billionaire Facebook cofounder Dustin Moskovitz becomes one of the top Democratic donors of the election Diaa Hadid, a Times correspondent making the Muslim pilgrimage to Mecca, picked up tips on how to practice some of the rites and rituals of the hajj Police arrested  people and seized bladed weapons after dozens of men occupied a Sikh temple in central England on Sunday A Sikh youth group said it was protesting the temples use for interfaith weddings Why for many of us does our behavior change while in the digital world Mary Aikens The Cyber Effect considers the possibilities A gallery at the National September  Memorial Museum has photos of all but  of the , people killed in either the  terrorist attacks or the  World Trade Center bombing A Union County town with characteristics often associated with urban living a vibrant downtown and cultural scene, and good transportation options Readers respond to recent reviews of Marjorie Ingalls Mamaleh Knows Best, Ben Lerners The Hatred of Poetry and more Heres what you need to know about the weeks top stories How violent images and news on the internet may be more traumatic for some viewers than those in traditional media The couple knew each other in high school in San Francisco, but werent friends The reconnected, through OkCupid, when both lived in New York In an election thats provided plenty of moments worthy of mockery, The Onion is going straight to the source There was a time when Bryan Akipa knew nothing of flutes But that was long ago, before the budding artist stumbled across a wooden mallardhead flute in the studio of his mentor, sparking a fascination that led to a career in both making and play"
2016-02-19,"Facebook is expanding its services to small businesses that want to sell to customers in other countries A yearold girl shot and wounded a fellow student at Alpine High School in rural West Texas on Thursday and then died of a selfinflicted gunshot wound, the Brewster County sheriff told reporters Tanzania has threatened to ban nongovernmental groups that promote the rights of lesbian, gay, bisexual, transgender and intersex LGBTI people in the first public statement the government has made against the minority group The European Union is set to extend some security rules currently only applicable to telecom operators to web services such as WhatsApp, Skype and Apple Incs FaceTime, according to a draft proposal seen by Reuters The travails of the antiestablishment Star Movements mayor of Rome mounted on Thursday when she announced the departure of the citys finance chief whom she appointed just four days ago Asked on MSNBCs Morning Joe on Thursday what he would do about the conflict in Aleppo, US presidential candidate Gary Johnson replied, what is Aleppo It took many years of struggle to figure out who I was, Erin OFlaherty, Miss Missouri, has said The US Military Academy removed a video clip of the football teams postgame lockerroom celebration after its upset win over Temple and is investigating whether a team prayer violated the religious freedom of the players Former Secretary of State Colin Powell found himself on the defensive Thursday following the release of a  email exchange with Hillary Clinton, describing his use of a private, dialup email account to carry out government business The chairman of the US Federal Communications Commission on Thursday unveiled revised proposed rules to allow tens of millions of Americans to drop costly rented payTV settop boxes for programing and get service through appbased software For months, Hillary Clintons supporters have griped that shes held to a higher, harder standard than Donald Trump After Wednesday nights forum on national security, those complaints became a rallying cry The company plans a new marketing campaign intended to place it in the company of other big fruit brands like Dole and Chiquita Welcome to California Today, a morning update on the stories that matter to Californians and anyone else interested in the state As fall approaches, get prepared with braised chicken legs, shrimp alla marinara and more Donovan, who retired two years ago at age , said a joking suggestion from a Los Angeles Galaxy official would become reality The team said he could play on Sunday Photos from The New York Times and photographers from around the world For months, Hillary Clintons supporters have griped that shes held to a higher, harder standard than Donald Trump After Wednesday nights forum on national security, those complaints became a rallying cry Diaa Hadid, a Times correspondent, is getting ready for her first hajj, the annual pilgrimage to Mecca And her family and colleagues have plenty of advice Diaa Hadid, a Times correspondent, is getting ready for her first hajj, the annual pilgrimage to Mecca And her family and colleagues have plenty of advice A failed car bombing in the heart of Paris was hatched by a group of French women, including one once engaged to men who had already killed in the name of the Islamic State group, Frances top antiterrorism prosecutor said Friday In a Sept  story about Facebook allowing postings of a  photo of a naked, screaming girl after a napalm attack in Vietnam, The Associated Press reported erroneously that the social media site often automatically removes photos if enough peop Friday What to see this autumn, ways to honor , and other weekend events Facebook Inc on Friday reinstated a Vietnam Warera photo of a naked girl fleeing a napalm attack, after a public outcry over its removal of the image including harsh criticism from Norways prime minister This monthly features rounds up all news and feature stories published across New York Times sections about young people Hillary Clinton said Friday it was time for a rethinking of Americas strategy for North Korea following the regimes latest test of a nuclear weapon Donald Trump and his campaign chief, meanwhile, refused to outline the Republican presidential An aide says Facebook removed Norwegian Prime Minister Erna Solbergs post which included an iconic  image of a naked girl running from a napalm attack in Vietnam The Latest on the  presidential campaign all times EDT Facebooks problems with European privacy regulators do not mean that the social network has breached the blocs competition rules, EU antitrust chief Margrethe Vestager said on Friday Geraldo Rivera says hes filled with regret for initially discounting the sexual harassment allegations against his former Fox News Channel boss, Roger Ailes, and is apologizing for his skepticism A safety director in a city that released photos of a yearold boy in a vehicle with two adults slumped over after overdosing on heroin and fentanyl said Friday he and others wanted to send a message to addicts they should find safe places for t The man who shot President Ronald Reagan is scheduled to leave a Washington mental hospital for good on Saturday, more than  years after the shooting A federal judge ruled in late July that the yearold John Hinckley is not a danger to himse"
2016-02-20,"Israels UN ambassador demanded Wednesday that media companies stop providing a platform for hate sites, saying there is a clear link between the rise of social media and the rise of antiSemitism Utahs Gov Gary Herbert said Wednesday that a Salt Lake City suburbs efforts to entice a new Facebook data center with millions of dollars in tax breaks may have ended, and local officials declined comment on whether they are still trying to lur Landon Donovan is returning to the LA Galaxy, ending a month retirement to suit up for his Major League Soccer team for at least the rest of this season Commissioner Roger Goodell finally weighed in on the protest, saying I dont necessarily agree with what hes doing But the NFLs noncommittal stance isnt going to end the debate Joanne Sullivan hides things from us Welcome to California Today, a morning update on the stories that matter to Californians and anyone else interested in the state From designer debuts to seasonless collections and seenow, shopnow disrupters, here is your crib sheet to the readytowear circus Female politicians across Brazil are debating what the removal of Dilma Rousseff, the countrys first female president, means in a political realm dominated by men The most promising young rapper the city has produced in some time, A Boogie may have cracked the code at creating a new New York style Verizons acquisitions of Yahoo and AOL raise legitimate questions about the judgment of Verizons management Supreme Court rulings have recognized principles of equality that the amendment was to have enforced A book and exhibit document the complexities of the Black Panther Party, a storied group that the FBI once deemed the greatest threat to the internal security of the country US tech giants Google and Facebook are among multinationals spending more in Brussels as the European Commission eyes new business regulation after last week handing Apple a billioneuro tax demand Thursday A schoolage fashion designer, Community Day at the US Open and a cornucopia of courses The Latest on Campaign  all times EDT"
2016-02-21,"North Carolina police say a man wanted for killing his son and critically wounding his exwife before using Facebook to admit to the attack has been found dead in a South Carolina motel room American mountain climbers Kyle Dempster and Scott Adamson earned reputations as two of the worlds best by pushing limits and setting out to conquer icy, steep routes others couldnt scale US tech giants Google and Facebook are among multinationals spending more in Brussels as the European Commission eyes new business regulation after last week handing Apple a billioneuro tax demand Welcome to the new Learning Network Heres what were offering this school year and how you can use it"
2016-02-27,New research finds that the great majority of people learn about political news from mainstream media sources
2016-02-28,The Latest on Apples San Francisco product event all times local Israels Space Communications Ltd and Beijing Xinwei Technology Group have given themselves  days to salvage a deal that was contingent on the launch of a satellite destroyed in an explosion last week
2016-02-29,"As the election nears, Times staffers have gotten another warning to play it safe on social media"
2016-03-01,"A sheriffs department in North Dakota is investigating possible charges against the US Green Party presidential candidate, Jill Stein, for damaging equipment during protests on Tuesday over construction of an oil pipeline"
2016-03-02,"Wednesday Bridgegate, a culinary history of the Great Depression, and picturing race in America American photographer Annie Leibovitz hopes to add a layer of mystery to her travelling Women New Portraits exhibition when it sets down in Milan  by including the image of writer whose identity is a closelyguarded secret Sex robots  discuss That is precisely what scientists and academics are doing at a British conference also covering alltoomodern issues like digital intimacy and older Facebook users"
2016-03-03,"For the norecipe fans, try polenta and fresh crab meat Carlos Parra used to love waking up to see his pet albino boxer, Nina Now, seeing her skeletal body on the floor next to his bed has become a daily reminder of the economic crisis engulfing Venezuela UFC star Miesha Tate says shes inspired by the tough little girl who broke her arm while hiking near Las Vegas after the mixed martial arts fighter carried the child back down the mountain In the aftermath of the attacks on the World Trade Center on Sept , , Nina Berman documented the feelings  including loneliness, danger, love and sensitivity  of New York City A suspected chlorine gas attack on an oppositionheld neighborhood in the Syrian city of Aleppo caused dozens of cases of suffocation on Tuesday, rescue workers and a monitoring group said The Via Francigena, an ancient pilgrimage route, does not have the high profile of the Camino de Santiago, but it has rewards of its own quiet among them"
2016-03-04,"Heres whats happened at the United States Open on Tuesday, when four players earn spots in the semifinals Nine days of shows and parties begin today, as the spring  collections and a few of their buynow brethren take the stage"
2016-03-05,"The mayor made the announcement after the police said they had arrested Reginald Moise, , in the death of Tiarah Poyau, , who was shot on Monday"
2016-03-06,"Amanda Beebe rushed to the day care center where she left her monthold and became hysterical Her boys body was covered with more than a dozen bite marks His face, limbs and back were swollen and raw Heres what you need to know to start your day"
2016-03-07,"The Latest on violent comments posted on a Facebook account of a local New Jersey politician directed toward a journalist all times local Romanian anticorruption prosecutors said on Tuesday they were investigating former leftist Prime Minister Victor Ponta on suspicion of abuse of power and complicity in tax evasion App Store Official Charts for the week ending September ,  The following list represents the most viral tracks on Spotify, based on the number of people who shared it divided by the number who listened to it, from Friday August , to Thursday September , via Facebook, Tumblr, Twitter and Spotify"
2016-03-08,"An appeals court in the Algerian city of Setif has convicted a convert to Christianity for insulting Islams prophet and sentenced him to three years in prison Italys antiestablishment Star Movement MS is in disarray following a disastrous start to its rule in Rome city hall, potentially denting its chances of winning power at a national level In Singapore, Dr Bernard Cheongs life reflects his passion for timepieces"
2016-03-09,"British s reggae band UB is backing Jeremy Corbyn in his campaign to be reelected as leader of the opposition Labour party, calling the leftwing leader incorruptible and welcoming his commitment to the arts American photographer Annie Leibovitz hopes to add a layer of mystery to her traveling Women New Portraits exhibition when it sets down in Milan  by including the image of writer whos identity is a closelyguarded secret"
2016-03-10,A New Jersey Republican ended his campaign for local office Tuesday following reports that he called online for the rape of a Washingtonbased reporter for news and opinion website The Daily Beast UFC star Miesha Tate says shes inspired by the tough little girl who broke her arm while hiking near Las Vegas after the mixed martial arts fighter carried the child back down the mountain An yearold dreams big
2016-03-11,"I went to Spain to dive into the language, and to pass Latino culture along to my American daughter A top aide of President Barack Obama said Tuesday he will meet with the wife of a missing Laotian activist, whose case has been repeatedly highlighted by human rights groups as an example of authoritarian excesses of Laos oneparty Communist gove North Carolina authorities are searching for a man who they say shot and killed his yearold son and later used Facebook to admit to shooting and critically wounding his exwife A suspected chlorine gas attack on an oppositionheld neighborhood in the Syrian city of Aleppo caused dozens of cases of suffocation on Tuesday, rescue workers and a monitoring group said In a separate development, Fox News announced that Greta Van Susteren was leaving the network, effective immediately Former Fox News anchor Gretchen Carlson settled her sexual harassment lawsuit against Roger Ailes for a reported  million and a public apology Tuesday, ending the case that triggered the downfall of the cable channels chief executive Greta Van Susteren has abruptly quit after  years as a primetime anchor at Fox News Channel, saying that Fox has not felt like home to me for a few years"
2016-03-12,"A book and exhibition feature the lush, multilayered photographs of Alex Webb  works that represent over  trips throughout Mexico It turns out some wealthy companies are just like some wealthy hedge fund managers Theyre taxed at far lower rates than nearly everyone else The Latest on legal proceedings involving the  billion Dakota Access Pipeline all times local Our attempts to stop corporations from moving overseas only hurt longterm shareholders in favor of insiders and foreign investors Labor Day is supposed to be the general election starting line But we got started a long time ago El Salvador players were offered financial inducements to win, draw or avoid a heavy defeat in their crunch World Cup qualifier against Canada, the countrys football association said on Tuesday When have you ever witnessed or been the recipient of a meaningful act of kindness What, if anything, should be done about unwanted clowns who appear in public Tuesday News you missed over the long weekend, the Clown Theater Festival, and a ships homecoming The Philippines new president wants to move Ferdinand Marcoss body to a cemetery for heroes Its an affront to our history"
2016-03-13,"Does a peace process to end the civil war in Colombia signal a trend toward less violence within and among other countries The thousands of Muslim asylum seekers pouring into Denmark have spawned a backlash, and questions over whether the country has a latent racial hostility at its core A chief executives political leanings may significantly influence whom workers donate to and choose at the polls, a study found If its not a tourist, the juvenile bird would be the first bald eagle hatched in the city in more than a century So few homes are on the market that buyers are getting more aggressive and innovative in approaching owners who havent officially decided to sell In the s, Korita regularly served over  miles per hour in an era when that was unheard of And power, he says, is about more than size and strength Go to the villages of south Kashmir and theyll tell you stories about Burhan Wani, the militant commander shot by security forces as he tried to escape through the back door of an isolated hideout ExPoison frontman Bret Michaels says two thieves stole his cellphone while he was onstage during a recent performance in New Hampshire"
