date,snippet
2016-05-27,"Led by Senator Christopher S Murphy, dozens of Democrats talked into early Thursday Wishful thinking among Twitter investors aside, there are not many obvious buyers for the social media network The gunman raged against the filthy ways of the west and spoke of Islamic state vengeance, a United States senator revealed The two companies envision a world where someones always bothering you while youre writing J Felix Strevell owed New York State money after admitting to fraud, but in a civil complaint, federal prosecutors accused him of spending it on his daughters farm wedding instead Photos from The New York Times and photographers from around the world Many people think they can teach themselves to need less sleep, but theyre wrong Terrorism isnt central to Islam, and terrorists arent practicing religion Friday The arrival of Lady Liberty, the Brooklyn Cyclones opener and a belated Fathers Day In the US, the sport has long been overshadowed by football Now a former bond trader is working to bring it back to the mainstream Antonio Perkins was streaming video of himself on Facebook Live on Wednesday when he was shot and killed in Chicago Weddings dont always bring out the best in people, but some fathers and stepfathers are setting aside their differences for the sake of the children"
2016-05-28,"Thursday An end to Albanys legislative session, a thrill ride at Penn Station, and reclaiming restaurant space A British vote to leave would be a colossal risk to no good end A look at how The Timess treatment of the Orlando shooting evolved as we learned more and discovered the scope of the horror You dont have to go vegetarian, new research says  even a moderate shift in eating habits can significantly lower your risk of Type  diabetes Its been a terrible week Cooking can help Make something delicious and familiar, or challenge yourself Here are some suggestions The identity of the gunman is known, but officials have not said whether he had any direct link to the Islamic State, despite his claim of allegiance to it A new mathematical model aims to track the activity of Islamic State sympathizers online and determine when groups will turn from talk to action"
2016-05-29,"The traveling exhibit Dandy Lion presents striking images of dapper men of African descent whose sartorial flair challenges notions of race and masculinity Churchbacked efforts to fight LGBT rights have been blamed for feeding a hateful atmosphere that accommodates attacks on gays Tencent Nears Deal to Buy Maker of Clash of Clans  Investors Bypass Private Equity Perhaps Im in the minority of men, but I appreciate being given ties After more than four decades of hosting A Prairie Home Companion, which he created and which, in turn, created him, the public radio legend is retiring"
2016-05-30,"Artists, responding to industry and fan expectations, must make themselves accessible while contending with harassment and the threat of violence A shadow network of patients are trying to treat their own debilitating diseases  by infecting themselves with gastrointestinal worms Jeffrey Rosens book is a concise exploration of this Supreme Court justices main intellectual causes, which included a mistrust of big business A team led by Dr Joshua D Stephany, Orange Countys chief medical examiner, has conducted autopsies on all of the  victims of the attack at the Pulse A ruling on how you get internet content means the neighbors blog matters as much as Netflix And Netflix cant be charged extra for being a data hog Senator Ron Johnson, chairman of the Committee on Homeland Security and Governmental Affairs, has asked the chief executive of Facebook, Mark Zuckerberg, to provide details of the postings of Omar Mateen, the gunman in the Orlando shooting Also, navigating bigticket social issues, sexual mismatches and what to bring to dinner Now that Hillary Clinton has effectively won the Democratic nomination, many of her young supporters can change their status update"
2016-05-31,"Get ready to make pancakes, and try a smoky, norecipe greens recipe The Orange Is the New Black actress reads the story of a woman who chooses not to react when her husband tells her I dont love you anymore Im not sure I ever did Posts that are flagged will be reviewed by the social network, which will provide resources to the concerned friend and offer help to the person at risk After moving to New York from Mexico City, Irma BohrquezGeisler began to document the lives of her fellow Mexicans living in Staten Island By recognizing an individual right to bear arms in overturning handgun bans, the court seemed to put gun control efforts in jeopardy Did it In a rare reversal, an influential panel of experts convened by the World Health Organization concluded that regularly drinking coffee could help protect against some types of cancer Larossi Abballa broadcasted to Facebook Live after killing a police captain and his companion at their home in a suburb of Paris on Monday Wednesday Our metropolis in words, sweaty weather, and boozier brunches It helped to develop all the new ways we watch TV  ondemand, bingeing, mobile But the Silicon Valley company still has to keep reinventing itself Bruce Weber, the Times reporter who penned Margaret Vinci Heldts obit, reflects on the iconic hairdos enduring appeal"
2016-06-01,"In an effort to keep developers happily writing apps for its software, as well as to reinvigorate its products, Apple will allow access to two of its crown jewels, hoping to spur creativity Microsofts extraordinarily generous takeover bid harks back to a time of higher technology valuations, but some analysts say theres no going back While LinkedIn had rapid growth and rising stock values in the past, more recently it has faced a hacking attack and declines in its share price When Clarence Williams learned his fathers life was about to end, his own life changed  for the better  as he documented that final month What can be done to make sure Sanders supporters become Clinton voters in November Supreme Court Rejects Puerto Rico Law in Debt Restructuring Case  Libyan Fund Claims Goldman Sachs Exploited Its Financial Navet Tuesday Vigils in the Village, lots of public schools are closed, and the Museum Mile Festival Dont scrub the letters LGBT from what happened in Orlando A collection of  Student Opinion questions from this school year, all still open to comment on our blog I heard from hundreds of people about my article on sending my daughter to a lowincome, segregated school in New York City Here are some of their questions and comments, along with my responses Emma Clines urge to understand the dark impulses that drove Charles Mansons acolytes gave rise to her debut novel"
2016-06-02,"Dwayne Johnson and Kevin Hart join an actioncomedy genre with a rich tradition that includes  Hours and Lethal Weapon After the death of the grooms mother put the couples wedding plans in doubt, Ms Swift helped ensure a memorable ceremony with a surprise performance Why Hillary Clintons threeword tweet resonated on Twitter And some other stuff  people were killed and dozens more were injured after a gunman opened fire inside Pulse nightclub in Orlando, Fla, early Sunday A scientist suing Gawker writes, Some of the people who were getting run over  like Hulk Hogan and me  called in the law After the Orlando attack, our community has to have some tough conversations The gunfire did not let up As rounds were fired, people dropped, some in panic, some because they were wounded, some because they were dead The Orlando gunmans life once seemed to be on a successful track, but he became the subject of investigations and allegations of abuse The terror group has blurred the line between operations planned and carried out by its core fighters and those carried out by its sympathizers A latecareer retrospective looks at some four decades of work by Danny Lyon, whose photographs  of the civil rights movement, prisons and a motorcycle gang  consider freedom, or its absence The current bathroom controversy reflects prejudice and misinformation about people who identify as transgender The Orlando police chief offered new details on the worst shooting in United States history, and other officials said that all but one of the  victims had been identified Monday Support for the attack victims, shootings in New York, and Hamilton sweeps the Tony Awards Omar Mateen has set a spark to a time of inflammable anger The companies said that Microsoft would pay  a share to acquire LinkedIn, the business social network site Its only on the surface that South Korea has made strides toward equality for women The reality is bleak A diagnosis of vestibular migraine forced the author to choose between living with disabling dizziness or a treatment that triggered disabling nightmares Fighting to hold on to console players, Microsoft will sell a cheaper Xbox One and introduce a virtual reality console next year Larossi Abballa, who stabbed a police captain and his companion to death, was released almost immediately after his conviction in  As friends and families mourned victims who were killed at Pulse nightclub, many noticed a marked seismic shift among Latinos acceptance of gay culture The fighting, which forced the closing of the Torkham crossing, left at least  wounded in Pakistan and killed least one Afghan police officer After a union in which she said he beat her, confiscated her paychecks and isolated her in their home, Ms Yusufiy said she fled with the help of her parents Family members and loved ones of those lost in the massacre gathered Monday to hear the names of the dead read aloud After The Post interpreted an insinuation made by the presumptive Republican candidate, Mr Trump barred its reporters from his events LinkedIns struggling stock price, and its reliance on stockbased compensation may be a factor in its sale to Microsoft Apple announced new features for the operating systems running its products, reflecting pressure to improve its software and services as hardware sales slow"
2016-06-03,"Holding the attention of young voters  and getting them to turn out on June  for a referendum on whether Britain should stay in the European Union  is a challenge The modern equivalent of debtors prisons lock people up if they cannot pay This is how a hate symbol rises in  A podcast sound effect becomes a Twitter meme and a browser extension before it finally slithers into the physical world Consider the lobster with some delicious and costsaving recipes Praising ISIS, the gunman, identified as Omar Mateen, opened fire in what emerged as the worst mass shooting in United States history The massacre early Sunday also left  wounded The bride works at Facebook, and the groom for Whipclip, a technology company The band, on its first American headlining tour in  years, seems to shrug off the incident The singer and actor has a new original series, Still the King, which premieres Sunday, June , on CMT As is prepares to reopen in a new downtown space, the center is trying to define what imagemaking means today"
2016-06-04,"A reader asks Are whole grains as beneficial if they are ground up, for example, as in smoothies, or made into flour as in cereal He fell for her from the first word It took many more for her to fall for him Friday Filling your lungs with fresh air, a Jazz Age party, and the Puerto Rican Day Parade The collapse of the European Union is implausible but not impossible It is time to awaken to the dangers Share sales in New York and Tokyo could value Line at more than  billion, the biggest market debut for a technology company so far this year Hillary Clintons generation aimed to free women from domestic prisons But work is a prison, too The companys decision to sell itself came just weeks after it was revealed that the Silicon Valley billionaire Peter Thiel financially supported Mr Hogans lawsuit For weeks I was barraged by rank antiSemitism, and Twitter failed to respond With growing competition from the likes of Google and Amazon, Apple appears to be working to improve its relationship with app makers An online community known as targeted individuals says its members are being surveilled by groups of stalkers as part of a sprawling conspiracy But psychiatrists beg to differ One student said she was headed to the University of Texas at Austin, and the other is Yalebound Our top  comments of the week Readers discuss the Stanford rape case, Hillary Clintons victory in the primaries and Muhammad Alis death Its Lifehacker, Kotaku, Kinja Deals and other sites have been generating commissions for Gawker and are of interest to Ziff Davis, a suitor A new breed of style stars celebrate their heritage in a mashup of prints"
2016-06-05,"An expert said, I would be surprised if it had anything to do with its reaction to its handler Still, the internet swooned at photos showing a great horned owl embracing a wildlife volunteer in Mississippi The technology companies were among some of his major investments Vice President Joseph R Biden Jr wrote that the woman had a solid steel spine, and lawmakers read excerpts of her statement on the House floor Photos from The New York Times and photographers from around the world"
2016-06-06,"GI Bill money doesnt count against forprofit colleges cap on federal funding Veterans groups say many charge a lot but provide little In a statement to the court, the former student said, I would give anything to change what happened, but insisted the encounter had been consensual My patient dutifully completed an advanced directive, but that piece of paper didnt help her to live out her final months with the comfort and dignity that she deserved Thursday Horse racing at Belmont, raising your own chickens, and celebrating our oceans Though our lesson plans will be on vacation until midAugust, election news will continue to dominate the headlines all summer long Here are a few ways students can keep up with the candidates, campaigns, conventions and controversies  and make  Nadal will not play Wimbledon as he continues to recover from a left wrist injury that forced him out of the French Open after the second round Language experts say one of the oldest forms of punctuation is going out of fashion, felled by the staccato sentences favored in instant messaging Current practices mark a break with  years of child rearing, a historian writes  Three students have been charged with sexual assault after an episode in October, and now anonymous callers from distant area codes are unleashing tirades The testimony revealed that Angelika Graswald, who is charged with the murder of her fianc, had indicated that plans for their marriage were in jeopardy After a news site reported that neoNazis were using parentheses to target social media users for harassment campaigns, a countercampaign began Think of your grill as an outdoor stovetop, and then get frying"
2016-06-07,"The band members appearance together onstage left many followers clinging to what one historian called a  percent possibility Now, three firms are increasing their pay scales after a nineyear drought for elite junior lawyers Get the brownie lowdown, make a vaguely Korean rag and welcome a new addition to the Food and Cooking family Tim BernersLee and other computer scientists are pondering newer technologies to create a web with more privacy and less government control With Senator Bernie Sanders still in the race, the president said the stakes were too high to let divisions stand in the way of defeating Donald J Trump The police have implicated two militant groups in an accelerating series of attacks over the past three years and say they are preparing to round up their leaders The Golden State Warriors are almost a metaphor for the way the tech industry improves, and also risks ruining, all that it touches Even as he chastised Washingtons political class for a lack of backbone, Mr Trump showed modest signs that some of his remarks crossed a line The Barcelona star Messi, who has been nursing a sore back, trained with his Argentina teammates and said he wanted to return to play soon Rangers at Yellowstone National Park say Colin Nathaniel Scott, , of Portland, Ore slipped and fell into a hot spring after wandering off a boardwalk Good English had been set to play at several locations in Brooklyn until the release of a letter one member wrote in defense of Brock Allen Turner The primate jumped on a transformer at a hydroelectric power station, starting a chain reaction that knocked out lights and the internet The basketball teams success can be seen as a metaphor for the way the tech industry improves, but also risks ruining, everything it touches Members of the Bronx Junior Photo League know their neighborhoods are a lot more complex than people realize Theyre determined to change that perception"
2016-06-08,"In an online environment where Facebook readers comment before reading, is it possible to make veracity cool Diehard Sanders fans come to terms with the end of the road How the internet has transformed our aesthetic experiences Tuesday A training ground for stellar chefs, cooking classes, and an exciting culinary competition Its latest fundraising round gives SMS, based in Chicago, a valuation of  billion, a company spokesman said The fivetime Grand Slam champion announced in March that she had tested positive for the recently banned drug meldonium at the Australian Open Wednesday The Empire States roll of honor, saying goodbye to a hero dog, and ghosts in Brooklyn New food labels will require manufacturers to list the added sugars in foods But is the sugar added to foods really more harmful than the sugars found naturally in foods Is recall from the bench appropriate for the light sentence in the Stanford rape case A hearing focused on an encounter between investigators and Angelika Graswald days after Vincent Viafore drowned in the Hudson River in  She is accused of murdering him A few months ago, Nicholas Nixon started photographing his eyes in closeup, fascinated by a surprising, palpable power in the resulting images The Saturday Night Live comedian reads the story of a protective bond between a young single mother and her Manhattan doorman The French cosmetics company was accused of bending to China after dropping a concert by a singer who supported the prodemocracy Occupy movement"
2016-06-09,"After attending an air show at a military training base, Maxim Babenko set out to document the servicemen in Russias Air Force, and to showcase the unseen facets of their military lives Does Hollywoods focus on historic injustices against AfricanAmericans let it avoid dealing with the problems of today Moral injury resembles posttraumatic stress disorder with an added burden of guilt, and requires different treatment Monday Soothing sounds at Penn Station, a taste of Times Square, and seeing beyond the pink and blue Everyone can tell when Im behind Every visit is pared to essentials Paperwork is postponed, chatting minimized Areas like computing and mobile devices have made advances, but the government has reported disappointingly slow growth and continuing stagnation in productivity Firms promise to help consumers spot metabolic red flags Critics say the services persuade healthy people to seek unneeded treatment Things can go terribly astray when raising a glass, but so much can go right, too Jun, on the outskirts of Granada and with a population of ,, has turned to the social network to help the town provide many public services Facebook has become a critical tool for visibility and acceptance, and is seen as contributing to the shift in mainstream attitudes toward transgender people Former Senator Bob Kerrey should not quit his role at the new Fulbright University Vietnam, despite an outcry over his war record A sharp rise in the number of undercover operations, once considered a last resort, has come with little public or congressional scrutiny The Catholic Church had a problem meeting graveyard expenses as more and more people chose cremation over burial The answer Bishops Vineyard Smartphones, the internet and other gadgets have become ubiquitous But economists wonder why they are not making us more efficient A key lesson from a data breach of Mark Zuckerbergs social media accounts Quit using the same password for multiple websites An exhibit that had been planned for months by the Gordon Parks Foundation opened this week, featuring the legendary photographers images of Muhammad Ali Official dress codes have become much more relaxed in recent years How does that change what professionals wear"
2016-06-10,"A hero to some and a villain to others, Francesca Immacolata Chaouqui stands accused with two others of leaking confidential documents to two journalists Nguyen Quang A, an activist blocked from meeting with President Obama, says the Communist Party sometimes needs coaxing, and sometimes confrontation The two men and two women fled in a Chevy Malibu to California, where they were arrested on seconddegree murder charges, the police said Videos of uniformed officers from around the world dancing to a s hiphop song have become an online sensation Our top  comments of the week Readers discuss a gorillas death, Donald J Trumps criticism of a federal judge, a thwarted date rape, and more Protests inspired by social media turned violent outside a rally in San Jose, Calif, the result of a combustible mix of the candidates fiery oratory and the passion of the antiTrump movement A plethora of examples involving companies like Dell, Facebook and Tribune Publishing prove that shareholder votes can be of great consequence After wasting millions of dollars in hopes of sinking Hillary Clintons presidential ambitions, Republican lawmakers seem to have nothing to show Mr Honour wrote and edited with John Fleming, his life partner, from a base in italy The bride works in an agency regulating Wall Street, and the groom works for Facebook A granddaughter of Leonard Bernstein finds her husband while singing in a karaoke bar Snapchat is enjoying a positive run, and the leading presidential candidates have both expressed skepticism toward the tech industry Fake profiles for a real Medal of Honor recipient keep popping up, possibly in connection with romance scams, and Facebook is slow to take them down Heres what you need to know at the end of the day A journalist has had guns pointed at him, slept in a shipping container, and walked past corpses, but until now had never been listed as a terrorist by a nationalist website This morning, its all about delicious food from the sea Also, fried chicken The Donald Trump media operation, which has dominated the political conversation so far, faces a bigger challenge in the general election Sundays episode touches smartly on trust, friendship and the lies we tell our friends and ourselves"
2016-06-11,"Some question whether Mr Kerrey, a former senator who has admitted that he and commandos he led in  killed women and children, should lead Fulbright University Vietnam Photos from The New York Times and photographers from around the world The community rallied around KankuDai Zanshin Dojo, donating space and equipment, before it reopened at its new location in Brooklyn Do my former classmates accept me as transgender out of compassion or simply loyalty In his photographs of the s music scene, David Godlis helped capture the grit and urgency of the era This Memorial Day weekend, Todd Heisler, a New York Times staff photographer, was part of a team that looked closely at the people and neighborhoods affected by that citys wave of gun violence Three days,  people shot, six of them dead Memorial Day on the streets, and the violence that has engulfed families and neighborhoods His prodigies want to rewire the world Will that mean more than inventing the next Snapchat"
2016-06-12,"Our soontobe Tokyo bureau chief learns to love Snapchat Pass the time with two elaborate mazes and games that readers suggest you play on the road At , Tao PorchonLynch is still teaching yoga, enjoying wine, driving and entering dance contests Readers react to an article about men wearing wedding rings, or not A reader asks Why do mosquito bites itch While trying to emphasize Chinas connectivity, a report by a state newspaper acknowledged the creeping pace of connections in the country Friday A commencement with the first lady, National Doughnut Day, and Broadway takes Times Square Get recommendations from New York Times reporters and editors, highlighting great stories from around the web Today, great reads from Jim Dwyer, Diaa Hadid and others Ten years after the release of her bestselling memoir, Elizabeth Gilbert raised money for a nonprofit by facing her fear of singing in public The only Siberian crane ever seen in Taiwan set off a frenzy by sightseers, the hiring of a hour guard and environmental efforts to welcome such migratory species"
